author,text,published_at,like_count,cluster
Ijasah_ditunjukan_user_610,jokowi hasil kerja mu presiden indonesia menang saham emas freeport hilirisasi nickel harga minyak profinsi pembangunan jalan toll mengadakan kereta api cepat pembangunan pariwisata hasil kerja jokowi menguntungkan indonesia pembicaraan picik ijazah nya ijazah presiden jokowi indonesia perusahaan pegawai berijazah orang berijazah hebat hebat jokowi kebanyakan duduk meja layanin indonesia presiden jokowi terjun langsung lapangan ijazah urusannya hasil kerja presiden jokowi males ngomongin ijazah jokowi jokowi nggak tunjukan ijazah hasil kerjamu dahsyat merubah indonesia negara maju bukti kerja ijazah,2025-05-18T13:30:54Z,6,18
Ijasah_ditunjukan_user_631,hei roy baktimu utk negara kerjanya menghasut contoh tu jokowi menyumbangkan segenap fikiran tenaganya utk bangsa salut utk jokowi,2025-05-18T10:18:02Z,0,18
Ijasah_ditunjukan_user_654,si jokowi yg kejar utk membuktikan ijazahnya ngk ush bnyak tiori,2025-05-18T04:56:44Z,0,18
Ijasah_ditunjukan_user_658,memng licik rombongan sakit hati tok menjtuhkn popularitas jokowi karna bersaing politik sehat sulit tok taklukan jokowi,2025-05-18T03:42:37Z,0,18
Ijasah_ditunjukan_user_682,roy suryo maunya sih suka bngt otak otik yg brhubngn dg keluarga pk jokowi,2025-05-17T16:06:57Z,0,18
Ijasah_ditunjukan_user_684,ah kou suryo sirik aja ama jokowi lu g akn jokowi lu coba deh nyalon bupati g akn menang lu,2025-05-17T15:54:01Z,0,18
Ijasah_ditunjukan_user_719,jokowi oke,2025-05-17T09:43:54Z,0,18
Ijasah_ditunjukan_user_734,masyarakat gk mempermasalah masya yg trmksh pd pk jokowi,2025-05-17T06:05:13Z,0,18
Ijasah_ditunjukan_user_774,jokowi lucu jd parodi,2025-05-16T16:24:45Z,0,18
Ijasah_ditunjukan_user_774,ggantung jokowi yg dukung jokowi orang sakit parah otaknya jokowi,2025-05-16T16:21:27Z,0,18
Ijasah_ditunjukan_user_785,otak ngga waras ya daftar sekolah aja pake akta kelahiran lha jokowi mantan walikota gubernur presiden th tuding fitnah klu ijasah jokowi palsu aneh otak dungu roy suryo cs,2025-05-16T14:47:45Z,0,18
Ijasah_ditunjukan_user_803,karna jokowi fitnah ga ngelawan diem jokowi takut,2025-05-16T11:22:30Z,0,18
Ijasah_ditunjukan_user_815,lihat layak pembenci jokowi dihukum,2025-05-16T09:19:07Z,0,18
Ijasah_ditunjukan_user_816,kalo jokowi ijazahnya uji,2025-05-16T09:10:36Z,0,18
Ijasah_ditunjukan_user_842,hebat jokowi tarik ulur biar kepo biar byk yg diseret kepenjara keren keren jokowi,2025-05-16T04:37:50Z,4,18
Ijasah_ditunjukan_user_845,gaya bicaranya rs dendam ksumat jokowi,2025-05-16T04:22:19Z,0,18
Ijasah_ditunjukan_user_855,yg memenjarakan nenek jokowi,2025-05-16T02:05:36Z,0,18
Ijasah_ditunjukan_user_859,ijasah jokowi beli,2025-05-16T01:11:15Z,0,18
Ijasah_ditunjukan_user_865,leave jokowi alone let him retire peacefully and menikmati hidupnya keluarganya roy suryo has an evil mind and iri berdosa menyakiti hati jokowi karmanya tunggu,2025-05-16T00:42:18Z,0,18
Ijasah_ditunjukan_user_872,intinya ijasah jokowi palsu dibayar utk asli kepalsuan nya polisi ahli forensik it ijasah jokowi tdk menelitinya dg ilmu² tsb polisi dibayar jokowi utk sdh meneliti kepalsuannya tetep hukum tuntutan hukum jokowi batal ditengah jalan,2025-05-15T22:42:11Z,0,18
Ijasah_ditunjukan_user_877,barisan manusia yg sakit hati boss makadih pakde jokowi,2025-05-15T20:52:02Z,0,18
Ijasah_ditunjukan_user_885,gini aja loh bepikir scara logika kolo jokowi memakai izazah palsu jokowi gk memiliki izasah tdak skolah pastinya jokowi tdak memimpin pemerintahan faktanya jokowi memimpin pemerintahan yaman damai berjalan piriode tau hukum klau orang fitnah bpak jokowi orang iri syirik,2025-05-15T17:43:19Z,0,18
Ijasah_ditunjukan_user_916,ijazah indonesia aja jokowi memenangkan,2025-05-15T13:51:05Z,0,18
Ijasah_ditunjukan_user_933,setuju dgn langkah jokowi,2025-05-15T12:19:51Z,0,18
Ijasah_ditunjukan_user_945,jokowi ngibul,2025-05-15T09:28:24Z,0,18
Ijasah_ditunjukan_user_947,jokowi merusak tatanan demokrasi indonesia ugm lembaga pendidikan mendidik anak bangsa,2025-05-15T09:07:59Z,0,18
Ijasah_ditunjukan_user_948,hemmmm dag dig dug hatinya ciuuuuttt bicara tpi tong kosong tihati y pitnahh jokowi pk jokowi dalang isu isu pitnah,2025-05-15T09:05:20Z,0,18
Ijasah_ditunjukan_user_953,kuncinya jokowi tunjukkan ijazahnya publik selesai,2025-05-15T08:13:03Z,0,18
Ijasah_ditunjukan_user_1021,suryo gugat izasah p jokowi skrng ga daridulu gugatnya sy masyrkt awam aja ngerti moso persiden ga proses aneh bngt koyo orng sakit hati benci p jokowi,2025-05-14T17:55:57Z,0,18
Ijasah_ditunjukan_user_1042,maaf ngga mantan presiden yg diperiksa ijazahnya biar adil pa jokowi,2025-05-14T15:38:05Z,0,18
Ijasah_ditunjukan_user_1044,ijasah jokowi ributkan seharusnnya wali kota,2025-05-14T15:34:31Z,0,18
Ijasah_ditunjukan_user_1066,fitna jokowi,2025-05-14T13:49:59Z,0,18
Ijasah_ditunjukan_user_1073,jokowi kasihan dg yg sdh tdk pny pekerjaan biar dpt uang dr media media yg mengundang,2025-05-14T13:23:37Z,0,18
Ijasah_ditunjukan_user_1076,kau hak dgn ijasah jokowi,2025-05-14T13:19:40Z,0,18
Ijasah_ditunjukan_user_1110,ribet si iya angkatan jokowi doang kaga org laen ayo komen yg seangkatan jokowi,2025-05-14T10:31:53Z,0,18
Ijasah_ditunjukan_user_1153,pki jokowi pki pki,2025-05-14T05:44:09Z,0,18
Ijasah_ditunjukan_user_1156,pa roy mmg mencari tau ttg keabsahan ijasahnya pa jokowi beliau sdh walkot gub jd presiden periode ko dipermasalahkan,2025-05-14T05:31:43Z,0,18
Ijasah_ditunjukan_user_1165,tunjukkan ijazahnya jokowi slesai,2025-05-14T05:05:43Z,0,18
Ijasah_ditunjukan_user_1170,matamu jokowi lapor polisi disalahin disalahin pilihan ku gak salah hebatnya jokowi udah purna aja disalahkan,2025-05-14T04:44:49Z,0,18
Ijasah_ditunjukan_user_1187,jokowi kau manusia licik penipu pembohong malu,2025-05-14T03:38:16Z,0,18
Ijasah_ditunjukan_user_1205,salam demak semoga alloh melindungi jokowi fitnah,2025-05-14T00:40:52Z,0,18
Ijasah_ditunjukan_user_1213,sengaja biar keliatan sifat orang yg senang jokowi karna jokowi yg singkirkan karna kejujurannya kalo emng mas roy pejabat yg jujur coba sahkan uud perampasan yg korupsi berani buktikan biar masyarakat indonesia tau,2025-05-13T23:19:39Z,9,18
Ijasah_ditunjukan_user_1213,presiden jokowi yg ijazah mantan presiden sifat iri,2025-05-13T23:02:40Z,0,18
Ijasah_ditunjukan_user_1241,jokowi cari perlindungan polisi aparat sogok jokowi,2025-05-13T17:10:55Z,1,18
Ijasah_ditunjukan_user_1246,sekelas mantan presiden titel ir bawa ijazah bawa koran gulung hadaaww jokowi jokowi nasib bagus nggak memilih mu,2025-05-13T16:25:20Z,0,18
Ijasah_ditunjukan_user_1264,sya banga jokowi melapor,2025-05-13T14:31:55Z,0,18
Ijasah_ditunjukan_user_1265,motif suryo cuman balas sakit hati dipecat jokowi mentri menpora provokator omong maksudnya gulingkan pemerintah jokowi,2025-05-13T14:30:32Z,0,18
Ijasah_ditunjukan_user_1270,polisi yg nguji forensi polisi jokowi tp jk uji negeri ijazah plsu,2025-05-13T14:07:44Z,0,18
Ijasah_ditunjukan_user_1281,mantap pk presiden jokowi lawan ajk sok bersih penjaraakan,2025-05-13T13:30:30Z,0,18
Ijasah_ditunjukan_user_1281,klu ngg terbukti pejaraakan ajk pk jokowi kasih pelajaran suka mengadu domba,2025-05-13T13:28:47Z,0,18
Ijasah_ditunjukan_user_1313,knp ijazahnya jokowi yg bahas bahas kh ekonomi indonesia spy tembus spy indonesia tdk bubar thn trus yg bhas ijazahnya jokowi,2025-05-13T11:53:34Z,0,18
Ijasah_ditunjukan_user_1339,jokowi melapor tunjukkan selesai pendukung jakowi diduga cinta buta jokowi ijazah palsu,2025-05-13T10:10:03Z,0,18
Ijasah_ditunjukan_user_1341,adili jokowi,2025-05-13T10:03:57Z,0,18
Ijasah_ditunjukan_user_1364,salahkan jokowi mulut busuk terimalah konsekwensinya,2025-05-13T07:46:59Z,0,18
Ijasah_ditunjukan_user_1369,sya membandubgkan dr berbsgai sumber sya ragu dg ijazah yg dimiliki jokowi ijazah keluarnya berproses,2025-05-13T07:27:38Z,0,18
Ijasah_ditunjukan_user_1372,masyasrakat mendukung memilih jokowi pferiode,2025-05-13T06:57:11Z,1,18
Ijasah_ditunjukan_user_1380,klo percaya roy percaya sm pembual bkn ahli telematika mnrut rismon tujuan mmg murni mnjatuhkn jokowi tdnya jokowi diam trnyata melaporkn bnyaklah yg bergumam mampus lo jg yg nyletuk alhamdulillah yg skeptis biar diuji dimnpun gak bkal percaya,2025-05-13T06:19:00Z,0,18
Ijasah_ditunjukan_user_1419,lanjutkan jokowi,2025-05-12T23:49:41Z,0,18
Ijasah_ditunjukan_user_1421,jokowi persiden diatur atur ole orang tempe tempe roisuryo iya kalo jokowi anak diatur ole roi suryo,2025-05-12T23:41:48Z,0,18
Ijasah_ditunjukan_user_1422,pidana hak yg gugat ijasah jokowi tunjukkan laporkan lgi lo suryo masuk buih lgi jokowi udah masarakat jabat presiden ok menjarakat rakyatnya gak etis bebas,2025-05-12T23:34:33Z,0,18
Ijasah_ditunjukan_user_1441,dukung bp jokowi,2025-05-12T18:35:54Z,0,18
Ijasah_ditunjukan_user_1460,sudang korban bambang tri gusnur dipenjara pembuktian jokowi ijazahnya jokowi akar permasalahannya jokowi yg gaduh ijazah beres rakyat mudah percaya dgn manusia muka bumi pengakuan mestinya pembandingnya,2025-05-12T16:51:45Z,0,18
Ijasah_ditunjukan_user_1490,jokowi nunjukin ijasah cek bareskrim ijasah jokowi asli ketahuan,2025-05-12T14:33:02Z,0,18
Ijasah_ditunjukan_user_1496,p jokowi yg menyintai stlah hina caci asli orang yg paham ajaran islam sabar rakyat damai sejuk berkat kepeminpinan p jokowi dn smg allah melindungi jokowi keluwarganya aminnn,2025-05-12T14:06:45Z,0,18
Ijasah_ditunjukan_user_1506,nyonyor lambemu le jokowi d lawan,2025-05-12T13:45:18Z,0,18
Ijasah_ditunjukan_user_1511,jokowi nggak usahlah unjuk unjuk ijazah asli mantan presiden jokowi nggak malu nama jokowi rusak menghalalkan,2025-05-12T13:26:03Z,0,18
Ijasah_ditunjukan_user_1533,hidup jokowi,2025-05-12T12:01:43Z,0,18
Ijasah_ditunjukan_user_1550,jokowi dituduh ijazah presiden pejabat negara,2025-05-12T10:35:33Z,0,18
Ijasah_ditunjukan_user_1553,buktikn si tukang ngibul tangkap dn adili jokowi,2025-05-12T10:19:17Z,0,18
Ijasah_ditunjukan_user_1570,gampang melemahkan jokowi tinggal kpk kekayaannya kekayaan jokowi berasal ertinya menghalalkan kakayaan sita jokowi jatuh miskin jokowi membela jokowi terbukti penipu,2025-05-12T08:18:19Z,0,18
Ijasah_ditunjukan_user_1620,palsu asli ijazah pk jokowi jokowi tetep pahlawan bangsa kinerja nya nyata roy suryo manusia yg iri dengki pk jokowi,2025-05-11T23:43:35Z,4,18
Ijasah_ditunjukan_user_1626,emangnya jokowi wktu skolah dri sd smpai kuliah ya g temn smpai bilang ijasahnya palsu sy nyakin teman jokowi dri sd smpai skrg msh hidup,2025-05-11T22:18:45Z,0,18
Ijasah_ditunjukan_user_1640,kariernya jokowi knapa si dungu roy suryo cs menjelek an ugm menuduh palsu tuh karier yg dilewati jokowi tu g menanggapi tuduhan yg bermutu orang tolol bodoh dungu yg benci jokowi wkwkwkw,2025-05-11T18:12:49Z,0,18
Ijasah_ditunjukan_user_1641,pengacara jokowi waras,2025-05-11T17:39:12Z,0,18
Ijasah_ditunjukan_user_1647,silahkan dukung pemitnah kebenaran p jokowi,2025-05-11T17:14:48Z,0,18
Ijasah_ditunjukan_user_1667,puas jokowi presiden ga bikin sejahtera miskin mah negeri,2025-05-11T15:26:01Z,0,18
Ijasah_ditunjukan_user_1691,dasar jokowi penipu kuliah jurusannya ga skripsi pembimbingnya salah orang ljazahnya asli dikeluarkan ugm proses perkuliahan dasar jokowi penipu,2025-05-11T13:20:58Z,0,18
Ijasah_ditunjukan_user_1716,masarakat menganggap ijasah pk jokowi palsu golongan pk roi panci rakyat gak ragukan ijasah pk jokowi,2025-05-11T10:51:05Z,0,18
Ijasah_ditunjukan_user_1719,jokowi sengaja mengalah menamg skrg sdh terjwb usil,2025-05-11T10:32:32Z,0,18
Ijasah_ditunjukan_user_1727,drs ir kuliah dimana jokowi kuliah,2025-05-11T09:54:35Z,0,18
Ijasah_ditunjukan_user_1741,byk yg jokowi jokowi walikota solo gambaran tetangga jakarta daerah a wali kotanya berijazah sma gengsi sang walikota kuliah cepat gelar sarjana era efek pelaku penguasa basic kontraktor at yg berduit skill mimpin no blkg tenaga ahli lebihnya berhubung kelas jokowi ri ya urusan nya berbeda coba level wali kota sorot gosip biodata kpu hilang menambah kecurigaan jd dunia pendidikan senyum disayangkan ugm sekelas universitas elit univ runahan ajh sih yg sarjana,2025-05-11T08:40:05Z,0,18
Ijasah_ditunjukan_user_1772,jokowi segaja berpelit ijasa nutupi isu kebodohan gimbran rusaknya hukum indonesia yg ngerusak jokowi,2025-05-11T05:25:59Z,0,18
Ijasah_ditunjukan_user_1781,sikat jokowi hujat mantan presiden yg terbaik ku,2025-05-11T04:30:02Z,0,18
Ijasah_ditunjukan_user_1785,karna politisi yg terkena ciduk kpk lihat tunggani partai politik yg suka jokowi yg menabur yg menuai,2025-05-11T04:14:25Z,0,18
Ijasah_ditunjukan_user_1794,dam duryo yg bikin ulah merendahkan jokowi serendahnya mencari cari alasan ijazah beliau palsu buktikan haknya saudara ijazah jokowi mengganggu ham jokowi,2025-05-11T03:17:37Z,0,18
Ijasah_ditunjukan_user_1822,sikat gerombolan pengrecok semangat jokowi,2025-05-11T00:30:44Z,0,18
Ijasah_ditunjukan_user_1840,teman seangkatan jokowi membela jokowi gentar lawan hahaha,2025-05-10T18:02:08Z,0,18
Ijasah_ditunjukan_user_1854,tangkap yg penghinaan mantan presiden jokowi jokowi orng hebat kaya kritik,2025-05-10T16:58:41Z,1,18
Ijasah_ditunjukan_user_1894,kepentinganmu ijazah jokowi kpu,2025-05-10T14:05:16Z,0,18
Ijasah_ditunjukan_user_1916,mendukung semangat jokowi,2025-05-10T12:54:09Z,2,18
Ijasah_ditunjukan_user_1927,rakyat tau ijasah jokowi asli roy berkokok dosen jokowi mahasiswa ugm jokowi,2025-05-10T12:03:49Z,0,18
Ijasah_ditunjukan_user_1935,itukan pencemaran nama jokowi usut tuntas,2025-05-10T11:12:36Z,0,18
Ijasah_ditunjukan_user_1950,jokowi melaporkan ko lapor laporan kehilangan,2025-05-10T10:05:55Z,0,18
Ijasah_ditunjukan_user_1976,alhamdulillah jokowi yg bijaksana nyata kebenarannya,2025-05-10T08:25:08Z,0,18
Ijasah_ditunjukan_user_2004,jik benci ya untung nya sih jitu menjatuhkan harga jokowi palsu jokowi akui presiden,2025-05-10T06:02:28Z,0,18
Ijasah_ditunjukan_user_2052,akutidak percaya jokowi,2025-05-10T03:12:09Z,0,18
Ijasah_ditunjukan_user_2056,roy setan jokowi legalitas nya jokowi km yg bikin ribut dasar setan km,2025-05-10T03:08:53Z,0,18
Ijasah_ditunjukan_user_2070,jokowi melaporkan pribadi mantan presiden,2025-05-10T02:02:40Z,0,18
Ijasah_ditunjukan_user_2123,sobat yg suka membuli keluarga jokowi tdk kesalahan dgn derajatnya terangkat yg oceh malu,2025-05-09T21:53:47Z,0,18
Ijasah_ditunjukan_user_2125,biang kerok kegaduhan jokowi dr beiau jujur pemimpin tunjukan ijasa aslinya pembiaran,2025-05-09T20:58:46Z,0,18
Ijasah_ditunjukan_user_2130,komponen rakyat tdk mudah percaya yg memeriksa ijazah jokowi kepolisian dgn kunjungan perwira polisi rumah jokowi solo rakyat percaya pemeriksaan ijazah jokowi melibatkan ilmuwan unipersitas terkenal ui itb ipb ugm meragukan melibatkan unipersitas negri,2025-05-09T19:27:53Z,0,18
Ijasah_ditunjukan_user_2163,udah kebaca kalo jokowi bener merka berkoar yg roy suryo mantan presiden mempidanakan ibu² tp kalo gk gitu yaa gk kapok² tetep dukung jokowi beliau yg salah intinya sakit hati jd gk bener yg lakukan jokowi mata ijazah karna penjara ngeles teroos,2025-05-09T15:28:06Z,0,18
Ijasah_ditunjukan_user_2173,dukung jokowi ngak percaya kena penyakit hati iri dengki,2025-05-09T14:28:43Z,0,18
Ijasah_ditunjukan_user_2175,maaf bos masyarakat gk butuh ijazah jokowi yg butuhin periode de mencalon,2025-05-09T14:23:50Z,0,18
Ijasah_ditunjukan_user_2188,kesalahannya jokowi,2025-05-09T13:36:46Z,0,18
Ijasah_ditunjukan_user_2190,patani dukung jokowi menang,2025-05-09T13:32:32Z,0,18
Ijasah_ditunjukan_user_2203,tangkap roysuryo jokowi ijaza aslinya penjarakan kru roysuryo,2025-05-09T12:47:53Z,0,18
Ijasah_ditunjukan_user_2214,biar cpat tuntas ijazah palsu pk jokowi tunjukan ijazah aslinya pk jokowi biar masarakat tau kebenaran yg nyinyir langsung tangkap penjarakan,2025-05-09T12:07:40Z,0,18
Ijasah_ditunjukan_user_2216,ayo yg jujur donk jokowi umpet umpetan,2025-05-09T12:04:06Z,0,18
Ijasah_ditunjukan_user_2241,parah jokowi kkn an,2025-05-09T10:27:24Z,0,18
Ijasah_ditunjukan_user_2257,semenjak bambang tri membongkar ijasah jokowi palsu persidangan x jokowi hadir hakim menunjukan ijasah asli jokowi masyarakat yg curiga,2025-05-09T09:11:46Z,1,18
Ijasah_ditunjukan_user_2269,menjatuhkan jokowi pakai bodoh,2025-05-09T08:07:47Z,0,18
Ijasah_ditunjukan_user_2271,sgt bernapsu gerombolan pembenci jokowi membunuh karir poltitik jokowi smg bpk jokowi keluarganya sllu dlm perlindungan allah swt,2025-05-09T08:02:59Z,0,18
Ijasah_ditunjukan_user_2284,jokowi sbgai presiden melaporkan roy cs berwajib etis sekrang jokowi sbgai rakyat berani lapor pahami,2025-05-09T07:30:06Z,0,18
Ijasah_ditunjukan_user_2306,sdh yg duplikat kehadiran jokowi kkn dihutan rimba,2025-05-09T06:00:17Z,0,18
Ijasah_ditunjukan_user_2307,dasar pinter keblinger klau emang palsu yg kusut ya ugm jokowi dasar pembenci jokowi mudah mudahan jokowi jaya semoga sadar suryo panci mandi junub biar bau tai omonganya,2025-05-09T05:55:51Z,0,18
Ijasah_ditunjukan_user_2324,jokowi si pembuat kegaduhan negri,2025-05-09T05:06:04Z,0,18
Ijasah_ditunjukan_user_2340,ga ga kepenting bikin gaduh lanju pa jokowi biar faham,2025-05-09T04:20:49Z,0,18
Ijasah_ditunjukan_user_2342,berdasarkan chanel kuliah jokowi mulyono adik iparnya jokowi dicaplok diakui nya diskenariokan kroninya rektor,2025-05-09T04:14:50Z,0,18
Ijasah_ditunjukan_user_2371,jokowi kepemimpinannya periode ngapain dipermasalahkan ijazah beliau tau korupsi,2025-05-09T02:51:56Z,0,18
Ijasah_ditunjukan_user_2382,roy suryo dkk apapun alasannya silakan membuktikan jokowi yg membuktikan sungguh memalukan kl roy kk polisikan hukum tindakan ijasah teruji jokowi menjabat wali kota presiden kl curiga ijasah palsu ya kpu nya yg gugat jokowinya,2025-05-09T01:37:38Z,0,18
Ijasah_ditunjukan_user_2391,slalu drama yg dibikin jokowi,2025-05-09T00:41:51Z,0,18
Ijasah_ditunjukan_user_2410,jgn alasan sdh tau jokowi walikota gubernur presiden pokonya penjara,2025-05-08T23:13:59Z,0,18
Ijasah_ditunjukan_user_2419,jokowi sukanya rumit salahnya jokowi tunjukan ijazah aslinya jokowi menutupi kebohongan dgn kebohongan,2025-05-08T21:59:02Z,0,18
Ijasah_ditunjukan_user_2420,bukti jokowi s pidato pake bhs inggris pasieh,2025-05-08T21:46:49Z,0,18
Ijasah_ditunjukan_user_2463,pengen nabok muka suyo menghina kayaknya ni dengn pk jokowi,2025-05-08T16:21:20Z,0,18
Ijasah_ditunjukan_user_2474,konsekuensinya ijazah jokowi asli mska terlapor diadili utk memvuat efek jera yg memfitnah ijazah jokowi palsu beliau dipidana sependapat roy surio terkesan menyebut mantan presiden melaporkan yg orang orang dimata hukum mantan presiden mantan menteri yg salah dihukum jokowi roy surio konsekuensinya roy surio koar kriminalisasi mencari kebenaran,2025-05-08T15:35:19Z,0,18
Ijasah_ditunjukan_user_2485,urusan ijazah pengalihan anehnya ijazah jokowi heboh yg,2025-05-08T15:07:32Z,0,18
Ijasah_ditunjukan_user_2499,intinya ijazah jokowi tdk bongkar tuntas uji ilmiah dll terbuka transparansi pastikan tdk selesai yg bikin resah yg,2025-05-08T14:35:10Z,0,18
Ijasah_ditunjukan_user_2502,stlah pk jokowi smua mph dgugat knpa gk dri dlu pk mnggugat y cari almuni y az tuk mnguji pk jokowi kuliah atu gk ugm,2025-05-08T14:19:22Z,0,18
Ijasah_ditunjukan_user_2504,bawa ijazah map ditekuk tekuk ngibul banget klo jokowi bawa ijazah,2025-05-08T14:09:18Z,0,18
Ijasah_ditunjukan_user_2513,motif bkn mslh kjujuran sy g percaya sm ksh amanah aja g jujur dgn merampok uang negara berjamaah skrg kjujuran sm jokowi motif hnya mmpermalukan mngkriminalisasi jokowi mmenjarakan jokowi krn bls dendam berkelit biar masyarakat tau mantan presidennya mmpidanakan rakyatnya heeioooo sadar g lu klo g ngotot berkoar g mngkin jokowi mngambil lngkah hukum,2025-05-08T13:32:07Z,0,18
Ijasah_ditunjukan_user_2518,mantab jokowi penjarakan orang² yg menghina merendahkanmu,2025-05-08T13:11:41Z,0,18
Ijasah_ditunjukan_user_2525,susah suryo cek aja ugm data jokowi kuliah,2025-05-08T12:31:33Z,0,18
Ijasah_ditunjukan_user_2551,jokowi playing victim,2025-05-08T11:09:55Z,0,18
Ijasah_ditunjukan_user_2562,si jokowi sekolah ugm thn jokowi gk ijasah skripsi,2025-05-08T10:29:55Z,0,18
Ijasah_ditunjukan_user_2574,pk jokowi sabar hajar gebuk biar mampus,2025-05-08T09:52:42Z,0,18
Ijasah_ditunjukan_user_2598,berdoa smoga ijasah pk jokowi asli pk jokowi orang sllu fitnah,2025-05-08T07:02:18Z,0,18
Ijasah_ditunjukan_user_2599,malu kau suryo kau belajar jokowi,2025-05-08T07:00:52Z,0,18
Ijasah_ditunjukan_user_2607,jokowi langsung ijazah aslinya kegaduhan berlajut yg yg jokowi,2025-05-08T06:10:54Z,0,18
Ijasah_ditunjukan_user_2641,izasah penasaran ayo mas suryo lanjutkan keberanian membongkar izasah bp jokowi,2025-05-08T03:10:53Z,0,18
Ijasah_ditunjukan_user_2643,menjatuhkan jokowi salah kuat jokowi akui dunia,2025-05-08T03:09:54Z,0,18
Ijasah_ditunjukan_user_2645,lambene sakit hati yg memfitnah menuduh jokowi semoga mulutnya pd dower dipenjara,2025-05-08T03:04:51Z,1,18
Ijasah_ditunjukan_user_2649,jokowi terima kasih membantu masyarakat sederhana rendah hati tuhan memberkati bapa jokowi,2025-05-08T02:43:16Z,35,18
Ijasah_ditunjukan_user_2655,bener nih menunjukan ijazah jokowi mediasi aja ngga bawa ijazahnya tunggu dipengadilan,2025-05-08T02:13:13Z,0,18
Ijasah_ditunjukan_user_2663,jokowi munafik biadab,2025-05-08T01:33:27Z,0,18
Ijasah_ditunjukan_user_2668,masyarakat indonesia terimah ksh pk jokowi yg suda thn menahan caci maki dihina anjing roy soroyo teman,2025-05-08T01:07:04Z,0,18
Ijasah_ditunjukan_user_2681,jokowi jgn mediasi,2025-05-08T00:09:11Z,0,18
Ijasah_ditunjukan_user_2694,intinya tunjukkan ijazah jokowi utk pemeriksaan forensik ahli independen dr negri fair hasilnya dpt diterima,2025-05-07T23:18:17Z,5,18
Ijasah_ditunjukan_user_2709,jokowi mantan presiden klu izasah jokowi asli roy suryo rismon dkk penjarakan biar negara aman,2025-05-07T22:47:27Z,0,18
Ijasah_ditunjukan_user_2727,ijazah jokowi viral,2025-05-07T21:33:22Z,0,18
Ijasah_ditunjukan_user_2728,kinerja jokowi presiden ijazah kertas,2025-05-07T21:24:23Z,0,18
Ijasah_ditunjukan_user_2729,org bijak jokowi diam fitnah tp klw uda bertindak pusing,2025-05-07T21:12:51Z,0,18
Ijasah_ditunjukan_user_2746,ijazah jokowi forensik aslian nya skripsi yg uu mk aja berani tabraknya kepentingan anaknya sekedar ijazah tunjukan aslian ijazahnya masyarakat jokowi sbg mantan presiden,2025-05-07T19:16:14Z,1,18
Ijasah_ditunjukan_user_2771,klu roy suryo penjara klu gak penjarakan muncul pentolan sampah pembenci jokowi mempermasalah kn ijaza jokowi,2025-05-07T17:37:04Z,0,18
Ijasah_ditunjukan_user_2806,yg menjamin tdk lanjutan jokowi ijasah ijasah tdk kebencian,2025-05-07T16:14:28Z,0,18
Ijasah_ditunjukan_user_2824,maju pa jokowi,2025-05-07T15:59:04Z,0,18
Ijasah_ditunjukan_user_2843,pk jokowi,2025-05-07T15:26:08Z,0,18
Ijasah_ditunjukan_user_2861,apain jokowi tetep gk akn berubah sayang cintaku gk bs d rubah sekeji apapun ttp syng jokowi,2025-05-07T15:03:40Z,0,18
Ijasah_ditunjukan_user_2870,dasar pengecut emg sebodoh kau pikir resiko pa jokowi gugat kl pa jokowi tdk menang,2025-05-07T15:00:13Z,0,18
Ijasah_ditunjukan_user_2891,roy suryo orang getolnya ngurusi ijazah pribadi jokowi dikeluarkan ugm meremehkan ijazah ugm,2025-05-07T14:48:01Z,0,18
Ijasah_ditunjukan_user_2896,nunjukin ijasahpun kerjanya jokowi nyata,2025-05-07T14:44:05Z,0,18
Ijasah_ditunjukan_user_2896,nunjukin ijasahpun kerjanya jokowi nyata,2025-05-07T14:43:23Z,0,18
Ijasah_ditunjukan_user_2904,semoga jokowi keluarga dlm lindungan tuhan yme jauhkan fitnah yg keji,2025-05-07T14:35:12Z,3,18
Ijasah_ditunjukan_user_2910,enak aja ijazahnya p jokowi tunjukkan mudah,2025-05-07T14:30:39Z,0,18
Ijasah_ditunjukan_user_2926,mkanya pilih jokowi,2025-05-07T14:20:03Z,0,18
Ijasah_ditunjukan_user_2931,pengecut roy suryo bilang jokowi mimidanakan lsetelah pk jokowo menunjukan ijazah aslinya pk jokowi menjukan ijazah aslinya kentu dirkam mrnghina pk jokowi orang jawa bilang keweleh ngapain ngurusin ijazah pk jokowi,2025-05-07T14:14:59Z,0,18
Ijasah_ditunjukan_user_2947,jokowi walikota kau tdk protes omong kosong sj km bilang sakit tdk mentri,2025-05-07T14:04:42Z,0,18
Ijasah_ditunjukan_user_2956,pk jokowi menjabat presiden dipermasalahkan ijazahnya menjabat koq dipermasalahkan,2025-05-07T13:57:11Z,0,18
Ijasah_ditunjukan_user_2970,pake akal sehat logika org bodoh kalo izasah pa jokowi palsu pa jokowi nyalonkan wali kota solo kalah ga mngkin diam lawan politiknya pa jokowi,2025-05-07T13:45:36Z,0,18
Ijasah_ditunjukan_user_2981,berani ya ma jokowi aje dasar pembenci jokowi roy panci,2025-05-07T13:28:00Z,0,18
Ijasah_ditunjukan_user_2993,p jokowi sdh berani menunjukan ijazahnya menunjukan kejujurannya polisi,2025-05-07T13:18:08Z,0,18
Ijasah_ditunjukan_user_2999,jokowi ijazah palsu kanapa pimpin negara priode negara berwajah indomesia jokowi bersni tantang dunia menjabat peremeh jokowi jgn bdoh tolol pengeritik,2025-05-07T13:13:16Z,0,18
Ijasah_ditunjukan_user_3006,atur jokowi enak roy,2025-05-07T13:06:35Z,0,18
Ijasah_ditunjukan_user_3007,memikirkan mempermasalahkan ijazah jokowi ijazah smp kah sma kah jokowi pikir pemimpin jokowi unggul kebijakannya pembangunannya nampak banget seandainya ijazah jokowi palsu diputar kebijakan pembangunan jokowi dirubah apasih pengaruhnya ijazah jokowi palsu sontoloyo,2025-05-07T13:04:51Z,0,18
Ijasah_ditunjukan_user_3045,maaf izasanya jokowi palsu jokowi berhak lho menerima gajih pensiunan mantan presiden uang negara ok,2025-05-07T12:24:27Z,1,18
Ijasah_ditunjukan_user_3049,emng si roy ngapain jokowi nunjukin ijazahnya,2025-05-07T12:18:23Z,0,18
Ijasah_ditunjukan_user_3073,tuduhan merugikan jokowi jokowi pasif nama jelek menuntut penuduh mantan presiden menuntut hukum,2025-05-07T11:43:39Z,0,18
Ijasah_ditunjukan_user_3080,ijazahnya terbukti jokowi kuliah ugm,2025-05-07T11:31:01Z,0,18
Ijasah_ditunjukan_user_3087,semoga alloh melindungi p jokowi beserta keluwarganya,2025-05-07T11:22:19Z,12,18
Ijasah_ditunjukan_user_3090,jokowi presiden terbaik,2025-05-07T11:16:54Z,3,18
Ijasah_ditunjukan_user_3097,puas dgn langka jokowi melaporkan ahli pengfitnah,2025-05-07T11:06:59Z,0,18
Ijasah_ditunjukan_user_3098,jokowi orangnya jenius gelar bersamaan drs ir ijasah sesukanya drs walikota ir gubernur presiden hebat jokowi,2025-05-07T11:02:50Z,26,18
