author,text,published_at,like_count,cluster
debat_tv_one_user_13654,sidang perdana ttg gugatan ijazah palsu jokowi buktikan jokowi hadir dlm sidang ngacir pendukubgnya bang silver dkk berani bawa ijazaah jokowo deoan hakim teliti forensik ngebacot meddos hayo rakyat menunggu kemunculan ijazah jokowi yg asli persidangan,2025-04-24T03:05:58Z,15,1
debat_tv_one_user_13656,ugm klarifikasi ijazah jokowi asli dikeluarkan ugm diragukan diaudit uji forensik,2025-04-24T03:05:47Z,2,1
debat_tv_one_user_13657,mari bomingkan gerakan dg tagar tunjukan ijazah asli foto upload publik,2025-04-24T03:05:44Z,0,1
debat_tv_one_user_13712,muri ijazah jokowi masukkan kedalam ijazah terbuas berbahaya sedunia memakan orang korban memakan orang korban memakan korban kiamat ijazah jokowi tunjukkan muka rakyat,2025-04-24T03:00:41Z,0,1
debat_tv_one_user_13745,ruwet ruwet ruwet tinggal tunjukkan ijazah aslinya kq repot sukanya memancing rakyat dijebak menuduh ijazah palsu d kriminalisasi,2025-04-24T02:58:33Z,5,1
debat_tv_one_user_13759,dr rismon sianipar ijazah jokowi ribu triliun palsu ijazah ugm palsu ijazah sma nya palsu kepalsuan ijazah jokowi terbongkar akar akarnya,2025-04-24T02:57:02Z,47,1
debat_tv_one_user_13809,pol cepatlah laporan diproses sdh gak sabar liat ijazah asli jokowi persidangan,2025-04-24T02:51:43Z,0,1
debat_tv_one_user_13812,pengadilan hakimnya ijazah asli ijazah asli membedakan asli palsu,2025-04-24T02:51:39Z,0,1
debat_tv_one_user_13818,ijazah jokowi palsu asli rakyat kejelasanya,2025-04-24T02:50:49Z,0,1
debat_tv_one_user_13877,foto d gunkn buku nikah ijazah sma ijazah ugm,2025-04-24T02:45:11Z,0,1
debat_tv_one_user_13878,dicek tuh ijazah fufu fafa,2025-04-24T02:45:06Z,177,1
debat_tv_one_user_13881,panda elit pdip partai yg mengusung mendaftarkan jokowi kpu aktif ijazah palsu simalakama bumerang,2025-04-24T02:44:35Z,0,1
debat_tv_one_user_13904,roy suryo rakyat ijazah jokowi palsu ijazah asli orang gimana asumsi roy suryo bilang ijazah orang palsu pembuktian nihil terbukti malu ni keren selamat ginting percaya roy suryo jokowi tolonh buktikan gitu,2025-04-24T02:41:53Z,2,1
debat_tv_one_user_13820,asli palsunya,2025-04-24T02:41:07Z,0,1
debat_tv_one_user_13917,kali sy liat orang ijazah asli bawa pengacara berbohong nya,2025-04-24T02:40:51Z,1,1
debat_tv_one_user_13925,ugm konfirmasi asli ijazah jokowi pengacara nya gk tunjukkan ijazah nya sih sulitnya sih bikin ribet gaduh indonesia,2025-04-24T02:39:40Z,0,1
debat_tv_one_user_13926,ugm membuktikan ijazah tsb asli palsu selesai ugm yg bertanggungjawab membuktikan pernyataannya,2025-04-24T02:39:38Z,1,1
debat_tv_one_user_13947,rakyat berhak informasi keaslian ijazah mantan presiden jokowi sesuai ketentuan pasal f uud mmenyembunyikan ijazah dgn melarang difoto patut diduga ijazah nya palsu,2025-04-24T02:38:00Z,0,1
debat_tv_one_user_13975,klu ijazah ugm universitas geng mulyono terbitkan asli presiden bekas namanya jokowi smp lulus jamin milyar pengepul kayu jati cobalah pdip bersuwara diam,2025-04-24T02:34:23Z,0,1
debat_tv_one_user_13994,jokowi skrg msh menikmati uang rakyat pengamanan uang pensiun rumah pensiun dll moral rakyat yg menguji ijazah nya jokowi mengizinkan tdk polemik bangsa sdh korban dipenjara jokowi tdk kerugian nama ijazah pn ijazah jokowi asli jokowi berhati busuk,2025-04-24T02:31:59Z,0,1
debat_tv_one_user_13948,jokowi ijazah asli bikin malu,2025-04-24T02:28:41Z,4,1
debat_tv_one_user_14056,megurusi ijazah koruptor,2025-04-24T02:24:38Z,0,1
debat_tv_one_user_14062,ijazah jkw asli legal tp bgt suryo simon menjabar ilmiah akademik mk skarang sy percaya ijazah nya duduga p a l s u,2025-04-24T02:23:52Z,0,1
debat_tv_one_user_14068,ugm kpu bs sogok knp ijazah sby dll tdk krn kronologi sekolahnya ap lg yg ditutupi ya sdh buka dibpengadilan hadir bw ijazah yg sdh liat awas klu mangkir ijazah tdk bawa,2025-04-24T02:23:33Z,0,1
debat_tv_one_user_14072,kasian jokowi korban pesennya ijazah asli tpi dapatnya palsu ketipu pratikno cs gank ugm jongos si raja ngibul pencitraan andalan prestasi terkorup dunia no mikir,2025-04-24T02:22:32Z,1,1
debat_tv_one_user_14106,orang ijazah jokowi asli beli mintanya asli palsu paham kalean yassalam,2025-04-24T02:19:17Z,0,1
debat_tv_one_user_12720,mulyono omon fitnah murahan nunjukin ijazah aslinya publik terbuka gak berani keanehan keganjilan ijazah skripsi mulyono orang dibantah dibuktikan ijazah aslinya publik beraninya main kucing kucingan wartawan difoto mulyono seneng difoto pencitraan sorry ye lulusan ugm bangga ijazah aslinya publik diumpetin mudah sederhana ruwet polemik ijazah palsu pengaruh kekuasaannya memenjarakan orang mempermasalahkan ijazah tahulah lembaga hukum persidangan ijazah aslinya dihadirkan pengadilan menjatuhkan hukuman hukum negeri konoha jungkir,2025-04-24T02:18:40Z,1,1
debat_tv_one_user_14135,lulusan ugm bangga ijazah ugm universitas bergengsi,2025-04-24T02:15:47Z,262,1
debat_tv_one_user_14137,alasan yg pengacaranya anak otto hasibuan bodoh preseden buruk krn bukti kepalsuan ijazah palsu pejuang kebenaran ijazah aslinya dungu,2025-04-24T02:15:34Z,0,1
debat_tv_one_user_14157,wajib si jokowi meninjukan ijazah yg asli aspal karna megunakan dokumen ijazah menerima gaji pensiun negara kecuali cari makan dr usaha ternak kodok,2025-04-24T02:12:05Z,0,1
debat_tv_one_user_14180,ijazah jokowi asli hercules si matapalsu indonesia periode pimpin sindikat pemalsu ijazah jokowi negri perintah prabowo disaat sidang disolo bareskrim bergerak dugaan ijazah palsu,2025-04-24T02:08:58Z,0,1
debat_tv_one_user_14192,wooo kuasa hukumnya ijazah jokowi,2025-04-24T02:07:20Z,0,1
debat_tv_one_user_14209,terbukti asli,2025-04-24T01:58:06Z,0,1
debat_tv_one_user_14314,yan g b aik dibicarakan ijazah jokowi,2025-04-24T01:15:28Z,1,1
debat_tv_one_user_14317,muak drama konoha tinggal tunjukan ijazah joko tetep tunjukan tinggal orang berani tunjukan beres paham,2025-04-24T01:12:57Z,91,1
Ijasah_ditunjukan_user_52,foto ijazah berkacamata sah,2025-05-28T07:23:32Z,0,1
Ijasah_ditunjukan_user_61,ijazah aslinya si jokodok keraguan kegaduhan,2025-05-28T02:16:10Z,0,1
Ijasah_ditunjukan_user_88,kertas ijazah jokowi asli nya sesuai dgn prosedur ketentuan,2025-05-26T14:58:02Z,0,1
Ijasah_ditunjukan_user_90,tunjukan ijazah asli jokowi kpd roy suryo dkk berubah palsu penjagat negara,2025-05-26T13:14:24Z,0,1
Ijasah_ditunjukan_user_106,asli,2025-05-25T23:47:57Z,0,1
Ijasah_ditunjukan_user_155,nunjukin ijazah asli aja repoooot preeet,2025-05-24T02:29:57Z,0,1
Ijasah_ditunjukan_user_165,org pesenya ijazah yg asli knp bang roy ngeyel aja sih coba tih ma hercules,2025-05-23T17:41:46Z,0,1
Ijasah_ditunjukan_user_308,mukidi tunjukkan ijazah aslinya asli palsunya pencemaran nama penghargaan finalis koruptor dunia occrp,2025-05-21T11:15:43Z,0,1
Ijasah_ditunjukan_user_345,tunjukkan ijazah aslinya roy kroni nya percaya asli,2025-05-21T03:08:55Z,0,1
Ijasah_ditunjukan_user_350,setahu sy kuliah sarat ijazah uji skripsi lulus berhak dpt ijazah sy tdk tau ugm,2025-05-21T02:22:23Z,0,1
Ijasah_ditunjukan_user_411,ijazah asli jokowi buatan cina,2025-05-20T12:16:54Z,0,1
Ijasah_ditunjukan_user_413,asli nya ijazah bpk jokowi beliau presiden legend,2025-05-20T11:57:55Z,0,1
Ijasah_ditunjukan_user_430,alasanmu aja ijazah tunjukan mulut jaminan diungkit,2025-05-20T09:17:08Z,0,1
Ijasah_ditunjukan_user_449,jokowi membawa ijazah tunjukan satupun orang yg tau ijazahnya jokowi kapolri sigit hakim aja gak tau ijazah jokowi,2025-05-20T06:25:52Z,0,1
Ijasah_ditunjukan_user_460,indonesia oh indonesia ijazah jokowi asli ngak gue pikirin yg gua pikirin cari kerja aja susah indonesia,2025-05-20T04:54:50Z,0,1
Ijasah_ditunjukan_user_480,suryo rismon coba tolong tunjukkan ijazah,2025-05-20T00:32:28Z,0,1
Ijasah_ditunjukan_user_493,ijazah asli palsu urusan jokowi kebijakan selagi menjabat presiden kau pertanggung jawabkan akhirat kebohongan kebohongan rakyat catat terlupakan,2025-05-19T22:31:42Z,0,1
Ijasah_ditunjukan_user_523,kalipun yg menuduh percaya sdh terkontaminasi memorinya ijazah jokowi palsu,2025-05-19T13:20:00Z,0,1
Ijasah_ditunjukan_user_542,pemikiran jokowi ijazah asli krn sblm presiden sdh walikota pemilu bukanya gk pake ijazah mendaftarkan calon,2025-05-19T10:54:24Z,0,1
Ijasah_ditunjukan_user_549,ijasahnya asli beli bilangnya yg asli,2025-05-19T09:27:37Z,0,1
Ijasah_ditunjukan_user_583,ijazah asli,2025-05-19T00:24:10Z,0,1
Ijasah_ditunjukan_user_610,jokowi hasil kerja mu presiden indonesia menang saham emas freeport hilirisasi nickel harga minyak profinsi pembangunan jalan toll mengadakan kereta api cepat pembangunan pariwisata hasil kerja jokowi menguntungkan indonesia pembicaraan picik ijazah nya ijazah presiden jokowi indonesia perusahaan pegawai berijazah orang berijazah hebat hebat jokowi kebanyakan duduk meja layanin indonesia presiden jokowi terjun langsung lapangan ijazah urusannya hasil kerja presiden jokowi males ngomongin ijazah jokowi jokowi nggak tunjukan ijazah hasil kerjamu dahsyat merubah indonesia negara maju bukti kerja ijazah,2025-05-18T13:30:54Z,6,1
Ijasah_ditunjukan_user_613,ijazah mulyono tdk pernh perlihatkan yg berani ngomong ijazah mulyono palsu jebloskan penjara aneh,2025-05-18T13:17:43Z,0,1
Ijasah_ditunjukan_user_687,ijazah jokowi asli ugm jebloskan tukang fitnah byk alasan jg menjatuhkan ugm ugm gugat trilyun sita aset,2025-05-17T15:33:57Z,0,1
Ijasah_ditunjukan_user_695,ra sah ngurusi roi panci wajibempersoalkan ijazah asli palsu institusi mengeluarkan bertanggung,2025-05-17T13:39:50Z,0,1
Ijasah_ditunjukan_user_718,rakyat menilai jokowi fitnah rendah x ijazah jokowi asli alias tdk palsu,2025-05-17T09:30:38Z,0,1
Ijasah_ditunjukan_user_758,ijazah urusannya pikir mudah ijazahnya diperiksa mendetail asli palsu ijazah asli bertele tele no induk mahasiswaan nilai semester kkn penelitian skripsinya dokumennya ugm sulit diselesaikan berbelit belit yg beres,2025-05-16T23:38:11Z,0,1
Ijasah_ditunjukan_user_765,pemilik tunjukan ijazah publik ijazah asli masuk akal pemiliknya orang menunjukan sembunyi ribet takut pengacara faham kliennya tunjukan ijazahnya asli,2025-05-16T19:20:23Z,0,1
Ijasah_ditunjukan_user_771,ijazah asli palsu sih hebatnya ijazahnya asli gk gunanya untk negara kyak roy suryo,2025-05-16T17:52:26Z,0,1
Ijasah_ditunjukan_user_839,universitas abal jual beli ijazah,2025-05-16T04:54:36Z,0,1
Ijasah_ditunjukan_user_841,roi tunjukan ijazah nya bp ijazah palsu,2025-05-16T04:44:28Z,0,1
Ijasah_ditunjukan_user_896,ijazah pesan neraka bro,2025-05-15T15:58:35Z,0,1
Ijasah_ditunjukan_user_900,ga dr diselesaikan dgn tunjukin ijazah ga nunggu th korban,2025-05-15T15:48:18Z,0,1
Ijasah_ditunjukan_user_916,ijazah indonesia aja jokowi memenangkan,2025-05-15T13:51:05Z,0,1
Ijasah_ditunjukan_user_921,ijazah y asli palsu g peduli gw yg jls kepemimpinan y bobrok,2025-05-15T13:32:11Z,0,1
Ijasah_ditunjukan_user_979,orang ijazah melamar calon pns ijazah hubungannya kalu ijazah,2025-05-15T04:37:07Z,0,1
Ijasah_ditunjukan_user_982,menguji ijazah asli ijazah palsu gampang tunjukkan aja lho gusdur gitu aja repot hahahaha,2025-05-15T04:21:20Z,0,1
Ijasah_ditunjukan_user_987,kualitas kertas ijazah diperbandingkan ijazah teman kuliahnya,2025-05-15T03:29:39Z,0,1
Ijasah_ditunjukan_user_987,tuntutan roy suryo jokowidodo merespon pensiun presiden singkat foto copy mendaftar asli diserahkan menguji kebenaran ijazah prosesnya ijazah jokowidodo palsu,2025-05-15T03:21:50Z,0,1
Ijasah_ditunjukan_user_1020,panggil aja yg suka koar biar lihat ijazah asli jokowi silahkan borgol aja penjara selesai,2025-05-14T18:16:21Z,0,1
Ijasah_ditunjukan_user_1028,kebuktian asli ijazah telusuri uji forensik,2025-05-14T17:12:49Z,0,1
Ijasah_ditunjukan_user_1031,maksudnya si suryo presiden berpidato acara apapun memamer ijazah nya prabowo bawa ijazah mu ya aturan,2025-05-14T16:48:34Z,0,1
Ijasah_ditunjukan_user_1065,ganti kapolrinya peneliti ijazah team independen,2025-05-14T14:00:22Z,0,1
Ijasah_ditunjukan_user_1091,masarakat cuek aja mslh ijazah roy aja krjaan,2025-05-14T12:12:39Z,0,1
Ijasah_ditunjukan_user_1144,simple seandainya jokowi ijazah asli tunjukkan urusan selesai,2025-05-14T06:22:08Z,0,1
Ijasah_ditunjukan_user_1164,kerjaan banget sih ngurusin ijazah orang gak ijazah mah yg kualitas,2025-05-14T05:08:05Z,0,1
Ijasah_ditunjukan_user_1242,menuduh salah bukti kuat asli palsu ijazah membuktikan penuduh yg ijazah membuktikan,2025-05-13T16:51:10Z,0,1
Ijasah_ditunjukan_user_1252,ijazah aslinya sdh kelar,2025-05-13T15:41:44Z,0,1
Ijasah_ditunjukan_user_1280,klu ijazah asli skripsinya yg tulisan nya sesuai tehnologi zamannya abal abal,2025-05-13T13:38:08Z,1,1
Ijasah_ditunjukan_user_1300,ijazah hak pribadi tapiii yg ajar bukti ijazah orag bilang palsu,2025-05-13T12:45:13Z,0,1
Ijasah_ditunjukan_user_1315,kalo ijazah asli knp buka bohong bobingblagi,2025-05-13T11:51:32Z,0,1
Ijasah_ditunjukan_user_1333,korupsi donk diributkan ijazah palsu asli lawak emang orang² lulusan sarjana gestur suryo ketar ketir koruptor ketar ketir keluarga jokowi gibran pemerintahan,2025-05-13T10:29:22Z,0,1
Ijasah_ditunjukan_user_1334,ijazah bertahun ribut rumah biar pajang ijazah,2025-05-13T10:25:58Z,0,1
Ijasah_ditunjukan_user_1367,menunjukan ijazah asli ijazah gitu dinyatakan pengadilan asli,2025-05-13T07:36:28Z,0,1
Ijasah_ditunjukan_user_1369,sya membandubgkan dr berbsgai sumber sya ragu dg ijazah yg dimiliki jokowi ijazah keluarnya berproses,2025-05-13T07:27:38Z,0,1
Ijasah_ditunjukan_user_1540,tuntut yg mengeluarkan ijazah jokowi asli palsu namanya cari mohon maaf yg bermasalah gunanya,2025-05-12T11:34:25Z,0,1
Ijasah_ditunjukan_user_1557,urgensi polemik ijazah sih,2025-05-12T10:08:21Z,0,1
Ijasah_ditunjukan_user_1586,pk jokowi jangm bikin gaduh cobaklian pikir dgn akl waras kgaduhan diciptakn olh jokowi klian simakbai klujokowi bnsr ijazah asli tujukn kpd roy dn grombolannya pny ir dng caraksatria mnujukn ijazah asli smua pncmaran namabaikmu slsai dngn sprtiini jngan pngalihan isu,2025-05-12T04:11:13Z,0,1
Ijasah_ditunjukan_user_1590,gak suka banget bersilat lidah roy kaya akhli pegang ijazah aslinya tega banget nuduh ijazah palsu,2025-05-12T03:59:36Z,0,1
Ijasah_ditunjukan_user_1627,ijazah pribadi sah gak publik hukum kepolisian kpok roy cs biar adab ijazah ranah roy cs salah wewenang meneliti ranah pribadi kepolisian,2025-05-11T22:16:58Z,0,1
Ijasah_ditunjukan_user_1655,ijazah roy asli nggak roy ijazah asli to nembak nggak sekolah sdgkan ijazah privasi roy orang tau dipublikasikan 𝕋𝕒𝕡𝕚 𝕜𝕒𝕝𝕒𝕦 𝕞𝕖𝕟𝕦𝕣𝕦𝕥 𝕤𝕒𝕪𝕒 𝕡𝕒𝕜 𝕣𝕠𝕪 𝕛𝕦𝕘𝕒 𝕙𝕒𝕣𝕦𝕤 𝕕𝕚𝕡𝕖𝕣𝕚𝕜𝕤𝕒 𝕛𝕒𝕟𝕘𝕒𝕟 𝕡𝕒𝕜 𝕣𝕠𝕪 𝕪𝕘 𝕡𝕒𝕝𝕤𝕦 𝕚𝕛𝕒𝕫𝕒𝕙𝕟𝕪𝕒,2025-05-11T16:20:44Z,0,1
Ijasah_ditunjukan_user_1705,masyarakat indonesia menilai mas roi mencari kesalah bpk jokowi knp sya blng gitu karna mas roi blm lihat ijazah bpk jokowi sdh menuduh ijazah bpk jojowi palsu pikiran mas roi ngarang aja,2025-05-11T12:09:15Z,0,1
Ijasah_ditunjukan_user_1795,asli tidaknya ijazah jokowi sesuai dgn uji forensik didalam negeri diluar negeri terbitan thn an,2025-05-11T03:15:54Z,0,1
Ijasah_ditunjukan_user_1835,buktikan kalu ijazah jokowii asli jgn ngomong doang,2025-05-10T19:18:04Z,0,1
Ijasah_ditunjukan_user_1848,rugi nya si roy ijazah jokowi palsu asli repot negara,2025-05-10T17:25:33Z,0,1
Ijasah_ditunjukan_user_1853,ijazahnya asli ugm jawabannya,2025-05-10T16:59:40Z,0,1
Ijasah_ditunjukan_user_1857,ugm universitas gila materi terbitkan ijazah asli bayar m tau taunya yg terbit ijazah palsu alias bodong,2025-05-10T16:45:08Z,0,1
Ijasah_ditunjukan_user_1871,hai penjilat jokwi lihatkan yg asli selessai kitab cuman ijazah,2025-05-10T16:00:56Z,0,1
Ijasah_ditunjukan_user_1871,hai penjilat jokwi lihatkan yg asli selessai kitab cuman ijazah,2025-05-10T16:00:33Z,0,1
Ijasah_ditunjukan_user_1893,beli asli,2025-05-10T14:07:25Z,0,1
Ijasah_ditunjukan_user_1894,kepentinganmu ijazah jokowi kpu,2025-05-10T14:05:16Z,0,1
Ijasah_ditunjukan_user_1938,tunjukan yg asli mata roisuryo bilang palsu ugm pembuat ijazah jokowi pernyataan asli maunusia busuk roisuryo diam,2025-05-10T11:05:35Z,0,1
Ijasah_ditunjukan_user_1991,kah dg jarak isu yg ijazah asli,2025-05-10T07:21:25Z,0,1
Ijasah_ditunjukan_user_1985,salahx jokowi gak tunjukan ijazah aslix tp tdk terbuka ijazah aslix makax publik curiga jokowi tdk jujur membohongi rakyat dgn memalsukan ijazah palsu pejuang kebenaran tdk salah salah dimana negara jgn pemimpin yg bohong menipu menyusahkan rakyatx trlalu biadab tdk d tunjukan sj inilh ijazah asli ku selesai gitu sj ribet,2025-05-10T07:21:21Z,0,1
Ijasah_ditunjukan_user_2017,sidangkan dugaan ijazah palsu ijazahnya asli pengadilan automatis rs cs pristiwa hukum,2025-05-10T05:22:38Z,0,1
Ijasah_ditunjukan_user_2032,rs cs membuktikan ijazah asli laporan ijazah palsu disebabkan hipotesa ketidak beradaan yg asli aslu yg dibuktikan kepalsuan ijazah,2025-05-10T04:31:46Z,0,1
Ijasah_ditunjukan_user_2081,susahnya tinggal kasi tunjukkan ijazah berat kah ijazah segede gaban yak sampe ribut ribet,2025-05-10T01:06:09Z,0,1
Ijasah_ditunjukan_user_2104,gampang tunjukkan ijazah asli salahnya berat kertas masyarakat penasaran berbelit belit tunjukkan aslinya masy diam klau tampil ijazah aslinya,2025-05-09T23:04:47Z,0,1
Ijasah_ditunjukan_user_2133,utk mbuktikn keaslian ijazah asli verifikasi berkas pncalonan pilpres,2025-05-09T18:03:44Z,0,1
Ijasah_ditunjukan_user_2141,betapa dungonya ijazah nya bilang asli,2025-05-09T17:13:03Z,0,1
Ijasah_ditunjukan_user_2175,maaf bos masyarakat gk butuh ijazah jokowi yg butuhin periode de mencalon,2025-05-09T14:23:50Z,0,1
Ijasah_ditunjukan_user_2177,mslkn ijazah asli palsu q sbgai rakyat g ngaru,2025-05-09T14:15:54Z,0,1
Ijasah_ditunjukan_user_2202,mempermasalahkan ijazah jokowi maksud tujuannya dendam jokowi klo membuktikan ijazahnya asli palsu mending bikin lembaga badan pemeriksa keaslian ijazah nasional biar pejabat negara dibuktikan ijasahnya asli palsu loh jokowi yg diserang dendam ya mas,2025-05-09T12:52:24Z,0,1
Ijasah_ditunjukan_user_2214,biar cpat tuntas ijazah palsu pk jokowi tunjukan ijazah aslinya pk jokowi biar masarakat tau kebenaran yg nyinyir langsung tangkap penjarakan,2025-05-09T12:07:40Z,0,1
Ijasah_ditunjukan_user_2248,bawa ijazah map klinting ijazah ugm lo,2025-05-09T09:42:44Z,0,1
Ijasah_ditunjukan_user_2370,jokowi antisipasi rekayasa kemenangan licik ijazahnya asli ridak menunjukan org awan ijazah asli sekian tuntutan,2025-05-09T02:54:09Z,0,1
Ijasah_ditunjukan_user_2371,jokowi kepemimpinannya periode ngapain dipermasalahkan ijazah beliau tau korupsi,2025-05-09T02:51:56Z,0,1
Ijasah_ditunjukan_user_2387,maju trus roy suryo dkk kebenaran ijazah si jokowi patut pertanyaakan dgn berita yg timbul medsos dosen pembimbing trus jurusan teknik kayu foto ijazah asli yg disebarkan psi,2025-05-09T00:51:41Z,0,1
Ijasah_ditunjukan_user_2426,ijazah asli lipat pakai map kuning pembungkus kacang rebus,2025-05-08T21:01:02Z,0,1
Ijasah_ditunjukan_user_2456,mang ijazah asli jokowi trs knp slalu mangkir dpanggil pn berani bayar pengacara yg rame preman buzer,2025-05-08T16:44:06Z,0,1
Ijasah_ditunjukan_user_2467,biarkan proses lidik sidik pengadilan yg menentukan kebenarannya terkait ijazah jokowi,2025-05-08T15:42:54Z,0,1
Ijasah_ditunjukan_user_2485,urusan ijazah pengalihan anehnya ijazah jokowi heboh yg,2025-05-08T15:07:32Z,0,1
Ijasah_ditunjukan_user_2486,elunya aja mencari cari mengada gw dah bilang ijazah asli pembenci mecari celah,2025-05-08T15:05:23Z,0,1
Ijasah_ditunjukan_user_2504,bawa ijazah map ditekuk tekuk ngibul banget klo jokowi bawa ijazah,2025-05-08T14:09:18Z,0,1
Ijasah_ditunjukan_user_2538,ijazah asli ko mempersulit orang gus nur penjara pemimpin,2025-05-08T11:57:29Z,1,1
Ijasah_ditunjukan_user_2551,dicarilah kesalahan skripsi jokowi asli rocky gerung bilang skripsi salah ijazah asli ijazah uang kertas asli jokowi salah mempertanggung jawabkan perbuatannya,2025-05-08T11:14:46Z,0,1
Ijasah_ditunjukan_user_2564,ijazah asli ngomong ingrisnya ko beltak beletoksi,2025-05-08T10:32:27Z,0,1
Ijasah_ditunjukan_user_2597,mulut bejat jebloskan penjara orang ajar bikin onar membangun negara meresahkan masyarakat maksud ijazah jokowi ijazah dokumen pribadi yg perlihatkan manusia bejat adab roy suryo,2025-05-08T07:23:33Z,0,1
Ijasah_ditunjukan_user_2639,jgn jokowi asli kuada hukumnya tdk ijazah jokowi asli sdh mengujinya bahawa ijakzah tsb asli bgm kyada hukum membela klain nya,2025-05-08T03:19:07Z,0,1
Ijasah_ditunjukan_user_2654,klo asli susah,2025-05-08T02:23:49Z,0,1
Ijasah_ditunjukan_user_2655,bener nih menunjukan ijazah jokowi mediasi aja ngga bawa ijazahnya tunggu dipengadilan,2025-05-08T02:13:13Z,0,1
Ijasah_ditunjukan_user_2694,intinya tunjukkan ijazah jokowi utk pemeriksaan forensik ahli independen dr negri fair hasilnya dpt diterima,2025-05-07T23:18:17Z,5,1
Ijasah_ditunjukan_user_2727,ijazah jokowi viral,2025-05-07T21:33:22Z,0,1
Ijasah_ditunjukan_user_2746,ijazah jokowi forensik aslian nya skripsi yg uu mk aja berani tabraknya kepentingan anaknya sekedar ijazah tunjukan aslian ijazahnya masyarakat jokowi sbg mantan presiden,2025-05-07T19:16:14Z,1,1
Ijasah_ditunjukan_user_2814,skripsi bodong ijazah asli mobil esemka seri siluman,2025-05-07T16:10:58Z,0,1
Ijasah_ditunjukan_user_2833,jokowi tukang ngibul ijazah palsu nya kalo emang bener jokowi ijazah asli dah tunjukan publik,2025-05-07T15:45:19Z,0,1
Ijasah_ditunjukan_user_2884,kalo bawa ijazah asli lunthung tekuk tekuk,2025-05-07T14:50:05Z,0,1
Ijasah_ditunjukan_user_2891,roy suryo orang getolnya ngurusi ijazah pribadi jokowi dikeluarkan ugm meremehkan ijazah ugm,2025-05-07T14:48:01Z,0,1
Ijasah_ditunjukan_user_2895,izazanya asli lg yg jd tuntutan pk jokowi tdk ijazah tk da paut,2025-05-07T14:44:21Z,0,1
Ijasah_ditunjukan_user_2909,faktanya jokowi periode presiden kinerjanya bagus terlepas ijazah asli falsu,2025-05-07T14:32:39Z,0,1
Ijasah_ditunjukan_user_2994,gampang tunjukkan ijazah teman kuliah speak up almamater,2025-05-07T13:16:24Z,0,1
Ijasah_ditunjukan_user_3014,jokowi tunjukan ijazah asli roy panci dkk menyudutkan jokowi,2025-05-07T12:54:28Z,0,1
Ijasah_ditunjukan_user_3018,hooooiiii ijazah koq sompan stopmap folio harga murah banget ijazah dokumen berharga stopmap isi ya,2025-05-07T12:47:26Z,0,1
Ijasah_ditunjukan_user_3086,skrg berani gk ijazah prabowo,2025-05-07T11:18:30Z,0,1
Ijasah_ditunjukan_user_3224,status ijazah akademis penuntut roy periksa sd perguruan tingginya asli ijazah jokowi yg tuntut,2025-05-07T08:28:04Z,0,1
Ijasah_ditunjukan_user_3238,apain roy suro diperdebatkan ijazah jokowi kinerjanya yg bagusnya,2025-05-07T08:12:50Z,0,1
Ijasah_ditunjukan_user_3237,ijazah jokowi diteliti belah pengakuan ijazah jual beli skripsi bodong,2025-05-07T08:12:28Z,0,1
Ijasah_ditunjukan_user_3258,menguji ijazah jokowi lantas pejabat gimana,2025-05-07T07:40:22Z,0,1
Ijasah_ditunjukan_user_3275,haknya jokowi tdk ijazah,2025-05-07T07:16:02Z,0,1
Ijasah_ditunjukan_user_3298,ijazah tujuanya mencari kesalahan yg roy cs orang gila ijazah skripsi gak ber henti karna tujuan ter,2025-05-07T06:50:08Z,0,1
Ijasah_ditunjukan_user_3321,sih lho sibuk ijazah jokowi,2025-05-07T06:13:11Z,0,1
Ijasah_ditunjukan_user_3386,ijazah jokowi sd ugm hasil curian,2025-05-07T04:59:19Z,0,1
Ijasah_ditunjukan_user_3434,ijazah asli presiden produk akademik asli palsu masuk kebohongan publik korban politik bikin resah,2025-05-07T04:02:00Z,0,1
Ijasah_ditunjukan_user_3467,p jokowi melaporkan menyerahkan ijazah asli kepolisian roy surya rismon tifa menyelidiki ijazah yg udah uji forensik ketiga yg ngaku pakar ilmu memvonis ijazah p jokowi palsu lihat rekam jejaknya orang medsos,2025-05-07T03:03:00Z,1,1
Ijasah_ditunjukan_user_3492,k lau tdk ju²r dgn mslh ijazah tsb m polemik b kepanjangan uji materi u ijazah,2025-05-07T02:15:32Z,0,1
Ijasah_ditunjukan_user_3500,lihat si suryo gak rapi in kumis nya gara sibuk ngurusin ijazah orang ijazah dunia diselidiki dgn suryo,2025-05-07T02:04:57Z,0,1
Ijasah_ditunjukan_user_3502,barang simpel dibikin ruwet tinggal tunjukkan ijazah dr sdh selesai kl palsu yg berhak menentukan asli tdkx ugm,2025-05-07T02:01:01Z,0,1
Ijasah_ditunjukan_user_3527,trus knp klo ijazah palsu dicap jd pembohon yaudah trus abis mo gmn dg ijazah asli tugas pake joki korupsi membunuh jelekan org mo diapain tu org bgitu tp ijazah asli g ad bedanya yg bnr ya liat diakhir hak yg udh dy lakukan udh g ush blg makasih deh g ush ribut gw udh syukur dr pd ribut wartawan cm ngejar brita bgini dn pejabat ngurus in ijazah mnding tuh urusin bnyk org ngisi perut aja susah,2025-05-07T01:08:55Z,0,1
Ijasah_ditunjukan_user_3556,kl udah ketahuan ijazah jokowi mendekati palsu udah disiapkan hercules acak acak udah ijazah edit salahnya roy suryo langsung dikasih tau kesalahan ijazahnya editnya canggih,2025-05-06T23:27:26Z,0,1
Ijasah_ditunjukan_user_3582,ijazah jokowi dikeluarkan ugm ugm mengakui dasarnya loe orang bilang palsu ugm mengeluarkan mengakui,2025-05-06T22:29:01Z,0,1
Ijasah_ditunjukan_user_3603,klo jokowi ijazah asli muka jokowi tenang gax wajah panik,2025-05-06T20:26:57Z,0,1
Ijasah_ditunjukan_user_3604,beritanya sdah ko ijazah asli jokowi tuduhan ijazah palsu jokowi perlihatkan ijazahnya yg asli kpd masyarakat memangnya knapa ko jokowi perlihatkan ijazahnya stelah ramai gaduh dibicarakan masyarakat,2025-05-06T20:23:15Z,0,1
Ijasah_ditunjukan_user_3608,ijazah asli gulung tekuk²,2025-05-06T20:09:02Z,0,1
Ijasah_ditunjukan_user_3622,ugm yg yg menyerahkan ijazah pk jokowi konfirmasi tpi klmpok nga percaya klo ijazah palsu trus klmpok roy suryo pk jokowi gtu yg slh ijazah d bikin,2025-05-06T19:18:58Z,0,1
Ijasah_ditunjukan_user_3631,jokowi menunjukan ijazah,2025-05-06T18:54:22Z,0,1
Ijasah_ditunjukan_user_3637,andai tunjukkan ijazah asli urusan selesai gk sbb pembenci pembenci mati,2025-05-06T18:25:36Z,0,1
Ijasah_ditunjukan_user_3639,kalo terbukti ijazah asli harga firi jokowi dunia tdk susah aslinya ijazah kalo palsu harga tdk sampe anak cucu asli kog susah nu jukin aslinya ijazah kog suka yg ribut ribut jokowi ya,2025-05-06T18:18:03Z,0,1
Ijasah_ditunjukan_user_3641,ijazah jokowi asli,2025-05-06T18:12:15Z,0,1
