author,text,published_at,like_count,cluster
Ijasah_ditunjukan_user_34999,ditunjukan polisi roy suryo tunjukkan bukti kepalsuan ijazah mulyono publik mulyono tunjukkan ijazah aslinya polisi mulyono lupa kalo ros suryo berkumis title,2025-04-30T13:22:46Z,0,15
Ijasah_ditunjukan_user_35106,waduhhhhh si mulyono walikota solo rakyat nggak peduli tinggal tunjukkan lulus sma nggak lulus,2025-04-30T13:20:48Z,0,15
Ijasah_ditunjukan_user_35133,roy suryo sugik nur bang rismon bambang tri yg gampang d takluk dukung yg d laporkan mulyono,2025-04-30T13:20:17Z,0,15
Ijasah_ditunjukan_user_35214,bohong mulyono tunjukin izasah,2025-04-30T13:19:02Z,0,15
Ijasah_ditunjukan_user_35216,pengcaranya mulyono dlam hati maju gentar membela yg bayar,2025-04-30T13:19:01Z,0,15
Ijasah_ditunjukan_user_35263,mulyono gorong gorong,2025-04-30T13:18:21Z,0,15
Ijasah_ditunjukan_user_35358,mulyono keluarkan edisi terbaru ijazah kacamata skripsi tandatangan penguji,2025-04-30T13:16:52Z,0,15
Ijasah_ditunjukan_user_35380,hrs dpn biar dunia ijazah nya jgn sm polisi doang sadar mulyono penipuan mu,2025-04-30T13:16:32Z,0,15
Ijasah_ditunjukan_user_35384,parcok ternaknya mulyono,2025-04-30T13:16:29Z,0,15
Ijasah_ditunjukan_user_35406,malahnya kebiasaanya mulyono bohong ijasah jg diuji forensik,2025-04-30T13:16:09Z,0,15
Ijasah_ditunjukan_user_35430,periode yg diatur mulyono,2025-04-30T13:15:35Z,0,15
Ijasah_ditunjukan_user_35464,terbukti palsu akal an mulyono dimiskinkan,2025-04-30T13:15:05Z,0,15
Ijasah_ditunjukan_user_35563,lucunya dinegeri konoha ijazah palsu kepolisi tanda penuh sandiwara masyarakat percaya dgn mulyono kepolisian mohon like nya,2025-04-30T13:13:28Z,0,15
Ijasah_ditunjukan_user_35571,parcok ternak mulyono,2025-04-30T13:13:23Z,0,15
Ijasah_ditunjukan_user_35931,mulyono licik munafik pengecut bangsa kacau gegara ijasah,2025-04-30T13:07:27Z,0,15
Ijasah_ditunjukan_user_35945,jurus melas sok bodoh mulyono udah gak mempan,2025-04-30T13:07:14Z,0,15
Ijasah_ditunjukan_user_35982,hebat mulyono salah pemimpin dunia memenjarakan rakyatnya perkara jati keilmuan kinerjanya mulyono layak rekor dunia,2025-04-30T13:06:39Z,13,15
Ijasah_ditunjukan_user_36067,lihat mulyono air diam menghanyutkan,2025-04-30T13:05:15Z,0,15
Ijasah_ditunjukan_user_36226,netizens kompas isinya ternak mulyono buzzer goblok jokowi kalo emang orang pinter ngapain berbelit belit sampe nangkap rakyatnya tinggal tunjukkan aja ijazahnya contoh tuh dedi mulyadi pemimpin yg bagus,2025-04-30T13:02:20Z,0,15
Ijasah_ditunjukan_user_36355,ternak mulyono,2025-04-30T12:59:51Z,0,15
Ijasah_ditunjukan_user_36454,beraninya tunjukkan kepolisi palsu parcok ternak mulyono buktikan ahlinya rismon sianipar mas roy,2025-04-30T12:57:53Z,0,15
Ijasah_ditunjukan_user_36517,semangat suryo mulyono tukang ngacak ngacak hukum ri,2025-04-30T12:56:48Z,1,15
Ijasah_ditunjukan_user_36585,ijazahe jokowi mulyono mukidi palsuuuuuuuu kui yakinnnnnnn,2025-04-30T12:55:25Z,0,15
Ijasah_ditunjukan_user_36086,weleh² gayamu mulyono lagu,2025-04-30T12:54:51Z,0,15
Ijasah_ditunjukan_user_36653,bikin gaduh si mulyono ijasah asli tinggal tunjukkan,2025-04-30T12:53:47Z,0,15
Ijasah_ditunjukan_user_36722,si mulyono kuliah gak lulus ijazah beli,2025-04-30T12:52:43Z,0,15
Ijasah_ditunjukan_user_36653,namanya kpk polisi kejaksaan anteknya mulyono,2025-04-30T12:50:47Z,0,15
Ijasah_ditunjukan_user_36722,klw mmng nunjukin ijazah asli nya polisi si mulyono tunjukin polisi tangkap bang roy dkk simpel kaya gini bikin ribet mulyono muka kaya orng kelakuan iblis jentel klw emng ijazah asli,2025-04-30T12:50:37Z,0,15
Ijasah_ditunjukan_user_36963,terkait ijazah mukidi julukan medsos presiden negeri konoha dugaan mulyono kakak mukidi kuliah fakultas kehutanan ugm anggota mapala diduga mulyono lulus meninggal mukidi ambisi mencalonkan walikota solo gubernur jakarta presiden negeri konoha kepentingan memiliki ijazah s syarat pencalonan terkait disusunlah rencana ijazah mulyono meninggal utk direkayasa milik mukidi permasalahannya pakai foto aslinya mulyono mukidi sialnya mukidi stok foto cocok usia lulus kuliah ditemukanlah keponakan mukidi wajahnya mukidi dibelilah foto keponakan gumatno diklaim foto mukidi penempelan foto gumatno menggantikan foto mulyono didapatkan foto gumatno cocok usia lulus kuliah mulyono pencalonan walikota gubernur presiden foto nikah foto ijazah foto wisuda diseragamkan foto gumatno biar manipulasinya sempurna kronologi upaya manipulatif ijazah dibilang ijazah mukidi asli direkayasa dgn mengganti foto mulyono foto gumatno discan nama mulyono ijazah asli diedit mukidi sulit ditemukan fisik asli ijazah mulyono disembunyikan ketahuan aslinya nama lengkap foto mulyono ijazah mukidi replika memutus rantainya diisukan ijazah asli hilang,2025-04-30T12:47:19Z,0,15
Ijasah_ditunjukan_user_37009,hidup dr roy suryo dkk melawan kedunguan si mulyono cs dn penjilat nya biar modyarr negeri,2025-04-30T12:45:50Z,0,15
Ijasah_ditunjukan_user_37062,mulyono mulyono mu bikin rakyat gak percaya gak gaduh tunjukan ijazah aslimu bhahaha tertekan keluarin jurus ngelesmu,2025-04-30T12:44:13Z,0,15
Ijasah_ditunjukan_user_37072,tunjukin bulsyiiiit tunjukin aja yg jentel main kucing kucingan mulu mulyono,2025-04-30T12:43:59Z,0,15
Ijasah_ditunjukan_user_37316,buzzer mulyono,2025-04-30T12:37:15Z,0,15
Ijasah_ditunjukan_user_37324,buzzer mulyono bermunculan,2025-04-30T12:37:05Z,1,15
Ijasah_ditunjukan_user_37355,mobil esemka finalis occrp nyata orang tolol aja yg memuja manusia penuh kepalsuan model si mulyono,2025-04-30T12:36:25Z,0,15
Ijasah_ditunjukan_user_37444,mulyono bikin gaduh aja,2025-04-30T12:33:30Z,0,15
Ijasah_ditunjukan_user_37559,mulyono beli asli kalo kasih yg palsu mulyono gak salah,2025-04-30T12:28:22Z,0,15
Ijasah_ditunjukan_user_37565,mulyono menang pakai kekuasa an duit aparat yg sdh ditangan mulyono sdh diborong nipotismenya,2025-04-30T12:28:04Z,0,15
Ijasah_ditunjukan_user_37727,buzzer mulyono guru dekan rektor ugm beraksi memalukan pecaaaat adili,2025-04-30T12:14:09Z,3,15
komentar_tokoh_politik_user_26,tokoh bunglon taruhlah ijazah palsu pembelajaran mahal bangsa kritik mulyono menteri mulyono bunglon,2025-05-30T14:14:04Z,0,15
komentar_tokoh_politik_user_82,si mulyono manusia iblis solo raja dusta indonesia tukang tipu nomor pengkhianat warga nkri rajanya ingkar janji,2025-05-27T05:50:10Z,0,15
komentar_tokoh_politik_user_377,ugm pnjual mulyono penada ny kenak,2025-05-08T16:04:05Z,0,15
komentar_tokoh_politik_user_420,emang loch mah pud kucing nya mulyono,2025-05-07T10:16:26Z,0,15
komentar_tokoh_politik_user_427,mahmud madura berusaha menywlamatkan mulyono,2025-05-07T05:56:18Z,0,15
komentar_tokoh_politik_user_526,mulyono end game skripsi palsu koq bsa ijazah,2025-05-05T22:21:45Z,0,15
komentar_tokoh_politik_user_639,adili mulyono rampas harta mulyono yg seabreg br solo,2025-05-05T14:16:58Z,0,15
komentar_tokoh_politik_user_700,intinya masuk gorong makan tuh yg pilih mulyono kmren kena imbas lo dosa,2025-05-05T13:21:47Z,0,15
komentar_tokoh_politik_user_766,menutupi kisruh pertamina bumn korupsi tambang mulyono sengaja mengulur ijazah aslinya menutupi korupsi republik,2025-05-05T12:23:50Z,0,15
komentar_tokoh_politik_user_799,penjahit membela penjahat si mahfut jahat nya mulyono,2025-05-05T11:47:24Z,0,15
komentar_tokoh_politik_user_867,pratikno pratikno pratikno diwaspadai mantan rektor ugm yg orang kepercayaan mulyono mentri periode diusulkan mulyono utk mentri prabowo peran pratikno sgt sbg pemegang peran utama utk legalisir ijasah mulyono yg kejanggalan operator urusan mulyono yakinkah permainan ugm,2025-05-05T10:51:19Z,9,15
teman_kuliah_user_76,mas jokowidodo spa mulyono,2025-05-30T18:52:17Z,0,15
teman_kuliah_user_128,jokowi bilang nama kecilnya mulyono adik ipar namanya,2025-05-29T23:05:41Z,0,15
teman_kuliah_user_151,pemimpin gaduh adu domba ya mulyono,2025-05-29T12:11:37Z,0,15
teman_kuliah_user_182,buk an izazah jokowi izasahnya mulyono aja meragukan sma aja nggak,2025-05-29T00:07:09Z,0,15
teman_kuliah_user_214,meragukan tuh tuk foto mulyono jokowi,2025-05-28T09:39:37Z,0,15
teman_kuliah_user_300,kalo berani ijazah mulyono ijazah nya sandingkan ijazah jokowi,2025-05-27T00:38:36Z,0,15
teman_kuliah_user_325,orang yg hadir yg dikasih jabatan mulyono ijasah identik otentik sj ijasah palsu,2025-05-26T14:10:17Z,0,15
teman_kuliah_user_351,tolong buktikansecara ilmiah akademisi mff barang sumbernya contoh mudah uang dg berdagang mulyono ijazahnya tolong klari ikadi ijazah mulyono cocokan dg ijazahnya jokowidodo,2025-05-26T04:59:38Z,0,15
teman_kuliah_user_381,yg mas fotonya mulyono,2025-05-25T14:41:38Z,0,15
teman_kuliah_user_381,yg mas fotonya mulyono,2025-05-25T14:37:08Z,0,15
teman_kuliah_user_389,teman bayaran mulyono,2025-05-25T12:44:04Z,0,15
teman_kuliah_user_396,bayaran ygngaku teman bayran yg begundal mulyono bayar kang ngaku teman mulyono,2025-05-25T10:31:05Z,0,15
teman_kuliah_user_401,bawa ijadah mulyono jokowi asli cerita selesai,2025-05-25T08:48:53Z,0,15
teman_kuliah_user_457,lha mulyono,2025-05-24T22:22:37Z,0,15
teman_kuliah_user_484,mulyono ijazahnya asli lulusan kehutanan gelarnya drs bos,2025-05-24T16:16:22Z,0,15
teman_kuliah_user_503,ternak mulyono ngibul aja orang foto ijazahnya aja beda mulyono,2025-05-24T14:31:45Z,0,15
teman_kuliah_user_555,bagaimn lulus cepat krn mulyono ngaku ipkx dibawah bgm lulus cepat,2025-05-24T09:52:52Z,0,15
teman_kuliah_user_629,kl jengkel ajak jokowi ngumpul ijazahnya trs disamakan dgn detail trs tau dgn mulyono iparnya jokowi cek tuh ijazahnya gak foto mulyono ugm meninggalnya yg aneh,2025-05-24T02:12:46Z,0,15
teman_kuliah_user_652,fofotmya aja fotonya mulyono ijazah fotonya bkn mulyono tp foto sodaranya,2025-05-23T23:01:39Z,0,15
teman_kuliah_user_660,foto harri mulyono adik ipar jokowi teman harri mulyono yg suruh ngaku temannya jd nipu tebar uang jokowi jagonya kekuasaan kemana,2025-05-23T22:13:01Z,0,15
teman_kuliah_user_758,temen nya mulyono kayanya bukanntemennya jokowow,2025-05-23T09:58:47Z,0,15
teman_kuliah_user_800,nama joko widodo mulyono mulyono yg asli namanya ijasah sd smp sma sarjana yaa,2025-05-23T05:24:21Z,1,15
teman_kuliah_user_859,curiga gelagapan gak pas suruh nunjukin fotonya mulyono yg,2025-05-23T00:57:21Z,0,15
teman_kuliah_user_906,foto mulyono yg pakai kaca mata,2025-05-22T17:38:07Z,0,15
teman_kuliah_user_977,ternak mulyono menggiring opini,2025-05-22T13:06:17Z,0,15
teman_kuliah_user_1089,ijazah nya mulyono,2025-05-22T02:58:08Z,0,15
teman_kuliah_user_1089,aja ijazah mulyono nggak bener samaan fotonya ndak gitu aja repot,2025-05-22T02:52:32Z,0,15
teman_kuliah_user_1099,ijazah asli yg mulyono yg diakui jokowi fotonya beda,2025-05-22T02:28:39Z,0,15
teman_kuliah_user_1149,foto yg berkaca mata beda wajahnya wajah mulyono aaahhh penipu,2025-05-21T20:20:06Z,0,15
teman_kuliah_user_1164,sy curiga yg ngaku teman mulyono ternak,2025-05-21T17:02:57Z,0,15
teman_kuliah_user_1192,foto ditampilkan foto ir mulyono,2025-05-21T14:21:53Z,0,15
teman_kuliah_user_1240,lingkar jkw mulyono bilang,2025-05-21T09:46:10Z,0,15
teman_kuliah_user_1240,eeee jkw yg lihat mulyono ijazahnya lihat fotonya,2025-05-21T09:35:33Z,0,15
teman_kuliah_user_1283,yg publik ijazah mulyono temen temen nya negeri konoha,2025-05-21T04:00:46Z,0,15
teman_kuliah_user_1323,seangkatan ir mulyono yah foto ir mulyono yah,2025-05-21T00:08:42Z,0,15
teman_kuliah_user_1325,mulyono coba bambang tri,2025-05-20T23:44:12Z,0,15
teman_kuliah_user_1535,ternak,2025-05-20T01:29:44Z,0,15
teman_kuliah_user_1542,mustoha iskanda r fakultas kehutanan jurusan kayu p mulyono yg ngarang sampeyan,2025-05-20T00:44:10Z,0,15
teman_kuliah_user_1544,temen kuliahnya berani menampilkan ijazah aslinya mulyono gk berani menampilkan ijazah aslinya yg ijasah mulyono ijasah temen nya tunjukan ijazah asli mulyono selesai urusan knp gk berani nunjukin ijazahnya wajar masyarakatnya curiga ngaku saksi fakta temenmu mulyono gk berani nunjukin ijazah apaaa,2025-05-20T00:25:12Z,0,15
teman_kuliah_user_1566,gak aja mulyono pamer ijazah bareng,2025-05-19T23:03:08Z,0,15
teman_kuliah_user_1594,tunjukkan ijazahnya mulyono,2025-05-19T19:21:40Z,0,15
teman_kuliah_user_1598,teman jokowi hery mulyono or mulyono,2025-05-19T19:01:24Z,0,15
teman_kuliah_user_1610,temannya berani si mulyono gak berani,2025-05-19T17:07:30Z,0,15
teman_kuliah_user_1625,ternak mulyono mah coba tunjukin ijazah asli nya mulyono gitu aja repot,2025-05-19T15:51:30Z,0,15
teman_kuliah_user_1633,dimana foto ijazah mulyono,2025-05-19T15:16:08Z,0,15
teman_kuliah_user_1658,kalo mulyono,2025-05-19T14:15:51Z,0,15
teman_kuliah_user_335,mulyono telinganya jokowi telinganya gk masuk akal,2025-05-19T14:12:39Z,0,15
teman_kuliah_user_1662,ojo bohong bincang bincang mahfud mulyono bilang ip nya dibawah,2025-05-19T13:50:50Z,0,15
teman_kuliah_user_1684,jokowi boong nya ga ketulungan potonya beda tuh mulyono,2025-05-19T13:02:49Z,0,15
teman_kuliah_user_1700,kmi pakta kenyataan kebenaran yg jokowi lulusan ugm universitas gerombolan mulyono,2025-05-19T12:39:55Z,0,15
teman_kuliah_user_1710,hasil ternak mulyono bnyak jg,2025-05-19T12:20:08Z,0,15
teman_kuliah_user_1733,emang jokowi blunder nama titel sdh sngt membagongkan djoko widodo ganti aja joko mulyono,2025-05-19T11:23:29Z,0,15
teman_kuliah_user_1733,luh berani gak jdi saksi persidangan ijazah jokowi asli heri mulyono coba nujuk potonya aja heri mulyono,2025-05-19T11:20:49Z,0,15
teman_kuliah_user_1770,ngapain pamerin ijazah yg ijazah mulyono anjir,2025-05-19T09:43:54Z,0,15
teman_kuliah_user_1847,bosen yg muncul teman mulu cuba ijasah mulyono spill,2025-05-19T07:40:29Z,1,15
teman_kuliah_user_1873,mulyono gak,2025-05-19T07:08:47Z,0,15
teman_kuliah_user_1880,kayaknya ijazah ugm asli mulyono,2025-05-19T06:56:17Z,0,15
teman_kuliah_user_1947,izazah asli mulyono jgn bohong,2025-05-19T05:49:12Z,0,15
teman_kuliah_user_1964,woiii ternak mulyono utk ijazahnya asli atw tdk dg uji forensik bkn dg testimoni emgnya obat kuat,2025-05-19T05:34:41Z,0,15
teman_kuliah_user_1989,ragu ragu foto mulyono,2025-05-19T05:09:52Z,0,15
teman_kuliah_user_2023,foto herry mulyono yg bambang tri,2025-05-19T04:22:26Z,0,15
teman_kuliah_user_2033,yg pake kacanata hary mulyono,2025-05-19T04:09:32Z,0,15
teman_kuliah_user_2040,jkw opo mulyono sing bener,2025-05-19T04:07:27Z,0,15
teman_kuliah_user_1286,mulyono jokowidodo frame orang yg berbeda,2025-05-19T02:04:35Z,0,15
teman_kuliah_user_2149,lumayan pamer ijazah dapet juataan mulyono,2025-05-19T01:01:39Z,0,15
teman_kuliah_user_2157,coba tunjukkan mulyono photo ijazahnya,2025-05-19T00:45:48Z,0,15
teman_kuliah_user_2179,kwn jokowi salah lihat jokowi diingatnya mulyono,2025-05-19T00:08:40Z,0,15
teman_kuliah_user_2181,nunjukin mulyono aja ribet bgt,2025-05-19T00:07:31Z,0,15
teman_kuliah_user_2228,dioastikan teman kuliah yg maksud jokowi tp mulyono,2025-05-18T21:52:13Z,0,15
teman_kuliah_user_2228,mulyono jokowi,2025-05-18T21:47:34Z,1,15
teman_kuliah_user_2238,mulyono aja,2025-05-18T20:09:36Z,2,15
teman_kuliah_user_2251,alumni universitas geng mulyono,2025-05-18T18:29:58Z,1,15
teman_kuliah_user_2259,fto mulyono,2025-05-18T17:35:54Z,0,15
teman_kuliah_user_2284,yg repot ngaku teman mulyono butuhkan ijasah mulyono cooong,2025-05-18T16:04:47Z,7,15
teman_kuliah_user_2299,mulyono seangkatanmu akademik forensik percaya,2025-05-18T15:12:38Z,0,15
teman_kuliah_user_2380,mulyono dati sikap teman nya dg ijazahnya terbuka diam tertutup berpikirnya mulyono ruwet,2025-05-18T12:30:55Z,0,15
teman_kuliah_user_2381,mustoha nunjuk foto mulyono aja kaya orang gugup salah wkwkwk,2025-05-18T12:30:51Z,0,15
teman_kuliah_user_2389,nunjukin foto mulyono gakjelas kayak gugup gak,2025-05-18T12:20:15Z,0,15
teman_kuliah_user_2390,hary mulyono tukeran kacamata,2025-05-18T12:18:04Z,0,15
teman_kuliah_user_2413,foto ijazah jokowi analisis berbeda dicurigai foto harry mulyono,2025-05-18T11:41:15Z,0,15
teman_kuliah_user_2435,brooooo klo angkatan terangkan jokowi mulyono konon org beda,2025-05-18T11:21:57Z,1,15
teman_kuliah_user_2455,teman nya mulyono teman dadakan temen bayaran makasih kasmujo jujur,2025-05-18T11:00:50Z,1,15
teman_kuliah_user_2483,adik ipar jokowi ugm namanya mulyono yg udh meninggal,2025-05-18T10:26:18Z,0,15
teman_kuliah_user_2503,heri mulyono yg berdiri pakai kacamata no,2025-05-18T10:01:17Z,0,15
teman_kuliah_user_2511,potone ilo gk memper blassss karo mulyono,2025-05-18T09:50:05Z,0,15
teman_kuliah_user_2538,yg seangkatan bilangin mulyono suruh tunjukin aja ijazah nya biar gk gaduh,2025-05-18T09:24:05Z,0,15
teman_kuliah_user_2566,foto fi ijazah jokowi persis foto mulyono teman jokowi foto yg wisuda yg berkaca mata mulyono mata yg tdk membedakan foto nyata ijazah jokowi memakai foto mulyono temannya berbohong,2025-05-18T08:56:35Z,0,15
teman_kuliah_user_2605,nggak percaya fotonya mulyono suami idayati,2025-05-18T08:08:23Z,0,15
teman_kuliah_user_2651,aja tunjukin mulyono engga tunjukin nya engga,2025-05-18T07:08:44Z,0,15
teman_kuliah_user_2676,sandiwara dadakan bayar mulyono,2025-05-18T06:45:53Z,0,15
teman_kuliah_user_2679,ijasah mulyono almarhum,2025-05-18T06:42:34Z,0,15
teman_kuliah_user_2689,ga ngebacot coba tunjukkan ijazah jokowi mulyono beres,2025-05-18T06:32:44Z,0,15
teman_kuliah_user_2695,yg dimasalahkan ijazahnya mulyono ijazahnya teman mulyono,2025-05-18T06:20:58Z,0,15
teman_kuliah_user_2719,mustoha menceritakan mulyono jokowi,2025-05-18T05:50:49Z,0,15
teman_kuliah_user_2753,berani menampilkan ijazah aslinya ayooooo mas mulyono tampilkan ijazah aslimu,2025-05-18T04:58:51Z,0,15
teman_kuliah_user_2778,yg tuh ijazah mulyono ngapain pamer berjamaah kesaksian lembar kertas,2025-05-18T04:39:59Z,0,15
teman_kuliah_user_2783,disuruh tunjukin ijazahnya yg ditunjukin ijazah rombongan reunian mulyono lucuuu,2025-05-18T04:37:51Z,0,15
teman_kuliah_user_2786,wkwk yg berbohong ngajak orang berbohong tinggal tunjukan ijazah mulyono,2025-05-18T04:37:08Z,0,15
teman_kuliah_user_2830,teman berani nunjukim izajahnya mulyono tdk berani,2025-05-18T03:57:49Z,0,15
teman_kuliah_user_2834,mustopa sdh dibokking mulyono berbohong ngibulbdgn jbtn yg diban,2025-05-18T03:54:35Z,0,15
teman_kuliah_user_2842,ijazah tdk butuhkan masyarakat yg menunjukan ijazahx joko widodo alias mulyono slm nkri merdeka,2025-05-18T03:46:08Z,0,15
teman_kuliah_user_2886,kx ijazahnya teman temannya yg perlihatkan ijazahnya mulyono aneh kie,2025-05-18T03:13:09Z,0,15
teman_kuliah_user_2898,yg jd emang temen temen nya lihat ijazah asli mulyono bs bilang lha org dunia blm yg lihat ijazah aslinya mulyono tuhan yg lihat ijazah aslinya,2025-05-18T03:09:10Z,0,15
teman_kuliah_user_2907,coba sandingkan ijazah mulyono dgn ijazah jokowi,2025-05-18T02:57:13Z,0,15
teman_kuliah_user_2950,biar temanya seribu si mulyono klo gk ijazah yg asli ya,2025-05-18T02:18:18Z,0,15
teman_kuliah_user_2953,adili mulyono bin fufufafa,2025-05-18T02:15:11Z,0,15
teman_kuliah_user_2970,g anaknya alm hary mulyono tunjukan ijazahnya,2025-05-18T01:58:34Z,0,15
teman_kuliah_user_2972,dah jebatan bela mulyono fotonya jokowi bantu pendusta,2025-05-18T01:57:15Z,0,15
teman_kuliah_user_2994,org bayaran mulyono sdr mustoha,2025-05-18T01:38:57Z,0,15
teman_kuliah_user_2998,adiknya jokwi hadi mulyono hidup mati ya,2025-05-18T01:36:59Z,0,15
teman_kuliah_user_3056,mulyono pack,2025-05-18T00:55:28Z,0,15
teman_kuliah_user_3060,rame rame temennya nunjukin ijazah kalo si mulyono ttep gamau,2025-05-18T00:52:02Z,0,15
teman_kuliah_user_3069,ragu posisi jokowi mulyono dlm foto,2025-05-18T00:43:49Z,0,15
teman_kuliah_user_3076,yg persoalkan ijazah mulyono ijazah kawan kawanya kalo ijazah mulyono asli berani nunjukin publik kawan kawanya rekayasa mulyono jago manipulasi kalo mamang ijazah asli tinggal nunjukin aja sederhana,2025-05-18T00:40:45Z,0,15
teman_kuliah_user_3081,apapun klo mulyono gak percaya,2025-05-18T00:36:22Z,0,15
teman_kuliah_user_3144,ijazah yg perlihatkan mulyono umpetin,2025-05-17T23:58:01Z,0,15
teman_kuliah_user_3146,temen nya heri mulyono getol pamerin ijazah adeh gaduh amet konoha,2025-05-17T23:57:34Z,0,15
teman_kuliah_user_3161,lupa ga si mulyono,2025-05-17T23:45:15Z,0,15
teman_kuliah_user_3176,orang bohong yg maksud mulyono,2025-05-17T23:36:15Z,0,15
teman_kuliah_user_3180,mulyono bikin gaduh tunjukin biar klar,2025-05-17T23:33:57Z,0,15
teman_kuliah_user_3200,mulyono pengecut kebohongan du lakukan sewa pemain bayaran menutupi bohong,2025-05-17T23:25:16Z,0,15
teman_kuliah_user_3181,yg mulyono,2025-05-17T23:22:56Z,0,15
teman_kuliah_user_3257,potonya mulyono,2025-05-17T22:40:26Z,0,15
teman_kuliah_user_3245,catat kuliah lulus lulus kuliah yg maksud saksi mulyono dipertegas,2025-05-17T22:31:07Z,0,15
teman_kuliah_user_3285,mulyono jokowi,2025-05-17T22:17:16Z,0,15
teman_kuliah_user_3288,aluminya yg pamer ijazahnya koq gak mulyono jngan ternak mulyono berkembang biak nich,2025-05-17T22:15:21Z,0,15
teman_kuliah_user_3291,yaallah sy aja orang awam sdh mimik kebohongan wajah sy nonton foto mulyono yg kuliah ugm allahualam,2025-05-17T22:12:06Z,0,15
teman_kuliah_user_3335,orang dijilat mulyono bnyk selali,2025-05-17T20:47:53Z,0,15
teman_kuliah_user_3341,ternak mulyono,2025-05-17T20:29:39Z,0,15
teman_kuliah_user_3348,temennya berani nunjukin ijazah mulyono ijazahmu,2025-05-17T20:12:27Z,0,15
teman_kuliah_user_3414,yg namanya joko widodo heri mulyono membingungkan,2025-05-17T18:20:12Z,6,15
teman_kuliah_user_3422,harry mulyono bkn jokowi berhubung harry mulyono sdh wafat akui jokowi ijazahnya harry mulyono,2025-05-17T18:14:15Z,0,15
teman_kuliah_user_3425,nama joko widodo mulyono beda orang mulyono bertukar identitas orang bernama joko widodo joko widodo presiden nama,2025-05-17T18:11:46Z,0,15
teman_kuliah_user_3432,ternak mulyono berani pamer ijazah jokomulyono ga berani tunjukin ijazah,2025-05-17T18:06:32Z,0,15
teman_kuliah_user_3447,kasmujo dosen pembimbing jokowi yg kuliah mulyono joko widodo ijazah nama mulyono joko widodo daftar capres nama joko widodo mulyono presiden tandatangan kepres nama joko widodo mulyono klo ijasahnya tdk nama joko widodo berati ijazahnya jokowi,2025-05-17T17:51:18Z,0,15
teman_kuliah_user_3462,perlihatkan ijazah mulyono mustoha berbohong,2025-05-17T17:37:08Z,0,15
teman_kuliah_user_3469,tmn nya pamer ijazahnya ijazahnya mulyono kalo saksi ak jg jdi teman sekolahnya bismillah komisaris,2025-05-17T17:33:15Z,0,15
teman_kuliah_user_3472,coyy yg ijazah mulyono ijazah ente yg suruh perlihatkan,2025-05-17T17:30:26Z,0,15
teman_kuliah_user_3497,ternak mulyono,2025-05-17T17:04:48Z,0,15
teman_kuliah_user_3520,dri kmren yg ngakunya tmen pakdhe jokowi byakkkkkkk gak yg ngaku tmennya mulyono trus nunjukij ftoya mulyono pas kuliah,2025-05-17T16:54:16Z,0,15
teman_kuliah_user_3534,berkonspirasi kasmujo udah mengaku kejadian yg dosen pembimbingnya mulyono,2025-05-17T16:47:05Z,0,15
teman_kuliah_user_3557,india pakistan perang ngurusin ijazah rudal nyasar kemari kna ijazahnya mulyono duaaarr bingung,2025-05-17T16:38:55Z,0,15
teman_kuliah_user_3564,nama ugm dipertaruhkan ternak mulyono ketar ketir,2025-05-17T16:37:03Z,0,15
teman_kuliah_user_3603,poto mulyono ditunjukan,2025-05-17T16:19:29Z,0,15
teman_kuliah_user_3605,bingung ngasih tau mulyono yg mn bohong,2025-05-17T16:16:08Z,0,15
teman_kuliah_user_3587,maksud mulyono almarhum,2025-05-17T16:14:52Z,0,15
teman_kuliah_user_3628,ternak mulyono seliweran,2025-05-17T16:05:39Z,0,15
teman_kuliah_user_3671,fik jokowi pakek ijazah mulyono,2025-05-17T15:49:47Z,0,15
teman_kuliah_user_3697,mulyono tinggal nampakin ijazah ngapain nyewa ternak ternaknya,2025-05-17T15:41:51Z,0,15
teman_kuliah_user_3720,ternak mulyono mulyono berkomentar ijazah perlukan publik ijazah aslinya mulyono ternak ternak nya,2025-05-17T15:36:02Z,0,15
teman_kuliah_user_3738,ad foto mulyono jkw berdua,2025-05-17T15:30:31Z,0,15
teman_kuliah_user_3752,poto jokowidodo mulyono adik iparnya jokowidodo,2025-05-17T15:23:37Z,0,15
teman_kuliah_user_3776,wkwkwkwk penyebutan gelar aja salah insinyur mulyono tuh gelarnya drs,2025-05-17T15:16:30Z,0,15
teman_kuliah_user_3823,teman temanya berani tunjukkan ijazahnya knapa mulyono takut ribet bgini,2025-05-17T15:06:07Z,0,15
teman_kuliah_user_3830,shilumaan temaaan muncul ijasahnya mulyono gak peenah muncul temen ternak,2025-05-17T15:04:12Z,1,15
teman_kuliah_user_3923,yg hary mulyono jokowi angkatan yg hary mulyono jokowi yg jokowi hary mulyono,2025-05-17T14:37:40Z,0,15
teman_kuliah_user_4003,temen nya nyindir mulyono gini mul tunjukan,2025-05-17T14:18:35Z,0,15
teman_kuliah_user_4022,yg tunjukin ijazah mulyono gk nunjukin jg yg nunjukin ijazah nyindir halus ato gimana,2025-05-17T14:16:16Z,0,15
teman_kuliah_user_4021,orang kena firusnya mulyono tranferan,2025-05-17T14:11:02Z,0,15
teman_kuliah_user_4048,disana ga ijazah mulyono bin malinkundang ga nilainya pernyataan klasifikasi narasi buktikan uji forensik independen ijazah mukidi,2025-05-17T14:10:26Z,0,15
teman_kuliah_user_4059,knapa gk tanyain kkn si mulyono,2025-05-17T14:08:49Z,1,15
teman_kuliah_user_4066,ijazah mulyono yg d publik ijazah alumni lawak kaum waras,2025-05-17T14:03:32Z,0,15
teman_kuliah_user_4109,sdm rendah hidup bansos yg percaya drakor ala mulyono,2025-05-17T13:59:36Z,0,15
teman_kuliah_user_4125,foto mulyono koq beda yg temen perempuannya dirumah jokowi yg ber kacamata bo ongnya ga kompak nih,2025-05-17T13:55:53Z,0,15
teman_kuliah_user_4135,yg ditunjukan dlm foto wisuda pakai kacamata mulyono,2025-05-17T13:53:13Z,0,15
teman_kuliah_user_4109,drakor utk pemuja mulyono yg nya sdm rendah hidup bansos,2025-05-17T13:50:12Z,0,15
teman_kuliah_user_4189,bnyak nich teman mulyono nunjukin ijazah gerangan,2025-05-17T13:44:17Z,0,15
teman_kuliah_user_4203,temannya mulyono diakui temannya tega banget lo wi ma saudara mu yg tiada,2025-05-17T13:41:33Z,0,15
teman_kuliah_user_4220,hubungan dgn teman mulyono yg d mulyono,2025-05-17T13:38:09Z,0,15
teman_kuliah_user_4226,tunjukan ijazah asli mulyono selesai ribet sih,2025-05-17T13:37:46Z,0,15
teman_kuliah_user_503,ternak mulyono yg dibayar,2025-05-17T13:34:08Z,0,15
teman_kuliah_user_4296,temen temenya knp mulyono gk bs tunjukan ijazah aslinya,2025-05-17T13:27:25Z,0,15
teman_kuliah_user_4268,ditelusuri ngga mahasiswa yg d tingah kiri adlh mulyono klo fix kesaksian palsu kunci,2025-05-17T13:26:45Z,0,15
