author,text,published_at,like_count,cluster
Ijasah_ditunjukan_user_28218,pengalihan koruptor ya orang yg memfitnah jokowi orang bodoh dah b nar b k n gadoh ijasah hak privasi individu b kqn ijasah pamer puplik jentel presiden tunjukan ijazanya panci p lajar malu gitu m ntri ha ha ha,2025-04-30T17:18:26Z,0,15
Ijasah_ditunjukan_user_28228,manusia berhati busuk suka mepidanakan orang pemimpin tai,2025-04-30T17:17:57Z,0,15
Ijasah_ditunjukan_user_28294,manusia suka cari kesalahan orang emang yg bilang jokowi ijazah palsu indonesia kelebihannya kehebatan diindonesia korek nama orang mudah masuk penjara seumur hidup,2025-04-30T17:13:51Z,0,15
Ijasah_ditunjukan_user_28300,kalo menang mah wajar orang mantan pleciden kalo kebenaran kejujuran terbongkar keren,2025-04-30T17:13:28Z,0,15
Ijasah_ditunjukan_user_28237,sok cari kesalahan orang akibatnya orang yg menjatuhkan orang,2025-04-30T17:11:25Z,0,15
Ijasah_ditunjukan_user_28357,orang yg berbohong ketahuan menutupi kebohongan kebohongan kebohongan olah kebenaran,2025-04-30T17:10:36Z,0,15
Ijasah_ditunjukan_user_28392,kerjaan orang yg sakit hati sm jokowi ngiriii,2025-04-30T17:08:43Z,0,15
Ijasah_ditunjukan_user_28422,pelajaran orang yg suka mitnah liat ijasajokowi sudh bilang ijasa jokowi palsu jangn percaya ama postingn orang yg ga bertagung,2025-04-30T17:06:38Z,0,15
Ijasah_ditunjukan_user_28424,senyumxa suryo uda ketakutan npa mengusik jokowi orang ngk perna ganggu kehidupan,2025-04-30T17:06:25Z,0,15
Ijasah_ditunjukan_user_28315,si roy tau urusan orang orang so,2025-04-30T17:06:19Z,0,15
Ijasah_ditunjukan_user_28452,hidup cuman mencari kesalahan orang,2025-04-30T17:04:51Z,0,15
Ijasah_ditunjukan_user_28457,orang membenci mencari kesalahan walapun kesalahan dibuktikan kebenaran dicari kesalahan orang membenci percaya kebenaran orang membenci hati pikiran nya cuman menjelekkan yg dibenci,2025-04-30T17:04:36Z,0,15
Ijasah_ditunjukan_user_28466,isu fitnah pki digulirkan mmg orang orang org g berguna hama,2025-04-30T17:04:02Z,0,15
Ijasah_ditunjukan_user_28473,bagus jokowi perangkap orang sakit hati akut tinjukkan ijasah orang sakit hati masuk perangkap buka ijasah asli tuntut biar golongan sakit hati akut kelar,2025-04-30T17:03:44Z,0,15
Ijasah_ditunjukan_user_28509,sebage masyarakat mendukung roi suryo cs orang orang selaluemprofokasi menyebar kebencian orang penjaraagar negri bersih orang kotor merusak persatuan kesatuan nkri,2025-04-30T17:00:14Z,0,15
Ijasah_ditunjukan_user_28561,ehhh dasar tukang panci apasih urusanmu dgn ijasah orang jgn suka bawa masyrkt,2025-04-30T16:56:43Z,0,15
Ijasah_ditunjukan_user_28565,lawak lawak negara fokus kemajuan indonesia sibuk ngurus ijazah orang,2025-04-30T16:56:37Z,0,15
Ijasah_ditunjukan_user_28579,intinya ga tindak orang rs liar,2025-04-30T16:56:00Z,0,15
Ijasah_ditunjukan_user_28589,jokowi ngelapor nunjukin tmnnya jg hahhaa tuh tahek namanya orang mah,2025-04-30T16:55:31Z,0,15
Ijasah_ditunjukan_user_28605,anehnya orang yg korup panci aja percaya,2025-04-30T16:54:41Z,0,15
Ijasah_ditunjukan_user_28615,cari cari kesalahan orang situ udah bener belom,2025-04-30T16:53:56Z,0,15
Ijasah_ditunjukan_user_28630,maluku ambon penjara kn kali orang kla,2025-04-30T16:51:26Z,0,15
Ijasah_ditunjukan_user_28667,gapenting bngt anjir nyari kesalahan orang mending mikirin,2025-04-30T16:51:17Z,0,15
Ijasah_ditunjukan_user_28460,masarakat yaaa bela jokowi ga bela orang yg ga,2025-04-30T16:50:53Z,0,15
Ijasah_ditunjukan_user_28460,suryo ga bagus fitna orang yg untung ga pemimpin,2025-04-30T16:48:55Z,0,15
Ijasah_ditunjukan_user_28679,aja roy masuk penjara gegara sibuk ngurus ijazah orang,2025-04-30T16:47:51Z,0,15
Ijasah_ditunjukan_user_28731,mentri orang spt,2025-04-30T16:47:00Z,0,15
Ijasah_ditunjukan_user_28779,mikir ekonomi sulit ngapain menilai ijasah orang lainn,2025-04-30T16:43:52Z,0,15
Ijasah_ditunjukan_user_28795,kalo perlihatkan ijasah asli ga menghentikan orang orang mencari cari karna orang orang benci sakit hati,2025-04-30T16:43:00Z,0,15
Ijasah_ditunjukan_user_28810,ciri ciri orang takut hadapin hukum nama orang bawa,2025-04-30T16:41:52Z,0,15
Ijasah_ditunjukan_user_28817,gk kerjaan orang duhhh gustiii,2025-04-30T16:41:21Z,0,15
Ijasah_ditunjukan_user_28821,sibuk mencari kesalahan orang lupa kalo kesalahan,2025-04-30T16:40:55Z,0,15
Ijasah_ditunjukan_user_28838,cari kesalahan kekhilafan kelemahan orang motif benci iri hati dengki manusia biadab,2025-04-30T16:40:01Z,0,15
Ijasah_ditunjukan_user_28839,pintar dikit sdh songong mas roy allah benci dgn orang songong,2025-04-30T16:40:00Z,0,15
Ijasah_ditunjukan_user_28735,dasar manusia pembohongkau ngk ngaku kejujuran orang,2025-04-30T16:38:40Z,0,15
Ijasah_ditunjukan_user_28901,orang jatu apapun lakukan kepuasan menfitna orang,2025-04-30T16:35:41Z,0,15
Ijasah_ditunjukan_user_28928,yakinlah orang si roy cs menuai yg tanam,2025-04-30T16:35:31Z,1,15
Ijasah_ditunjukan_user_28957,orang yg numpang populer,2025-04-30T16:34:12Z,0,15
Ijasah_ditunjukan_user_28966,isu knp skrg perlihatkan yg jdi fsni orang,2025-04-30T16:33:45Z,0,15
Ijasah_ditunjukan_user_28970,bersiaplah berseragam oren kumpulan orang pembenci sakit hati jabatan era jokowi,2025-04-30T16:33:27Z,0,15
Ijasah_ditunjukan_user_28973,susah kalo orang yg sakit hati tetep salah motif nya sakit hati,2025-04-30T16:33:22Z,0,15
Ijasah_ditunjukan_user_28983,perang dunia meletus indonesia sibuk ngurusin ijasah palsu pemaksulan gibran lengserkan indonesia masii orang yg fitnah blm y bukti udah koar koar roy suryo orang gaduh suana,2025-04-30T16:32:49Z,0,15
Ijasah_ditunjukan_user_28987,orang orang yg spt yg bikin indonesia dibelakang disaat negara negara memperkenalkan teknologi temuannya bikin roket bs kebulan bs angkasa mengembangkan nuklir senjata sumber energi dll indonesia ngurusin cela orang yg benernya gelar prof dok ngakunya orang pintar ngurusin yg kepentingannya perkembangan kemajuan bangsa,2025-04-30T16:32:16Z,0,15
Ijasah_ditunjukan_user_29000,hati ga bohong orang awam aja tau salah,2025-04-30T16:31:45Z,0,15
Ijasah_ditunjukan_user_29054,mengorek² mencari kesalahan orang menjerumuskan mu,2025-04-30T16:29:02Z,0,15
Ijasah_ditunjukan_user_29069,keppo tau urusan orang manfaatnya lu,2025-04-30T16:28:19Z,0,15
Ijasah_ditunjukan_user_28939,roy suryo orang pintar asli bangsa indonesia yg terkenal beradab memanggil nama mantan presiden manggil nama doang manggil istilah orang jawa saru nglunjak,2025-04-30T16:24:34Z,0,15
Ijasah_ditunjukan_user_29140,orang kerjaan e,2025-04-30T16:24:21Z,0,15
Ijasah_ditunjukan_user_29142,menilai orang namanya manusia sombong yau orang yg jujur,2025-04-30T16:24:16Z,0,15
Ijasah_ditunjukan_user_29204,orang pekok orang lihat ijazah jokowi udah nuduh ijazah palsu pekok yg dukung pekok,2025-04-30T16:21:03Z,0,15
Ijasah_ditunjukan_user_29209,gak tanggung² kelompok pembenci jokowi menganggap jokowi orang sekolah sd smp sma kuliah dunia kalo orang sekolah gak apa² krn orang bodoh fakta,2025-04-30T16:20:44Z,0,15
Ijasah_ditunjukan_user_29214,ga membuktikan apapun orang membenci apapun buruk dimatanya,2025-04-30T16:20:40Z,0,15
Ijasah_ditunjukan_user_29100,penjarakan orang senang fitnah kapok,2025-04-30T16:19:53Z,0,15
Ijasah_ditunjukan_user_29259,masak negara ator bilang abal abal orang pemerintahan,2025-04-30T16:18:29Z,0,15
Ijasah_ditunjukan_user_29296,banyakin ngomong aja si privasi buka emang tau orang sedunia mikir orang suka menghujat penyakit hati bahas ijazah palsu roy suryo sengaja alibi biar korupsi negri mereda curiga,2025-04-30T16:16:46Z,0,15
Ijasah_ditunjukan_user_29301,jokowi pitnah hina orang orang dolim biar hukuman orang dolim,2025-04-30T16:16:20Z,0,15
Ijasah_ditunjukan_user_29330,kalo dlu berkuasa orang nomor menghina beliau bersikap sabar rapopo yg orang yg menghina tp berkuasa orang nomor sepuluh sikap karakter berubah reaktif main lapor rakyat sekedar perkataan salah bangsa amerika serikat yg negarawan sejati orang tahan penderitaan tp kau karakter berilah kekuasaan kekuasaan karakter asli dr yg dipendamnya memalukan mengecewakan,2025-04-30T16:14:38Z,0,15
Ijasah_ditunjukan_user_29343,kocak bgt ni orang sumpah,2025-04-30T16:14:08Z,0,15
Ijasah_ditunjukan_user_29369,orang yg menggebu mencari kesalahn orang tnpa bukti nyata udang dibalik batu kali dukung jkw mari buktikn dipengadilan yg slh,2025-04-30T16:13:04Z,0,15
Ijasah_ditunjukan_user_29409,ya alloh republik indonesia jokowi orang permasalahkan jokowi terima masarakat sabar ambil hikmahnya masyarakat awam gimanapun kepimpinan jokowi sabar pa orang yg alloh membimbing orang berhati,2025-04-30T16:11:34Z,0,15
Ijasah_ditunjukan_user_29486,ngumpet dibalik roy roy krn dibuang penguasa cari aib orang hidup yg memprihatinkan,2025-04-30T16:07:34Z,116,15
Ijasah_ditunjukan_user_29412,emang roi cs apaa wewenangnya kepentingannya ngotot pingin ijasah orang sll ber narasi yg laporin alasan mbulet kayak orang kentut nyeret nama masyarakat dasar kompor kau roy,2025-04-30T16:07:10Z,0,15
Ijasah_ditunjukan_user_29499,orang ga sekola ijasah nya inenget temen apal lulusan lulusan sekola ga orang paham ya ga usia udah tau pk jokowi,2025-04-30T16:06:49Z,0,15
Ijasah_ditunjukan_user_29475,roy suryo tu orang gk malu otaknya dh miring golongan orang stressss,2025-04-30T16:06:41Z,0,15
Ijasah_ditunjukan_user_29507,tangkap sja orang pki yg suka kse adu domba orang yg,2025-04-30T16:06:35Z,0,15
Ijasah_ditunjukan_user_29412,emang roi cs apaa wewenangnya kepentingannya ngotot pingin ijasah orang sll ber narasi yg laporin alasan mbulet kayak orang kentut,2025-04-30T16:06:12Z,0,15
Ijasah_ditunjukan_user_29560,inih pembuktian yg menghukum orang dengki sirik serakah,2025-04-30T16:03:58Z,0,15
Ijasah_ditunjukan_user_29583,roy roy kasihan ijajah zokowi bilang palsu lihat cari penyakit menduga membuktikan cari sendi buktinya penjara menunggumu orang berakar hati kedengkian cari kesalahan orang buktikan,2025-04-30T16:02:54Z,0,15
Ijasah_ditunjukan_user_29372,orang orang stres,2025-04-30T16:01:56Z,0,15
Ijasah_ditunjukan_user_29606,lu pakar tai goblok banget udah fitnah orang nyari pembelaan ya pa jokowi orang kaya lu otak co ga dipake,2025-04-30T16:01:46Z,0,15
Ijasah_ditunjukan_user_29647,kedepan nya orang roy suryo yg menuduh ijasah orang palsu,2025-04-30T16:00:07Z,0,15
Ijasah_ditunjukan_user_29660,orang penyakit hati susah sembuhnya,2025-04-30T15:59:34Z,0,15
Ijasah_ditunjukan_user_29695,orang sosoan rame²in publik menjatuhkan orang hati² hukum karma berlaku rs,2025-04-30T15:58:23Z,0,15
Ijasah_ditunjukan_user_29752,salah nya orang yg kepo nyinyir d sosmed jokowi sabar,2025-04-30T15:55:15Z,0,15
Ijasah_ditunjukan_user_29775,roy panci suryo orang licik seandainya jokowi menujukan ijazah aslinya cari kesalahan,2025-04-30T15:54:18Z,0,15
Ijasah_ditunjukan_user_29784,suryo orang usil borok,2025-04-30T15:53:58Z,0,15
Ijasah_ditunjukan_user_29798,gonggong orang ijazah benda pribadi ngk main d lihatkan d khalayak ramai mending penjarakan aja roy suryo kemarin d cecar pengacaranya mirna yg bilang vidio nya asli udh d edit ngeles kocak orang,2025-04-30T15:52:58Z,0,15
Ijasah_ditunjukan_user_29824,kebencian menutupi kebenaran apapun orang yg membencimu percaya,2025-04-30T15:51:54Z,1,15
Ijasah_ditunjukan_user_29836,jokowi orang jujur dunia berbohong cerdas intelektualitas lulusan ugm diragukan ijazahnya biar jokower senang,2025-04-30T15:51:23Z,0,15
Ijasah_ditunjukan_user_29867,roy suryo panci orang gak tau pencuri panci ember tau lagu kebangsaan indonesia narapidana penghinaan agama mulia jokowi masyarakat indonesia yg spt roy panci jabar aura rumah dibantaran sungai orang gak gaya selangit orang orang waras,2025-04-30T15:50:09Z,0,15
Ijasah_ditunjukan_user_29882,wajib pidana krn suka fitnah orang tdk membuktikan yg,2025-04-30T15:49:29Z,0,15
Ijasah_ditunjukan_user_29824,ngurusin orang bersih,2025-04-30T15:49:14Z,0,15
Ijasah_ditunjukan_user_29939,orang sombong mencari cari kesalahan orang prosedur banget agama bernegara iri lan meri allah swt maha adil,2025-04-30T15:46:55Z,0,15
Ijasah_ditunjukan_user_29944,klo negara model suryo aja rusak negara dn orang sengkuni yg asli,2025-04-30T15:46:38Z,0,15
Ijasah_ditunjukan_user_29945,suara mas roy kaya orang panikan gitu,2025-04-30T15:46:37Z,0,15
Ijasah_ditunjukan_user_29982,yah menipu balasan dunia akhirat apalago dibohongi jutaan orang,2025-04-30T15:45:11Z,0,15
Ijasah_ditunjukan_user_29987,bilang aja roy lo suka nyari kebencian orang,2025-04-30T15:45:00Z,0,15
Ijasah_ditunjukan_user_30020,orang orang cari panggung konsep bawa bawa masyrakat,2025-04-30T15:43:20Z,0,15
Ijasah_ditunjukan_user_30029,manusia yg ad kerjaan jd cari kesalahan orang,2025-04-30T15:42:56Z,0,15
Ijasah_ditunjukan_user_29944,ben modar suryo buang aja orang nusa kambangan,2025-04-30T15:42:07Z,0,15
Ijasah_ditunjukan_user_30043,orang yg sakit hati aja sabar jokowi,2025-04-30T15:42:06Z,0,15
Ijasah_ditunjukan_user_30092,lha kapasitas roy kepo pengen tau ijasah orang kalo orang diamini aneh ruang privat warga negara terletak dimana roy polisi jaksa hakim,2025-04-30T15:39:47Z,0,15
Ijasah_ditunjukan_user_30097,koplotan orang sakit hati ijazah knpa nggak dr pas walikota,2025-04-30T15:39:31Z,0,15
Ijasah_ditunjukan_user_30114,allah psling mrmbenci orang yg melampau batas yakinlah orang sibuk mencari kesalahan orang dirinyavdan mengalami yamg is lakukan orang jokowi bisr allah yg menghilumnya bekas pemimpin kadi roy sutyondkk yg ghibah sia sisp kelaj kelyarganya mengalami balsannya,2025-04-30T15:38:52Z,0,15
Ijasah_ditunjukan_user_30116,horeee ngapain ribut gk malu orang yg jelekin orang tanda jelek hatinya,2025-04-30T15:38:43Z,0,15
Ijasah_ditunjukan_user_30141,jangnlh mencari kesalahan orang roy kau dr orang berfikirlh membangun indonesia maju orang,2025-04-30T15:37:19Z,0,15
Ijasah_ditunjukan_user_90,jokowi orang jujur,2025-04-30T15:37:07Z,0,15
Ijasah_ditunjukan_user_30150,yg kepo bpk roy suryo cs sibuk urusin ijasah orang sirik pelihara,2025-04-30T15:36:42Z,0,15
Ijasah_ditunjukan_user_30184,rs omon nya bau busuk liat mukanya aja udah baca munafikkk urusannya ngurusin ijazah orang ilmiah ilmiah bidang hoaxxx berkembang mulutmu rs sok orang pintar dasar mantri panci,2025-04-30T15:34:51Z,0,15
Ijasah_ditunjukan_user_30192,motif nya sakit hati tu orang sgelintir yg masalahkan hhhhh,2025-04-30T15:34:18Z,0,15
Ijasah_ditunjukan_user_30196,orang klu dh g suka benci sperti apapun kasih kebenaran psti sll cari cari kesalahan org,2025-04-30T15:34:07Z,0,15
Ijasah_ditunjukan_user_29885,orang bandel bgt kandel mukanya ngeyel bilang mempidanakan emang hrs oidana orang seoerti jg yg suka berkoar koar menyebalkn,2025-04-30T15:34:01Z,0,15
Ijasah_ditunjukan_user_30222,manusia picik sirik iri dengki pintar mencari kesalahan orang lo mimpin negeri kayak beliau mentri aja kagak jujur,2025-04-30T15:32:19Z,0,15
Ijasah_ditunjukan_user_30241,kesalahan orang dicari kesalahan disadari,2025-04-30T15:31:24Z,0,15
Ijasah_ditunjukan_user_30249,jokowi penyakit bawaan suka senang melaporkan orang ditangkap,2025-04-30T15:31:00Z,2,15
Ijasah_ditunjukan_user_30264,pandang ibuk roy mencemarkan pribadi orang memprokator orang hukum berlaku ibuk gak dihukum,2025-04-30T15:30:28Z,0,15
Ijasah_ditunjukan_user_30294,penyakit yg sulit dusembuhkan sakit hati orang kehilanggan akal sehatnya,2025-04-30T15:29:03Z,0,15
Ijasah_ditunjukan_user_30313,cari maslah sma jokowi slah salah lubang kuburan tolong polisi yg cari mslah sma presiden kumpulin penjara sma orang pembunuhan biar hancur orang cri mslah indonesia,2025-04-30T15:28:03Z,0,15
Ijasah_ditunjukan_user_30314,problemnya karna orang sakit hati iri dengki kunjung padam,2025-04-30T15:28:03Z,0,15
Ijasah_ditunjukan_user_30329,roy suryo orang pintar nyelehne orang didepan hukum kedudukan nya tdk cari simpati orang,2025-04-30T15:27:35Z,0,15
Ijasah_ditunjukan_user_30332,roy sayur pea motiv tujuan y kaga nyari kesalahan orang yg sdh tdk menjabat basi,2025-04-30T15:27:26Z,0,15
Ijasah_ditunjukan_user_30465,roy panci ngelles orang kayak gini rukyah tdk mencari kebenaran tpi perusak nama orng,2025-04-30T15:21:58Z,0,15
Ijasah_ditunjukan_user_30490,jokowi cerdas serendah pikiran mantan orang tertinggi ri meladeni orang pembenci ditempat polisian kejaksaan dijalankan,2025-04-30T15:20:48Z,6,15
Ijasah_ditunjukan_user_30495,ni orang bahagia menikmati difst dengki jahatnya ya gak beban nya bikin masarakat infonesia gaduh otaknya ni orang,2025-04-30T15:20:45Z,0,15
Ijasah_ditunjukan_user_30499,kasi kera orang,2025-04-30T15:20:43Z,0,15
Ijasah_ditunjukan_user_30507,yutube isinya orang orang dongo,2025-04-30T15:20:35Z,0,15
Ijasah_ditunjukan_user_30529,udah nggak dimunculin deh orang busuk,2025-04-30T15:19:48Z,0,15
Ijasah_ditunjukan_user_30499,orang moga masuk penjara,2025-04-30T15:19:46Z,0,15
Ijasah_ditunjukan_user_30537,hadeuuuhhh aj tu orang kg percaya bae aneh bnget dh tu orang ya,2025-04-30T15:19:23Z,0,15
Ijasah_ditunjukan_user_30542,orang udah kuasai benci apapun yg lakukan jokowi sekeluarga salah alloh yg orang yg munafik,2025-04-30T15:19:08Z,0,15
Ijasah_ditunjukan_user_30551,langkah hukum tempuh biar klo menuduh orang jgn koar koar membuktikan klo gak bukti menuduh jatuhnya fitnah mencemarkan nama orang,2025-04-30T15:18:52Z,0,15
Ijasah_ditunjukan_user_30458,dasar manusia gak berterimakasih kepimpinan pakjokowi pakjowi jdi persiden kenapala orang orang mengungitgungit masala ijasa okowi jendak ya,2025-04-30T15:17:08Z,0,15
Ijasah_ditunjukan_user_30597,hati hati jaman yg percaya hukum bobrok gak bayak orang orang yg jujur dizaman,2025-04-30T15:17:00Z,0,15
Ijasah_ditunjukan_user_30606,percaya pembohong orang orang munafik cari keuntungan sesa at penjilat,2025-04-30T15:16:42Z,0,15
Ijasah_ditunjukan_user_30614,hei roy suryo masyarakat yg mencurigai kepribadian orang tp golongan yg sakit hati kehidupan pribadi orang tujuannya mencari cari menyudutkan jokowi intinya karna sakit hati dendam,2025-04-30T15:16:14Z,0,15
Ijasah_ditunjukan_user_30538,pertempuran orang sehat orang dungu,2025-04-30T15:15:03Z,0,15
Ijasah_ditunjukan_user_30651,jokowi tuntut orang yg fitnah dibiarin orang fitnah,2025-04-30T15:14:18Z,0,15
Ijasah_ditunjukan_user_30678,bang roy udah salah org ilmiah bodoh mencari sasisasi menpenjara orang kuyul,2025-04-30T15:13:10Z,0,15
Ijasah_ditunjukan_user_30706,q nilai orang nyari salah orang doank,2025-04-30T15:12:06Z,0,15
Ijasah_ditunjukan_user_30712,barisan orang sakit hati pemerintahan jokowi roy soriyoo,2025-04-30T15:11:58Z,0,15
Ijasah_ditunjukan_user_30725,orang roy suryo cs biarpun orang ahli mrngatakan asli teysp sajs meteks percaya manusia manusia hatinys hitam jadam manusia iri dengki saķit hati kronis,2025-04-30T15:11:30Z,0,15
Ijasah_ditunjukan_user_30689,orang rmng dasarnya sifat iri dengki motifnya orang jokowi yg keabsahan dokumen pendidikan beliau negara jokowi indonesia jt rakyat jutaan pejabat pusat daerah desa lucu orang,2025-04-30T15:10:17Z,0,15
Ijasah_ditunjukan_user_30772,orang ngga dibela,2025-04-30T15:09:36Z,0,15
Ijasah_ditunjukan_user_30778,semoga cepat ringkus pembuat kegaduhan ngurusin ijazah orang aja nih,2025-04-30T15:09:20Z,0,15
Ijasah_ditunjukan_user_30783,imigrasi tutup orang,2025-04-30T15:09:06Z,0,15
Ijasah_ditunjukan_user_30792,orang bicara bohong menudukan orang berbohong pelaku kebohongan roy banget senyumnya memalukan dimuka,2025-04-30T15:08:50Z,0,15
Ijasah_ditunjukan_user_30818,aneh repot ngurusi ijazah orang,2025-04-30T15:08:04Z,0,15
Ijasah_ditunjukan_user_30872,negara gaduh orang susah nyari kerja,2025-04-30T15:05:43Z,0,15
Ijasah_ditunjukan_user_30902,roy suryo ngajak orang bicara jujur orang jujur panci tolong kau kalo kau ahli kejujuran,2025-04-30T15:04:30Z,0,15
Ijasah_ditunjukan_user_30908,roysuryo mbok nyuruh orang skripsi jiazah km tunjukin public km yg gk,2025-04-30T15:04:21Z,0,15
Ijasah_ditunjukan_user_30958,ketahuan orang engga seneng ngomongnya,2025-04-30T15:02:16Z,0,15
Ijasah_ditunjukan_user_30828,jgan melawan orang sabar,2025-04-30T15:01:57Z,0,15
Ijasah_ditunjukan_user_30978,imbang rs dibelakangnya orang kuat ga membela anis seru,2025-04-30T15:01:32Z,0,15
Ijasah_ditunjukan_user_30979,tdk ngurusin kejujuran orang cobalah sdh jujur blm,2025-04-30T15:01:32Z,0,15
Ijasah_ditunjukan_user_31023,orang kampung ogah menilai intinya orang licik buanyak ngelesnya ujung nya cari kambing hitam,2025-04-30T14:59:36Z,0,15
Ijasah_ditunjukan_user_31042,apasih urusanmu rs ngurusi ijazah orang,2025-04-30T14:58:46Z,0,15
Ijasah_ditunjukan_user_30992,hakmu hak milik orang haknya bp jokowi dasar manusia panci,2025-04-30T14:58:24Z,0,15
Ijasah_ditunjukan_user_30897,mudahan jokowi kena apesnya takut jokowi mmbeli hukum mmbungkam hukum yng berlaku smoga klo emng ukum yng beli orang orang yng bukam jokowi sgera hukuman instan aja doaku kpda orang yng berbelit belit,2025-04-30T14:58:05Z,0,15
Ijasah_ditunjukan_user_31069,klo orang hati benci dikasih kebenaran kaya apapun ga percaya kecuali klo ajal menjemputnya,2025-04-30T14:57:55Z,0,15
Ijasah_ditunjukan_user_31127,lanjutkan jokowi orang jawa prinsipnya ngalah ngaleh dablek ngamuk tangkap buang pulau kosong orang orang roy suryo,2025-04-30T14:56:12Z,0,15
Ijasah_ditunjukan_user_31135,liat orang yg pinter dinegara pinter liat hasil sidang nya aja ntar sekelas fakechat orang pinter dinegara percaya,2025-04-30T14:56:04Z,0,15
Ijasah_ditunjukan_user_31137,roy suryo congormu bawa masarakat isi bicaramu receh maknanya gestur bicara konsisten segi runutan perlindungan masyarakat bicara kehukum bahasa masyarakat rakyat baju tameng pribadi pertanda dirimu lengkap kau kenali orang suci kafirkan orang kapirmu kau kenali sehebat apapun ilmu mu masuk penjara kebodohan terfreming sok pintar remehkan orang badanmu terima remehkan orang,2025-04-30T14:55:58Z,0,15
Ijasah_ditunjukan_user_30707,rakyat yg dukung roi surya kawan kawan kumpulan orang orang sekelompok orang ajah rakyat papua ambon ntt manado suda pintar wkwkwkwkw,2025-04-30T14:55:19Z,0,15
Ijasah_ditunjukan_user_31166,kalo orang sj nanya langsung tunjukan negarawan,2025-04-30T14:54:50Z,0,15
Ijasah_ditunjukan_user_31170,orang yg rs,2025-04-30T14:54:35Z,0,15
Ijasah_ditunjukan_user_31171,mulut mulut manis orang orang yg mencederai hukum negeri,2025-04-30T14:54:32Z,0,15
Ijasah_ditunjukan_user_31225,orang pinter keblinger orang bodo plongaplongo anak bangsa barsatru cari kebenaran,2025-04-30T14:53:38Z,0,15
Ijasah_ditunjukan_user_31231,roy mempidanakan mempidanakan orang orang yg cangkeme busuk orang orang yg pengecut siapaa orang yg pengecut yg cangkeme busuk dikasih pelajaran yaa tuman,2025-04-30T14:53:26Z,0,15
Ijasah_ditunjukan_user_31095,orang kaya gitu tampilin mulu heran bikin pusing orang aja,2025-04-30T14:52:56Z,0,15
Ijasah_ditunjukan_user_31260,orang yg ditengah pas kali muka penjilat,2025-04-30T14:52:30Z,0,15
Ijasah_ditunjukan_user_31311,orang bener mah kalem ngadepin aja,2025-04-30T14:50:48Z,0,15
Ijasah_ditunjukan_user_31334,orang mencari kesalahn jokowi orang trima kekelahan pilpres kemaren ya wajar sih kalah telak uang milyran hilang karna kalah wajar sih smpe sekarng bikin gaduh karna krna anaknya pa jokowi wapres,2025-04-30T14:49:22Z,0,15
Ijasah_ditunjukan_user_31335,orang usiiil dipenjarakan negara amaaan,2025-04-30T14:49:21Z,0,15
Ijasah_ditunjukan_user_31279,orang ngeyel ngeles anak smp,2025-04-30T14:49:11Z,0,15
Ijasah_ditunjukan_user_31342,roysuryo kayak orang berpengalaman kyk orang tua padah yg tua orang adah kekurangan kelebihan,2025-04-30T14:49:02Z,0,15
Ijasah_ditunjukan_user_30990,yg benci orang tdk mempercayai orang yg benci tsb orang yg benci tsb,2025-04-30T14:48:25Z,3,15
Ijasah_ditunjukan_user_31369,pelapor cari panggung sja biar tenar jokowi orang hebat,2025-04-30T14:48:18Z,0,15
Ijasah_ditunjukan_user_31384,pas pilpres orang sibuk microfon skrang sibuk ijazah emang sibuk bnget orang sampek lupa ngaca lagu kebangsaan aja gak hafal,2025-04-30T14:47:47Z,0,15
Ijasah_ditunjukan_user_31387,orang gk posisi,2025-04-30T14:47:40Z,0,15
Ijasah_ditunjukan_user_31388,kayak masukan nusa kambangan orang syah tersangka,2025-04-30T14:47:39Z,0,15
Ijasah_ditunjukan_user_31435,hahaha orang juta kesusahan pret orang desa tinggal ujung pulau desa gak kesusahan tu penghasilan hasil menoreh karet cuman ribu perbulan tu gak susah tu karna terbiasa hidup kesusahan ya salah bro krn memaknainya syukur bro beda orang kota tinggal dikota kota jakarta rumahnya betonpun aja susah aja bbm demo dikut demo orang goblok mah bbm liter ribu liter anteng aja tu gak demo tu kesusahan miskin orang desa orang kota bro hahaha gak percaya aja desa lihat aktifitas bejerja bercanda bergurau bro gak mikir susah miskin gak hiraukan masyarakat desa merasajan orang kaya bro beda orang orang kota serba pikirin coba kasih contoh lombok cabai orang kota beli orang desa gak beli bro sayur bayam sayur kangkung beras tomat timun pepaya pisang ayam telur ikan gak beli bro beda orang kota beli bro jafi susah bro orang desa orang tinggalnya perkotaan bro lucu ribu bro,2025-04-30T14:46:27Z,0,15
Ijasah_ditunjukan_user_31446,luh roy benci mencari kebenaran heters ni orang orang ular kayak nya,2025-04-30T14:45:51Z,0,15
Ijasah_ditunjukan_user_31458,kaya suryo cs orang berpendidikan gaya recehan orang yng pendidikan gugat izasah jokowi gitu kaya nuansa sakit hati cari yng kekisruhan masyarakat yng akur akur,2025-04-30T14:45:25Z,0,15
Ijasah_ditunjukan_user_31488,mengurus negara mengurus ijazah orang pemerintah ngga becus salah bertele,2025-04-30T14:44:04Z,0,15
Ijasah_ditunjukan_user_31524,kedepan ketidaksukaan orang orang kekuasaan jokowi kekuasaan jokowi keluarga jokowi waper bobi nasution menantunya pejabat negara orang orang takut roy suryo orang orang suruhan membuka pensiunan jendral menunjukan mad gibran ketidaksukaan kekuasaan jokowi,2025-04-30T14:43:04Z,0,15
Ijasah_ditunjukan_user_31574,roi panci rismon balon orang usil banget parut sumbat penjara biar kapok,2025-04-30T14:41:34Z,0,15
Ijasah_ditunjukan_user_31637,orang orang plus roy panci,2025-04-30T14:39:00Z,0,15
Ijasah_ditunjukan_user_31699,menurutku manusia kekurangan suka mencari kesalahan orang,2025-04-30T14:37:21Z,0,15
Ijasah_ditunjukan_user_31671,orang salah cenderung berbelit,2025-04-30T14:37:05Z,0,15
