author,text,published_at,like_count,cluster
Ijasah_ditunjukan_user_1657,kuliah membiayayai tp ijasah orang gila sakit hati,2025-05-11T16:07:03Z,0,15
Ijasah_ditunjukan_user_1668,orang gak tau malu roy suryo sdah fitnah orang kuar blang izajah palsu tpi laporkn panik,2025-05-11T15:28:36Z,0,15
Ijasah_ditunjukan_user_1688,den bagus e panci roi suryo iri jokowi kalah jokowi orang jawa orang ningkrat roi suryo teravilias baalawi,2025-05-11T13:33:56Z,0,15
Ijasah_ditunjukan_user_1721,hakmu rs lihat ijasah orang,2025-05-11T10:24:49Z,0,15
Ijasah_ditunjukan_user_1736,ya alloh jd orang ngeyel mmg cari suka onar semoga orang orang salah terbalaskan perbuatannya,2025-05-11T09:09:01Z,0,15
Ijasah_ditunjukan_user_1736,kalo sy jd p jokowi ijazah nya asli ngapain ngeladeni orang orang yg tdk berkepentingan tp sabarsabarnya orang jg marah,2025-05-11T08:42:14Z,0,15
Ijasah_ditunjukan_user_1736,orang yg suka onar semoga balasannya,2025-05-11T08:34:56Z,0,15
Ijasah_ditunjukan_user_1747,gak tau malu d masukin orang orang gituh bos,2025-05-11T07:45:29Z,0,15
Ijasah_ditunjukan_user_1812,elu salah roy panci mencemarkan nama orang memfitnah orang menerus,2025-05-11T01:39:34Z,0,15
Ijasah_ditunjukan_user_1826,penyelelidik menunjukan keaslian ijasahnya ketiga orang tdk penjarakan,2025-05-10T23:47:33Z,1,15
Ijasah_ditunjukan_user_1847,orang mencari cari celah kesalahan orang hemat sayabegitu hubung hubungi tindak pidana mas surya bijak niatnya mulia menjaga negara ya kesinambungan,2025-05-10T17:35:06Z,0,15
Ijasah_ditunjukan_user_1863,orang yg suka cengengesan hobi berbohong biar masuk sel rada eror otaknya,2025-05-10T16:30:30Z,0,15
Ijasah_ditunjukan_user_1895,uda gini menyalakan jokowi fitnah orang belajar sel biar nda songong,2025-05-10T14:02:29Z,0,15
Ijasah_ditunjukan_user_1907,roy suryo orang kerjaan ngapain ngurusin ijasah orang emang dirimu udah bener,2025-05-10T13:23:29Z,0,15
Ijasah_ditunjukan_user_1921,teman teman roy tunggu momen tunggu kekuatan orang orang jokowi bersih kekuasaan barulah ajukan laporkan,2025-05-10T12:32:48Z,0,15
Ijasah_ditunjukan_user_1934,nggak kayak gini ilmunya orang orang pinter nggak kepakek percumah kuliah ilmunya nganggor,2025-05-10T11:16:03Z,0,15
Ijasah_ditunjukan_user_1944,tunjukkan ijazah asli darimana orang tdk kuliah ugm manusia aneh orang berbuat kedzoliman dibela dilindungi,2025-05-10T10:45:03Z,0,15
Ijasah_ditunjukan_user_1988,semangat roy semoga الله orang orang penegak hukum jujurlah negara mari bantu president prabowo subianto membangun negara pemerintahannya pendidikannya kekayaannya utama kuasai lahan pulau tambang tambang coba dikuasai penduduk asing,2025-05-10T07:26:28Z,0,15
Ijasah_ditunjukan_user_1989,jalan jokowi cepak jokowi dah diam tenang membiarkan orang nyinyir fitnah cemo ohan ne da roy gk klo mantang presiden penjarakan orang efek jerah masyarakat yg gk tau orang jokowi,2025-05-10T07:13:29Z,0,15
Ijasah_ditunjukan_user_2023,penelitian ilmiah menjelek an orang penelitian ilmiah membantu masyarakat,2025-05-10T04:57:40Z,0,15
Ijasah_ditunjukan_user_2025,orang sok pintar salah jalan urusin keluarga yg ngurusi orang,2025-05-10T04:42:06Z,0,15
Ijasah_ditunjukan_user_2030,udah penjarahan aja roy edan bikin ngadu domba orang,2025-05-10T04:33:37Z,0,15
Ijasah_ditunjukan_user_2034,o berati orang menyebabkan orang indonesia menguasai element kerja avatar,2025-05-10T04:27:19Z,0,15
Ijasah_ditunjukan_user_2045,orang salah seleh,2025-05-10T03:32:31Z,0,15
Ijasah_ditunjukan_user_2047,jokowi orang bsik sabar,2025-05-10T03:20:09Z,0,15
Ijasah_ditunjukan_user_2053,ko hak usut orang ijasah jgn roy suryo yg palsu,2025-05-10T03:12:03Z,0,15
Ijasah_ditunjukan_user_2054,senang banget orang yg meren dah bpk kowi tindak sampe tuntas roy panci krunya,2025-05-10T03:09:54Z,0,15
Ijasah_ditunjukan_user_2065,ugm tuntut baliklah orang,2025-05-10T02:28:49Z,0,15
Ijasah_ditunjukan_user_2069,orang gila alias manusia dajjal streess bodoh dungu ijazah jokowi palsu,2025-05-10T02:06:57Z,0,15
Ijasah_ditunjukan_user_2154,mampus loe gara ngurusin ijazah orang penjara loe panji,2025-05-09T16:02:23Z,0,15
Ijasah_ditunjukan_user_2173,ngapain ngurusin ijasah orang ngak penyakit hati kronis,2025-05-09T14:30:20Z,0,15
Ijasah_ditunjukan_user_2193,ugm berhobong roy resmon tava orang otak,2025-05-09T13:29:07Z,0,15
Ijasah_ditunjukan_user_2206,dasar orang bacot,2025-05-09T12:32:01Z,0,15
Ijasah_ditunjukan_user_2207,semoga cepat masuk penjara orang omong penyebar fitnah pembenci jokowi,2025-05-09T12:28:31Z,1,15
Ijasah_ditunjukan_user_2210,orang bodo mas roy,2025-05-09T12:18:30Z,0,15
Ijasah_ditunjukan_user_2212,jgn membenci orang sengaj mencemarkan orang,2025-05-09T11:56:26Z,0,15
Ijasah_ditunjukan_user_2219,orang orang menghambat kemajuan negara presiden prabowo layani grup sakit hati klompotanya anis b,2025-05-09T11:54:51Z,0,15
Ijasah_ditunjukan_user_2239,tindakan jokowi urus pribadinya orang hak orang tunjukkin ijazahnya orang,2025-05-09T10:39:07Z,0,15
Ijasah_ditunjukan_user_2247,roy suriyo orang munafik orang orang habisi aja,2025-05-09T09:46:23Z,0,15
Ijasah_ditunjukan_user_2253,orang yg cerdas yg rumit disederhanakan roy suryo cs orang tolol yg sederhana remeh temeh rumit mulyono cs,2025-05-09T09:25:04Z,0,15
Ijasah_ditunjukan_user_2286,orang roy suryo psikologisnya sehat gerakannya kasar srampangan ga mencerminkan orang berpendidikan orang jawa bilang ora duwe unggah ungguh mulutnya lamis banget mental banci,2025-05-09T07:20:46Z,0,15
Ijasah_ditunjukan_user_2299,dipenjarakan tujuanya mendidik orang orang yg adab suryo cs pekaharan enak udelnya menghina memfitnah orang,2025-05-09T06:52:20Z,0,15
Ijasah_ditunjukan_user_2310,roy suryo orang aneh mencari cari kesalahan orang,2025-05-09T05:50:15Z,0,15
Ijasah_ditunjukan_user_2313,penyiyiir ijazah palsu p jokowi orang pintar bodoh,2025-05-09T05:43:43Z,0,15
Ijasah_ditunjukan_user_2315,masyarakat tdk suka orang mencari panggung menfitnah gaduh nkri,2025-05-09T05:38:58Z,0,15
Ijasah_ditunjukan_user_2335,rs slalu mencari cari kesalahan orang menganggap,2025-05-09T04:33:16Z,0,15
Ijasah_ditunjukan_user_2362,udah penjarakan orang,2025-05-09T03:20:09Z,0,15
Ijasah_ditunjukan_user_2367,nga malu roy ngejar ngejar ijazah orang,2025-05-09T03:09:59Z,0,15
Ijasah_ditunjukan_user_2422,ngapain nunjukin ijasah kekelompok manusia bus k hak loe kepengen lihat ijasah orang,2025-05-08T21:32:44Z,0,15
Ijasah_ditunjukan_user_2423,pintar tapisayangsenang hujat mencari kesalahan orang laen,2025-05-08T21:14:11Z,0,15
Ijasah_ditunjukan_user_2433,setujuuuu ijasah asli penjarakan orang,2025-05-08T19:23:51Z,0,15
Ijasah_ditunjukan_user_2465,roy suryo cs orang pintar tpi cuman pintar bodohi orang,2025-05-08T16:12:16Z,0,15
Ijasah_ditunjukan_user_2471,saudara gugat presiden orang tindaki,2025-05-08T15:48:39Z,0,15
Ijasah_ditunjukan_user_2489,urus roy urus aja ga bener mgurus orang negara butuh orang yg berpikir kerjanya nyinyir,2025-05-08T14:58:47Z,0,15
Ijasah_ditunjukan_user_2515,orang takut penjara maknya urusin ijasah orang urusin aja keluarga mu look report aja,2025-05-08T13:19:23Z,0,15
Ijasah_ditunjukan_user_2566,kalo ijazah jokowi asli trus bagimana orang iri hati orang ganggu,2025-05-08T10:23:44Z,0,15
Ijasah_ditunjukan_user_2586,indonesia kejam presiden mantan diadili rakyatnya yg sdh kebenaran nya sungguh barisan orang sakit hati orang terlaknat tunggu aja roy panci kebinasaan mu tipa tipu dll,2025-05-08T08:29:07Z,0,15
Ijasah_ditunjukan_user_2611,roy surso nya maaf nantangin pake dalil mantan presiden pidanakan orang orang basmi km yg hrs bertanggung trhdp org yg kena imbasnya krn ulah mu,2025-05-08T05:56:23Z,0,15
Ijasah_ditunjukan_user_2630,loohh gilaa looh streess royy dkk hak looh ijazah orang rasain cpt masuk sel roy dkk dalil lohh roy cs bersalah interpensi hak pribadi orang,2025-05-08T04:26:39Z,0,15
Ijasah_ditunjukan_user_2634,buatku untungnya si ngurusin ijasah orang urusin kehidupan lingkungan,2025-05-08T04:23:26Z,0,15
Ijasah_ditunjukan_user_2637,pidanakan orang jahat masiarakat tdk tega lihat yg mencemarkan nama jokowi,2025-05-08T03:38:22Z,0,15
Ijasah_ditunjukan_user_2642,mampos lo roy penjara suka fitnah orang,2025-05-08T03:10:14Z,0,15
Ijasah_ditunjukan_user_2664,konsekuensi orang yg memperkarakan orang yg perkarakan membuktikan sah mengguggat orang tsbt ga lebay orang terlapor hadapi prosesnya ga teori dl jokowi memperkarakan mrk pakde joko msh menjabat presiden skrg sdh ga menjabat ya sikat,2025-05-08T01:28:08Z,0,15
Ijasah_ditunjukan_user_2693,asli tolong hukum orang seumur hidup keluarkan penjara karna orang kepintarannya nga pake kebaikan pake untu menghancurkan lebi manusia yg,2025-05-07T23:34:02Z,0,15
Ijasah_ditunjukan_user_2700,gak blas cuman orang penghasut indonesia pecah orang gila berita gk blas coook,2025-05-07T23:11:08Z,0,15
Ijasah_ditunjukan_user_2703,masarakat biar kapok bacot golongan orang pea,2025-05-07T23:04:54Z,0,15
Ijasah_ditunjukan_user_2716,orang songong jokowi perusak negara dijebloskan,2025-05-07T22:24:32Z,0,15
Ijasah_ditunjukan_user_2732,roi jngan cari kesalahan orang,2025-05-07T21:02:01Z,0,15
Ijasah_ditunjukan_user_2749,mangkanya cari kesalahan orang,2025-05-07T19:09:12Z,0,15
Ijasah_ditunjukan_user_2797,jabatan orang si pengin tau banget status orang mencari cari kesalahan orang,2025-05-07T16:27:06Z,1,15
Ijasah_ditunjukan_user_2801,yah mengusik ketenangan merugikan individu pelanggaran terbukti keaslian tuntutan terima konsekuensinya pelaku berdalih yah palingan masyarakat menilai mantan presiden memenjarakan rakyatnya leh inikan pernyataan orang bodoh sadar tuntutan orang,2025-05-07T16:21:56Z,0,15
Ijasah_ditunjukan_user_2803,masarakat menilai orang mempunya sifat kedengkian mencari cari kesalahan orang sifat berhati santun ayoo pengadilan menentukan perkara siap²,2025-05-07T16:21:17Z,0,15
Ijasah_ditunjukan_user_2816,pencemaran nama orang klau gara gara ijasah mepenjara kn orang nya,2025-05-07T16:09:39Z,0,15
Ijasah_ditunjukan_user_2818,bpk jokowi orang mas,2025-05-07T16:08:28Z,2,15
Ijasah_ditunjukan_user_2818,masyarakat senang klo orang penyerbar isu bohong wajib d adili,2025-05-07T16:05:31Z,0,15
Ijasah_ditunjukan_user_2821,orang yg menghargai karya orang laen tanda orang yg mengkoreksi,2025-05-07T16:02:10Z,0,15
Ijasah_ditunjukan_user_2831,dukung orang yg berani jujur,2025-05-07T15:47:01Z,1,15
Ijasah_ditunjukan_user_2838,ngapain lo ngurusin ijazahnya orang pk jokowi selesai tugasnya ketahuan si roy busuk hatinya si roy kawan menanggung akibatnya ngapain lo ngurusin ijazah orang orang mantan presiden aneh bin sinting,2025-05-07T15:31:02Z,0,15
Ijasah_ditunjukan_user_2899,orang bodoh jokowi mempidanakan ibuk mulut ibuk adab rs cari selamat,2025-05-07T14:39:00Z,0,15
Ijasah_ditunjukan_user_2933,kewajiban jokowi tunjukkan ijazahnya pd waras orang orang yg tunjukkan asli,2025-05-07T14:13:17Z,0,15
Ijasah_ditunjukan_user_2936,orang biila kebencian cari kesalahan meskipon ijasah tunjukan buta hati,2025-05-07T14:12:50Z,0,15
Ijasah_ditunjukan_user_2941,kebohongan menang mata manusia kebenaran menang mata allah orang yg memiliki kecerdasan menilai,2025-05-07T14:00:46Z,9,15
Ijasah_ditunjukan_user_2947,orang sakit gati,2025-05-07T14:00:19Z,0,15
Ijasah_ditunjukan_user_2962,titel syarat presiden muslim allah jokowi salah satunya orang indonesia baiknya buruknya terbukti jokowi panggil masuk kedalam ka bah gak mumkin orang jahat panggil masuk ka bah orang tertutup mata hatinya fitnah jokowi pki,2025-05-07T13:52:42Z,0,15
Ijasah_ditunjukan_user_2953,lumayan penjara terbuka orang suka menjelekkan orang allah swt maha tau terimalah akibatnya,2025-05-07T13:50:20Z,0,15
Ijasah_ditunjukan_user_2965,orang penuh kedengkian akal untungnya mencari cari kesalahan orang sekses semoga busuk dipenjara,2025-05-07T13:50:12Z,0,15
Ijasah_ditunjukan_user_2980,konoha orang pinter omng doank sekolah g jaminan pintar lahir batin susah d negara konoha,2025-05-07T13:34:16Z,0,15
Ijasah_ditunjukan_user_2987,coba ajah klu orang berbohong hukuman allah hati bang,2025-05-07T13:26:47Z,0,15
Ijasah_ditunjukan_user_3009,gayanya roy kayak orang berani hatinya panik,2025-05-07T12:58:57Z,0,15
Ijasah_ditunjukan_user_3027,orang reseh cari cari kesalahan,2025-05-07T12:36:14Z,0,15
Ijasah_ditunjukan_user_3051,nggak hak lihat ijazah orang kecuali yg mempekerjakan,2025-05-07T11:54:24Z,0,15
Ijasah_ditunjukan_user_3083,urusanmu ijasa orang,2025-05-07T11:23:50Z,0,15
Ijasah_ditunjukan_user_3093,ya orang beriman suka membuka aib orang sll mencari cari kesalahan orang sungguh memuakkan ktnya orang yg berpendidikan prof dr bermental pengecut iri dengki berhati busuk,2025-05-07T11:13:08Z,0,15
Ijasah_ditunjukan_user_3102,penjara aja tu roe suryo kawanya waras tu orang sok pinter orang percaya omonganya pingin viral tu tobat kao kalo penjara merengek coba aja tu kapok lulusan sd aja tau omongan mu bener tauu,2025-05-07T10:54:33Z,0,15
Ijasah_ditunjukan_user_3155,mulutnya warga negara dilindungi hukum harkat martabatnya harga suka merendahkan menyepeleksn orang suka mengorek ngorek borok orang boroknya,2025-05-07T09:55:31Z,0,15
Ijasah_ditunjukan_user_3166,ijazahnya asli ywdh tanggung akibatnya orang,2025-05-07T09:42:40Z,0,15
Ijasah_ditunjukan_user_3185,orang orang model roy suryo model manusia provokator kalo memenuhi syarat langsung dintahan polisi biar gak ribut kemana,2025-05-07T09:19:42Z,0,15
Ijasah_ditunjukan_user_3205,gampang banget ijazah daratan tinggal diuji selesai asli ato palsu sulit banget nyari jenazah tenggelam samodra luas trus bilang lho mata hukum kalo ya tengok dasar negara dimata tuhan kaya miskin pejabat rakyat orang cakep orang cakep,2025-05-07T08:53:43Z,0,15
Ijasah_ditunjukan_user_3212,orang berbohong keterangannya berbelit belit mencari kebohongan menutupinya gas pool mas roy,2025-05-07T08:42:19Z,0,15
Ijasah_ditunjukan_user_3214,sibuk ngurusin orang kapok kau,2025-05-07T08:37:24Z,0,15
Ijasah_ditunjukan_user_3243,kelompok orang mabuk lem panci,2025-05-07T08:03:47Z,0,15
Ijasah_ditunjukan_user_3268,roy orang indonesia tdk hapal lagu indonesia raya cendikiawan pedagang kelontong,2025-05-07T07:30:16Z,0,15
Ijasah_ditunjukan_user_3279,ibuk ibuk mulutnya kayak jelek jelekin orang jokowi jelek jelekin teros kalok dilawan masi menyalakan jokowi otak gak dasar orang goblok sok pintar suryo malu kalok masi normal kecuali sudahgila,2025-05-07T06:56:24Z,0,15
Ijasah_ditunjukan_user_3293,masakat menilei emang roi panci dr tifa dn kawan orang gila,2025-05-07T06:55:17Z,0,15
Ijasah_ditunjukan_user_3304,orang orang iri jokowi dengar manusia² yg masuk akal,2025-05-07T06:39:29Z,0,15
Ijasah_ditunjukan_user_3317,kelas codot pantes penjarakan orang cari panggung,2025-05-07T06:21:12Z,0,15
Ijasah_ditunjukan_user_3344,riosuryo menggagu orang menggusi orang ajah kenah hukuman apah menuduh ituh bisah hukum,2025-05-07T05:44:12Z,0,15
Ijasah_ditunjukan_user_3355,kandangin ajah seumur hidup jgn kasih ampun orang orang sampah ga pungsi idup hukum mati,2025-05-07T05:32:03Z,0,15
Ijasah_ditunjukan_user_3381,bagus buka pengadilan orang hatinya busuk penjelasan apapun menambah kebisukannya,2025-05-07T05:03:55Z,0,15
Ijasah_ditunjukan_user_3395,roi surya pembikin kisruh negara orang patut contoh,2025-05-07T04:51:11Z,0,15
Ijasah_ditunjukan_user_3379,bagus lanjutkan tintas jokowi biar dikemudian orang dgn mudah menuduh mengoreksi prifasi ijsah,2025-05-07T04:48:23Z,0,15
Ijasah_ditunjukan_user_3399,narasi yg diangkat orang menduga ijazah palsu orang pinter keblinger,2025-05-07T04:45:12Z,0,15
Ijasah_ditunjukan_user_3425,yg gw heran ya aja orang orang yg mempermasalahkan ijazahnya jokowi berani gak tuh mantan presiden nya,2025-05-07T04:18:16Z,0,15
Ijasah_ditunjukan_user_3445,ijasah orang km roiy pangci,2025-05-07T03:32:32Z,0,15
Ijasah_ditunjukan_user_3445,roy ngomong afa si orang salah ngomongnya ngair,2025-05-07T03:25:08Z,0,15
Ijasah_ditunjukan_user_3475,hak saudara memeriksa ijajah orang emangnya lu,2025-05-07T02:45:28Z,0,15
Ijasah_ditunjukan_user_3486,ga kerjaan coba aja wacana kiat yg menopang kemajuan negara amati perbuatan orang antipati jokowi kemana,2025-05-07T02:29:18Z,0,15
Ijasah_ditunjukan_user_3498,permainan anak jujur berbohong menuduh orang,2025-05-07T02:05:36Z,0,15
Ijasah_ditunjukan_user_3516,memfitnah jokowi izazah palsu orang memfitnah silahkan penjarahkan,2025-05-07T01:24:56Z,0,15
Ijasah_ditunjukan_user_3518,menuntut orang menuduh,2025-05-07T01:22:44Z,0,15
Ijasah_ditunjukan_user_3540,pakar bertele tele mati kutu kejeniusan jokowi orang orang bodoh goblok percaya omongan pembenci jokowi sadar maaf beliau roy suryo dkk pakar abal abal pakar memutar balikan fakta,2025-05-07T00:29:18Z,0,15
Ijasah_ditunjukan_user_3553,bodoh ngomen cuman koar denger ni namanya menanggapi elegan jokowi pikiran selangkah maju orang bodoh beliau memikirkan bertindak kaya orang bodoh berfikir,2025-05-06T23:49:11Z,1,15
Ijasah_ditunjukan_user_3565,semoga orang tolol masuk penjara,2025-05-06T23:06:26Z,0,15
Ijasah_ditunjukan_user_3591,ngapain rs ngurus ijazah orang,2025-05-06T21:44:18Z,0,15
Ijasah_ditunjukan_user_3600,orang yg pande nyari kekeliruan orang pintar mikir salah arah,2025-05-06T20:42:03Z,0,15
Ijasah_ditunjukan_user_3617,nyari kesalahan orang mendingan tuh cari org yg korupsi smoga kebenaran cpt terungkap,2025-05-06T19:32:27Z,0,15
Ijasah_ditunjukan_user_3620,orang yg gaduh negara makan umpan tinggal jebloskan penjara beda orba orang tinggal culik buang,2025-05-06T19:28:39Z,0,15
Ijasah_ditunjukan_user_3666,wajar orang dihina bacot,2025-05-06T17:06:54Z,0,15
Ijasah_ditunjukan_user_3683,gambar orang pandai,2025-05-06T16:28:47Z,0,15
Ijasah_ditunjukan_user_3685,orang senyumnya pembohong percaya smiling aslinya orang,2025-05-06T16:26:15Z,0,15
Ijasah_ditunjukan_user_3686,benci jokowi orang sakit hati sakit jiwa abnormal,2025-05-06T16:17:26Z,0,15
Ijasah_ditunjukan_user_3710,roy suryo coba brpikir cerdas apkh orang nyalon presiden nekat mnggunkn ijasah palsu sy tdk mngkin jngnkn nyalon presiden lamar kerja orang tuh mikir,2025-05-06T15:31:55Z,0,15
Ijasah_ditunjukan_user_3705,orang munafik berbicara membolak balikan fakta mengambing hitamkan orang orang ketakutan perbuatan fitnah nada bicaranya udah ketauan,2025-05-06T15:31:36Z,0,15
Ijasah_ditunjukan_user_3715,politik jokowi diakui politik abal abal orang pendengki mencari boroknya orang boroknya sendirilah pembenci parah,2025-05-06T15:21:51Z,0,15
Ijasah_ditunjukan_user_3715,politik jokowi diakui politik abal abal orang pendengki mencari boroknya orang boroknya sendirilah pembenci parah,2025-05-06T15:21:18Z,0,15
Ijasah_ditunjukan_user_3721,logikanya om rs orang no sembarangan ijazah hadehh,2025-05-06T15:15:50Z,0,15
Ijasah_ditunjukan_user_3731,biasalah ngelak bohong rekaman pertemuan ugm indonesia raya dengar nonton ugm nantang orang orang ngadukan ugm eeee bacotnya intelek pembohong,2025-05-06T15:07:47Z,0,15
Ijasah_ditunjukan_user_3735,jgn mencari cari kesalahan orang,2025-05-06T14:59:26Z,0,15
Ijasah_ditunjukan_user_3745,orang dosen ugm emang jokowi kuliah disana lg semoga aja suryo cs dpt ganjaran krn kebenaran menang,2025-05-06T14:34:16Z,0,15
Ijasah_ditunjukan_user_3763,gini ngributin ijazah nggak kerjaan orang masuk pns aja selesi ketat,2025-05-06T14:16:34Z,0,15
Ijasah_ditunjukan_user_3769,sekedar ijazah jokowi melawan orang orang membencinya dianggap jokowi orang orang jokowi melaporkan orang polisi,2025-05-06T14:09:49Z,5,15
Ijasah_ditunjukan_user_3773,kapok orang suka urusin pribadi orang,2025-05-06T14:07:42Z,0,15
Ijasah_ditunjukan_user_3785,orang setres jokowi gubris roisuryo dn kawn barisan skthati hati,2025-05-06T13:52:59Z,0,15
Ijasah_ditunjukan_user_3794,roy cs tu setressss diperkaran yalahkan orang,2025-05-06T13:40:30Z,0,15
Ijasah_ditunjukan_user_3800,menilai kalok jokowi orangnya disukai orang yg iri,2025-05-06T13:35:01Z,0,15
Ijasah_ditunjukan_user_3850,roy rismon orang pinter bodoh,2025-05-06T12:31:26Z,0,15
Ijasah_ditunjukan_user_3852,indonesia ga maju sepele perpanjang bikin hambat perjalanan negara orang pakai,2025-05-06T12:18:05Z,0,15
Ijasah_ditunjukan_user_3864,kacau otak roy suryo dkk orang dulunya kuliah bayarnya pakai uang haram kali ya pikiran negatif orang tujuan kedepannya ku usulkan uji aja perilaku mu uji dana kuliahmu shg pikiran dajal gitu,2025-05-06T12:06:40Z,0,15
Ijasah_ditunjukan_user_3877,orang pintar bermoral,2025-05-06T11:59:50Z,0,15
Ijasah_ditunjukan_user_3900,mas roy suryo jgn mas menghambat orang koruptor karna orang koruptor jd hilang karna izasa palsu yg tdk untung negara,2025-05-06T11:36:28Z,0,15
Ijasah_ditunjukan_user_3823,orang yg ngurus ijasah jokowi palsu orang ga ker jaan ijasah sd orang kerna kerna ijasah otak ki nerja,2025-05-06T10:52:52Z,0,15
Ijasah_ditunjukan_user_3955,juta persen dukung pa jokowi penjarakan orang tukang fitnah biar kapo,2025-05-06T09:51:11Z,1,15
Ijasah_ditunjukan_user_3978,rakyat udah menilai yg yg bicara orang gk berguna crocos mlulu mulutnya kaya orang bener,2025-05-06T09:16:28Z,0,15
Ijasah_ditunjukan_user_3979,ijasah asli ugm milik jokowi kepunya an orang,2025-05-06T09:16:08Z,0,15
Ijasah_ditunjukan_user_3984,anak buah dajjal mah bebas pitnah mencari cari kesalahan orang,2025-05-06T09:08:26Z,0,15
Ijasah_ditunjukan_user_3990,orang hatinya dirasuki iblis aja men cari kesalahan orang muak lihat,2025-05-06T08:58:55Z,0,15
Ijasah_ditunjukan_user_3993,salah lo mencari kesalahan orang,2025-05-06T08:51:27Z,0,15
Ijasah_ditunjukan_user_4044,giriing joko orang suka fitnah laki perempuan ngeles payah,2025-05-06T07:06:10Z,0,15
Ijasah_ditunjukan_user_4063,pelajaran hukum seumur hidup ijaza jokowidodo asli rakyat indonesia penlaran orang orang yg sok tau orang model wajib tindak tdk tdk orang orang sok dolan solusinya si roy antek anteknya,2025-05-06T06:31:33Z,0,15
Ijasah_ditunjukan_user_4051,roi suryo sopan halus memelas orang pandai menggolah,2025-05-06T06:26:04Z,0,15
Ijasah_ditunjukan_user_4096,orang orang kerja an nuduh nuduh ijazah palsu gampang su udzon otak nya kayaknya membenci,2025-05-06T05:32:38Z,0,15
Ijasah_ditunjukan_user_4127,ribet roy suryo hidupnya mencari kesalahan orang dosa karma,2025-05-06T04:21:39Z,0,15
Ijasah_ditunjukan_user_4139,mencari cari kesalahan jokowi orang yg ga berfikir maju,2025-05-06T04:02:22Z,0,15
Ijasah_ditunjukan_user_4146,ibuk ibuk yg orang sekarat salah yo salah,2025-05-06T03:46:14Z,0,15
Ijasah_ditunjukan_user_4159,he roy suryo kamuitu milutmu ndak bgomong kaya anak kamuharus pidanakan biarmulutmu ndak ngoceh mulutmuadalah harimaumu biarkamu tau lo rasainlo kamuitu orang pintar tpsok pintar yakalo tunjukan mulutmu palengkamu cari kesalahan laen dasar mulut ba ngor ngapainkamu cari kesalahan orang laen dasar mulut setan,2025-05-06T03:27:21Z,0,15
Ijasah_ditunjukan_user_4156,ahli ngurusin orang,2025-05-06T03:26:30Z,0,15
Ijasah_ditunjukan_user_4200,roy orang tida kerja an,2025-05-06T01:58:50Z,0,15
Ijasah_ditunjukan_user_4206,orang hati busuk,2025-05-06T01:47:20Z,0,15
Ijasah_ditunjukan_user_4209,pk jokowi laporkan polisi orang polda menghujat orang,2025-05-06T01:39:57Z,0,15
Ijasah_ditunjukan_user_4213,jokowi laparkan orang orang bilang jokowi ijasah palsu makasi,2025-05-06T01:32:46Z,0,15
Ijasah_ditunjukan_user_4239,mencemarkan nama sese orang kerana hukum suka sukanya menghina orang resah masyarakyat orang presiden berbuat kemajuan negara,2025-05-06T00:44:39Z,0,15
Ijasah_ditunjukan_user_4257,langkah jokowi orang gaduh kasih pelajaran,2025-05-06T00:10:43Z,1,15
Ijasah_ditunjukan_user_4264,orang sebenarxa sih,2025-05-05T23:54:02Z,0,15
Ijasah_ditunjukan_user_4282,pakde jkwi enaknya melaporkan orang kl mmang tunjukan,2025-05-05T23:14:53Z,0,15
Ijasah_ditunjukan_user_4288,masyarakat menilai roy suryo dkk kumpulan orang orang sakit,2025-05-05T23:01:04Z,0,15
Ijasah_ditunjukan_user_4297,ditunjukin roy suryo kapasitasnya urusannya kpu polisi orang nanya random pejabat manapun kalo orang nanya ditunjukin nanya kyk gk urusan aja roy suryo ngerepotin orang aja,2025-05-05T22:38:10Z,0,15
Ijasah_ditunjukan_user_4301,orang tau,2025-05-05T22:25:59Z,0,15
Ijasah_ditunjukan_user_4314,halah ngapain sibuk usil ngurusi ijazah orang,2025-05-05T21:20:04Z,0,15
Ijasah_ditunjukan_user_4317,elo pingin tau ijazah orang lha nya jg ngapain jg ngurusi ijazah orang urusi rumah tangga,2025-05-05T21:04:11Z,0,15
Ijasah_ditunjukan_user_4341,masuk in aja nusakambangan pembuat gaduh negri gerombolan orang orang sakit hati yg masyarakat konyol m ngatas namakan rakyat kau roy kmn walikota sampe presiden ndak proses,2025-05-05T19:18:56Z,0,15
Ijasah_ditunjukan_user_4352,ngeless bae royyy penjarakan orang pesakitan bikin ruwet,2025-05-05T18:46:35Z,0,15
Ijasah_ditunjukan_user_4365,negara bodoh menjadikan presiden kagak pendidikan orang orang yg melapor d tangkap d penjarakan yg dalangnya d baca dalang,2025-05-05T18:12:37Z,0,15
Ijasah_ditunjukan_user_4376,resiko akibatnya asli palsu ngak hak mengurusi ijazah orang motivasinya mencari cari kesalahan orang,2025-05-05T18:05:54Z,0,15
Ijasah_ditunjukan_user_4409,barisan sakit hati cari cari kesalahan orang,2025-05-05T16:39:12Z,0,15
Ijasah_ditunjukan_user_4425,maksa orang nunjukin ijazahnya emg hak km yo,2025-05-05T16:04:58Z,0,15
Ijasah_ditunjukan_user_4426,dengar roy surya ngaco orang panik seakan ketahuan berbohong mencari dukungan rakyat indonesia sifat orang pembenci yg pintar memuatar balikkan fakta,2025-05-05T16:03:53Z,0,15
Ijasah_ditunjukan_user_4428,tau orang yg bnyak ngomong ketar ketir,2025-05-05T15:59:35Z,0,15
Ijasah_ditunjukan_user_4441,orang begok udah pemimpin identitas grombolan sakit hati,2025-05-05T15:50:11Z,0,15
Ijasah_ditunjukan_user_4474,orang yg nuduh ijazah palsu orang yg bermasalah negara,2025-05-05T15:17:34Z,0,15
Ijasah_ditunjukan_user_4504,pantaslah orang masuk penjara bikin onar madyarakat dengar ocehan,2025-05-05T14:40:19Z,0,15
Ijasah_ditunjukan_user_4523,dipidanakan orang bikin biyar ter ulang epek jera,2025-05-05T14:15:10Z,0,15
Ijasah_ditunjukan_user_4553,biar orang keliatan pinter ga bermutu,2025-05-05T14:03:24Z,0,15
Ijasah_ditunjukan_user_4570,orang pandai bilang,2025-05-05T13:46:36Z,0,15
Ijasah_ditunjukan_user_4577,cari kesalahan orang sja mcm sja,2025-05-05T13:40:23Z,0,15
Ijasah_ditunjukan_user_4584,tujuan roy pembuktian ijazah orang,2025-05-05T13:35:30Z,0,15
