author,text,published_at,like_count,cluster
debat_tv_one_user_7739,tdk tunjukan ijazah asli rakyat curiga kebohongan kepalsuan peresiden buruk mulyono,2025-04-24T17:50:44Z,0,15
debat_tv_one_user_7700,fokus adili mulyono,2025-04-24T17:49:23Z,0,15
debat_tv_one_user_7785,ternak peliharaan mulyono beraksi sesuai dgn arahan induk nya,2025-04-24T17:41:55Z,0,15
debat_tv_one_user_7849,roy suryo maju lawan rezim mulyono,2025-04-24T17:24:15Z,0,15
debat_tv_one_user_7737,gw baca komen ko ga pendukung mulyono,2025-04-24T17:24:09Z,0,15
debat_tv_one_user_7860,bermutu undang jongos mulyono ilc omongannya nggak berbobot,2025-04-24T17:22:17Z,0,15
debat_tv_one_user_7884,kelimpungan ternak mulyono,2025-04-24T17:15:37Z,0,15
debat_tv_one_user_7885,anak buahnya mulyono tukang ngibul,2025-04-24T17:15:30Z,1,15
debat_tv_one_user_7896,mulyono negarawan kegaduhan,2025-04-24T17:12:53Z,0,15
debat_tv_one_user_7917,pendukung mulyono ilmian ngimi,2025-04-24T17:05:05Z,0,15
debat_tv_one_user_7984,intinya konoha yg ga gara mulyono,2025-04-24T16:51:45Z,0,15
debat_tv_one_user_8009,orang sinting yg percaya mulyono ternak mulyono,2025-04-24T16:47:13Z,1,15
debat_tv_one_user_8026,yg telanjangi ijasah mulyono yg beredar medsos yg upload kader psi anehan janggalan ijasah yg pegang mulyono terbukti asli lulusan ugm berbeda yg tersebar medsos yg bersalah,2025-04-24T16:43:13Z,0,15
debat_tv_one_user_8053,biarkan buzzer²nya orang² bayaran ternak mulyono jokowi yg mempercayai rakyat muak jokowi pembohong,2025-04-24T16:35:18Z,1,15
debat_tv_one_user_8095,gw si silfester bilang mendesak jokowi buktikan taunya laporkan wkwkwkwk dalang dibalik kriminalisasi kepemimpinan mulyono ah,2025-04-24T16:27:46Z,8,15
debat_tv_one_user_8165,mulyono,2025-04-24T16:11:43Z,0,15
debat_tv_one_user_8201,lapor bareskrim kapolri siapanya mulyono,2025-04-24T16:09:05Z,0,15
debat_tv_one_user_8161,emang mulyono geblek,2025-04-24T16:05:37Z,0,15
debat_tv_one_user_8258,penjilat mulyono g otaknya,2025-04-24T15:58:53Z,1,15
debat_tv_one_user_8277,abisss looo mulyono x,2025-04-24T15:54:05Z,0,15
debat_tv_one_user_8289,ternak mulyono kompak silfester cs,2025-04-24T15:50:55Z,0,15
debat_tv_one_user_8352,mulyono tkng ngibul tp pemujanya mmbela smpe mati n,2025-04-24T15:39:27Z,0,15
debat_tv_one_user_8365,ternak mulyono ga becus omongannya aja ngga becus lari kemana,2025-04-24T15:35:54Z,0,15
debat_tv_one_user_8405,raja catur si mulyono bejat moral etika hancur pion pion ugm,2025-04-24T15:28:27Z,0,15
debat_tv_one_user_8406,pengacara mulyono jd penipu ijazah mulyono prosedurnya sdh proses hukum yg berjalan hakim sdh mengisyaratkan ijazahnya dihadirkan mulyono tdk kunjung menghadirkan ijazahnya dgn alasan,2025-04-24T15:28:20Z,0,15
debat_tv_one_user_8422,mulyono lihat pd menang karna pejabat negeri naungan hutang budi hutang jabatan tersandra mulyono aparatur negara dikuasai mulyono jd sulit menghukum mulyono tp insyallah allah swt tinggal diam ciptaanya kelewat batas tuhan maha berkuasa jd klo allah kekuarga beban negara hancur hancur si plester the real penjilat,2025-04-24T15:26:00Z,0,15
debat_tv_one_user_8425,ngotot bgt membela si mulyono,2025-04-24T15:25:30Z,0,15
debat_tv_one_user_8452,penjarakan si mulyono,2025-04-24T15:19:50Z,1,15
debat_tv_one_user_8459,ngerii lawan tekanan politik parcok pemain hukum preman sakti sih mulyono oportunis,2025-04-24T15:18:57Z,0,15
debat_tv_one_user_8489,beda klw ternak mulyono yg ngomong ngga pake otak ngapain sekolah klw ngga pake bedakan yg yg buruk,2025-04-24T15:14:45Z,0,15
debat_tv_one_user_8528,ternak mulyono dungunya gitu ngotot kedunguan nya koplak,2025-04-24T15:07:50Z,0,15
debat_tv_one_user_8352,la mulyono sndri omongnnya ngalor ngidul msih aja yg mmbela,2025-04-24T15:06:48Z,0,15
debat_tv_one_user_8558,ternak mulyono ngomong oonnya,2025-04-24T15:01:14Z,0,15
debat_tv_one_user_8587,buzer mulyono kepanasan membela kebohongan,2025-04-24T14:57:34Z,0,15
debat_tv_one_user_8603,penjilat mulyono hina hidup nya kebanyakan duit haram,2025-04-24T14:55:04Z,0,15
debat_tv_one_user_8609,ugm universitas genk mulyono ugm begundalnya jokowi,2025-04-24T14:54:20Z,0,15
debat_tv_one_user_8613,ternak mulyono keliatan ndak menguasai perdebatan dl ma rg ternak mulyono gagap gugup keok,2025-04-24T14:53:43Z,0,15
debat_tv_one_user_8567,pembela mulyono bukti argumen narasi,2025-04-24T14:52:30Z,1,15
debat_tv_one_user_8657,liat ternak mulyono malu ssya,2025-04-24T14:46:02Z,0,15
debat_tv_one_user_8666,palsu dgn keyakinan penuh penjarakan mulyono,2025-04-24T14:44:47Z,0,15
debat_tv_one_user_8687,ternak mulyono gk ad malu nya tuh,2025-04-24T14:40:02Z,0,15
debat_tv_one_user_8710,buzzeer buzzer panik ijazah mulyono diungkap keasliannya,2025-04-24T14:37:24Z,0,15
debat_tv_one_user_8656,hati hakimnya uda diatur mulyono,2025-04-24T14:27:27Z,0,15
debat_tv_one_user_8778,ngibul dh kelawatan mulyono heran yg bela sdm rendah,2025-04-24T14:26:19Z,0,15
debat_tv_one_user_8785,backingannya mulyono panik main hp trs mendengar paparan dr roy,2025-04-24T14:25:15Z,0,15
debat_tv_one_user_8662,ternak mulyono ngeri otaknya udh d doktin mulyono,2025-04-24T14:22:34Z,0,15
debat_tv_one_user_8818,kayaknya mulyono kena karma nih,2025-04-24T14:15:53Z,0,15
debat_tv_one_user_7745,kalo memiinta ijazah tunjukkan dipikir pikir yg lihat ijazah koplak berfikirnya bnr rocky contoh anak muda yg membodohi krna membela bela mulyono keluarganya,2025-04-24T14:12:08Z,0,15
debat_tv_one_user_8863,kasihan lihat muka² pendukung mulyono,2025-04-24T14:11:56Z,0,15
debat_tv_one_user_8898,si pratiikxx amankan ijazah si mulyono mrskipun sejuta persen palsu,2025-04-24T14:07:03Z,0,15
debat_tv_one_user_8914,celakalah mulyono institusi golongan org muthafifiin,2025-04-24T14:03:16Z,0,15
debat_tv_one_user_8934,bukti kuat ijazah mulyono terindikasi asli alias palsu kuat dugaan ijazah mulyono palsu kejahatan kriminal bikin gaduh negeri konplik warga penegak hukum memble kroninya penegak hukum wajib memproses hukum bukti kuat sbb nama mulyono lulus sipenmaru fakultas kehutanan ugm foto ijazah mulyono kacamata foto ijazah mulyono sepupunya foto mulyono ijazah kena stempel foto wisuda mulyono asli editan posisi lambang ugm ijazah mulyono beda dgn ijazah lulusan yg ijazah lembar pengesahan skripsi mulyono digital skripsi mulyono tdk tanggal tanda tangan dosen penguji dipertahankan sidang skripsi ejaan nama dosen pembimbing skripsi mulyono salah prof dr ir achmad soemitro prof dr ir achmad sumitro tanda tangan dosen pembimbing skripsi mulyono prof dr ir achmad sumitro berbeda aslinya mulyono lulus kuliah skripsi kasmojo diakui berkali kali olwh mulyono dosen pembimbingnya lembaran ucapan terima kasih kertas lembaran pengesahan beda umur kertas lembar ucapan terima kasih gelar ber ubah² drs ir kkn datanya ugm berani menunjukan ijazah aslinya palsu kejanggalan keanehan kontradiksi yg dihimpun sumber media,2025-04-24T13:58:47Z,0,15
debat_tv_one_user_8938,polisinya tangan mulyono ngimana,2025-04-24T13:57:43Z,0,15
debat_tv_one_user_8968,roy is the best pjuang sjati pmbongkaran kpalsuhan pmbohongan publik ijazah mulyono,2025-04-24T13:52:03Z,1,15
debat_tv_one_user_8983,buzzers mulyono rata² lucu²,2025-04-24T13:49:22Z,0,15
debat_tv_one_user_9031,universitas gank mulyono,2025-04-24T13:41:44Z,0,15
debat_tv_one_user_9051,pengacara membela mulyono menang,2025-04-24T13:39:34Z,0,15
debat_tv_one_user_9089,yg pakai baju batik ternaknya mulyono kali,2025-04-24T13:34:50Z,0,15
debat_tv_one_user_9096,adili mulyono palsu omong karni,2025-04-24T13:33:51Z,0,15
debat_tv_one_user_9120,mulyono kena kau,2025-04-24T13:29:53Z,0,15
debat_tv_one_user_9138,faktanya ijasah sripsi kejanggalan mulyono takut nunjukin ijasah yg kty asli,2025-04-24T13:25:24Z,0,15
debat_tv_one_user_8774,wkwk preseden buruk mulyono d fantung,2025-04-24T13:25:02Z,0,15
debat_tv_one_user_9166,mantap bang roy bang rismon laporkan kebohongan terkuak mulyono malu,2025-04-24T13:19:15Z,0,15
debat_tv_one_user_9179,nara sumber pembela ijazah mulyono terpapar virus p penjilat pembohong penipu penjahat krn moralnya tingkahlakunya yg tdk kejujuran,2025-04-24T13:17:39Z,0,15
debat_tv_one_user_8938,polisinya tangan mulyono ngimana,2025-04-24T13:17:00Z,0,15
debat_tv_one_user_9192,juta rakyat indonesia ditipu mulyono presiden penipu klo ijazah palsu,2025-04-24T13:16:05Z,0,15
debat_tv_one_user_9211,mulyono panikkkk,2025-04-24T13:13:24Z,0,15
debat_tv_one_user_9003,ugm universitas geng mulyono ugm kampus terbaik dongeng alias tipu,2025-04-24T13:13:10Z,0,15
debat_tv_one_user_9233,ternak mulyono kalo ngelantur ya,2025-04-24T13:10:16Z,0,15
debat_tv_one_user_9191,pusing lihat org nya mulyono,2025-04-24T13:08:05Z,0,15
debat_tv_one_user_9256,mulyono bohong mobil smk bohong,2025-04-24T13:06:28Z,0,15
debat_tv_one_user_8352,ternak mulyono,2025-04-24T13:02:13Z,1,15
debat_tv_one_user_9286,ternak mulyono tangkap,2025-04-24T13:00:16Z,0,15
debat_tv_one_user_9256,brantas kecurangn kebohongan mulyono,2025-04-24T12:59:52Z,0,15
debat_tv_one_user_9004,tuntut pembunuhan suhada km pelakunya klo mulyono antek nya semoga terbuka kejahatan yg lakukan rezim dzolim berkuasa,2025-04-24T12:50:43Z,0,15
debat_tv_one_user_9345,susahnya d tunjukan mulyono,2025-04-24T12:47:08Z,0,15
debat_tv_one_user_9384,semoga jd pintu hancur nya genknya mulyono,2025-04-24T12:39:18Z,0,15
debat_tv_one_user_9410,lucu pendukung mulyono ngotot pembenaran tampa data ana lisis,2025-04-24T12:33:18Z,0,15
debat_tv_one_user_9486,tangkap mulyono muly ni lhut perusak negara adili,2025-04-24T12:22:00Z,0,15
debat_tv_one_user_9509,esemka ga import dll aja ngibul cm ijazah remeh temeh mulyono mah,2025-04-24T12:18:22Z,0,15
debat_tv_one_user_9510,penduduk indonesia lulusan smp paham aturan skripsi planga plongo dikibuli mulyono bela mulyono,2025-04-24T12:18:20Z,0,15
debat_tv_one_user_9530,kasian ternak mulyono,2025-04-24T12:15:00Z,0,15
debat_tv_one_user_9539,mulyono mahluk zaman batu,2025-04-24T12:12:57Z,0,15
debat_tv_one_user_9545,ternak mulyono mangap,2025-04-24T12:11:19Z,0,15
debat_tv_one_user_9560,universitas geng mulyono,2025-04-24T12:08:43Z,0,15
debat_tv_one_user_9567,tangkap adili jokowi bin mulyono,2025-04-24T12:07:34Z,0,15
debat_tv_one_user_9577,selesai sidang ijazah mulyono tunjukkan ijazah fufufafa,2025-04-24T12:05:27Z,0,15
debat_tv_one_user_9583,ternak mulyono ngelesss,2025-04-24T12:04:38Z,0,15
debat_tv_one_user_9583,ternak mulyono gugup gemetaran,2025-04-24T12:03:58Z,0,15
debat_tv_one_user_9616,mulyono emang gak urat malu,2025-04-24T12:00:02Z,0,15
debat_tv_one_user_9628,lawyer mulyono anaknya wamenkumham hakimnya udah disetting yaa dagelan,2025-04-24T11:57:43Z,0,15
debat_tv_one_user_9674,cucuknya tai kebonya pendukung mulyono,2025-04-24T11:51:02Z,0,15
debat_tv_one_user_9680,jujungan mulyono,2025-04-24T11:50:17Z,0,15
debat_tv_one_user_9684,ngeri kali si mulyono antek nya yahh,2025-04-24T11:49:42Z,0,15
debat_tv_one_user_9718,mulyono gak persidangan trend kabur aja dlu dg alasan lawatan urusan ijazah beres timing pas kebohongan terungkap,2025-04-24T11:44:50Z,0,15
debat_tv_one_user_9738,yaaa susah debat sm ternaknya mulyono capeeek suara sy rakyat indo lindungi nkri dr kelompok pengkhianat bangsa,2025-04-24T11:41:33Z,5,15
debat_tv_one_user_9760,tuh dengerin ternak mulyono izasah jungjungan lo bodong,2025-04-24T11:38:06Z,1,15
debat_tv_one_user_9804,mantap bang karny mengangkat ijasah mulyono yg palsu,2025-04-24T11:30:37Z,0,15
debat_tv_one_user_9819,ugm universitas geng mulyono,2025-04-24T11:28:07Z,0,15
debat_tv_one_user_9836,bikin kacau sbnrnya ternak buzzer mulyono,2025-04-24T11:21:45Z,0,15
debat_tv_one_user_9857,tinggal buktikan klo emang ijazah kasih sesimpel mulyono nipunegoro jelas² gak ijazah herannya dilindungi teruss negara,2025-04-24T11:21:27Z,3,15
debat_tv_one_user_9886,penjarakan yg melindungi mulyono klo ijazahnya palsu,2025-04-24T11:16:23Z,0,15
debat_tv_one_user_9912,lo lo lo mulyono jabat emang rwt,2025-04-24T11:09:37Z,0,15
debat_tv_one_user_9959,jgn kasih panggung ternak mulyono tdk faham kebeneran,2025-04-24T10:58:26Z,0,15
debat_tv_one_user_10010,indonesia d kibulin si mulyono,2025-04-24T10:46:30Z,0,15
debat_tv_one_user_9622,kebohongan sempurna mulyono kebohonganmu terungkap,2025-04-24T10:46:00Z,0,15
debat_tv_one_user_10016,coba kalo anies yg presiden mulyono antek nya jeruji besi,2025-04-24T10:44:21Z,0,15
debat_tv_one_user_10032,ganyang mulyono,2025-04-24T10:42:13Z,0,15
debat_tv_one_user_10015,haha diksh k polisi ato hakim ato bidang forensik smua skrg mreka ternak mulyono pstlah dikalahkan smua sdh pd disuap sm si mulyono lo jg silver mknya mo z lo jd ikutan bodoh,2025-04-24T10:40:16Z,0,15
debat_tv_one_user_10087,gg mas roy x menggentarkan keluarga mulyono fufufafa bos,2025-04-24T10:31:09Z,0,15
debat_tv_one_user_10099,kasian narasumber mulyono berani karna cuan mulyono kaya raya thn ngejabat,2025-04-24T10:28:05Z,1,15
debat_tv_one_user_10110,mulyono tuh kemaruk kekuasaan firaun jaman now,2025-04-24T10:26:08Z,1,15
debat_tv_one_user_10156,cecunguk mulyono suryo panda selamat g netral,2025-04-24T10:16:15Z,0,15
debat_tv_one_user_10099,kuasa hukum mulyono dpt cuan kaya raya mulyono thn ngejabat,2025-04-24T10:16:11Z,0,15
debat_tv_one_user_10165,adili mulyono kroninya,2025-04-24T10:15:19Z,0,15
debat_tv_one_user_10185,tumben ternak mulyono bilang ayo hentikan membahas yg,2025-04-24T10:10:34Z,0,15
debat_tv_one_user_10200,mulyono dngan program mobil elit siluman smk nya mengalahkan zet tempur siluman amerika raja gorong gorong raja nipu negoro mulyono,2025-04-24T10:07:15Z,0,15
debat_tv_one_user_10204,tepok jidat kena tipu mulyono milih doi periode poker face,2025-04-24T10:06:13Z,0,15
debat_tv_one_user_10223,ternak mulyono bodoh seh,2025-04-24T10:02:14Z,0,15
debat_tv_one_user_10226,adili jokowi ga sekuat penjilat pantat mulyono,2025-04-24T10:01:51Z,0,15
debat_tv_one_user_10231,mulyono seret aja kelapangan tapuki cangkeme ngaku,2025-04-24T10:01:03Z,0,15
debat_tv_one_user_10240,udah gamblank tunggu tangkap mulyono pasal yg kena,2025-04-24T09:59:41Z,0,15
debat_tv_one_user_10244,ternak mulyono pingsan,2025-04-24T09:58:46Z,0,15
debat_tv_one_user_10267,maju roy suryo bongkar si mulyono manusia manipulatif bumi pertiwi,2025-04-24T09:53:37Z,0,15
debat_tv_one_user_10306,silver ternak mulyono otaknya iq jongkok bikin habis,2025-04-24T09:45:11Z,0,15
debat_tv_one_user_10312,antek² mulyono ilc pda kicep haha dgr penjelasan roy suryo,2025-04-24T09:44:25Z,0,15
debat_tv_one_user_10325,ternak mulyono cepat terpancing emosinya tandanya yg salah,2025-04-24T09:41:48Z,0,15
debat_tv_one_user_255,ijazah palsu mulyono serahkan ahli forensik dokter rismon sianipar ahli telematika roy suryo kebenarannya yg mudah dipersulit,2025-04-24T09:34:27Z,0,15
debat_tv_one_user_10365,yg ngadi domba si mulyono laahh tunjukin aja ijazahnya beres,2025-04-24T09:33:35Z,0,15
debat_tv_one_user_10377,sarjana ruko preman pasar ngapain disitu kapasitas tinggal jhongoz pendjilads mulyono,2025-04-24T09:30:57Z,0,15
debat_tv_one_user_10405,narasumber pembela mulyono panik,2025-04-24T09:25:33Z,0,15
debat_tv_one_user_10416,sylvester bilang remeh temeh muncul dimana bela ijazah mulyono remeh temeh ya ngapain an bela ijazah mulyono,2025-04-24T09:24:28Z,2,15
debat_tv_one_user_10430,selfester si penjilat ternak mulyono,2025-04-24T09:22:24Z,0,15
debat_tv_one_user_10446,hakkul ijazah mulyono palsu,2025-04-24T09:20:13Z,0,15
debat_tv_one_user_10512,param kocok mainan mulyono berani periksa ijasah palsu tuan nya,2025-04-24T09:06:52Z,1,15
debat_tv_one_user_10325,penjelasan roy surya ginting mencerdaskan sedangak ternak mulyono mengeles yg isi ilc sbg narsum,2025-04-24T09:05:27Z,143,15
debat_tv_one_user_10544,sylvester ternak mulyono dimna hati nurani hahhaahha jokowi korupsi pembohong ngibul m ncla mnlce,2025-04-24T09:00:28Z,1,15
debat_tv_one_user_10546,mulyono ruwet,2025-04-24T09:00:20Z,0,15
debat_tv_one_user_10604,orang yg bela mulyono rame penjarakan,2025-04-24T08:51:03Z,1,15
debat_tv_one_user_10544,ijasah mulyono kw,2025-04-24T08:49:40Z,1,15
debat_tv_one_user_10625,ternak mulyono ngeyel truuus,2025-04-24T08:47:05Z,1,15
debat_tv_one_user_10281,ugm universitas gerombolan mulyono gak berani tampil utk debat gak pastinya dilarang tampil mulyono situasi dikontrol,2025-04-24T08:43:53Z,5,15
debat_tv_one_user_10642,panda nababannnn mantan penyembah mulyono,2025-04-24T08:43:29Z,0,15
debat_tv_one_user_10653,gocekan gocekan trik menghindar ala geng mulyono,2025-04-24T08:41:52Z,0,15
debat_tv_one_user_10661,silpester antek mulyino bayar jokowi pentingkan mulyono negerimu indonesia carut marut,2025-04-24T08:39:38Z,1,15
debat_tv_one_user_10544,bela ternak mulyono apakh cuan nya gede maju trus bang roy kbnran no,2025-04-24T08:37:07Z,0,15
debat_tv_one_user_10693,andai mulyono bp bangsa tinggal ks liat ijazahnya slesai inikan rakyat ragu kl mulyono indah s ugm krn tdk perlihatkan lbh aneh lg wartwan diajak liat ijazah tp ga be kamera ato merekam,2025-04-24T08:32:16Z,0,15
debat_tv_one_user_10723,usut tuntas dinasti politik bobrok mulyono,2025-04-24T08:25:35Z,0,15
debat_tv_one_user_10756,tinggal tongolin publik beres berbelit kuasa hkum ny mulyono,2025-04-24T08:20:15Z,0,15
debat_tv_one_user_10781,penjarakan klo ijasah mulyono asli matanya penjilat bosooook mk otak atik paman usman kkn dancoook sylvester,2025-04-24T08:16:14Z,0,15
debat_tv_one_user_10807,klo ijazah jokowi asli bambang tri mulyono keluarga ndak korban rejimnya,2025-04-24T08:11:20Z,0,15
debat_tv_one_user_10821,ijazah mulyono palsu,2025-04-24T08:09:46Z,1,15
debat_tv_one_user_10846,fufu fafa ilmiah samsul bin mulyono kapolri nya pilihan mulyono,2025-04-24T08:04:54Z,1,15
debat_tv_one_user_10860,gerindra takut mulyono takut psi,2025-04-24T08:03:55Z,0,15
debat_tv_one_user_10887,warga nkri membiarkan terusss menerus dikibuli ditipu mulyono warga nkri warga yg mati an jdi buzzer penjiat mulyono,2025-04-24T08:00:41Z,0,15
debat_tv_one_user_10916,lanjutkan bang roy suryo sy dukung kalo mulyono ijazahnya palsu yg membela mulyono orang bayaran si mulyono,2025-04-24T07:57:04Z,0,15
debat_tv_one_user_10821,adili mulyono makzulkan samsul fufufafa,2025-04-24T07:54:56Z,1,15
debat_tv_one_user_10362,sombong x mulyono mentang pro oknum ugm,2025-04-24T07:54:04Z,0,15
debat_tv_one_user_10944,anjingnya mulyono slalu menggong gong,2025-04-24T07:53:37Z,0,15
debat_tv_one_user_10955,sebenernya pernyataan fakta yg dikeluarkan mas roy suryo sulit dibantah kubu pembela mulyono berusaha keras membantah walopun konyol saran mulyono naikin gaji pembela kasihan keras menutup kesalahan,2025-04-24T07:50:38Z,0,15
debat_tv_one_user_10956,asbun aja golongan mulyono,2025-04-24T07:50:22Z,0,15
debat_tv_one_user_10966,dungu orang peliharaaan mulyono,2025-04-24T07:49:13Z,1,15
debat_tv_one_user_10990,sdh kena suap sm mulyono,2025-04-24T07:46:13Z,0,15
debat_tv_one_user_10719,buzer mulyono plonga plongo,2025-04-24T07:43:23Z,0,15
debat_tv_one_user_11020,ternak mulyono membela habis habisan mulyono pembuktian tinggal menunggu keputusan formalitas pengadilan lakukan peradilan pembuktian ijazah palsu tsb terbukti palsu tangkap ternak mulyono yg bela habis habisan tsb sdh dilaporkan polri tp tindak lanjuti dg serius polri parpol yg sebar sosmed ijazah palsu nyatakan asli pembohongan publik tuntut tangkap patut diduga polri sengaja tdk proses dg serius,2025-04-24T07:41:51Z,0,15
debat_tv_one_user_10719,mulyono ijazah palsu ajq bikin onar indonesia,2025-04-24T07:33:55Z,0,15
debat_tv_one_user_11088,sayang youtube gak fitur ngeludah pengen ngeludahin ternak mulyono,2025-04-24T07:33:11Z,0,15
debat_tv_one_user_11092,usut ijazah palsu mulyono,2025-04-24T07:32:32Z,0,15
debat_tv_one_user_11088,intinya mulyono diadili ternaknya gak makan ternaknya bela mati an seculas apapun mulyono,2025-04-24T07:30:19Z,0,15
debat_tv_one_user_11108,mulyono tinggal tunjukin sj klw nga berani palsu setuju amin,2025-04-24T07:29:07Z,0,15
debat_tv_one_user_11155,kasihan jongosnya mulyono berjibaku menyelamatkan muka junjungannya,2025-04-24T07:22:53Z,0,15
debat_tv_one_user_11155,kasihan jongosnya mulyono berjibaku menyelamatkan muka junjungannya,2025-04-24T07:19:50Z,0,15
debat_tv_one_user_11189,shame on you mulyono,2025-04-24T07:18:58Z,0,15
debat_tv_one_user_11155,kasihan jongosnya mulyono berjibaku menyelamatkan muka junjungannya,2025-04-24T07:17:51Z,0,15
debat_tv_one_user_11207,lulusan ugm bahasa ingggris mulyono wiwok detok pala lw bau pletok,2025-04-24T07:17:46Z,0,15
debat_tv_one_user_11155,kasihan jongosnya mulyono berjibaku menyelamatkan muka junjungannya,2025-04-24T07:17:41Z,0,15
debat_tv_one_user_11210,liat aja dialog mulyono berbahasa inggris,2025-04-24T07:17:09Z,0,15
debat_tv_one_user_11212,mulyono ngomong tong kosong nyaring bunyinya,2025-04-24T07:16:58Z,0,15
debat_tv_one_user_11250,penjahat ko bela prabowo gak legitimasinya krn mulyono,2025-04-24T07:13:08Z,0,15
debat_tv_one_user_11255,jongos mulyono ga malu,2025-04-24T07:11:55Z,0,15
debat_tv_one_user_11293,naguslah klonsampek terbukti ijasah mulyono palsu hak politiknya cabut biar efek jera kedepannya,2025-04-24T07:07:14Z,4,15
debat_tv_one_user_11330,manusia pembela mulyono yg cm omon aj,2025-04-24T07:02:40Z,0,15
debat_tv_one_user_11357,ijazah mulyono fixxxx palsu,2025-04-24T06:59:19Z,0,15
debat_tv_one_user_11369,tukang tipu mah bisanya ngeles mulu si mulyono,2025-04-24T06:58:13Z,0,15
debat_tv_one_user_11384,senjata ternak mulyono ngotot data ngajak ribut dasar,2025-04-24T06:57:01Z,0,15
debat_tv_one_user_11395,bang karni minggu angkat tema ijazah undang rismon roy suryo ugm kalo undang si mulyono,2025-04-24T06:55:53Z,0,15
debat_tv_one_user_11397,kebodohan kemiskinan sengaja d pelihara negara orang mulyono anaknya bs menang dlm kontestasi pemilu,2025-04-24T06:55:44Z,0,15
debat_tv_one_user_11412,tangkapin aja tuh busser mulyono yg bikin rusak indonesia,2025-04-24T06:54:27Z,0,15
debat_tv_one_user_10623,semoga hakim pengadil ijazah mulyono berani mengambil keputusan intervensi,2025-04-24T06:49:09Z,0,15
debat_tv_one_user_11476,ya mudah mudahan hasil sidang dimenangkan mulyono bem indonesia bersatu senayan jakarta pusat,2025-04-24T06:46:44Z,0,15
debat_tv_one_user_11570,forum yg cinta mulyono gila mulyono,2025-04-24T06:34:19Z,0,15
debat_tv_one_user_11612,ma hakim yg mulia disogok gak petinggi univ gibran mulyono jg disogok,2025-04-24T06:30:17Z,0,15
debat_tv_one_user_11681,diskusi ajha pembela mulyono ntar akal sehat nya lulusannya mulyono,2025-04-24T06:22:06Z,0,15
debat_tv_one_user_11760,dijadikan panggung politik mulyono,2025-04-24T06:13:26Z,0,15
debat_tv_one_user_11824,ternak mulyono gak yg bantah keterangan roy suryo,2025-04-24T06:05:15Z,0,15
debat_tv_one_user_11850,ternak mulyono ngeyel argumennya nol,2025-04-24T06:02:12Z,0,15
debat_tv_one_user_11864,si andi n silverter buzer nya mulyono yg sdh dpt jabatan iya pantes aja bela mati an,2025-04-24T06:01:14Z,0,15
debat_tv_one_user_11871,mulyono mulyono tinggal tunjukin ijazahnya gitu aja repot,2025-04-24T06:00:42Z,0,15
debat_tv_one_user_11875,jongos mulyono panik,2025-04-24T06:00:33Z,0,15
debat_tv_one_user_11878,onderdil logi ngotot bela mulyono,2025-04-24T06:00:18Z,12,15
debat_tv_one_user_11884,sudang kabur mulyono dungu,2025-04-24T05:59:55Z,0,15
debat_tv_one_user_11897,begundal begundal nya mulyono emang koplak malu maluin,2025-04-24T05:58:11Z,0,15
debat_tv_one_user_11884,mulyono sakit jiwa,2025-04-24T05:55:28Z,0,15
debat_tv_one_user_11918,universitas gada mulyono ugm,2025-04-24T05:54:50Z,0,15
debat_tv_one_user_11929,kasihan ternak piaraan mulyono omong berbusa busa membela junjungannya,2025-04-24T05:53:21Z,0,15
debat_tv_one_user_11930,palsu berakibat fatal mulyono cs klu keputusan hakim uasli piye power mulyono,2025-04-24T05:53:17Z,0,15
debat_tv_one_user_11953,usut tuntas ijazah palsu mulyono fitnah berkepanjangan,2025-04-24T05:49:33Z,16,15
debat_tv_one_user_11994,mulyono biang nya siveszter penjilat,2025-04-24T05:45:05Z,0,15
debat_tv_one_user_12003,muasal kegaduhan negeri pdip yg memuluskan jalan mulyono,2025-04-24T05:44:07Z,0,15
debat_tv_one_user_12007,jd penjilat mulyono gajinya brp ya koq ngotot teruss,2025-04-24T05:43:54Z,0,15
debat_tv_one_user_12024,menekan berkali menerangkan konfirmasi ugm hati ugm krn nya tumbal jk terbukti palsu ugm berani pusaran mulyono,2025-04-24T05:42:24Z,0,15
debat_tv_one_user_11293,mulyono gak jadir persidangan takut,2025-04-24T05:40:41Z,1,15
debat_tv_one_user_12053,mulyono sengaja gaduh menunjukan ijazah aslinya,2025-04-24T05:38:38Z,0,15
debat_tv_one_user_12066,ayo lawan mulyono,2025-04-24T05:37:09Z,0,15
debat_tv_one_user_12062,pendukungnya mulyono n dobbol kabeh tukang pembohong,2025-04-24T05:31:14Z,1,15
debat_tv_one_user_12128,ternak mulyono kuliti ilc putus urat malu nya,2025-04-24T05:29:27Z,0,15
debat_tv_one_user_12180,orang jokower pendukung mulyono knp diundang menjatuhkan martabat ilc aja sbg talkshow berkelas silpretster kuliah aja ruko,2025-04-24T05:22:42Z,5,15
debat_tv_one_user_12222,mantaf roy suryo dkk usut tuntas mulyono,2025-04-24T05:18:05Z,0,15
debat_tv_one_user_12227,university of gank mulyono,2025-04-24T05:17:53Z,0,15
debat_tv_one_user_12237,apapun d lakukan mulyono jangankn kampus undang mk aja d rubah,2025-04-24T05:16:32Z,0,15
debat_tv_one_user_12244,bang panda peran nya mulyono,2025-04-24T05:15:27Z,0,15
debat_tv_one_user_12294,muak ternak ternak mulyono,2025-04-24T05:07:45Z,1,15
debat_tv_one_user_12304,narasi pembela mulyono sell menggiring penyesatan informasi publik,2025-04-24T05:06:23Z,0,15
debat_tv_one_user_12240,ternak nya mulyono otak nya pendeekk,2025-04-24T05:06:08Z,0,15
debat_tv_one_user_12307,ternak mulyono debatnya nol,2025-04-24T05:05:50Z,0,15
debat_tv_one_user_12324,yo gantung neng alun alun ae mulyono benke peng hianat penipu bangsa antek antek komunis mulyono iki kelewat batas,2025-04-24T05:04:20Z,0,15
debat_tv_one_user_12344,intinya sumber dibangsa mulyono gaduh tabuh biar rakyat resah susahnya ijazahnya,2025-04-24T05:02:23Z,0,15
debat_tv_one_user_12362,mulyono raja ngibul,2025-04-24T05:00:46Z,0,15
debat_tv_one_user_12369,mantap bg roy penelitian nya tangkap mulyono antek anteknya,2025-04-24T05:00:04Z,0,15
debat_tv_one_user_12401,ternak mulyono ngumpet sempak panutannya,2025-04-24T04:56:11Z,0,15
debat_tv_one_user_12403,univ genk mulyono,2025-04-24T04:56:01Z,0,15
