author,text,published_at,like_count,cluster
Ijasah_ditunjukan_user_16228,yg cba bela jokowi sy trust issue buzzer,2025-05-01T08:13:14Z,0,18
Ijasah_ditunjukan_user_16247,skrg kata² mantan presiden mempidanakan memfitnah org d kasi d lapor d penjara ngeles masyarakat indonesia mendukung jokowi memenjarakan smua menzolimi jokowi kalo d nama yg terlapor masyarakat membantu nama jokowi mempidanakan smua yg memfitnah jokowi terkait ijasah,2025-05-01T08:10:40Z,0,18
Ijasah_ditunjukan_user_16261,uji jokowi aja menteri presiden anggota dpr dprd pejabat negara,2025-05-01T08:08:32Z,0,18
Ijasah_ditunjukan_user_16269,semoga org yg sdh memfitnah jokowi masuk bui biar negri tdk gaduh,2025-05-01T08:07:59Z,0,18
Ijasah_ditunjukan_user_16273,ikuti peristiwa sungguh kecewa jokowi sepele gaduh,2025-05-01T08:07:14Z,0,18
Ijasah_ditunjukan_user_16314,yg ijazah jokowi yg asli ya jokowi contoh nya yg mengongong anjig masak kambing paksa menyalak ternak mulyono penegak hukum goblok,2025-05-01T08:01:39Z,0,18
Ijasah_ditunjukan_user_16326,go loknya si panci tujuannya mengulik ijazah p jokowi,2025-05-01T07:59:35Z,0,18
Ijasah_ditunjukan_user_16370,p jokowi orangnya yg tega ya gpp p jokowi yg sabar allah membalasnya orang yg menyakiti p jokowi,2025-05-01T07:54:12Z,0,18
Ijasah_ditunjukan_user_16397,gx yg asli biar selesai jawabannya ya biar rame trus keliatan muncul otak dalang wajah pembenci jokowi giliran udah tau aja diselesaikan dipenjarakan orang cerdas jokowi,2025-05-01T07:50:11Z,0,18
Ijasah_ditunjukan_user_16421,kakak panggil pakde beliau ternyaata almameter jokowi lulus beliau jokowi sengaka mengeluarkan ijazah efek jera bikin kegaduhan,2025-05-01T07:47:37Z,0,18
Ijasah_ditunjukan_user_16444,ass pikir dgn logika akal sehat alumni ugm bang roy s bang rismon hs pifa tdk pengaduan polisi dgn tuduhan pidana jokowi ijazahnya yg permassalahkn jokowi alumi ugm kerena bang roy s bang rismon hs pifa adik bawahannya jokowi ugm ragukan jokowi alumi ugm ijazah yg jokowi buatan yg sesungguhnya yg keluarkan ugm massanya thn yg membela jokowi motif kerena jokowi ampaynya you ok thank you so much,2025-05-01T07:44:54Z,0,18
Ijasah_ditunjukan_user_16451,astagfirullah al azhim bencinya jokowi,2025-05-01T07:44:04Z,0,18
Ijasah_ditunjukan_user_16460,jokowi curang prabowo curang,2025-05-01T07:42:54Z,0,18
Ijasah_ditunjukan_user_16465,lawyernya menyebut jokowi indikasi jokowi ijasah yg diterimanya ugm wisuda asli,2025-05-01T07:42:32Z,0,18
Ijasah_ditunjukan_user_16467,usir aja jokowi keluarga indonesia meresahkan,2025-05-01T07:42:22Z,0,18
Ijasah_ditunjukan_user_16469,kalo tuduhan roy cs yg salah yg ngungsung jokowi jokowi lngsung tuduhan jokowi tuduhan artai pengungsing jokowi,2025-05-01T07:41:48Z,0,18
Ijasah_ditunjukan_user_16478,ijazah jokowi hak jokowi urusan roy suryo dasar pembenci keluarga jokowi tdk kerjaan,2025-05-01T07:40:24Z,0,18
Ijasah_ditunjukan_user_16491,oalah ray suloyo nek gething ambek pk jokowi eram tenan mugo ijazahe pk jokowi asli cek mrongos cangkeme ray suloyo eeeh kliru roy suryo maaf luur,2025-05-01T07:38:47Z,0,18
Ijasah_ditunjukan_user_16514,jokowi biang kisruh negara jokowi sdh diadili,2025-05-01T07:34:54Z,0,18
Ijasah_ditunjukan_user_16552,tujuanya memenangkan sayembara miliar menjatuhkan nama jokowi pendukungnya jokowi pendukung berhubungan prabowo berbahaya lawan politik mengajukan kandidat wakil presiden jabatan,2025-05-01T07:29:57Z,0,18
Ijasah_ditunjukan_user_16564,do jokowi sehat n berkati tuhan yg maha esa org yg tdk suka n org lindungannya,2025-05-01T07:28:42Z,3,18
Ijasah_ditunjukan_user_16575,pengacara jokowi kelabakan,2025-05-01T07:27:20Z,0,18
Ijasah_ditunjukan_user_16598,mantan presiden kucluk beda sby langit bumi jokowi,2025-05-01T07:25:19Z,2,18
Ijasah_ditunjukan_user_16614,pengacara berprinsip dipermudah alasan yg krusial ijazah aslinya jokowi ruginya mengurangi harga jokowi bangga ijazahnya bangga kuliah ugm anak masuk ugm sdh bangga pengacara dengarin dipersulit ngapain dipermudah kejanggalan kejanggalan bermunculan kejanggalan pejabat ugm tujuan melindungi jokowi yg eks presiden,2025-05-01T07:23:29Z,0,18
Ijasah_ditunjukan_user_16627,jokowi pembohong tulen,2025-05-01T07:22:06Z,0,18
Ijasah_ditunjukan_user_16634,ijazah jokowi rumitnya ampun,2025-05-01T07:21:37Z,0,18
Ijasah_ditunjukan_user_16639,semangat jokowi rakyat solo mendukung langkah jokowi laporkan biar gak koar,2025-05-01T07:20:00Z,0,18
Ijasah_ditunjukan_user_16641,jokowi orang pinter biar pembenci kepanasan dlu klo heboh kecerdasan jokowi jokowi geram jdi ahirnya melaporkan pembenci,2025-05-01T07:19:53Z,5,18
Ijasah_ditunjukan_user_16677,suryo mengejar nilai kejujuran jokowi sejujur sih suryo sesuci sih kalo jokowi menang kumisnya dicabuti persatu tu,2025-05-01T07:15:15Z,0,18
Ijasah_ditunjukan_user_16678,polisi hakim genggaman fir aun jokowi fir aun jokowi penuh kelicikan kebohongan rakus,2025-05-01T07:15:09Z,0,18
Ijasah_ditunjukan_user_16704,penghujat menghujat p jokowi institusi negara ugm penghujat olah menghormati undang negara indonesia mungkinlah kali gubenur kali president ijazah p jokowi gk dipriksa yg menghujat udah lihat ijazahnya,2025-05-01T07:12:03Z,0,18
Ijasah_ditunjukan_user_16721,setifikat dibikin jokowi rakyatnya,2025-05-01T07:10:02Z,0,18
Ijasah_ditunjukan_user_16734,suru tujukin ijasa pa jokowi pribadi pa jokowi hak pa jokowi orang klo lgi benci lakukan,2025-05-01T07:08:14Z,0,18
Ijasah_ditunjukan_user_16767,ndak jokowi melaporkan ibuk ibuk yg nyinyir,2025-05-01T07:04:31Z,0,18
Ijasah_ditunjukan_user_16769,suryo p jokowi yg ditanyain ijasahnya kalo karna dendam,2025-05-01T07:03:59Z,0,18
Ijasah_ditunjukan_user_16785,jokowi bikin gaduh,2025-05-01T07:02:33Z,0,18
Ijasah_ditunjukan_user_16800,kalo jokowi ijazah nya palsuh org pdi tau melaporkan bentuk kekesalan jokowi yg org pdi gak yg mempermasalahkan ijasah jokowi asli,2025-05-01T07:01:01Z,0,18
Ijasah_ditunjukan_user_16823,ga selesai berdasarkan fakta kebencian sekelompok orang tehadap jokowi putusan inkrah curiga mencari tuduhkan jokowi,2025-05-01T06:58:36Z,0,18
Ijasah_ditunjukan_user_16828,ngak dibahas ijazah jokowi belia ngak presiden ngak beliau menduduki jabatan presiden,2025-05-01T06:58:11Z,0,18
Ijasah_ditunjukan_user_16836,tunjukin aja ijazah aslinya jok jokowi gausah muter muter mbulet kaya kentut,2025-05-01T06:56:56Z,0,18
Ijasah_ditunjukan_user_16848,hak azasi jokowi tdk sembarangan ijazah asli orang yg onar masyarakat indonesia bravo jokowi,2025-05-01T06:55:59Z,45,18
Ijasah_ditunjukan_user_16861,priksa smua it ijazah pejabat jgn hnya jokowi,2025-05-01T06:53:45Z,0,18
Ijasah_ditunjukan_user_16793,kuasahukum jokowi wawasan ijazah itukan jalurnya sekripsi dongok pengacara jokowi dongok,2025-05-01T06:52:52Z,0,18
Ijasah_ditunjukan_user_16884,kesalahan jokowi yg kegaduhan ya jokowi yg menghormati jokowi koperatif dilaporkan bambang tri jokowi ijazah yg dikhawatirkan jokowi asli,2025-05-01T06:51:51Z,0,18
Ijasah_ditunjukan_user_16919,percaya jokowi sih,2025-05-01T06:48:05Z,0,18
Ijasah_ditunjukan_user_16903,bos roy gk kerjaan tuntut jokowi gk enak fitnah balas jokowi muslim balas sesuwai perbuatan y rakyat gk trima mantan pemimpin negaraku lecekan balas,2025-05-01T06:46:08Z,0,18
Ijasah_ditunjukan_user_16973,kesini iri dengki jokowi persatu bermunculan semoga jokowi lindunganya aamiin,2025-05-01T06:42:28Z,37,18
Ijasah_ditunjukan_user_16979,poling kecilam percaya ijasah jokowi palsu like percaya ijasah jokowi asli komen,2025-05-01T06:41:46Z,0,18
Ijasah_ditunjukan_user_16884,jokowi kpu jokowi ijazah nya temannya yg th yg jokowi sekelas seangkatan dgn yg lucu,2025-05-01T06:40:18Z,0,18
Ijasah_ditunjukan_user_17002,bilang ijazah jokowi asli aspal prosesnya bermasalah tunggu aja hukum berbicara antek jokowi bicara,2025-05-01T06:39:47Z,0,18
Ijasah_ditunjukan_user_17004,alkisah wartawan mndpat cerita yg org seangkatan dgn jokowi swaktu smp berangkat dr cerita smp berkesimpulan ijazah ugm jokowi palsu denger dr org lho ya sampe skarang yg denger dr org orgngnya ga nongol yg percaya ma org saksi ga bukti dlm khayalan yg ga tau ceritanya ya bgini crita nya hnya dengar org bercerita tmn seangkatan jokowi smp logika aj ga permah kroscek tdk ni org tmn seangakatan smp org seangakatan tp beda smp yg digaris bawahi,2025-05-01T06:39:45Z,0,18
Ijasah_ditunjukan_user_16943,yg dukung jokowi udh disuap udh gk takut dosa uang lupa tuhan miris,2025-05-01T06:39:29Z,0,18
Ijasah_ditunjukan_user_17008,jokowi tdk tunjukkan izajasah aslinya berati tujuannya memperkeruh,2025-05-01T06:39:19Z,0,18
Ijasah_ditunjukan_user_17018,udahlah gk cm ngelawan jokowi tp ngelawan pemerintah trmsuk hakim kejaksaan kepolisian mreka msih pengaruh jokowi,2025-05-01T06:38:27Z,0,18
Ijasah_ditunjukan_user_17029,mata pembenci jokowi jokowi salah cari celah salahnya mengfitnah jokowi semangat jokowi,2025-05-01T06:37:25Z,0,18
Ijasah_ditunjukan_user_16884,jokowi ijazah tempo jgn jgn dicetak yg bikin kesalahan jokowi wajar jokowi takut diselidiki ilmiah,2025-05-01T06:36:52Z,0,18
Ijasah_ditunjukan_user_17050,yg bikin brisik panci bolong knapa nyalahin jokowi,2025-05-01T06:35:16Z,0,18
Ijasah_ditunjukan_user_16972,penegak hukum dlm polisi pengungkapan ijazah jokowi netral tekanan mantan penguasa jokowi skarang kedudukannya dgn masyarakat,2025-05-01T06:34:47Z,0,18
Ijasah_ditunjukan_user_17075,jokowi keren beliau ditonjok habis habisan giliran beliau tinggal injak dibawah kakinya salut jokowi,2025-05-01T06:32:57Z,0,18
Ijasah_ditunjukan_user_17077,fitnah kejam pembunuhan presiden jokowi ijazah palsu giliran memfitnah dilaporin marah masyarakat jokowi penipu jokowi orangnya sabar kasihan beliau presiden difitnah caci maki dihina beliau diam beliau tunjukkan gigi laporkan memfitnah,2025-05-01T06:32:52Z,0,18
Ijasah_ditunjukan_user_17094,udah roy nggk cingcong latar belakangi hati yg luka krn pecat nyari ama jokowi dah tunjukkan jokowi tinggal terima aja yg tanam bui,2025-05-01T06:31:26Z,0,18
Ijasah_ditunjukan_user_17099,kesempatan hti fpi orang sakit hati mencoba balas dendam jokowi gerombolan tsb berusaha mencari ijazah jokowi dinyatakan palsu upaya lanjutan yg diteken jokowi presiden cacat hukum salah satunya keputusan pelarangan hti fpi dianulir skenario hitam perkara remeh temeh,2025-05-01T06:31:08Z,0,18
Ijasah_ditunjukan_user_17105,dasar tnya saksi tetangga jokowi jokowi kuliah ngga,2025-05-01T06:30:45Z,0,18
Ijasah_ditunjukan_user_17107,polisi dibawah ketiak jokowi gimana netral,2025-05-01T06:30:37Z,0,18
Ijasah_ditunjukan_user_17113,pidanakan org semangat jokowi,2025-05-01T06:30:02Z,1,18
Ijasah_ditunjukan_user_17119,jokowi yg bikin gaduh video roy ngmg yg jokowi gak ijazahnya yg boom penasaran nya masyarakat indonesia partai yg mengupload foto ijazah yg nya ijazah jokowi asli disitu pakar menyelidiki yg ijazah kuliah melewati skripsi yg kunci skripsi jokowi penuh anomali gaduh kasusnya skripsi penuh anomali gini lulus dpat ijazah klean kuliah paham skripsi penuh kesalahan masak iya d acc wisuda dpat ijazah kuliah,2025-05-01T06:29:15Z,0,18
Ijasah_ditunjukan_user_17136,bela bela jokowi lihat ijazah jokowi,2025-05-01T06:27:51Z,0,18
Ijasah_ditunjukan_user_17146,yg lucunya melewati lembaga diperdebatkan semngt pk jokowi,2025-05-01T06:26:33Z,0,18
Ijasah_ditunjukan_user_17110,anehnya nggak seblum beliau jokowi persiden aneh kemana suaranya,2025-05-01T06:24:21Z,0,18
Ijasah_ditunjukan_user_17066,jokowi adili rakyat ttp menuntut jokowi,2025-05-01T06:24:12Z,0,18
Ijasah_ditunjukan_user_17182,tujuan tau ijazah jokowi tujuan mengkriminalisasi keluarga jokowi apapun hasilnya yng dipermasalahkan gk selesai,2025-05-01T06:22:23Z,3,18
Ijasah_ditunjukan_user_17201,dukung pa jokowi semangat pa jokowi semoga keluarga kesehatan yg bilang pa jokowi ijazah palsu bikin gaduh rakyat indonesia dilaporkan aj kepihak berwajib semangat pa jokowi,2025-05-01T06:20:29Z,0,18
Ijasah_ditunjukan_user_17028,ijazah jokowi uji pembenci palsu hasilnya uji org yg membenci jokowi asli karna kenyataannya asli pembenci bilang yg menguji ijazah jokowi mmbenci pembenci blg jujur serba salah jokowi semangat jokowi,2025-05-01T06:20:15Z,0,18
Ijasah_ditunjukan_user_17225,rakyat yg menilai asli pk jokowi presiden terbaik trimakasih pk jokowi dn keluarga semoga sehat amin,2025-05-01T06:19:03Z,0,18
Ijasah_ditunjukan_user_17227,tanyain detail pas jokowi kkn,2025-05-01T06:18:38Z,0,18
Ijasah_ditunjukan_user_17232,maju jokowi,2025-05-01T06:17:48Z,0,18
Ijasah_ditunjukan_user_17247,sdh dibuktikan ijasah jokowi asli gerombolan cari jalan utk menjatuhkan jokowi dasarnya mmg kebencian keyok mulu dlm politik,2025-05-01T06:16:07Z,0,18
Ijasah_ditunjukan_user_17249,yg ijzah jokowi yg d permasalahkan kena presiden d,2025-05-01T06:15:45Z,0,18
Ijasah_ditunjukan_user_17272,sori perguso ga gila karna ijazah jokowi palsu asli ga untung rugi nya masyarakat jokowi udah persiden yg pilih jokowi persiden rakyat yg permasalah,2025-05-01T06:13:46Z,0,18
Ijasah_ditunjukan_user_17249,musal jokowi menunjukan ijazah nya tetep percaya jokowi menjabat presiden,2025-05-01T06:12:48Z,0,18
Ijasah_ditunjukan_user_17285,roy panci jokowi mempinakan mencemarkan nama beliau danmengujar kebencian beliau,2025-05-01T06:12:31Z,0,18
Ijasah_ditunjukan_user_17297,cocote kyak panci jatoh gantungan paku dinding aja usut tuh mamaknya banteng beliau mengusung jokowi utk maju pilpres pemilihan walikota pilgub jg usut yg terkait ijasah jokowi palsu diloloskan menjabat logikanya jongkok pakar gadungan,2025-05-01T06:11:31Z,0,18
Ijasah_ditunjukan_user_17301,jokowi udah presiden sasaran pengaruh pencapaian jokowi kuat banget bayang bayang hilang prabowo dibanding bandingin presiden dinilai standar ditinggalkan pemimpin,2025-05-01T06:11:17Z,0,18
Ijasah_ditunjukan_user_17319,kocak roy dy yg bikin rakyat gk percaya jokowi tudingan ijasah palsu menggiring opini yg buruk keluarga jokowi giliran lapor pencemaran nama langsung ngadu mantan presiden pidanakan kwkwwkk kocak llu llu klo gk lapor tmn tmn llu gk main api,2025-05-01T06:09:55Z,0,18
Ijasah_ditunjukan_user_17317,roy suryo kau tdk nya berpolitik jokowi sengaja tdk kasih kau paksa tunjukkan ijazah presiden jokowi hak utk publikasikan ijasahnya bodohnya pembenci jokowi gurunya habib palsu rizik dllsdh pastii berpikirnya berantakan sdh hukumnya berat tdk kompromi kuhp thn ya jalani penjara thn utk pembenci jokowi yg dalang kaum kardun next buiin biar otak cerdas tinggal muka bumi,2025-05-01T06:08:14Z,0,18
Ijasah_ditunjukan_user_17385,ijazah jokowi palsu jokowi menghindar ngelez swmakin,2025-05-01T06:04:34Z,0,18
Ijasah_ditunjukan_user_17393,gerakkan massa jokowi mania hancur rmh roy dr tifa dll klau terbukti asli ijazah jokowi yg fitnah karma nx,2025-05-01T06:03:56Z,0,18
Ijasah_ditunjukan_user_17400,dasarmu mintak ijazah jokowi apamksdnya grup pembenci,2025-05-01T06:03:12Z,0,18
Ijasah_ditunjukan_user_17389,laporin jokowi,2025-05-01T06:02:28Z,0,18
Ijasah_ditunjukan_user_17422,aneh aja klo emang ijazah jokowi palsu akam menjawabat walikota gubenur mantap jokowi jokowi dilawan hancur dirimu orng diam menghanyutkan,2025-05-01T06:01:35Z,0,18
Ijasah_ditunjukan_user_17430,cerdas kuwasa hukum pk jokowi lanjutkan biar ngringkuk dipenjara tu orang pembenci pk jokowi,2025-05-01T06:00:58Z,0,18
Ijasah_ditunjukan_user_17444,lapor jokowi polisi tangkap dlu jokowi selslu onar indonesia kepolisian netral,2025-05-01T05:58:34Z,0,18
Ijasah_ditunjukan_user_17474,undang teman jokowi seangkatan wisuda ngeyel,2025-05-01T05:57:50Z,0,18
Ijasah_ditunjukan_user_17475,jokowi manusia sabar batas y yg benci dgn p jokowi,2025-05-01T05:57:48Z,0,18
Ijasah_ditunjukan_user_17476,mampus lu pembenci jokowi,2025-05-01T05:57:38Z,0,18
Ijasah_ditunjukan_user_17536,kalo tdk brani ngucap yg tdk penghormatan samasekali jokowi presiden presidin bro,2025-05-01T05:53:02Z,0,18
Ijasah_ditunjukan_user_17550,ugm mengecuwalikan foto ijazah jokowi pakai kacamata karna presiden,2025-05-01T05:52:08Z,0,18
Ijasah_ditunjukan_user_17578,sehat trus pk jokowi,2025-05-01T05:49:29Z,0,18
Ijasah_ditunjukan_user_17592,jokowi is the best,2025-05-01T05:48:23Z,0,18
Ijasah_ditunjukan_user_17600,emang salahnya jokowi melaporkan orang yg menfitnanya nggak bedanya yg melanggar hukum dilaporkan maju jokowi dihukum,2025-05-01T05:47:40Z,0,18
Ijasah_ditunjukan_user_17583,pidanakan karna barisan sakit hati yg berakar masuk penjara beliau presiden jokowi masyarakat indonesia jokowi pakai hak nya warga negara indonesia penjarakan efek jerah barisan sakit hati,2025-05-01T05:46:57Z,0,18
Ijasah_ditunjukan_user_17630,mari ijasahnya pk jokowi gantian ijasahnya pk prabowo coba ijasahnya pk prabowo berani gk,2025-05-01T05:44:22Z,0,18
Ijasah_ditunjukan_user_17656,jokowi hidup tenang solo sibuk ngurusi pilkada kalo ngomong plin plan,2025-05-01T05:42:16Z,0,18
Ijasah_ditunjukan_user_17685,yg bikin gaduh tp jokowi yg dituduh,2025-05-01T05:39:18Z,0,18
Ijasah_ditunjukan_user_17708,ga aja ijazah presiden ijazah jokowi tujukin ijazah mengusik kalo ga kerjaan cek perangkat negara perangkat desa,2025-05-01T05:37:35Z,0,18
Ijasah_ditunjukan_user_17740,lucu skali eh pk jokowi nglaporin kejer pk jokowi tega,2025-05-01T05:35:45Z,0,18
Ijasah_ditunjukan_user_17761,roy benci jokowi ga kebagian proyek koar koar,2025-05-01T05:34:16Z,0,18
Ijasah_ditunjukan_user_17764,jokowi pakai penjara hinaan dipenjara tuntutan dicabut dibebaskan,2025-05-01T05:34:11Z,0,18
Ijasah_ditunjukan_user_17772,percayalah gak habisnya pembenci jokowi tdk berhenti mengganggu keluarga jokowi roy panci tidur buih,2025-05-01T05:32:21Z,0,18
Ijasah_ditunjukan_user_17802,pikiran ank g ush ngelak emang dr dl orng pembenci jokowi,2025-05-01T05:32:00Z,0,18
Ijasah_ditunjukan_user_17801,majuterus jokowi,2025-05-01T05:31:07Z,0,18
Ijasah_ditunjukan_user_17819,r oi huru hara gaduh negara seakan r oi dkk kaum pembenci jokowi jokowi menjabat ujung ujung agenda busuk kaum pembenci menjatuhkan mas gibran mas kaesang biar namanya jelek,2025-05-01T05:29:58Z,0,18
Ijasah_ditunjukan_user_17849,roy suryo ahli abal masak ijazah jokowi aja analisa uda dibilang asli uda yg dihukum lo asikk jokowi aja yg disenggol senggol nampak kali yg gak kerjaan,2025-05-01T05:27:01Z,0,18
Ijasah_ditunjukan_user_17871,menggiring opini bapa jokowi buruk mempidanakan nya berbuat sesatu yg melanggar hukum ya trus dibilang coba krmin ditunjukin ijasanya hak menuntuk kewajiban bapa jokowi nunjukin ijasanya,2025-05-01T05:26:06Z,0,18
Ijasah_ditunjukan_user_17874,ngujinya sandingkan ijasa jokowi ijasa teman temannya kelulusannya bersamaan perbedaan,2025-05-01T05:25:54Z,0,18
Ijasah_ditunjukan_user_17881,p jokowi melapor krn sdh hai roy kayak yg sdh pinter aja,2025-05-01T05:25:31Z,0,18
Ijasah_ditunjukan_user_17951,lanjutkan jokowi biar pembenci hoax melulu,2025-05-01T05:16:26Z,0,18
Ijasah_ditunjukan_user_18002,suka jokowi sdh lengser presiden sma ketiga dirugikan jokowi ijaza s roy suryo motip pribadi pk jokowi,2025-05-01T05:16:13Z,0,18
Ijasah_ditunjukan_user_18010,kapolri diganti jokowi menang,2025-05-01T05:15:47Z,0,18
Ijasah_ditunjukan_user_18019,rs cengengas cengenges ngenes yg pikirannya tidur lantai kedinginan kena jebakan batman jokowi diam dikiran legowo sprt njabat presiden koar koar ijazah palsu dilaporkan kenadeh mengiba memohon jokowi wise tdk laporkan hukum pengecut,2025-05-01T05:14:44Z,1,18
Ijasah_ditunjukan_user_18021,loyalis jokowi up melebihi gabungan parpol ngak peduli ijasah asli palsu menunggu arahan jokowi,2025-05-01T05:14:38Z,0,18
Ijasah_ditunjukan_user_17835,polisi mapia terbesar yg bekingi jokowi,2025-05-01T05:12:44Z,0,18
Ijasah_ditunjukan_user_18044,giliran jokowi ngelaporin salah kalok jokowi diam ngelunjak,2025-05-01T05:11:50Z,0,18
Ijasah_ditunjukan_user_18064,jokowi mempidanakan roooooy roy statemen murahan bodoh indonesia iba gitu indonesia mendukung marah jokowi melaporkan orang gitu preeeet jauuuuuuh indonesia dukung jokowi meng adu domba indonesia gitu murahan,2025-05-01T05:10:25Z,0,18
Ijasah_ditunjukan_user_18083,kuasa hukum jokowi jokowi sdh pensiun biar kembsli kumpul dgn keluarga melaksanakan kegiatan sosial tp jomowi g sdh pensiun tp dibuk berpolitik nempel partai menuntun membentengi gibran,2025-05-01T05:09:18Z,0,18
Ijasah_ditunjukan_user_18092,semangat pk jokowi kendor merdeka,2025-05-01T05:08:51Z,0,18
Ijasah_ditunjukan_user_17835,jokowi mafia terbesar indonesia,2025-05-01T05:05:51Z,0,18
Ijasah_ditunjukan_user_18141,tujuh presiden aman tdk hina hujat hox jokowi aja emang,2025-05-01T05:05:08Z,0,18
Ijasah_ditunjukan_user_18151,masyarakat indonesia mendukung tindakan jokowi ente yg udah tau jokowi gak respon ente manfaatkan biat dapet nasi kotak media negara hukum bos fitnah mempidanakan maen bos rutan pondok bambu isinya hahahha,2025-05-01T05:04:33Z,0,18
Ijasah_ditunjukan_user_18173,pengacara mendampingi jokowi keuntungan kenyataannya jokowi kalah persidangan,2025-05-01T05:02:44Z,0,18
Ijasah_ditunjukan_user_18180,kalao ijazahnya asli pidanakan netizen yg membuli jokowi seumur hidup palsu pidanakan orang yg membela jokowi thn,2025-05-01T05:01:47Z,0,18
Ijasah_ditunjukan_user_18200,kuncinya ugm krna ugm yg tau keaslian ijazah jokowi ijazahnya dibuatkan tergantung ugm,2025-05-01T05:00:21Z,0,18
Ijasah_ditunjukan_user_18226,rombongan roysuryo yg meragu ijazah jokowi pemerintah,2025-05-01T04:58:07Z,0,18
Ijasah_ditunjukan_user_18228,apasih k untungannya roy prsoalkan ijasa pk jokowi,2025-05-01T04:58:00Z,0,18
Ijasah_ditunjukan_user_18243,pa jokowi pinter presiden taktik cerdik politik kaya main catur bro bodoh kalah yg setuju,2025-05-01T04:56:46Z,0,18
Ijasah_ditunjukan_user_18248,pendukung jokowi penjilat du dungu ga yg,2025-05-01T04:56:20Z,0,18
Ijasah_ditunjukan_user_18249,jokowi klu watak negarawan dri tunjukkan ijazahnya biar kegaduhan negri meluas jdi curiga knp jokowi sewa pengacara milyaran preman,2025-05-01T04:56:20Z,0,18
Ijasah_ditunjukan_user_18259,tolong melaporkan tim rektor ugm dekan fak kehutanan pemalsuan ijazah jokowi terlibat berbuat kriminal,2025-05-01T04:55:33Z,0,18
Ijasah_ditunjukan_user_18228,kebencian pk jokowi,2025-05-01T04:54:04Z,0,18
Ijasah_ditunjukan_user_18282,semoga allah tmenunjukkan kebohongan jokowi klau berbohong hancurnya indonesia gara jokowi mengembang biakkan koruptor,2025-05-01T04:53:52Z,0,18
Ijasah_ditunjukan_user_18293,klo jokowi bilang jalur hukum knp bambang tri gus nur penjarakan gara gara ijazah jokowi,2025-05-01T04:53:16Z,0,18
Ijasah_ditunjukan_user_18301,p jokowi maaf mantan presiden dikqgumi dunia mgp ngk utusan pengacara ap tim projo ngk kelas meladeni barisan sakit hati yg kemampuan kerja bacot sensasi media nol kerja rakyat irian jaya aj jokowi jd warga bangun irian negara,2025-05-01T04:52:41Z,0,18
Ijasah_ditunjukan_user_18228,kebencian pk jokowi,2025-05-01T04:52:39Z,0,18
Ijasah_ditunjukan_user_18339,jokowi emang g temn angkatan yah coba aja speak up,2025-05-01T04:50:09Z,0,18
Ijasah_ditunjukan_user_18382,nanggung kakau cuman ijasah jokowi ijasah pejabat dikroscek biar roy kerjaan,2025-05-01T04:48:10Z,0,18
Ijasah_ditunjukan_user_18402,roy byk bacot ndk hak liat ijazah jokowi,2025-05-01T04:46:47Z,0,18
Ijasah_ditunjukan_user_18326,iya jokowi warga warga licik,2025-05-01T04:45:20Z,1,18
Ijasah_ditunjukan_user_18437,ribut ribut jokowi menjabat periode berjasa negara bangsa,2025-05-01T04:44:37Z,0,18
Ijasah_ditunjukan_user_18453,gali kubur pk jokowi tinggal nimbun enak gk capek,2025-05-01T04:43:40Z,0,18
Ijasah_ditunjukan_user_18464,jokowi emang pembohong buktinya jokowi menyerahkan ijazahnya hakim ijazahnya serahkan ternak piaraan kesayangannya listio sigit,2025-05-01T04:42:37Z,0,18
Ijasah_ditunjukan_user_18505,wes ketebak akal akalane jokowi,2025-05-01T04:39:40Z,0,18
Ijasah_ditunjukan_user_18529,suryo mnggolo sngt bnci sm pa jokowi knp bs bgt klo mmng ga bnci ngpain sll mnghsut msrakt yg sdh td mmkirkn izasah pa jokowi krn pa jokowi sdh tdk mnjbt appun jd roy suryo maunya tjuan ny cm bnci pa jokowi mrip krno wlw bnyk brjuang untk bngsa tp ujung sm antek orba pnjra kn tnp asasa praduga ta brsalah,2025-05-01T04:38:09Z,0,18
Ijasah_ditunjukan_user_18560,ijazah jokowi asli menipu negara rakyat indonesia pemberian negara purna tugas haknya ijazah jokowi palsu indonesia menuntut negara menarik menyita harta kekayaan jokowi jokowi menjabat pemberian jasa negara purna tugasnya,2025-05-01T04:36:00Z,1,18
Ijasah_ditunjukan_user_18562,klu pendapat jokowi yg kegaduhan krn udh tunjukan,2025-05-01T04:35:57Z,0,18
Ijasah_ditunjukan_user_18567,roy suryo udah kebenarannya temen kuliah dll tp gk nyangka jokowi melaporkan politis sakit hati biar rakyat mencintai jokowi,2025-05-01T04:35:39Z,0,18
Ijasah_ditunjukan_user_18583,roy jokowi sang pemilik ijazah,2025-05-01T04:34:12Z,0,18
Ijasah_ditunjukan_user_18584,byk kejanggalan ijazah jokowi,2025-05-01T04:34:12Z,0,18
Ijasah_ditunjukan_user_18585,jokowi senang berbohong wataknya memalukan sifat bengis manusia penjilat yg percaya jokowi,2025-05-01T04:34:11Z,0,18
Ijasah_ditunjukan_user_18592,semoga ga perang yg suka ngak suka jokowi ma loossss,2025-05-01T04:33:40Z,0,18
Ijasah_ditunjukan_user_18630,jgn percaya dgn jokowi bajingan bandit pemhohong penghianat buktikan dgn ijazah aslinya pinter ngeles,2025-05-01T04:31:15Z,0,18
Ijasah_ditunjukan_user_18633,masarakat pk jokowi ok,2025-05-01T04:31:11Z,0,18
Ijasah_ditunjukan_user_18638,ijasah jokowi pelapor yg memenang perkara belah teliti berpolitik koruptor selesai jabatan jokowi presiden menagih janji yg sepakati bidang bisnis koruptor bnyak koruptor yg tertangkap balas dendam keluarga jokowi,2025-05-01T04:30:58Z,0,18
Ijasah_ditunjukan_user_18658,mendukung jokowi,2025-05-01T04:29:36Z,0,18
Ijasah_ditunjukan_user_18715,jokowi insinyur dizaman pinter selesai ragu banget sumpah kalo cerita orang kuliah tekhnik selesai sampe la jokowi gile,2025-05-01T04:26:44Z,0,18
Ijasah_ditunjukan_user_18725,yth nara sumber jokowi publik etika kejujuran,2025-05-01T04:26:08Z,0,18
Ijasah_ditunjukan_user_18737,tunjukkan ijasah aslimu jokowi diteliti skripsinya forensik dinyatakan asli palsu seandainya palsu hutang negara diakibatkan perilaku jokowi jokowi bertanggungjawab hutang²nya kompensasi apapun negara,2025-05-01T04:25:40Z,1,18
Ijasah_ditunjukan_user_18745,jokowi melapor biar ber damai ijasah nya bongkar lobi lobi jokowi olah menakut nakuti r s dkk,2025-05-01T04:24:51Z,0,18
