author,text,published_at,like_count,cluster
user_31745,mampus kau roy suryo egy sujana,2025-04-30T14:36:08Z,2,16
user_31763,roy suryo orang jahat yg gak puas cari kesalahan orang masyarakat stop stop stop kau jahat kau jahat orang yg jdi korban rekayasa kebohongan kmu roy suryo,2025-04-30T14:35:36Z,0,16
user_31765,kebodohan pertontonkan rakyat indonesia kau terimalah konsekwensinya kau masuk lobang yg kau senang tidur hotel prodeo,2025-04-30T14:35:32Z,0,16
user_31674,mampuuuuzzz kau roy kroninya,2025-04-30T14:35:08Z,0,16
user_31840,palsu asli untungnya hidup kau netijen,2025-04-30T14:32:56Z,0,16
user_31832,org gila yg dukung kau beserta antekantek mu roy masyarakat yg mendukungmu kau gaduh,2025-04-30T14:29:46Z,0,16
user_31972,udahlah ga ush bacot kau roy tggu aja pengadilan buktikan yg,2025-04-30T14:28:50Z,0,16
user_31975,woiii roy panci kau rismon ditunggu joshua gk berani bertemu klarifikasi omong kau,2025-04-30T14:28:43Z,0,16
user_32057,tameng nya wkkwkw lucu kau babi,2025-04-30T14:26:48Z,0,16
user_32078,jgn kripik kau suryo kau sepelekan jokowi kau bilang kriminalisasi kau yg gara i kriminal x kripik kau,2025-04-30T14:26:13Z,0,16
user_31868,suka fitnah kau roy rakyat mendukung jokowi widodo,2025-04-30T14:22:19Z,7,16
user_32201,bicara jokowi otaknya roy suryo dkk pertanggung jawabkan kau perbuat kau bilang dikriminilasi putusan pengadilan,2025-04-30T14:22:17Z,0,16
user_32268,aja kau bui menteri tutup panci,2025-04-30T14:20:15Z,0,16
user_32322,kau bersuara roy nampak panci,2025-04-30T14:19:14Z,0,16
user_32409,roy kapasitasnya opo uji ijazah orang bohong kau roy,2025-04-30T14:14:37Z,0,16
user_32623,pupu papa kmna roy kacau pengacau propokator smoga kau penjara sengsara,2025-04-30T14:12:00Z,0,16
user_32707,wajahhmu royyy kyknya sdh kncing celana kau situ,2025-04-30T14:09:45Z,0,16
user_32757,aja kau rs tukang gaduh aja kau giliran dilaporin ketar ketirn nya kau masuk buih ga adil katamu hadeuuuuhhhh panci pancinya bang tolong dikembalikan,2025-04-30T14:08:27Z,0,16
user_32767,masyarakat indonesia ulah enak aja kau roy keliatan kau udah blunder pokoknya tahan terbukti bersalah roy gemar membawa ilmiah ilmiah uji ijazah tangan jokowi menganalisis ijazah aslinya asli aslinya tangan jokowi lucu roy langsung panci liat kau,2025-04-30T14:08:08Z,0,16
user_32768,tunjukan ijazah aslinya gak bacot rakyat indonesia berhenti jokowi tunjukan ijazah aslinya tunjukan tunjukan ijazah asli jokowi kau bohobgi kau tipu rakyatmu jahat kau raja tipu raja bohong janji borong alat pertanian produk anak bangsa bohong janji borong mobil esemka nipu janji sertifikat tanah rakyat rempang tanah dirampok janji gak hutang negeri hutang menggunung,2025-04-30T14:08:07Z,0,16
user_32814,roy roy kau,2025-04-30T14:07:01Z,0,16
user_32820,roy kau busuk penjara,2025-04-30T14:06:58Z,0,16
user_33048,mampussss kau panci pakar telematika abal persidangan kau hadapi ahli digital forensik yg sesungguhnya kebusukan mu terbongkar maju jokowi,2025-04-30T14:01:23Z,0,16
user_33033,kau bahas ijasah habis lari skripsi,2025-04-30T14:00:31Z,0,16
user_33033,yg kau goblok roy kau org ijasah lihat kau pikir mantan presiden periode yg dicintai rakyat kau mencemarkan nama org nomor hakmu paksa org ijazah manusia kesabaran kau berkoar koar sakit hati balas dendam,2025-04-30T13:59:36Z,0,16
user_33156,kasian kau suryoo nangis kau,2025-04-30T13:59:06Z,0,16
user_33338,masukan penjara aja masayrakat kapala lu peang masyarakat bodok yg dukung kau,2025-04-30T13:55:28Z,0,16
user_33420,alasan kau ugm dah berbwlit kau roy sok kau yg,2025-04-30T13:53:25Z,0,16
user_33463,muncung mu bilang mantan presiden mempidanakan kemarin muncung mu koar gak terkontrol dimana hati nurani mu saudara pembenci jokowi kah kau menghancurkan kehormatan nya pribadi memikirkan dampak sosial keluarga nya dimana kau letakkan otakmu haaaa,2025-04-30T13:52:17Z,0,16
user_33502,orang gini kali mulut kau rs kali kek dibayar kau,2025-04-30T13:51:32Z,1,16
user_33479,kau aja gak jujur bs hukum jg,2025-04-30T13:51:17Z,0,16
user_33548,ijazah skrip kau teman kau ugm mencurigakan roy cobak tunjukkan skripsi ijazah mu,2025-04-30T13:50:32Z,0,16
user_33549,cengengesan lo roy klo dah masuk sel tekaing kaing kau,2025-04-30T13:50:25Z,0,16
user_33683,kriminalisasi woy roy jokowi hak hukum giliran beliau laporan kau anggap kriminalisasi yg gentle pakar pecundang,2025-04-30T13:47:39Z,0,16
user_33690,bentuk ketakutannya suryo aja kau sur,2025-04-30T13:47:31Z,0,16
user_33703,wo mengoceh tau malu kau roy juri besi mah ringan tanggung andaikaya jakowi bohong kau soryo menanggu dosa yg karma menghibah orang orang yg mendengar percaya mu kau tambahan dosa kau m gk menyelamatkan kau rekan mu you will deserve with what you do,2025-04-30T13:47:18Z,0,16
user_33830,roy panci gk bawa bawa masyarakat kau kau bawa cs mu kepenjara bawa panci ngerebus ijazah palsu yg kau tuduhkan bpk jokowi,2025-04-30T13:44:10Z,0,16
user_33848,membusuk kau penjara roy panci,2025-04-30T13:43:47Z,0,16
user_33873,kebanyakan ngeles sdh orang dihukum gara ijazah ugm sdh dg aturan jokowi sampe purna kau serang otakmu dmn knapa tdk mantan presiden krn kau sakit hati gara dipecat perkara ijazah tdk disidang urusan hakim kau mmg cari penyakit resikonya jgn bilang dikriminalisasi baju orange sdh disiapkan bsm gerombolanmu salam waras,2025-04-30T13:42:53Z,0,16
user_33938,jokowi buktiin ijazah asli kau tunjukan kau pembohong kau udah bayar orang yg berkepentingan jokowi kau ijasah nya palsu antas aja kau presiden terkorupsi dunia bulseeet jokowi,2025-04-30T13:41:46Z,0,16
user_33933,mampus kau roy suryo terpancing kau kebenaran jokowi,2025-04-30T13:40:26Z,0,16
user_33639,habis kau roy dokter ilmiah yg g peduli kalo mencemarkan nama orang kau diseret kau g hak menuduh orang,2025-04-30T13:39:40Z,0,16
user_34109,mampuslah kau jok,2025-04-30T13:38:09Z,1,16
user_34128,kau tu tuntut pidana roy lu berbicara aja loe masuk penjara,2025-04-30T13:37:52Z,0,16
user_34166,mampos kau panci,2025-04-30T13:37:11Z,0,16
user_34447,mampuslah kau roiyuryo,2025-04-30T13:31:50Z,0,16
user_34479,la bukti yg kau omongkan roy,2025-04-30T13:31:17Z,0,16
user_34570,kenasih koau susah cuman kau tunjukan kau berati anjing buktikan ijahsah,2025-04-30T13:29:47Z,0,16
user_34346,o hrs kau sdh koar lg ko,2025-04-30T13:29:30Z,0,16
user_34619,loh panci twrtawa huhahehe bentar kau pakai baju rompi orange modyarrrrr kau,2025-04-30T13:28:48Z,0,16
user_34624,ketawa panci kau menangis hahaha,2025-04-30T13:28:44Z,0,16
user_34642,busuk kau roy panci penjara,2025-04-30T13:28:35Z,0,16
user_34683,kau mentri kau ijazah asli kau dasar oblis,2025-04-30T13:27:48Z,0,16
user_34714,kau yg nuduh palsu izasah kau sendirilah yg buktikan bikin ribut aja roi,2025-04-30T13:27:16Z,0,16
user_34848,kau roy mendekam penjara,2025-04-30T13:25:20Z,1,16
user_34655,joko sumber mala petaka kau,2025-04-30T13:24:36Z,0,16
user_34624,halah roy roy kasian kali nangis kau,2025-04-30T13:22:59Z,0,16
user_34655,kebohongan hancur jokowi tuhan yg mengadili kau,2025-04-30T13:22:25Z,0,16
user_35063,mampus kau roy,2025-04-30T13:21:37Z,0,16
user_34683,kau pikir roy perempuan kebal hukum perempuan bersalah dihukum saudara roi pintar mencari kesalahan dituduhkan jokowi kau masuk penjara,2025-04-30T13:20:48Z,0,16
user_35166,kepala kau abal panci,2025-04-30T13:19:42Z,0,16
user_35236,ilmiah kepala lo roy kau yg gaduh dasar ember mulut kau yg kau uji poto ijazah ijazah aslinya bpk jokowidodo dn bpk jokowi nunjukin ijazah gromboln ndak,2025-04-30T13:18:43Z,0,16
user_35367,orang jawa bilang sopo salah seleh hati kau bang,2025-04-30T13:16:44Z,0,16
user_35504,kau roy sdh ciut kau roy manusia hoblok kau,2025-04-30T13:14:21Z,0,16
user_35309,putar balikan fakta si roy kau aja yg kepoo,2025-04-30T13:13:30Z,0,16
user_35692,bos jgn bawak nama masarakat kau yg kerjaan,2025-04-30T13:11:11Z,0,16
user_35335,mampus kau roi,2025-04-30T13:10:37Z,0,16
user_35739,alah si roy suryo ijazah kau gimana,2025-04-30T13:10:20Z,0,16
user_35929,roy suryo gak kerjaan bner hadehh kau pakar tele tele,2025-04-30T13:07:30Z,0,16
user_35952,gk pa duo rs masuk rumah sel mampus kau dgn krucuk kau,2025-04-30T13:07:00Z,0,16
user_36041,senyum panik muka panci kena kau,2025-04-30T13:05:37Z,0,16
user_36050,licik roy panci ngapain bilang biar masyarakat menilai kau bawa masyarakat kepentinganmu politik membusuklah kau penjara,2025-04-30T13:05:31Z,0,16
user_35535,enak aja kau yg resah trus asli selesai enak aja,2025-04-30T13:05:19Z,0,16
user_36070,palsu roy suryo kepala kau peang suryo dipenjara kau roy jgn alasan kau ya pura sakit nnti kau hotel mu,2025-04-30T13:05:14Z,0,16
user_36076,kau roy suryo penyakit hatimu,2025-04-30T13:05:09Z,0,16
user_36138,gemetar kau roisurio skrg kau lempar bola panas orang partai kau bobo dlm sel,2025-04-30T13:04:10Z,0,16
user_36234,ngawur si roy suryo kau yg mendalilkan kau yg hrus buktikan skrng kau ngeyel dgn preming pidanakan resiko roy jngan kau ketakutan llu sembarangan mayoritas rakyat tdk mendukungmu,2025-04-30T13:02:11Z,0,16
user_36260,masyarakat indonesia biar menilai menilai kau roy,2025-04-30T13:01:35Z,0,16
user_36411,mampuss kau roy sury sok pintar nilai orang,2025-04-30T12:58:43Z,0,16
user_36418,maling panci sebentar masuk penjara kau rasakan cegegesan,2025-04-30T12:58:39Z,0,16
user_36507,roy suryo pd tunggu kau penjara,2025-04-30T12:56:56Z,0,16
user_36714,egk tunjukan kau suryo tunggu episode selanjut nya,2025-04-30T12:52:47Z,0,16
user_36864,roi kau bodoh,2025-04-30T12:49:28Z,0,16
user_36887,kau merendahkan almamatermu memalukan,2025-04-30T12:48:45Z,0,16
user_36898,menangis kau pembenci,2025-04-30T12:48:35Z,0,16
user_36903,masuk kau roy,2025-04-30T12:48:27Z,0,16
user_36931,masyarakat kau bilang roy cinta jokowi,2025-04-30T12:47:55Z,0,16
user_36966,roy suryo ahli digital tpi ahli nyolong panci nyahookkkk kau karma sdh kau makan,2025-04-30T12:47:13Z,0,16
user_36974,roy luuuu tuuuhh maen diksi seenak udel giliran p jokowi melaporkan kuntilanak lu berdiksi matan presiden melaporkan pas kuntilanak kelakuannya sontoloyooo bangeeettt kau cengengesan siaaaapp kau dipenjara yaaaa wkwkwk wkwkwk,2025-04-30T12:47:02Z,0,16
user_36993,panik kau dek dilaporin,2025-04-30T12:46:29Z,0,16
user_36997,suryo kau bodoh lucu,2025-04-30T12:46:20Z,0,16
user_37160,tunjukkan ijazah didepan polisi kutukupret tunjukkan lgsg media mul meresahkan kau,2025-04-30T12:41:50Z,0,16
user_37169,ketawa kau tunggu masuk sel,2025-04-30T12:41:36Z,0,16
user_36315,yg biak kau roy masuk pnjara dlu bru tunjukin,2025-04-30T12:41:29Z,0,16
user_37181,roy roy hatimu penuh dengki yg kau bangsa kau bikin gsduh tujuan mu sehat jokowi biar yg salah buktikan pengadilan dikit biar masyarakat tau roy cari panggung masyarakat pingin hidup damai gak kau giring opini mu,2025-04-30T12:41:19Z,0,16
user_36695,luh roy suryo dkk klau ngomong jng jeplak nanya jgn langsung bil palsu terali besi nunggu modar kau,2025-04-30T12:38:26Z,0,16
user_36734,urusannya mantan persiden jokowi warga sipil beliau memiliki hak hukum roy cs ikutilah hukum yg berlaku negara berani berbuat berani bertanggung terimalah konsekuensinya ga bawa² rakyat stoplah menggiring opini memecah belah bangsa kau roy cs layak dipidanakan bikin gaduh kontribusi kau negara apa²nya dibandingkan jokowi panci kau angkut memalukan,2025-04-30T12:38:22Z,0,16
user_37220,njirrr pefitnah kau panci,2025-04-30T12:37:25Z,0,16
user_37414,bawa bawa masyarakat goblok masyarakat y kau,2025-04-30T12:34:33Z,0,16
user_37461,kau hakmu menguji dokumen ijin pemilik dokumen kau melanggar hukum meneliti dokumen menyebarluaskan melaui media ijin pemilik dokumen,2025-04-30T12:32:38Z,0,16
user_37437,emang kl ngga bole dipidana belajar dr mn kau roy,2025-04-30T12:29:22Z,0,16
user_37587,ngak omon kau suryo,2025-04-30T12:27:02Z,0,16
user_37598,kurangi gayamu rismon paktor bencinya kau panci udah ngak gunanya orang penjarakan aja orang yg gaduh bawak nama masyarakat panci orang kau ajanya tuh,2025-04-30T12:26:34Z,0,16
user_37587,jgan kabur kau roy panci,2025-04-30T12:25:38Z,0,16
user_37670,roy panci ntar kau dekam penjara fitnah hukumannya berat,2025-04-30T12:21:18Z,0,16
user_37093,ketakutan kau pencuri panci,2025-04-30T12:15:27Z,0,16
user_111,hina rakyat yg kau zalimi,2025-05-07T10:19:26Z,2,16
user_136,kau gelaplah kau roy,2025-05-07T00:45:39Z,0,16
user_142,kau hina penipu rakyat,2025-05-06T23:56:52Z,0,16
user_160,kalo gak urusan polisi kau jaga ituh mulut jgn fitnah wahay roy suryo cs masuk penjara,2025-05-06T18:56:41Z,0,16
user_492,kau manusia hina dunia akherat,2025-05-05T13:44:34Z,0,16
user_505,peribahasa kau tanam kau tuai nanam sih,2025-05-05T13:33:31Z,19,16
user_506,hajar terkencing celana biar tau hadiah orang yg iri dengki hati nya busuk ikatan otak nya sdh normal ya aja kau panci jgn bual kau sdh merasakan ya akibatnya manusia sombong panci aja embat mikir muka tembok yg kasih kotoran kebo,2025-05-05T13:33:15Z,0,16
user_587,kau roy surya persen kmi psti dipenjara,2025-05-05T12:21:39Z,0,16
user_624,mampus kau roy suryo tifa rismon cs manusia berguna anak haram bangsa indonesia malu melahirkan menangislah penjara,2025-05-05T11:54:43Z,0,16
user_660,dasar ray panci kelak kau orang bangkrut,2025-05-05T11:25:31Z,0,16
user_670,busuk kau panci penjara,2025-05-05T11:17:43Z,0,16
user_711,ijasah mu asli kau bilang orang menghinamu,2025-05-05T10:58:17Z,0,16
user_733,terhinakan hina jok semoga kau hinakan tanah,2025-05-05T10:46:17Z,0,16
user_819,klo ngak d hina bos kasih liat ijazah kau jd beres kau,2025-05-05T10:04:21Z,0,16
user_834,sihh susahnya kau tunjukan ijazahmu publik jok org ruwetttt skli,2025-05-05T10:00:06Z,2,16
user_587,kau kds lbuan ditmbk mti,2025-05-05T15:23:47Z,0,16
user_656,yg kau mahmud so tua ngana,2025-05-05T13:59:30Z,0,16
user_200,ngomong kau rismon batak,2025-05-28T13:43:33Z,0,16
user_227,nampak kau pembohong nya,2025-05-28T03:00:06Z,0,16
user_253,melawan jokowi ga karna berkuasa tp hati kau sma org jujur,2025-05-27T15:02:47Z,0,16
user_835,dah ingetin bambang pacul lawan orang org cantik kalah kau,2025-05-23T02:17:41Z,0,16
user_967,besok pitnah yg kau ciptakan roy suryo sya nhefhan trnyata biang rusuh,2025-05-22T13:37:09Z,0,16
user_1236,truslah kau betbohong kasihan jd org yg merugi,2025-05-21T10:04:15Z,0,16
user_1322,ketar ketir pemfitnah hayo kau jokowi biar kapok,2025-05-21T00:09:26Z,0,16
user_1331,hai runyam turun tanganlah jokowi tunjukan publik sdh kau sibuk membela orang yg mbalelo,2025-05-20T22:46:30Z,0,16
user_2286,bambang pacul lawan kalah kau kalahh semoga roy panci tobatt,2025-05-18T15:56:35Z,0,16
user_3121,kau liat kamera klo ngomong bro,2025-05-18T00:12:31Z,0,16
user_3210,kau sibuk foto tunjukan ijasahmu biar bandingkan koar tmn mah pembohong jg ngaku,2025-05-17T23:20:11Z,0,16
user_3948,nampak bohong nya kau,2025-05-17T14:34:03Z,0,16
user_4507,jangkrik nunjukin poto kalangkabut tu telunjuk dosa kau lakukan,2025-05-17T13:05:57Z,0,16
user_4515,ingatlah toha kau mati jokowi membantu kesaksian bohong kau,2025-05-17T13:03:44Z,0,16
user_4693,alamatttt game over kau royyyy,2025-05-17T12:49:15Z,0,16
user_4880,penjelasanmu menunjukan kebohonganmu baca imik wajah kau ngomong,2025-05-17T12:34:57Z,0,16
user_4918,ah bohong kau,2025-05-17T12:32:09Z,0,16
user_4920,klau gt ceritanya hbislah kau roy suryo konco nya,2025-05-17T12:31:52Z,0,16
user_5327,saksi palsu modar dipenjara kau,2025-05-17T12:07:18Z,1,16
user_5588,kau bingung sebutkan foto jokowi taeik,2025-05-17T11:45:07Z,0,16
user_5826,dunia la cakap pengadilan allah kau tau la,2025-05-17T11:20:50Z,0,16
