author,text,published_at,like_count,cluster
Ijasah_ditunjukan_user_13211,sukurin semoga terlibat tangkap ahirnya gali lobang bodoh yaa bodoh aja kelewatan bangat pahlawan kesiangan hukum penjarakan orang orang berguna terimakasih yaa allah karna engkau melindungi orang orang,2025-05-01T17:12:34Z,0,15
Ijasah_ditunjukan_user_13222,emang salah mempidanakan orang salah engga dipidanakan pk roy,2025-05-01T17:09:28Z,0,15
Ijasah_ditunjukan_user_13230,mari berdo a semoga negara aja hilangkan orang keblinger,2025-05-01T17:05:20Z,0,15
Ijasah_ditunjukan_user_13232,ijazah aja ributin bnr bnr orang orang idiot,2025-05-01T17:03:08Z,0,15
Ijasah_ditunjukan_user_13240,hukum tegakkan setegak tegaknya biar jgn lecehan orang orang pa kyk roy suryo jgn tegak rakyat tegak tajam adil intervensi pandang bulu,2025-05-01T17:02:01Z,0,15
Ijasah_ditunjukan_user_13259,maunya roy orang bebas bicara menghina orang bebas gitu,2025-05-01T16:57:50Z,0,15
Ijasah_ditunjukan_user_13266,orang jujur menguji kejujuran orang orang tidah jujur,2025-05-01T16:55:50Z,0,15
Ijasah_ditunjukan_user_13275,mudah²an inazah jokowi asli biar si rs dkk penjarakan seumur hidup biar tau ras gmn kalo orang kerjaan,2025-05-01T16:52:53Z,11,15
Ijasah_ditunjukan_user_13276,bang suryo ngapain ngurusin ijajah orang kaya ga kerjaan ajah pa jokowi biar mata suryo terbuka,2025-05-01T16:52:46Z,0,15
Ijasah_ditunjukan_user_13302,muka tembok kw roy suryo manusia tidk tau malu bagus buktikan hidup bangkit orang yg mati biar hidup percaya salam kalbar,2025-05-01T16:40:49Z,0,15
Ijasah_ditunjukan_user_13321,teruntuk orang yg ijazah orang tolol forensik ijazah gak tolol audit ya pembayaran kuliah nya sedari kuliah bukti pembayaran perkuliahan,2025-05-01T16:37:45Z,0,15
Ijasah_ditunjukan_user_13343,kapasitas roy suryo jd maksa banget pengen tau ijazah pa jikowi jokowi dah lengser msh aj obok obok ama si suryo pantes klo jokowi mrlaporkan orang orang perusuh,2025-05-01T16:28:43Z,0,15
Ijasah_ditunjukan_user_13364,g krjaan ngurusin orang,2025-05-01T16:22:40Z,0,15
Ijasah_ditunjukan_user_13372,emang orang kerjaan ngotot biar panggil panggung tv ragu lulusan ugm iya lulusan ugm hasil nya orang udah nuduh bukanya nunjukin bukti lho buktinya ijasahnya palsu orang yg ijasah bikin ribet trus roy suryo tuduh maling panci ga buktiin si roy maling panci masyarakat setuju orang biarin tp ngrecokin ya laporin giliran laporin suruh rakyat yg menilai menilainya ya lu lu yg ngeributin ijasah palsu orang bego kerjaan,2025-05-01T16:18:48Z,0,15
Ijasah_ditunjukan_user_13403,jokowi dipercaya keaslian dimenangkan pengadilan semudah jokowi dilepas bebaskan intinya sejujur apapun dipercaya pemimpin lulusan sma bijak indonesia orang pintar krisis orang biarlah pintar,2025-05-01T16:08:22Z,0,15
Ijasah_ditunjukan_user_13432,orang kerjaan,2025-05-01T16:02:57Z,1,15
Ijasah_ditunjukan_user_13440,orang g otak,2025-05-01T16:00:45Z,0,15
Ijasah_ditunjukan_user_13443,semakim cepat bagus buang kerok yg bikin riweh penjarakan biar damai males liat orang omon,2025-05-01T15:59:46Z,0,15
Ijasah_ditunjukan_user_13454,orang pinter bodoh orang menuduh ijazah palsu ijazah aslinya lucu ya,2025-05-01T15:56:56Z,0,15
Ijasah_ditunjukan_user_13458,roi surya orang gawean orang jawa bilang,2025-05-01T15:54:59Z,0,15
Ijasah_ditunjukan_user_13460,indonesia butuh ijaza butuh orang jujur kerja yata goblok,2025-05-01T15:53:37Z,0,15
Ijasah_ditunjukan_user_13460,orang iri repot gini salah gitu salh,2025-05-01T15:52:29Z,3,15
Ijasah_ditunjukan_user_13481,tdk membela plg benci dg orang yg suka ngurusin urusan orang,2025-05-01T15:50:43Z,0,15
Ijasah_ditunjukan_user_13484,hak orang ijasah,2025-05-01T15:49:53Z,0,15
Ijasah_ditunjukan_user_13497,biarin aja gengnya roy suriyo yg tukang koar urus urusan yg tdk produktif seret aja jokowi biar malu biar membusuk penjara orang tdk tau roy suriyo pencuri uang negara pencuri panci penjara jokowi maju rakyat dukung seret orang pengacau negara,2025-05-01T15:43:41Z,0,15
Ijasah_ditunjukan_user_13524,orang gila rs,2025-05-01T15:42:52Z,0,15
Ijasah_ditunjukan_user_13539,jokowi engkau presiden terbaik didiamkan dibuktikan dipercaya orang berusaha membusukkan akal hatinya orang menganiayai na uzubillah,2025-05-01T15:39:55Z,0,15
Ijasah_ditunjukan_user_13595,orang gk da kerjaan,2025-05-01T15:26:33Z,0,15
Ijasah_ditunjukan_user_13604,orang orang pintar bangun negara bangsa eeee bikin ulah terusan termakan bisikan setan karna ga ngendalikan ga habisnya,2025-05-01T15:25:22Z,0,15
Ijasah_ditunjukan_user_13610,kalo percaya orang pemerentahan jujur masuk kerja sumpah pakai alquran verivikasi kpu walikota gubernur presiden yg mencurigakan kadang koruptor penipu pertamax oplos ljasah mudah pembuktianya berbelit orang jawa tau berani takut salah pepatah jawa bro hasto penjara udah selesai hahaha,2025-05-01T15:24:32Z,0,15
Ijasah_ditunjukan_user_13614,orang orang yg mengaku ahli peneliti menemukan batu sandungannya lupa dg keahlian yg sandangnya,2025-05-01T15:23:25Z,0,15
Ijasah_ditunjukan_user_13620,takut si sukro memaksa orang dokumen pribadinya itukan privasi orang tuduh sukro pantatnya kutil tunjukkan pantatnya publik kutilnya,2025-05-01T15:22:27Z,1,15
Ijasah_ditunjukan_user_13686,indonesia bnyk orang lucu aneh gamblang suruh nunjukin ijasah aja ribetnya main dah ketauan tu boroknya,2025-05-01T15:10:39Z,0,15
Ijasah_ditunjukan_user_13687,ngaku pintar kayak gitu orang diadili gantian diadili bicaranya,2025-05-01T15:10:36Z,0,15
Ijasah_ditunjukan_user_13717,orang sakit hati munkin percaya si suryo,2025-05-01T15:06:50Z,0,15
Ijasah_ditunjukan_user_13713,tdk jokowi tdk laporkan yg terjerat hukum niat orang orang tdk berkeliaran alam bebas tdk bikin gaduh dg mata to tdk mata mayoritas rakyat indonesia tdk sadarkah sdh mencemarkan nama orang ugm sdh anggap ugm mengeluarkan ijasah palsu jokowi,2025-05-01T15:02:55Z,0,15
Ijasah_ditunjukan_user_13740,presiden berhati orang pintar dipolitik yg mengalihkan menghambat indonesia maju,2025-05-01T15:01:57Z,0,15
Ijasah_ditunjukan_user_13771,orang panik stress,2025-05-01T14:56:02Z,0,15
Ijasah_ditunjukan_user_13799,orang dongo ijazah asli kpd orang yg mefitnah sekian,2025-05-01T14:50:08Z,0,15
Ijasah_ditunjukan_user_13809,kasih ampun masukan orang penjara tunggu kabarnya rs masuk penjara,2025-05-01T14:49:17Z,0,15
Ijasah_ditunjukan_user_13818,jani orang pendendam terjerumus mengendalikan emosi,2025-05-01T14:48:01Z,0,15
Ijasah_ditunjukan_user_13859,orang terbuang mencari panggung exsis mencari panggung politik,2025-05-01T14:38:42Z,0,15
Ijasah_ditunjukan_user_13866,orang idonesia,2025-05-01T14:37:36Z,0,15
Ijasah_ditunjukan_user_13873,tuduhan rs dikenal maling panci dasarnya masyrakat luas kebencian jokowi orang picik didengarkan semoga hukum menghukum orang,2025-05-01T14:36:42Z,0,15
Ijasah_ditunjukan_user_13913,dipikir pikir ngapain ngurusin ijazah orang mending mikirin hidup gimna biar kehidupan senang,2025-05-01T14:30:05Z,0,15
Ijasah_ditunjukan_user_13914,orang ngak kerjaan tu,2025-05-01T14:30:01Z,0,15
Ijasah_ditunjukan_user_13892,emang orang ky gini mh dibiarkan buang kelaut,2025-05-01T14:28:23Z,0,15
Ijasah_ditunjukan_user_13928,orang ngeyel angel penjara aja,2025-05-01T14:27:27Z,0,15
Ijasah_ditunjukan_user_13937,orang pinter adu bacot orang yg sekolah otaknya jongkok bacotnya lbih dripada rakyat yg sekolah orang tau adab moral orang mengatas nama rakyat utk kedok kegobl g an,2025-05-01T14:26:06Z,0,15
Ijasah_ditunjukan_user_13942,yg lucu ko wali kota gubernur berjalan ko aneh aja orang orang yg mempermasalahkan lucu aja,2025-05-01T14:25:00Z,0,15
Ijasah_ditunjukan_user_13952,orang kerjaan pengen cari muka doang membahas miris negeri dibahas ganti presiden bagus ekonomi bobrok,2025-05-01T14:22:25Z,0,15
Ijasah_ditunjukan_user_13971,orang lau udh benci sm orang wlpn orang mencari kslhannya namanya org yg iri dengki cocoknya d suka adu domba ato provokator,2025-05-01T14:18:23Z,0,15
Ijasah_ditunjukan_user_13975,roy suryo gak malu urus ijazah orang urus ijazah kayak orang bener aja orang bejat k negara d pssi,2025-05-01T14:17:23Z,0,15
Ijasah_ditunjukan_user_13977,tujuannya utk mencari kebenaran tp mempermalukan orang,2025-05-01T14:17:02Z,0,15
Ijasah_ditunjukan_user_13999,hidup diindonesia merasakan senang presiden jokowi bantuan orang miskin anak sekolah didesa bantuannya sasaran orang orang yg,2025-05-01T14:13:31Z,6,15
Ijasah_ditunjukan_user_14008,orang sabar batasnya mhi jokowi bersabar slama orang yg kerjaan mecari kesalahan orang jokowi mantan presiden yg jasa negri,2025-05-01T14:12:24Z,0,15
Ijasah_ditunjukan_user_14010,yg dlu memimpin tp suka ngibul jd dipercaya orang,2025-05-01T14:11:58Z,0,15
Ijasah_ditunjukan_user_14032,sehat sllu jokowi semoga orang yg sllu zalim kpada hidayah dimusnahkan dunia,2025-05-01T14:06:42Z,1,15
Ijasah_ditunjukan_user_14069,fitnah keji apapun serang orang orang kena makanyya fitnah lwan terang,2025-05-01T13:58:51Z,0,15
Ijasah_ditunjukan_user_14111,harap pa jokowi melihatkan ijazahnya biarkan orang orang bingung lucu s s kaya orang aja,2025-05-01T13:51:33Z,0,15
Ijasah_ditunjukan_user_14125,km orang bersih,2025-05-01T13:48:10Z,0,15
Ijasah_ditunjukan_user_14153,yaaa allah tunjukan kebesaran mu orang orang bazingan bazingan tengiik megara,2025-05-01T13:42:55Z,0,15
Ijasah_ditunjukan_user_14169,orang orang lucu nuduh kc yg dituduh yg hrus buktikn menuduh bukti n mmbuktikn sperty nuduh orang maling berani mnuduh kn hrus buktinya lha yg dituduh disuruh mmbuktikn lucu pda dasarnya kebencian dlm hti,2025-05-01T13:40:06Z,0,15
Ijasah_ditunjukan_user_14188,lucu orang pergi orang indonesia ngurusi n yg gk,2025-05-01T13:35:49Z,0,15
Ijasah_ditunjukan_user_14229,ijazah orang melaporkan kepalsuan izajah pk jokowi mendetail,2025-05-01T13:27:59Z,1,15
Ijasah_ditunjukan_user_14232,rombongan orang orang usil norak wajib pelajaran berat berat nya,2025-05-01T13:27:33Z,0,15
Ijasah_ditunjukan_user_14243,hidup nya suka sakit hati orang penyakit sakit hati gak sembuh,2025-05-01T13:25:18Z,0,15
Ijasah_ditunjukan_user_14245,harga roi suryo ngapain tujukan orang yg ngak berwenang roi suryo kawan kawan orang ngak aturan sampah yg nga berguna ngapain nanai ijasah lho suryo ddk,2025-05-01T13:25:01Z,0,15
Ijasah_ditunjukan_user_14263,karna bebas vikna orang memaki orang laporkan enak kali ngomong roy suryo enaknya aja republik bikin ribut aja media,2025-05-01T13:22:13Z,0,15
Ijasah_ditunjukan_user_14268,menguji netral orang nuntut,2025-05-01T13:21:32Z,2,15
Ijasah_ditunjukan_user_14275,orang idiot yg bela orang sakit hati fakta yg pikiran,2025-05-01T13:19:52Z,0,15
Ijasah_ditunjukan_user_14340,uu perampasan aset diurus ijasah jokowi negara sungguh suka orang senang dgn oknum orang yg korupsi,2025-05-01T13:06:27Z,0,15
Ijasah_ditunjukan_user_14392,ijasahnya tunjukkan roy kapasitas lu edan orang,2025-05-01T12:58:58Z,0,15
Ijasah_ditunjukan_user_14403,bpk jokowi orang laporkan sj orang sirik,2025-05-01T12:57:25Z,0,15
Ijasah_ditunjukan_user_14413,ngomong orang bodoh,2025-05-01T12:55:31Z,0,15
Ijasah_ditunjukan_user_14433,cepat jokowi ngilbas rombongan orang,2025-05-01T12:52:25Z,0,15
Ijasah_ditunjukan_user_14401,aja mencari kesalahan orang pidanakan,2025-05-01T12:52:23Z,0,15
Ijasah_ditunjukan_user_14441,dilaporkan jkw karna tujuannya orang orang menghembus menerus ijasah palsu jkw menciptakan keragu raguan mata masyarakat bangsa internasional yg bersangkutan melaporkan manusia manusia bodoh menyerang posisi wapres tujuan diambil tindakan menghentikan ilmiah selidiki informasi ijasah palsu yg ngaku pakar pakar bodoh tolol pura pura bodoh,2025-05-01T12:49:34Z,0,15
Ijasah_ditunjukan_user_14442,sbenarx orang bodoh yg nganggap presiden make izasah palsu,2025-05-01T12:49:07Z,0,15
Ijasah_ditunjukan_user_14475,usut tuntas tangkap orang orang yg suka provokator masyarakat yg berpendidikan memfitnah umbar media sosial negara kesatuan republik indonesia bersatu kemajuan kesatuan bangsa negara dimana lahir tinggal indonesia,2025-05-01T12:43:34Z,0,15
Ijasah_ditunjukan_user_14502,jokowi listyo sigit orang gue gampang gue atur,2025-05-01T12:38:00Z,0,15
Ijasah_ditunjukan_user_14508,menamakan masarakat km orang yg membeci jokowi aja,2025-05-01T12:36:56Z,0,15
Ijasah_ditunjukan_user_14509,dibilang orang orang pintar bikin kacau negara to jokowi presiden fitnah ijasah palsu orang orang ditindak iri anak nya jokowi wapres,2025-05-01T12:36:55Z,0,15
Ijasah_ditunjukan_user_14512,orang kerjaan ijasah bpk joko widodo asli masarakat artinnya mati nggak bawa pulang,2025-05-01T12:36:40Z,0,15
Ijasah_ditunjukan_user_14517,jokowi seneng ricuh coba jujur ni orang tua susah jujurnya,2025-05-01T12:35:16Z,0,15
Ijasah_ditunjukan_user_14521,orang waras laporin orang setres kejiwaan sampe orang orang stres gak puas,2025-05-01T12:34:33Z,0,15
Ijasah_ditunjukan_user_14582,pintar orang kampung orang orang yg memiliki gelar menjabat pemerintahan negara indonesia bodoh orang orang roy suryo kawan kawan nya,2025-05-01T12:21:14Z,0,15
Ijasah_ditunjukan_user_14585,kirain publik penyidikk ta penyidiknya orang,2025-05-01T12:20:48Z,0,15
Ijasah_ditunjukan_user_14597,roy pa jokowi segitu repotnya ngurusin ijasah orang urus ja,2025-05-01T12:19:42Z,0,15
Ijasah_ditunjukan_user_14612,yaaaaa orang pinter pinter omon omon muter muter,2025-05-01T12:16:58Z,0,15
Ijasah_ditunjukan_user_14643,penjarakan orang orang nggak kerjaan,2025-05-01T12:12:10Z,0,15
Ijasah_ditunjukan_user_14648,orang orang barisan sakit hati kasihan masuk penjara biar mampus,2025-05-01T12:11:54Z,0,15
Ijasah_ditunjukan_user_14649,penjarakan orang yg menyebar fitnah,2025-05-01T12:11:41Z,0,15
Ijasah_ditunjukan_user_14678,ampun sepele aja ampe penjarain orang,2025-05-01T12:06:23Z,0,15
Ijasah_ditunjukan_user_14701,sonto loyo marilah orang cerdas menyuarakan kebenaran yg bumkam sang mantan,2025-05-01T12:01:54Z,0,15
Ijasah_ditunjukan_user_14727,llagian rs sibuk sibuk ngurusin ijazah orang swdangkan lulusny ugm duluan jokowi emang orsng suka bgt kepo kepo urusan orang jebloskan penjara ujung ujung nya timbul ya mantan presiden menjarakan rakyatnya gitu,2025-05-01T11:59:09Z,0,15
Ijasah_ditunjukan_user_14737,knapa ngurusin urusan orang,2025-05-01T11:57:40Z,0,15
Ijasah_ditunjukan_user_14738,orang sabar yg benci umar bin khattab,2025-05-01T11:57:33Z,0,15
Ijasah_ditunjukan_user_14718,baguslah diuji forensik ijazahnya biar dusta lupa selidiki ugm isi ijazah kehutanan berbeda fakultas ugm orang orang adminstrator kehutanan melanggar ketentuan rektorat dicabut pns biar miskin,2025-05-01T11:53:19Z,0,15
Ijasah_ditunjukan_user_14811,kapok biar mampus orang orang yg mengumbar pitnah mencari cari kesalahan orang,2025-05-01T11:47:59Z,0,15
Ijasah_ditunjukan_user_14815,orang yg keruh hros diadili masarakat belajar kesopanan,2025-05-01T11:47:52Z,0,15
Ijasah_ditunjukan_user_14822,mah orang bodoh berharap orang pintar tolong pake mental pintar nya ngebangun negara bikin narasi penciptaan senjata laser negara bikin satelit bisanya utak atik yg mah manfaatnya,2025-05-01T11:46:46Z,0,15
Ijasah_ditunjukan_user_14827,orang yg kerjaan yg suka mengungkit ijazah palsu orang proses hukum seberat nya,2025-05-01T11:46:29Z,0,15
Ijasah_ditunjukan_user_14828,izazah orang bahas urus aja gk bener lg gurus orang dasar orang orang iri sinis rasain tu laporin nnti tngkap nangissss mikir roy panci,2025-05-01T11:46:27Z,0,15
Ijasah_ditunjukan_user_14840,masarakat dah menilai jokowi orang,2025-05-01T11:45:10Z,0,15
Ijasah_ditunjukan_user_14844,orang iri orang sakit hati kredibilitas orang orang sakit hati orang bodoh,2025-05-01T11:44:54Z,10,15
Ijasah_ditunjukan_user_14844,diproses diproses hukum orang orang sakit hati jokowi,2025-05-01T11:43:53Z,6,15
Ijasah_ditunjukan_user_14844,rakyat indonesia mendukung jokowi melaporkan orang orang berniat mengacuhkan negara menghina memfitnah ijazah jokowi palsu orang orang penyebar kebencian diproses hukum,2025-05-01T11:42:43Z,3,15
Ijasah_ditunjukan_user_14868,orang bego coba otak dipake tuduh mencuri memperkosa membunuh yg bukti orang menuduh orang yg dituduh suruh membuktikan,2025-05-01T11:41:18Z,0,15
Ijasah_ditunjukan_user_14850,semu orang mencemarkan nama bpk jokowi ijasah palsu dpenjara biar utk pengalaman penjara,2025-05-01T11:39:55Z,0,15
Ijasah_ditunjukan_user_14874,sebastian orang indonesia memboros yg tdk,2025-05-01T11:39:45Z,0,15
Ijasah_ditunjukan_user_14890,pokoknya penjarakan orang fitnah jokowi,2025-05-01T11:37:10Z,15,15
Ijasah_ditunjukan_user_14906,masuk penjara orang anggota barisan sakit hati,2025-05-01T11:35:09Z,0,15
Ijasah_ditunjukan_user_14917,menangkap orang busuk diam tunggu bungkus mantap jokowi,2025-05-01T11:33:46Z,0,15
Ijasah_ditunjukan_user_14921,orang solo malu muak lihat tingkah laku jokowi sang mantan presiden mencerminkan budaya orang solo,2025-05-01T11:33:11Z,2,15
Ijasah_ditunjukan_user_14941,bru sekrang sibuk ijazah dlu kmna wktu jdi presiden orang goblok tau klo yg sibuk ngurusin skrang gila,2025-05-01T11:30:05Z,0,15
Ijasah_ditunjukan_user_14977,jgn nyiyir buka edintitas orang kapok,2025-05-01T11:23:34Z,0,15
Ijasah_ditunjukan_user_15000,masyarakat menilai orang orang bodoh sekolah utk manfaatnya,2025-05-01T11:18:08Z,1,15
Ijasah_ditunjukan_user_15014,tuntut klu contoh klu dibiarkan sarapan fitnah orang,2025-05-01T11:15:22Z,0,15
Ijasah_ditunjukan_user_15062,kalo jahatin orang giliran dilaporin,2025-05-01T11:06:55Z,0,15
Ijasah_ditunjukan_user_15109,orang berpendidikan omongnya plin plan,2025-05-01T10:59:28Z,0,15
Ijasah_ditunjukan_user_15114,orang pinter keblinger,2025-05-01T10:58:30Z,0,15
Ijasah_ditunjukan_user_15118,orang orang yg bikin negara pusing tolong pemerintah diberesin rayat membutuhkan ketenangan rayat membutuhkan usaha kerameyan ijasah,2025-05-01T10:57:50Z,0,15
Ijasah_ditunjukan_user_15186,itukan ulamu siroy paksa orang melihatkan izasa orang,2025-05-01T10:45:44Z,0,15
Ijasah_ditunjukan_user_15189,roy suryo nih orang streeees cari kerjaan yg bener pejabat kasian deh,2025-05-01T10:45:21Z,0,15
Ijasah_ditunjukan_user_15210,suryo km ngurus ijasah orang km ap ad mahsud klo tdk ad masut tdk ngurus ijasah orang,2025-05-01T10:42:37Z,0,15
Ijasah_ditunjukan_user_15204,tujuannya tuk ijazah orang,2025-05-01T10:40:49Z,0,15
Ijasah_ditunjukan_user_15229,masyarakat mendukung jokowi biar terang benderang yg suka nyiyir biar sadar mencari kesalahan orang laen,2025-05-01T10:38:17Z,0,15
Ijasah_ditunjukan_user_15246,pidanakan biar jera orang yg sipat iri dengki,2025-05-01T10:37:59Z,0,15
Ijasah_ditunjukan_user_15274,ngapain nyari keburukkan orang,2025-05-01T10:33:08Z,0,15
Ijasah_ditunjukan_user_15293,pelampiasan kekecewaan orang orang kalah tdk laku politik memprovokasi memfitnah digebuki,2025-05-01T10:28:26Z,0,15
Ijasah_ditunjukan_user_15315,cuman orang lulusan ugm asli riy panci dr tipu krismon,2025-05-01T10:25:50Z,0,15
Ijasah_ditunjukan_user_15334,orang secepatnya d proses biar negara aman d tenteram,2025-05-01T10:21:29Z,0,15
Ijasah_ditunjukan_user_15352,ngedengerin bacot roy ko kaya orang yg pinter tp goblok gk produktif dr faedah,2025-05-01T10:20:52Z,0,15
Ijasah_ditunjukan_user_15353,udahh penjarakan aja orang orang yg bikin olah biar merasakan hasilnya rasain soryo mulutmu maumu,2025-05-01T10:20:43Z,0,15
Ijasah_ditunjukan_user_15360,pejabat sibuk ngurusin ijazah coba sibuk ngurusin orang orang kampung skrang bayak yg kelaparan,2025-05-01T10:19:37Z,0,15
Ijasah_ditunjukan_user_15390,orang iri ni,2025-05-01T10:14:21Z,0,15
Ijasah_ditunjukan_user_15400,khawatir ributribut ijazah ni mengalihkan perhatian masyarakat bencana yg lbh ditutuptutupi yg menimpa republik ijazah cmn jokowi orang orang berkepentingan,2025-05-01T10:12:46Z,0,15
Ijasah_ditunjukan_user_15436,dunia perang ekonomi dinegara perang ecek ecek orang orang yg mutu pintar seneng gaduh dgn bangsa orang orang berjiwa pemberontak munafik,2025-05-01T10:08:10Z,0,15
Ijasah_ditunjukan_user_15438,ijasah orang pejabat trus kepentinganmu,2025-05-01T10:03:40Z,0,15
Ijasah_ditunjukan_user_15492,sapa suruh orang usil sih untungnya benci diam urus keluarga anak gk urus orang,2025-05-01T09:58:11Z,0,15
Ijasah_ditunjukan_user_15507,ngorus presiden orang indonesia bodoh roi,2025-05-01T09:54:56Z,0,15
Ijasah_ditunjukan_user_15520,orang yg suka negaraini damai,2025-05-01T09:54:42Z,0,15
Ijasah_ditunjukan_user_15536,perasaan ribut ijazah isinya orang x hti x fpi bertambah orang sakithati pdi arahnya terkesan balas dendam mempermalukan keluarga jokowi,2025-05-01T09:52:22Z,0,15
Ijasah_ditunjukan_user_15553,mas roy suryo mengejar orang orang jemu kejar laporan polisi menyalahkan orang kejar melaporkan orang mas roy suryo mas roy suryo nggemesin,2025-05-01T09:49:27Z,0,15
Ijasah_ditunjukan_user_15560,negara berlomba maju negeriku ngurus izajah orang,2025-05-01T09:48:23Z,0,15
Ijasah_ditunjukan_user_15570,roy suryo orang aneh negara ngurusin pribadi orang,2025-05-01T09:47:34Z,0,15
Ijasah_ditunjukan_user_15590,mulut comberan kau suryo gx wewenangmu identitas ijazah orang,2025-05-01T09:45:15Z,0,15
Ijasah_ditunjukan_user_15595,orang orang kerjaan,2025-05-01T09:44:52Z,0,15
Ijasah_ditunjukan_user_15610,sibuk mencari aib orang kemana,2025-05-01T09:43:23Z,0,15
Ijasah_ditunjukan_user_15616,selesaikan pengadilan orang sembarang menuduh ri sosik yg dikasihi bangsa indonesia penjarakan orang yg sopan santun kerumah orang maksa nunjukin ijazah orang rumah dibayangin belom sdh berkoar platform online menimbulkan kegaduhan penyelesaiannya yg netral ya dipengadilan,2025-05-01T09:41:56Z,0,15
Ijasah_ditunjukan_user_15636,intinya orang ndak suka pk jokowi,2025-05-01T09:38:53Z,0,15
Ijasah_ditunjukan_user_15638,roy gk hakmu izajah orang emangnya lu,2025-05-01T09:38:20Z,0,15
Ijasah_ditunjukan_user_15688,orang kasih mencari kesalahan,2025-05-01T09:27:39Z,0,15
Ijasah_ditunjukan_user_15710,pa jokowi penjarakan orang orang fitnah bpk orang dibiar kacau indonesia kedepan,2025-05-01T09:24:30Z,0,15
Ijasah_ditunjukan_user_15796,pepatah bohong seumur hidup orang percaya,2025-05-01T09:11:06Z,0,15
Ijasah_ditunjukan_user_15809,meneliti ijazah orang mending telitih gimana negara maju malu negara negara da bahas ngurusin urusan pribadi orang,2025-05-01T09:09:33Z,0,15
Ijasah_ditunjukan_user_15820,roy orang diam jgn fitnah orang diam udah bertindak jgn membalikan ucapan mu yg suka fitnah orang penajarakan sj gk sembuh sifat roy,2025-05-01T09:08:35Z,0,15
Ijasah_ditunjukan_user_15834,menggiring opini mengatasnamakan orang mati akal plus panik,2025-05-01T09:06:13Z,0,15
Ijasah_ditunjukan_user_15823,klu keartisan rs dp orang suka nyinyir sllu,2025-05-01T09:02:33Z,0,15
Ijasah_ditunjukan_user_15851,kaliyan mencari cari kesalahan orang,2025-05-01T08:56:36Z,0,15
Ijasah_ditunjukan_user_15851,ibuk golongan sakit hati merendahkan harga orang,2025-05-01T08:54:26Z,0,15
Ijasah_ditunjukan_user_15882,kepentingan si roi mencari kesalahan orang,2025-05-01T08:54:24Z,2,15
Ijasah_ditunjukan_user_15908,orang maafin karna orang hatinya sakit cuman penjara yg menyadari prang²,2025-05-01T08:54:13Z,0,15
Ijasah_ditunjukan_user_15915,berisik orang orang gak laku politik,2025-05-01T08:53:20Z,0,15
Ijasah_ditunjukan_user_15922,orang tolol mengaku pintar tolol menyebar fitnah layaknya dajjal,2025-05-01T08:52:45Z,0,15
Ijasah_ditunjukan_user_15922,orang tolol mengaku pintar tolol nenyebar fitnah layaknya dajjal,2025-05-01T08:51:54Z,0,15
Ijasah_ditunjukan_user_15922,orang tolol mengaku pintar tolol nenyebar fitnah layaknya dajjal,2025-05-01T08:50:48Z,0,15
Ijasah_ditunjukan_user_15935,orang mah mikir bkin nuklir izasah orang dipikirin yg kinerjanya jokowi bagus arti izasah yg pemikirannya bagus,2025-05-01T08:50:39Z,0,15
Ijasah_ditunjukan_user_15828,kompastv j ungkit terlambat kalo jokowi orang sekolah yg masalahkan,2025-05-01T08:46:55Z,0,15
Ijasah_ditunjukan_user_15967,orang pd usil urusan orang,2025-05-01T08:46:27Z,0,15
Ijasah_ditunjukan_user_15976,smoga ijazahnya asli ya hukum orang orang yg mnebar hoak jgn dgn maaf aja hrus dihukum sesuai undang undang yg berlaku jgn diksih maaf apapun alasannya,2025-05-01T08:45:10Z,0,15
Ijasah_ditunjukan_user_15988,suryo hukum mati orang sakit hatii orang bikin gduh nkri,2025-05-01T08:43:41Z,0,15
Ijasah_ditunjukan_user_15989,orang g malu suryo,2025-05-01T08:43:39Z,0,15
Ijasah_ditunjukan_user_15990,lu yg kepo roy ngapain urusin orang,2025-05-01T08:43:33Z,0,15
Ijasah_ditunjukan_user_15960,penjara seumur hidup orang yg onar,2025-05-01T08:43:29Z,0,15
Ijasah_ditunjukan_user_16004,rs udah salah aja ngeyel sakit hati ngga habisnya memfitnah orang coba tunjukin ijasahmu asli palsu,2025-05-01T08:41:14Z,0,15
Ijasah_ditunjukan_user_16034,mencari kesalah orang manusia sekrang tpi nilai,2025-05-01T08:37:46Z,0,15
Ijasah_ditunjukan_user_16044,negara kebanyakan mengaku orang pintar ya kayak saking banyaknya mengaku orang pintar kerja nya mengurus pribadi orang gaduh salah nya kepintaran kemajuan indonesia bidang pintaran semoga roy suryo dkk secepatnya masuk buih mulut manisnya tersumbat,2025-05-01T08:36:38Z,1,15
Ijasah_ditunjukan_user_16053,ngapain cari kesalahan orang introkpesi aja rombongan orang sakit hatiiiiiiii,2025-05-01T08:35:18Z,0,15
Ijasah_ditunjukan_user_16071,kebenaran menemukan jalannya jalan orang,2025-05-01T08:33:29Z,0,15
Ijasah_ditunjukan_user_16111,orang berbahaya lidahnya orang ngga ngaca masyarakat cerdas bos barang inventaris aja dimbat pejabat parah ni manusia uratnya uda putus,2025-05-01T08:28:10Z,0,15
Ijasah_ditunjukan_user_16121,asli gimana skripsinya ga parah orang yg pintar zolim banget,2025-05-01T08:26:40Z,0,15
Ijasah_ditunjukan_user_16155,kayak filem aja suka nya nyari kesalahan orang,2025-05-01T08:23:12Z,0,15
Ijasah_ditunjukan_user_16158,orang dendam pribadi ngapain layani orang ngk waras alias gila apapun yg hasratnya tercapai udah orang dendam pribadi ngapain negara yg sibuuuuukk goblok orang ngk perusak bangsa malaikat aja ijazahnya palsu salam waras sumbar nkri harga mati,2025-05-01T08:22:59Z,0,15
Ijasah_ditunjukan_user_16173,ngapain ngurusin ijazah uda presiden priode mangknya ga urusin hidup orang,2025-05-01T08:21:22Z,0,15
Ijasah_ditunjukan_user_16198,orang kerjaan,2025-05-01T08:17:54Z,0,15
Ijasah_ditunjukan_user_16209,orang obok obok,2025-05-01T08:16:25Z,0,15
