author,text,published_at,like_count,cluster
Ijasah_ditunjukan_user_31226,hayolah jokowi tunjukan ijazahnya publikjuga polisi penyidik kecurigaan sebelah pendukungnya kecurugaannya polisi penyidik main mata inikan mendukungkung ayolah tunjukan ijazahnya publik cepat selesai terkesan jokowi berusaha menutup nutupi gak jentel,2025-04-30T14:53:36Z,0,18
Ijasah_ditunjukan_user_31234,bang surio jokowi pintar jokowi sengaja ijasa nya analisa wali kota gubernur peresiden cepat lambat analisa kasihan coba sekolah mengerti bahasa indonesia,2025-04-30T14:53:24Z,0,18
Ijasah_ditunjukan_user_6113,keliatan jokowi bohong,2025-04-30T14:52:40Z,0,18
Ijasah_ditunjukan_user_31273,rivai pelajaran hukum masyarakat maju si mulut panci masuk bui alloh prnh ngobrol petugas kbersihan an candi prambanan bhw terpengaruh tuduhan roy suyo cs walopun tdk percaya jokowi berijasah palsu maju tuntas rakyat pecinta jokowi tuhan sang maha kuasa maha penyayang sayangilah orang,2025-04-30T14:52:06Z,0,18
Ijasah_ditunjukan_user_31248,tujuanya royy suryo membunuh jokowi,2025-04-30T14:51:46Z,0,18
Ijasah_ditunjukan_user_31286,jokowi tunjukan ijazah kapada kasihan bangat klu kpu setara dgnnya legal,2025-04-30T14:51:38Z,0,18
Ijasah_ditunjukan_user_31306,mampus lu suryo hakmu nyuruh pa jokowi,2025-04-30T14:50:57Z,0,18
Ijasah_ditunjukan_user_31317,org sakit ya kali teman jokowi aja ngakui beliau teman kuliah wisuda foto wisuda bareng jokowi aj liatin ugm aj udah akui lg benci g suka terserah tp jgn bawa isu g bodoh sperti koar d media krna indonesia rame rakyat ny yg sdm rendah yg gampang percaya ama g kek gni,2025-04-30T14:50:33Z,0,18
Ijasah_ditunjukan_user_31345,gua dukung roy teman jujur gua mikirnya gini knp pa jokowi tdk langsung nunjukin izajah aslinya mengulur wkt izajah mantan presiden anak buahnya logikanya gini knp pikiran gua liyar pa jokowi pemimpin pelapor izajah asli langsung tunjukan biar masyarkat pikiranya gak liar,2025-04-30T14:48:59Z,0,18
Ijasah_ditunjukan_user_31350,mending ngawal pengungkapan korupsi timah bensin pik reklamasi lpg kg kelapa jokowi tanggungjawab pdi yg nggendong jokowi walkot solo rakyat digiring mbahas ijazah shg lupa korupsi penyelewengan ribuan trilyun dana negara,2025-04-30T14:48:51Z,0,18
Ijasah_ditunjukan_user_31354,pengacara jokowi tangkap,2025-04-30T14:48:46Z,0,18
Ijasah_ditunjukan_user_31280,ksh paham jokowi wkwkwk biar ngerasain hotel prodeo bui,2025-04-30T14:48:03Z,0,18
Ijasah_ditunjukan_user_31396,jokowi sukanya bukin gaduh tinggal tunjukin aja selesai muakk,2025-04-30T14:47:22Z,0,18
Ijasah_ditunjukan_user_31406,jokowi cerdas ajian pamungkasnya pengadilan roy suryo kawanya kalah cerdas bandingkan jokowi mencari sensasi biar tenar,2025-04-30T14:47:08Z,0,18
Ijasah_ditunjukan_user_31437,jokowi permainkan bocil bocil,2025-04-30T14:46:20Z,0,18
Ijasah_ditunjukan_user_31441,roy surya orang angkat mentri p jokowi roy menyelidiki p jokowi periode presiden,2025-04-30T14:46:15Z,0,18
Ijasah_ditunjukan_user_31450,z suka liat bibir pengacarax jokowi,2025-04-30T14:45:43Z,0,18
Ijasah_ditunjukan_user_31461,oh masyarakat udah mengerti roisuryo hak izasah jokowi jokowi wajib memperliatkan izasahx sampe eboh melecehkan nama baikx jokowi mesti roisuryo cs dilaporkan rs abis eboh nikin pitnah akun pupu papa dipenjarakan moga roisuryo pikiranx,2025-04-30T14:45:17Z,0,18
Ijasah_ditunjukan_user_30901,jokowi gak kuliah fakta gak kuliah ngaku ijazah dr ugm bel gedes rektor ugm wajib adili melindungi kejahatan jokowi jokowi lulus slta kerja jadii kuli pabrik kertas riau dgn ijazah slta adili jokowi dusut harta jokowi anak nya,2025-04-30T14:45:13Z,0,18
Ijasah_ditunjukan_user_31470,p jokowi semoga sehat p,2025-04-30T14:44:47Z,20,18
Ijasah_ditunjukan_user_31478,si roy surya ngebet pingin tau ijazah jokowi pingin presiden,2025-04-30T14:44:23Z,0,18
Ijasah_ditunjukan_user_31540,mantap jokowi,2025-04-30T14:42:39Z,0,18
Ijasah_ditunjukan_user_31570,tuhan memberkati jokowi,2025-04-30T14:41:41Z,17,18
Ijasah_ditunjukan_user_31571,menghadapi jokowi ruwet ruwet ruwet,2025-04-30T14:41:41Z,0,18
Ijasah_ditunjukan_user_31595,saking bencinya jokowi si rs rela dipenjara,2025-04-30T14:40:36Z,0,18
Ijasah_ditunjukan_user_31644,hakim dn polisinya ternak jokowi gk sgra bers,2025-04-30T14:38:52Z,0,18
Ijasah_ditunjukan_user_31699,mundur jokowi jg biar merasakan enaknya terali besi,2025-04-30T14:36:06Z,0,18
Ijasah_ditunjukan_user_31504,kalo ga pidanakan ngelunjak pindahkan aja yg menyebarkan berita hoax yg memfitnah jokowi tangkap biar kapok,2025-04-30T14:35:25Z,0,18
Ijasah_ditunjukan_user_31781,perbatasan indonesia philipina mendukung jokowi biar pembuat gaduh jerah,2025-04-30T14:34:51Z,0,18
Ijasah_ditunjukan_user_31802,semoga kepolisian kejujurannya menyikapi ijazah jokowi,2025-04-30T14:34:09Z,0,18
Ijasah_ditunjukan_user_31728,jokowi kampang,2025-04-30T14:32:06Z,0,18
Ijasah_ditunjukan_user_31885,cari pembuktian teman almamater angkatan fakultas ituh yg teman pa jokowi klo yg pura pura ngaku temannyah berat kuliti,2025-04-30T14:31:19Z,0,18
Ijasah_ditunjukan_user_31894,jokowi diam difitnah jokowi lelah setuju jokowi,2025-04-30T14:31:02Z,0,18
Ijasah_ditunjukan_user_31896,jokowi segeralah insyaf mumpung hidup kesempatan tobat,2025-04-30T14:31:00Z,0,18
Ijasah_ditunjukan_user_31908,jokowi presiden uda rakyat kau pk jokowi mempidanakan roy yg mulut nya tajam kayak silet menghina menuduh koar media nama pk jokowi giliran orng menuduh giliran pk jokowi membalas kau bilang mempidanaka pretttttt,2025-04-30T14:30:43Z,0,18
Ijasah_ditunjukan_user_31918,ngurusin ijasah jokowi,2025-04-30T14:30:30Z,0,18
Ijasah_ditunjukan_user_31921,jokowi bohong sipino internasional,2025-04-30T14:30:28Z,0,18
Ijasah_ditunjukan_user_31926,walopun ijasah jokowi asl biangkeroknya jokowi,2025-04-30T14:30:21Z,0,18
Ijasah_ditunjukan_user_31930,jokowi tdk ijazahnya publik yg sederhana sulit gaduh,2025-04-30T14:30:17Z,0,18
Ijasah_ditunjukan_user_31571,ora wedi jokowi wes panik parah,2025-04-30T14:29:04Z,0,18
Ijasah_ditunjukan_user_31968,penjilat manusia sampah yg msh mendukung jokowi,2025-04-30T14:28:54Z,0,18
Ijasah_ditunjukan_user_1051,roy suryo mrongos pk jokowi kau suruh suruh pemeriksaan jk polisi memanggil beliau langsung pengacaranya yg yg tdk menyalahi aturan tdk,2025-04-30T14:28:30Z,0,18
Ijasah_ditunjukan_user_32002,semoga polisi hakim jaksa jujur membela jokowi,2025-04-30T14:28:09Z,0,18
Ijasah_ditunjukan_user_31728,jokowi bohong biadab,2025-04-30T14:27:40Z,0,18
Ijasah_ditunjukan_user_32021,repot coba cek alumni yg seangkatan jokowi diwisuda,2025-04-30T14:27:37Z,0,18
Ijasah_ditunjukan_user_32051,klo lihat jokowi disni salah langkah tujuan roy suryo dkk memancing jokowi utk melapor roy dkk bsa menguji ijazahnya duduk pengadilan utk keterangannya blunder jokowi kepolisian dilema dsni mreka kpd kebenaran mmperthankan kebobrokan,2025-04-30T14:26:58Z,3,18
Ijasah_ditunjukan_user_3264,rektor ugm wk rektor ugm dekan fak kehutanan ugm teman teman seangkatan jokowi tdk dipercaya penyakit yg dlm hati pikiran roy suryo rismon tifa dkk hidup penuh dg prasangka buruk,2025-04-30T14:25:45Z,0,18
Ijasah_ditunjukan_user_31779,walah tujuan politis tujuan kebenaran org tau yg menyerang jokowi kelompoknya lihat aja otak nya tipe pendukung yg menyerang jokowi motif mrk adl politis,2025-04-30T14:25:18Z,0,18
Ijasah_ditunjukan_user_32124,orang bodoh yg mempertayakan keaslian ijazah jokowi percaya omongan si roy gerombolangx ketimbang omongan yg mengeluarkan ijazah kampus ugm penuduh orang yg percaya keaslian ijazah jokowi amal ibadahmu hisap jokowi,2025-04-30T14:24:40Z,1,18
Ijasah_ditunjukan_user_32153,harapan ijaza jokowi asli tpi hati ku ijaza jokowi palsu proses pembuktiannya fair,2025-04-30T14:23:49Z,0,18
Ijasah_ditunjukan_user_32158,jokowi mbulet mudah sulit berkembang kemana coba tunjukan ijasahnya kl ijasahnya asli tuntutan dr masyarakat sy bangga sy lulusan ugm silahkan cek ijasah silahkan diuji dg apapun yg disembunyikan kl dilakukab rakyat menilai jokowi dg respek yg dianggap mnfitnah bs sj diajukan dilaporkan diproses scr hukum jokowi muter mbulet yg dmkn kejahatan yg direncanakan disembunyikan kepalsuan yg tdk muter mbulet smp sewa pengacara yg dmkn konyol bikin gaduh,2025-04-30T14:23:42Z,0,18
Ijasah_ditunjukan_user_32163,bravo p jokowi tlh tuntut pencemaran nama perusuh,2025-04-30T14:23:32Z,0,18
Ijasah_ditunjukan_user_32167,mnutupi kepanikanya roy berdalih lihat sj jokowi mantan presiden memidanakan,2025-04-30T14:23:26Z,0,18
Ijasah_ditunjukan_user_32184,semoga pengadilan berjalan netral ijasah jokowi dinyatakan asli dipertanggungjawabkan hukum tolong pendukung roy kaum abadi pembenci jokowi jngn koar koar ya ntr bilang hakim gk netral ntr bilang dikriminalisasi ntr bilang pengaruh kekuasaan pliss muakk ocehan tong kosong,2025-04-30T14:22:45Z,0,18
Ijasah_ditunjukan_user_32194,jokowi orang sipil yg kuat tentara sekelas luhut prabowo wiranto agum gumelar sby takluk jokowi salut jokowi ilmu pakk,2025-04-30T14:22:29Z,0,18
Ijasah_ditunjukan_user_32212,mantap jokowi penjarakan jokowi mantap,2025-04-30T14:21:58Z,0,18
Ijasah_ditunjukan_user_32220,mempercayai bang suryo teman temannya jokowi contoh kebohongan jokowi,2025-04-30T14:21:42Z,0,18
Ijasah_ditunjukan_user_32239,jokowi kulian prosedur kulia ampe ujian bilang palsu kasian jokowi jawabannya hukum unsur coba ma roy suryo kasian roy suryonya kejebak dicoba cobanya,2025-04-30T14:21:20Z,0,18
Ijasah_ditunjukan_user_32247,jokowi kontroversi,2025-04-30T14:20:53Z,0,18
Ijasah_ditunjukan_user_32265,dilaporkan komentarnya biar masyarakat indonesia menilailah mantan presiden mempidanakan jokowi diam aja komentarnya jokowi diam aja ijasah nya palsu serbasalah khan jokowi dimata,2025-04-30T14:20:20Z,65,18
Ijasah_ditunjukan_user_32280,selidiki ijazah jokowi polisi yg menangani yg menggugat yg menggugat pingin tunjukkan ijazah aslinya teliti keasliannya,2025-04-30T14:19:58Z,0,18
Ijasah_ditunjukan_user_32291,bravo jokowi teruskan,2025-04-30T14:19:47Z,0,18
Ijasah_ditunjukan_user_32292,aslinya izasah palsupun jokowi mantan pres okeee,2025-04-30T14:19:45Z,0,18
Ijasah_ditunjukan_user_32299,klo jokowi jujur clear krn bohong ruwet,2025-04-30T14:19:38Z,0,18
Ijasah_ditunjukan_user_32302,intinya pembenci jokowi putusan hakim ijasah asli mrk ttp tdk percaya karna fakta tertutup dg kebencian,2025-04-30T14:19:36Z,0,18
Ijasah_ditunjukan_user_32315,bravo jokowi sikat pemfitnah pembuat gaduh negeri,2025-04-30T14:19:23Z,3,18
Ijasah_ditunjukan_user_32317,menuduh langsung kehidupan jokowi dewasa ilmiah forensik kubu roy cs samar kebenaranya anti jokowi apapun yg lakukan jokowi mata mrreka yg iblis senang orang yg sok suci mengaku pinter,2025-04-30T14:19:22Z,0,18
Ijasah_ditunjukan_user_32320,gimana jokowi ijazah ugm sma aja,2025-04-30T14:19:17Z,0,18
Ijasah_ditunjukan_user_32325,jokowi jokowi dibilang goblok diam dibilang pki diam dibilang korupsi diam dibilang diam disuruh ijazah melapor polisi,2025-04-30T14:19:07Z,0,18
Ijasah_ditunjukan_user_32331,mantan presiden menuntut mempinah jokowi memalsukan ijazah hl pendidikan arga negara mempinah tutut jokowi,2025-04-30T14:18:58Z,0,18
Ijasah_ditunjukan_user_32334,duo rs cepet dipanggil diproses dasar pencemaran nama ugm jokowi oknom yg bikin gaduh,2025-04-30T14:18:55Z,0,18
Ijasah_ditunjukan_user_32339,ewako jokowi,2025-04-30T14:18:53Z,0,18
Ijasah_ditunjukan_user_32340,yg sdh jd advokat jokowi dlm tdk dituñjukan ijazah aslinya tuntas,2025-04-30T14:18:46Z,0,18
Ijasah_ditunjukan_user_32345,jokowi mantan presiden terburuk yg,2025-04-30T14:18:40Z,0,18
Ijasah_ditunjukan_user_32363,kasihan org yg menjamur benci hatinya jokowi bertahun diam tuduhan fitnah blm satupun yg terbukti klo masyarakat menilai hati fikiran positif tau yg yg tdk tlong kedepan kemanusiaan hati nurani nya yg gak suka kebijakan jokowi tp suka dgn sosok jokowi yg begtu tawadhu sabar salut sikap jokowi,2025-04-30T14:18:17Z,14,18
Ijasah_ditunjukan_user_31934,hei roy bodoh menghina jokowi jokowi menjabat presiden,2025-04-30T14:17:47Z,0,18
Ijasah_ditunjukan_user_32394,jokowi menang hakimnya bilang sogok,2025-04-30T14:17:27Z,0,18
Ijasah_ditunjukan_user_32402,jokowi pembuat kekacauan negara indonesia,2025-04-30T14:17:20Z,1,18
Ijasah_ditunjukan_user_32280,semangat mas roy ketipu pendusta tipu daya komplotan jokowi berkuasa jokowi,2025-04-30T14:17:03Z,0,18
Ijasah_ditunjukan_user_32415,photo copy yg tunjukkan ugm yg mengakui ijazah jokowi ugm ttp pa jokowi,2025-04-30T14:16:55Z,0,18
Ijasah_ditunjukan_user_32132,ijasah jokowi hasil cetakan ugm mahar ijasah hasil kuliah sesuai prosedur,2025-04-30T14:16:40Z,0,18
Ijasah_ditunjukan_user_32426,laporan jokowi secepatnya penyelidik polri pro aktif mengecek dokumen ijasah jokowi yg ugm semoga yg oknum yg ijasah palsu jokowi ditangkap,2025-04-30T14:16:39Z,9,18
Ijasah_ditunjukan_user_32434,jokowi bohongnya berulang ulang orang meragukan keterangan jokowi,2025-04-30T14:16:28Z,0,18
Ijasah_ditunjukan_user_32449,dalih kajian ilmiah bahan tambahan merendahkan martabat jokowi,2025-04-30T14:16:09Z,0,18
Ijasah_ditunjukan_user_32452,kelompok roy suryo yg curiga ijazah p jokowi menyudut pa jokowi,2025-04-30T14:15:58Z,0,18
Ijasah_ditunjukan_user_32462,yg penyebab refly benci jokowi ni dah rahasia ya orang tau kalo mahfud md mas² jawa yg ngga hapal lagu indonesia raya ngga tau penyebabnya pengadilan terbukti ijazahnya asli si roy pinter ngungkit² jokowi pki,2025-04-30T14:15:46Z,0,18
Ijasah_ditunjukan_user_32465,percaya kapolri sungkem jokowi,2025-04-30T14:15:42Z,0,18
Ijasah_ditunjukan_user_32467,bl ggggg ijazahnya pa jusuf ga ekspose kaya jokowi dah gas aja jokowi,2025-04-30T14:15:39Z,0,18
Ijasah_ditunjukan_user_32498,yg kejujuran kemenangan jokowi karna jokowi mengumpulkan smua aset yg penuduh yg gembor publik yg yg percya ijazah jokowi palsu orng sangaaaattt toloooooollll dungu suka mengada ngada suka menyebar fitnah roysuryo kau tidur bui roysuryo,2025-04-30T14:14:49Z,0,18
Ijasah_ditunjukan_user_32512,ugm keabsahan jokowi sdh selesai beliau presiden yg dipilih mayoritas rakyat indonesia nggak etis demo adili jokowi menyebut jokowi mulyono memfitnah mencemarkan nama yg pengadilan disitulah kebenaran dpt dibuktikan yg salah,2025-04-30T14:14:33Z,15,18
Ijasah_ditunjukan_user_32520,sepak terjang jokowi dunia politik penuh dgn misteri dgn ijazah palsu yg jokowi dr roy suryo dr rismon dr tifa menanggapi postingan kader psi dian sandi utama membuktikan memverivikasi keaslian ijazah postingan kader psi dgn ugm sbg sumber penerbit ijazah jokowi babak pembuktian pengadilan yg terbukti ijazah palsu jokowi ugm mempertanggung jawabkan perbuatannya sdh menghianati rakyat,2025-04-30T14:14:16Z,0,18
Ijasah_ditunjukan_user_32132,jokowi kang tukang bohong bilang sdh buktinya,2025-04-30T14:14:12Z,0,18
Ijasah_ditunjukan_user_32126,biar nenek kalo bikin pitnah orang laporkan jokowi uda jabis kesabaran nya jokowi uda sabar aja bikin gaduh,2025-04-30T14:13:42Z,0,18
Ijasah_ditunjukan_user_32561,setuju rs rs uji ilmiah yg mengedukasi maju mas roy ojo wedi karo jokowi salah mesti seleh jokowi menuai yg tanam karma,2025-04-30T14:13:20Z,0,18
Ijasah_ditunjukan_user_32569,ijazah nya jokowi tunjukan publik sengaja photo ijazah pake roy panci tinggal adu pengadilan tunjukan publik sumber photo ijazah yg pake roy panci meng klaim sumber dr jokowi,2025-04-30T14:13:05Z,0,18
Ijasah_ditunjukan_user_32610,mantabbb sehat jokowi,2025-04-30T14:12:19Z,0,18
Ijasah_ditunjukan_user_32615,suryo udah panik salah prediksi jokowi tuntut pidana polda delik aduan jokowi bener polda laporan,2025-04-30T14:12:12Z,0,18
Ijasah_ditunjukan_user_32635,jokowi sok raja jawa,2025-04-30T14:11:40Z,0,18
Ijasah_ditunjukan_user_32646,roy suryo curiga jokowi sdh menunjukan ijazah aslinya sy sbg rakyat menanggapi bhw org sinting ga otak waras yg ga percaya institusi yg mengeluarkan ijazah sdh kebenaran ijazah jokowi aneh ga warasnya lbh percaya pd hasil copy ijazah yg beredar yg tdk tau usulnya tdk dipertanggung jawabkan,2025-04-30T14:11:24Z,1,18
Ijasah_ditunjukan_user_32680,clo ijazah jokowi palsu kampus ugm udah jokowi laporkan beliau daftar wali kota sih jokowi bandingkan nama ugm logika kampus ternama sekelas ugm gk nama besarnya tercoreng gara² ijazah palsu walkot masuk akal orang² syirik dendam dipakai rompi orange mantan kuropsi yg gk terima sya pengikut jokowi orang jokowi rakyat gk kerja gk makan sya muak orang² bikin gaduh negeri kayak pintar,2025-04-30T14:10:25Z,0,18
Ijasah_ditunjukan_user_32728,jokowi licik pembohong,2025-04-30T14:09:16Z,1,18
Ijasah_ditunjukan_user_32761,polisi semoga terpengarih listyo kapolri kacung jokowi,2025-04-30T14:08:14Z,0,18
Ijasah_ditunjukan_user_32776,orang egk nunjukin ijasah nya media sosial yg ngedit jokowi hak menujukan berfikir pake logika aja jokowi walikota gubernur presiden iya palsu kalo bilang palsu egk aja pas jokowi walikota,2025-04-30T14:07:59Z,0,18
Ijasah_ditunjukan_user_32795,sya mnilai bgus jokowi,2025-04-30T14:07:30Z,0,18
Ijasah_ditunjukan_user_32802,jgn menang sendri curut jokowi dlo jokowi br kuasa sidang gelar bambang tri db gusdur penjarakn alasan yh bambang tri gusdur penjarq kn padahl bambang tri tau jokowi karna bambang tri adalh temaan jokowi knpa mmenjarakan bambang tri,2025-04-30T14:07:15Z,0,18
Ijasah_ditunjukan_user_32808,jokowi punyak hak tdak ijazah roy,2025-04-30T14:07:06Z,0,18
Ijasah_ditunjukan_user_32813,jokowi yg manggung,2025-04-30T14:07:01Z,0,18
Ijasah_ditunjukan_user_32828,sy laporan jokowi polda metro menghasilkan penyelidikan laporan tsb tdk kuat ngambang jokowi tdk ijazah nya case close,2025-04-30T14:06:47Z,0,18
Ijasah_ditunjukan_user_32749,roy skr omongan beda klian yg fitna bpk jokowi jokowi ugm sdh tp kaum pembenci jokowi isu jd yg salah jd skr hrs tanggung dengat fitnah yg,2025-04-30T14:06:45Z,0,18
Ijasah_ditunjukan_user_32838,pk jokowi jgn damai,2025-04-30T14:06:30Z,0,18
Ijasah_ditunjukan_user_32874,jokowi masuk jebakan rakyat menang melawan gerombolan jokowi,2025-04-30T14:05:38Z,0,18
Ijasah_ditunjukan_user_32910,semoga cepat selesai pusing mendengarnya jokowi lulusan sd berjasa pembangunan,2025-04-30T14:04:43Z,0,18
Ijasah_ditunjukan_user_32913,ringkus org yg bikin gaduh hidup jokowi,2025-04-30T14:04:36Z,0,18
Ijasah_ditunjukan_user_32838,gk roy curiga klo istri jokowi dulunya lelaki,2025-04-30T14:04:33Z,0,18
Ijasah_ditunjukan_user_32622,daluwarsa ps kuhp daluwarsa kuh pidana ijazah jokowi th ijazah jokowi dilaporkan pidana perdata kuasa hukum jokowi melaporkan pencemaran nama fitnah dsb barisan sakit hati jokowi secepatnya masuk penjara,2025-04-30T14:04:26Z,0,18
Ijasah_ditunjukan_user_32920,kapok pora kowe yo suryo lha kowe karo gerombolanmu fitnah jokowi ijazah e palsu kowe dewe to yo suryo ngoceh nang tv nasional kowe durung ngerti ijazah e jokowi sing asli e kowe karo gerombolanmu sowan gone jokowi sek takon lihat ijazahnya dak ngono tah yo suryo,2025-04-30T14:04:24Z,0,18
Ijasah_ditunjukan_user_32936,hidup jokowi,2025-04-30T14:03:59Z,0,18
Ijasah_ditunjukan_user_32314,kesempatan jokowi uang dgn alpokat pengecarah lahan basah untk menguras kekayaan jokowi,2025-04-30T14:03:26Z,0,18
Ijasah_ditunjukan_user_32778,jokowi alumnus ugm sdh barang ugm bangga gak kabar beritanya bukti bhw jokowi alumnus ugm,2025-04-30T14:03:21Z,0,18
Ijasah_ditunjukan_user_32921,kalah jokowi badut,2025-04-30T14:03:10Z,0,18
Ijasah_ditunjukan_user_32981,pk jokowi yg bikin gaduh bilang ringan ngga dr tunjukan ijazahnya jd sengaja bikin jebakan batman,2025-04-30T14:03:01Z,0,18
Ijasah_ditunjukan_user_32936,hidup jokowi,2025-04-30T14:02:43Z,0,18
Ijasah_ditunjukan_user_32991,jokowi terbaik keluarga terserah laen ngomong,2025-04-30T14:02:42Z,0,18
Ijasah_ditunjukan_user_33012,dengki sih terserah jokowi,2025-04-30T14:02:15Z,0,18
Ijasah_ditunjukan_user_33020,jokowi menjabat presiden periode mempermasalahkan ijazahnya asli palsu jokowi dicopot presiden aneh aneh dibahas coba dibahas berguna negara kek program jangka pendek program jangka mesti dicapai negara mestinya diperhatikan negara,2025-04-30T14:02:08Z,0,18
Ijasah_ditunjukan_user_33036,aneh bin ajaib jokowi kuliah ugm angkatan alumni tdk group wa alumni imi yg mudah ditelusuri hrs ijasah,2025-04-30T14:01:42Z,0,18
Ijasah_ditunjukan_user_33039,kesabaran jokowi pembenci wajar dipidana,2025-04-30T14:01:36Z,0,18
Ijasah_ditunjukan_user_33002,nnti epesud yg mnggugat ijsah pk jokowi plsu pk jokowi difitnah keturunan org china trnyata fitnah pk jokowi difitnah bapaknya pki tidk trbukti llu difitnah ijsah palsu dn jgn prcya mulut suryo rai alsan suryo rai sllu bilang masyarakt lh menilai,2025-04-30T14:01:34Z,0,18
Ijasah_ditunjukan_user_33067,jokowi tamat smp,2025-04-30T14:00:57Z,0,18
Ijasah_ditunjukan_user_32930,jokowi ijasahnya beres,2025-04-30T13:59:55Z,1,18
Ijasah_ditunjukan_user_1922,tujuan penyebar hoax pembenci jokowi kebencian balas dendam,2025-04-30T13:59:40Z,0,18
Ijasah_ditunjukan_user_33152,roy suryo cs menang bab udah uji ilmiah ijasah jokowi yg beredar pastikan palsu kalo jokowi ijasah diluar akal sehat gak diterima ijasah bikin,2025-04-30T13:59:08Z,1,18
Ijasah_ditunjukan_user_33202,cerdiknya jokowi mengalahkan lawannya yg sok pinter jokowi nggk baca lawannya terpancing suruh melihatkan ijasahnya segitu gampangnya menunjukan pers roy soryo csnya kalah taktik malu koar koarnya,2025-04-30T13:58:09Z,0,18
Ijasah_ditunjukan_user_33204,jokowi kebaliknnya faham,2025-04-30T13:58:05Z,0,18
Ijasah_ditunjukan_user_33215,adil krn perwira polisi diangkat presiden jokowi,2025-04-30T13:57:46Z,0,18
Ijasah_ditunjukan_user_33246,semoga pemitnah pk jokowi laknat allah swt,2025-04-30T13:57:09Z,0,18
Ijasah_ditunjukan_user_33268,aslian stnk samsat aslian ijazah jokowi ugm roy ijazah palsu fotonya foto pk jokowi trus ngapain pk jokowi bikin ijazah yh tempelin foto orang lucu royy,2025-04-30T13:56:45Z,0,18
Ijasah_ditunjukan_user_33284,mantap jokowi jgn diam aja bls orng yg suka fitnah,2025-04-30T13:56:25Z,0,18
Ijasah_ditunjukan_user_1922,knapa ijazah jokowi yg d korek permasalahkan gmana dgn ijazah presiden ri,2025-04-30T13:56:11Z,0,18
Ijasah_ditunjukan_user_33317,jokowi gretak sambel takut,2025-04-30T13:55:55Z,0,18
Ijasah_ditunjukan_user_32778,narasi orang terlapor bhw ijazah jokowi ugm persen palsu jokowi alumnus ugm semenjak pertamakali jokowi dilantik presiden,2025-04-30T13:54:37Z,0,18
Ijasah_ditunjukan_user_33381,melaporkan membuktikan jokowi yg melaporkan jokowilah membuktikan hayoo buktikan biar terang benderang,2025-04-30T13:54:31Z,0,18
Ijasah_ditunjukan_user_33387,jokowi yg lapor lanngsung gercep seandainya jokowi kehilangan sandal lapor polisi langsung gercep,2025-04-30T13:54:18Z,0,18
Ijasah_ditunjukan_user_33400,jokowi kegaduhan sengaja menunda ijazah menunda korban perangkap orang delik pengujar kebencian kejahatan jokowi menunda menunjukan ijazah nya publik proses hukum sederhana membuatnya rumit gaduh menundanya,2025-04-30T13:53:45Z,0,18
Ijasah_ditunjukan_user_33411,klpun palsu ijazahnya nuntut la jokowi skrng rakyat kl msh menjabat iya anehnya kemaren jokowi wali kota gubernur presiden periode kaum pembenci kemana nuntut lucuu kocak,2025-04-30T13:53:32Z,0,18
Ijasah_ditunjukan_user_33434,sehat sll umur bang roy kebenaran kebohongan hancur tinggal tunggu kelicikan jokowi tdk henti nya mudah memenjarakan org org tdk bersalah org jujur jokowi yg msk kdlm jeruji besi allah maha kuasa allah maha dunia besera smua isinya milik allah bang roy klo jokowi tdk ijazah asli tangkap adili jokowi pengakuan jokowi ir ugm rakyat yg bukti fakta buktikan ijazah asli jokowi rakyatlah yg ijazah asli jokowi,2025-04-30T13:53:07Z,0,18
Ijasah_ditunjukan_user_33468,ku sih tujuan suryo meleceh keluarga pa jokowi,2025-04-30T13:52:13Z,0,18
Ijasah_ditunjukan_user_33473,polisi musti buktikan dokumen jokowi asli terlapor proses uji dokumennya jokowi sdh proses lp jokowi tanda jokowi komandan parcok,2025-04-30T13:52:07Z,0,18
Ijasah_ditunjukan_user_33253,iya donk royci p jokowi melapor,2025-04-30T13:51:48Z,0,18
Ijasah_ditunjukan_user_33512,barisan sakit hati jokowi wkwkwkwk,2025-04-30T13:51:20Z,0,18
Ijasah_ditunjukan_user_33522,kejadian era jokowi menit selesai tinggal tunjukkan ijazah aslinya jokowi selesai geger indonesia bikin geger jokowi terimakasih,2025-04-30T13:51:00Z,48,18
Ijasah_ditunjukan_user_33538,bang roy polarisasi jokowi trik jokowi sorotan publik frustasi nggak bolehin presiden,2025-04-30T13:50:39Z,0,18
Ijasah_ditunjukan_user_32909,ironis buanget orang pinter sehat jasmani rohani digobloki budaknya jokowi nasionalisme mu akal sehatmu jokowi walikota solo ngakunya titel drs jokowi lhakok presiden berubah ir kehutanan wowowowo dasar jokowi bajingan apbn penghianat bangsa,2025-04-30T13:50:24Z,0,18
Ijasah_ditunjukan_user_33562,langsung ditunjukan jokowi tau dalang ijazah palsu lihat orang yg dilaporkan jokowi masyarakat tinggal nonton aja,2025-04-30T13:50:11Z,0,18
Ijasah_ditunjukan_user_33142,konstitusi negara aja dirubah bikin ijazah cetek jokowi,2025-04-30T13:49:57Z,0,18
Ijasah_ditunjukan_user_33597,semoga jokowi sehat kuat menerima tuduhan yg kontroversi,2025-04-30T13:49:35Z,0,18
Ijasah_ditunjukan_user_33607,nunggu counter attack dr jokowi lihat pd penggugat,2025-04-30T13:49:20Z,0,18
Ijasah_ditunjukan_user_33617,hakim jaksa polri aparat bayar jokowi hasilnya adil,2025-04-30T13:49:10Z,0,18
Ijasah_ditunjukan_user_33647,dendam ama jokowi ye,2025-04-30T13:48:36Z,0,18
Ijasah_ditunjukan_user_33674,orang terima kasih sakit hati pemerintahan pusat daerah meniru kinerja jokowi jokowi pejabat pemerintah duduk duduk nunggu laporan bawahan gak zerjun langsung lapangan,2025-04-30T13:47:57Z,0,18
Ijasah_ditunjukan_user_33677,ibu² laporkan jokowi gaduh negara,2025-04-30T13:47:54Z,0,18
Ijasah_ditunjukan_user_33604,simpel cecar dicemarkan nama baiknya lapor menyalahkan jokowi,2025-04-30T13:47:36Z,0,18
Ijasah_ditunjukan_user_33693,tepatnya jokowi pelajaran kaum ngeyel yg menyebalkan,2025-04-30T13:47:28Z,1,18
Ijasah_ditunjukan_user_33700,jokowi hebat roy gitu aja repot haaaaa,2025-04-30T13:47:24Z,0,18
Ijasah_ditunjukan_user_33730,mencemar nama jokowi,2025-04-30T13:46:32Z,0,18
Ijasah_ditunjukan_user_33738,yg membela jokowi pastikan,2025-04-30T13:46:27Z,0,18
Ijasah_ditunjukan_user_33741,semangat p jokowi,2025-04-30T13:46:23Z,0,18
