author,text,published_at,like_count,cluster
Ijasah_ditunjukan_user_18402,roy byk bacot ndk hak liat ijazah jokowi,2025-05-01T04:46:47Z,0,1
Ijasah_ditunjukan_user_18497,ijazah photoh copi bilang aslinya pengecara abal cari duit dr mulyon mulyono mengeluarkan duit bodoh biaya gampang tunjukan ijazah aslinya biaya mulyono kemana yg asli nya,2025-05-01T04:40:14Z,0,1
Ijasah_ditunjukan_user_18530,ijazah tunjukan biar ngg meresahkan susahnya nunjukin ijazah aslinya masuk kerja nunjukin ijazah asli lgi pejabat negara sdh atur dlm uu,2025-05-01T04:38:08Z,0,1
Ijasah_ditunjukan_user_18538,haha sekian jokowi tunjukan ijazah hasil rekayasa berhasil cloning persis ijazah asli mengeluarkan uang milyaran rupiah menghasilkan barang lucu ya tunjukkan ijazah nya memakan korban dipenjaranya orang bersalah coba tunjukkan si jokowi memproses pembuatan ijazah negeri hasil ijazah asli nya jokowi stand up komedi,2025-05-01T04:37:42Z,0,1
Ijasah_ditunjukan_user_18539,si roy ga caya ijazah jokowi asli karna maunya si roy yg mengeluarkan langsung ijazah nya bari si panci,2025-05-01T04:37:39Z,0,1
Ijasah_ditunjukan_user_18579,jokowi ente kadang kadang woyy tunjukan ijazah asli mu majelis hakim persidangan teliti ahli asli palsu nunjukin ijjazah orang yg berkepentingan nunjukin ijazah wartawan polisi tunjukan pedagang pasar security mall pns indonesia sopir angkot,2025-05-01T04:34:38Z,0,1
Ijasah_ditunjukan_user_18582,diamana asli jiwa pencitraan selucu jokowi menutupi ijazah aslinya mmg ijazah ijazah bertele tele rakyat mempercayakan kepolisian hakim hakim ternak jokowi,2025-05-01T04:34:21Z,0,1
Ijasah_ditunjukan_user_18583,roy jokowi sang pemilik ijazah,2025-05-01T04:34:12Z,0,1
Ijasah_ditunjukan_user_18584,byk kejanggalan ijazah jokowi,2025-05-01T04:34:12Z,0,1
Ijasah_ditunjukan_user_18596,negara bahas teknologi kecerdasan buatan kesejahteraan keaehatan masyarakat bahas gosip ijazah asli palsu pantes negara susah maju,2025-05-01T04:33:33Z,0,1
Ijasah_ditunjukan_user_18630,jgn percaya dgn jokowi bajingan bandit pemhohong penghianat buktikan dgn ijazah aslinya pinter ngeles,2025-05-01T04:31:15Z,0,1
Ijasah_ditunjukan_user_18698,lebay banget ni jokowi urusan ijazah aja berminggu minggu pakek pengacara tinggal tunjukin udah,2025-05-01T04:27:34Z,0,1
Ijasah_ditunjukan_user_17136,ijazah jokowi palsu ijazah tunjukan ijazah asli nya memponis gusnur bambang tri berkuasa ugm takut,2025-05-01T04:26:59Z,0,1
Ijasah_ditunjukan_user_18720,ugm sdh jokowi lulus wisuda otomatis sdh pegang ijazah asli sdh seret paksa si roy suryo si rismon bujanginam msh,2025-05-01T04:26:21Z,0,1
Ijasah_ditunjukan_user_18765,jokowi kegaduhan tinggal tunjukan kepublik urusan beres eh nunjukan ijazah polda hehehe awas membudaya,2025-05-01T04:23:59Z,0,1
Ijasah_ditunjukan_user_18697,tetep gak ijazah asli ijazah palsu,2025-05-01T04:23:27Z,0,1
Ijasah_ditunjukan_user_18787,ijazah asli yg ditunjukan,2025-05-01T04:22:56Z,0,1
Ijasah_ditunjukan_user_18798,khan ranah pengadilan tdk sidang pengadilan ijazah,2025-05-01T04:22:00Z,0,1
Ijasah_ditunjukan_user_18862,ijazah pk jokowi asli selamatlah penyokongnya dunia akhirat,2025-05-01T04:18:26Z,0,1
Ijasah_ditunjukan_user_18789,cocok nih pelaporan ijazah seharus bentuk pelapor seharus disertai membawah ijazah asli pembuktian pelaporan ijazah asli pencemaran nama diserahkan perlihatkan diserahkan tok keraguan diuji forensik keapsaan asli tidaknya jgn lupa ijazah itupun langka langka itupun jejak pencapaian ijazah dibawah setorkan sebelah aj yg membuktikan data lengkap disetor seru alias sesuai prosedur,2025-05-01T04:17:35Z,0,1
Ijasah_ditunjukan_user_18803,suryo suryoooo ijazah orang km ngk ijazah sendirikh ijazahnya cari cari kegaduhan negara ngk sadar masyarakat muak nglihat mukamu,2025-05-01T04:16:23Z,0,1
Ijasah_ditunjukan_user_18910,roy tujuannya untk mntan ijazah,2025-05-01T04:15:00Z,0,1
Ijasah_ditunjukan_user_18937,asli publikasikan biar dunia tau asli ga ajak ahli fair negeri uji forensik emang membuka kebenaran memenjarakan penggugat emang asli roy cs penjarakan palsu jokowi penjara dah simpel,2025-05-01T04:12:56Z,0,1
Ijasah_ditunjukan_user_18947,pusing ngurusin ijazah org mulu biar sih,2025-05-01T04:12:29Z,1,1
Ijasah_ditunjukan_user_18766,bang rifa i memutar balikkan fakta obyek ijazah asli nya sekedar penjelasan jokowi presiden ijazah asli nya selesai menimbulkan polemik berkepanjangan,2025-05-01T04:10:07Z,0,1
Ijasah_ditunjukan_user_18996,gini ajaa pendapat jokowi kawan sekelas ijazah ugm kehutanan gak ajak pas sidang skalian tunjukkan ijazah aslinya kawan nya uang kirim donasi datangkan kawan kelas mulyono ruang sidang liat tidaknya nama rektor dll tgl thn penulisan times roman pakai mesin ketik,2025-05-01T04:09:39Z,14,1
Ijasah_ditunjukan_user_18950,roy soryo sdh biat ya negara jokowi yg ijazahnya presiden yg yg nanya ijazah jokowi ijazah nya asli,2025-05-01T04:07:32Z,0,1
Ijasah_ditunjukan_user_18307,ijazah jokowi tunjukan diperiksa ahli pengadilan,2025-05-01T04:06:46Z,0,1
Ijasah_ditunjukan_user_19062,andai ijazah jokowi palsu bertanggung parpol pdip partai pendukung kpu univ ugm ijazah jokowi asli karna skenario bertahan puluhan,2025-05-01T04:06:09Z,0,1
Ijasah_ditunjukan_user_18998,terimakasih kader psi yg sdh memposting ijazah asli jokowi shg terungkap,2025-05-01T04:02:53Z,0,1
Ijasah_ditunjukan_user_19027,astagfirullah al adziim indonesia mendukung ijazah x perlihatkan kah tunjukkan ijazah krn penjara masi bersih keke gak ijazah x,2025-05-01T04:02:39Z,0,1
Ijasah_ditunjukan_user_19124,ijazah yg tanda tangan si herkules asli sah tdk,2025-05-01T04:02:05Z,0,1
Ijasah_ditunjukan_user_19126,ijazah beli mahal liat aja skill bahasa inggris nya kayak kawan yg kerja pelaut yg beli ijazah kerja,2025-05-01T04:01:54Z,0,1
Ijasah_ditunjukan_user_19137,ijazah publik,2025-05-01T04:01:22Z,0,1
Ijasah_ditunjukan_user_19155,tinggal ijazah asli kebanyakan drama,2025-05-01T04:00:03Z,0,1
Ijasah_ditunjukan_user_19158,roy cek ijazah prabowo,2025-05-01T03:59:57Z,0,1
Ijasah_ditunjukan_user_19162,ijazah jokowi asli universitasnya oke yg fitnah masuk penjara seumur hidup palsu universitas yg memeriksa aslian ijazah jd walikota gubernur presiden kenpa gak teliti,2025-05-01T03:59:26Z,0,1
Ijasah_ditunjukan_user_19171,ha hnya ijazah sampe segitunya krn kebencian dlm hati sampe segitunya pa sih ijazah,2025-05-01T03:58:52Z,0,1
Ijasah_ditunjukan_user_19184,gk terungkap asli,2025-05-01T03:58:11Z,0,1
Ijasah_ditunjukan_user_19193,maap orang bodoh ttp berterimakasih jokowi ijazah asli palsu beliau berjasa kerja nyata shat sll jokowi,2025-05-01T03:57:57Z,0,1
Ijasah_ditunjukan_user_19222,ijazah beli ugm,2025-05-01T03:56:23Z,0,1
Ijasah_ditunjukan_user_19229,sample aja jokowi tunjukan aja ijazah asli tdk issu korupsi sengaja alihkan,2025-05-01T03:55:58Z,0,1
Ijasah_ditunjukan_user_19231,gampang tinggal ubah aja peraturan syarat ijazah asli diatur sertifikat tanah asli aja dianulir laut aja sertifikat syarat capres cawapres aja berubah besok subuh sesuai orderan,2025-05-01T03:55:54Z,0,1
Ijasah_ditunjukan_user_19263,orang bodoh aja usut ijazah palsu emang untung ruginya usut ijazah bodoh,2025-05-01T03:53:36Z,0,1
Ijasah_ditunjukan_user_19268,ijazah makan korban,2025-05-01T03:53:28Z,0,1
Ijasah_ditunjukan_user_19279,ijazah aslinya hadirkan pengadilan jokowi,2025-05-01T03:52:48Z,0,1
Ijasah_ditunjukan_user_19296,coba roy suryo ditangkap ijazah tuh asli orang bikin rusuh aja sibuk polisi ngurus ijazah korupsi trilyunan hilang cerita,2025-05-01T03:51:43Z,0,1
Ijasah_ditunjukan_user_19320,udahlah ijazah ijazah aj yg masalahkan jokowi udah bantu bangun negara jalan uda dibangun dimana,2025-05-01T03:49:51Z,0,1
Ijasah_ditunjukan_user_19335,sederhana ijazah jokowi jokowi kuliah ugm administrasi yg keluarkan ugm administrasi ugm semeraut shg yg palsu asli ugm perguruan ternama indonesia serusak,2025-05-01T03:49:07Z,0,1
Ijasah_ditunjukan_user_19335,sederhana ijazah jokowi jokowi kuliah ugm administrasi yg keluarkan ugm administrasi ugm semeraut shg yg palsu asli ugm perguruan ternama indonesia serusak,2025-05-01T03:48:27Z,0,1
Ijasah_ditunjukan_user_19404,rakyat paham jokowi ijasah aslinya hadir pengadilan mencemarkan yg rakyat yg menduga ijasah jokowi palsu bukti bukti hasil forensik skripsi jokowi ijazah beredar palsu tujuan roy suryo bukti iya berani kepalsuan ijazah jokowi berdasarkan uji forensik ijazah beredar media rasulullah hasutan ujaran kebencian berdasarkan data fakta keilmuan miliki,2025-05-01T03:44:32Z,0,1
Ijasah_ditunjukan_user_19437,knp ijazah jokowi bahas,2025-05-01T03:42:39Z,0,1
Ijasah_ditunjukan_user_19490,gw membela bpk jokowi gw pribadi berfikir simple ijazah asli beliau nya berjasa presiden noted pendapat silahkan berpendapatan bertengkar,2025-05-01T03:39:23Z,1,1
Ijasah_ditunjukan_user_19493,ijazah kahh rakyat indonesiaa klw semoga petanii buruh wajip ijazah pengalaman,2025-05-01T03:39:14Z,0,1
Ijasah_ditunjukan_user_19504,roy suryo gendeng ngak liat ijazah prabowo ijazah buk mega ijazah sby ijazah pramono palsu ngak liat,2025-05-01T03:38:38Z,0,1
Ijasah_ditunjukan_user_19515,berani nunjukin ijazah asli liat aja,2025-05-01T03:37:37Z,0,1
Ijasah_ditunjukan_user_19543,klo ijazah jokowi palsu lulusan ugm ditahun yg palsu ditahun kuliah masuk ugm susah bgt ujiannya berkali ujian aja msh susah utk masuk kuliah ugm ugm hebat lho lulusannya orang yg hebat alumni nya msh meragukan ijazah ugm jg meragukan ijazah jg salam damai,2025-05-01T03:35:55Z,0,1
Ijasah_ditunjukan_user_19549,logika klo ijazah palsu terpilih walikota kali disolo kalo terpilih gubernur kali presiden lucu negara org sdh menjabat curigai ijazah palsu logika org pinter mikir penggiringan opini ijazah ranah pribadi bkn utk umbar maksud terselubung nih hehehehe,2025-05-01T03:35:33Z,0,1
Ijasah_ditunjukan_user_19555,ijazah emang asli beli,2025-05-01T03:35:02Z,0,1
Ijasah_ditunjukan_user_19598,pengacaranya mulyono tau ijazah asli mulyono pekerjaannya gaduh berkepanjang si mulyono,2025-05-01T03:32:39Z,0,1
Ijasah_ditunjukan_user_19630,nyiapin ijazah aslinya aja sampe bertahun,2025-05-01T03:30:40Z,0,1
Ijasah_ditunjukan_user_19638,dipikir apasih susahnya tunjukkan ijazah asli,2025-05-01T03:30:08Z,0,1
Ijasah_ditunjukan_user_19661,undang ad yg mewajibkan menunjukan ijazah asli,2025-05-01T03:28:04Z,0,1
Ijasah_ditunjukan_user_19666,ijazah asli krn potret ijazah dipajang langsung disembunyikan universitas erasmus belanda bangga pemimpin spt bunghatta cerdas berintelektual,2025-05-01T03:27:52Z,0,1
Ijasah_ditunjukan_user_19692,lucu kmrn kemana pas pengadilan pengacara jokowi gak tuh ijazah asli knp skrg polisi tunjukkan kr partai coklat temennya rakyat sdh pinter mul mul lawak loe,2025-05-01T03:25:55Z,0,1
Ijasah_ditunjukan_user_19712,kalo orang sipil ngapain tunjukan ijazah menjabat wajib tunjukan ijazah asli,2025-05-01T03:24:43Z,0,1
Ijasah_ditunjukan_user_19719,kalo pake ilmu nalar teman alumni seangkatan jokowi ugm rektor dosen yg mengajar ugm angkatan jokowi uji keaslian ijazah klo ijazah asli roy suryo yg menganggap ijazah beliau palsu gantle maaf jokowi rakyat indonesia tv nasional,2025-05-01T03:24:16Z,0,1
Ijasah_ditunjukan_user_19700,apapun pemilik ijazah asli diterima penuduh ijazah palsu penuduh silahkan rumuskan syarat membuktikan asli mengaku ahli mengakui ahli kau sopan dipidanakan kampungan kau rai panci,2025-05-01T03:23:04Z,0,1
Ijasah_ditunjukan_user_19766,polisinya ijazah jokowi keasliannya,2025-05-01T03:22:11Z,0,1
Ijasah_ditunjukan_user_19768,ijazah tinggal tunjukin aja ruwet jokowi,2025-05-01T03:22:08Z,0,1
Ijasah_ditunjukan_user_19769,bawa nama masyarakat donk suka keterangan berbelit skripsi ijazah nomor ijazah sesuai,2025-05-01T03:22:07Z,0,1
Ijasah_ditunjukan_user_19787,andaikan asli ijazah milik orang yg bersangkutan semoga terungkap,2025-05-01T03:21:13Z,0,1
Ijasah_ditunjukan_user_19832,ijazah suka personal jokowi dibalik,2025-05-01T03:18:15Z,0,1
Ijasah_ditunjukan_user_19863,ijazah sdh basi krn sdh diputus pengadilan negeri solo sindang ptun sdh inkrach jokowi sdh rakyat mengacu pasal uu ttg kip bhw ijazah informasi yg dikecualikan krn ijazah milik privat,2025-05-01T03:16:24Z,0,1
Ijasah_ditunjukan_user_19855,kalo polisi hakim ijazah asli jokowi roy cs salah roy cs kalo g ijazah aslinya ya jokowi salah mudsh keadilan bosen ijazah ribet,2025-05-01T03:14:32Z,0,1
Ijasah_ditunjukan_user_19903,utamanyakan tuduhan ijazah palsu klo sy dituduh sperti klo sy ijazah sy tdk bermasalah didpt sesuai prosedur dr perkuliahan yg tdk menyalahi aturan ya sy tunjukan sy persilahkan orang yg menuduh utk menguji dg apapun sy tuntut sesuai hukum orang yg menuduh tsbt hasilnya ijazah sy dinyatakan asli klo yaaa,2025-05-01T03:13:33Z,0,1
Ijasah_ditunjukan_user_19810,ijazah asli kasi penjarah orang yg fitnah,2025-05-01T03:12:45Z,0,1
Ijasah_ditunjukan_user_19916,kunci ijazah jokowi praktino kejar selidiki pratikno,2025-05-01T03:12:43Z,0,1
Ijasah_ditunjukan_user_19977,seharus nya ijazah asli jokowi perlihatkan pengadilan disaksikan saksi dn ahli dn diputuskan halkim terbuka td yg asli ya tida direkayasa jd jls menghargai ketaatan hukum,2025-05-01T03:09:17Z,0,1
Ijasah_ditunjukan_user_20002,mantap jokowi ngumpulkan tikus pakai issue ijazah,2025-05-01T03:08:06Z,0,1
Ijasah_ditunjukan_user_20007,negara ijazah ributin negara menunjukan kecanggihan teknologi,2025-05-01T03:07:42Z,0,1
Ijasah_ditunjukan_user_20011,yg membuktikan asli ijazah lembaga menuntut ilmu lembaga pemerintah dinas pendidikan uji karbon lawak,2025-05-01T03:07:18Z,0,1
Ijasah_ditunjukan_user_20017,jaman cuman menunjukan ijazah gampang yg uji asli palsu semoga cepet uji keaslian nya ahli selesai,2025-05-01T03:07:04Z,0,1
Ijasah_ditunjukan_user_20034,asli dungu,2025-05-01T03:06:16Z,0,1
Ijasah_ditunjukan_user_20036,bener ijazah asli beliau yg kegaduhan negri bambang tri menggugak tunjukkan aslinya,2025-05-01T03:06:15Z,1,1
Ijasah_ditunjukan_user_20049,jokowi sadar presiden masyarakat ga mengalah tunjukkan ijazahnya media masyarakat biar ijazah nya asli ayo jokowi ijazah asli ga langsung buktikan pengadilan media,2025-05-01T03:05:40Z,0,1
Ijasah_ditunjukan_user_20090,roy kawan salah yg diteliti ijazah palsu ijazah potocopi,2025-05-01T03:03:52Z,0,1
Ijasah_ditunjukan_user_20094,nama penelitian ilmiah tdk ijazah pejabat negri teliti keasliannya,2025-05-01T03:03:47Z,0,1
Ijasah_ditunjukan_user_20115,ttp ga kalo ijazah nya wiwi asli,2025-05-01T03:02:43Z,0,1
Ijasah_ditunjukan_user_20122,cenderung percaya ijazah jokowi asli logika aingin memalsukan ijasah gak ijasah pengin bikin ijasah yg gak menempelkan foto asli lembar ijasah abal tsb menempelkan foto seppupu ijasah asli sungguh bodoh menempelkan foto oranglain ijasah yg palsukan akui sbg ijazah ketahuan palsunya bahjan inazah dupakai mencalonkan walikota gubernur presiden,2025-05-01T03:02:13Z,4,1
Ijasah_ditunjukan_user_20149,orang menuduh ijazah palsu terbukti ijazah asli dipidanakan,2025-05-01T03:00:38Z,0,1
Ijasah_ditunjukan_user_20184,simple tinggal mulyono tunjukan ijazah aslinya bodoh banget ga habis pikir,2025-05-01T02:58:19Z,0,1
Ijasah_ditunjukan_user_20191,untungnya kelompok inj mengejar ijazah jokowi,2025-05-01T02:57:54Z,0,1
Ijasah_ditunjukan_user_4682,mantap jokowi mengeluarkan ijazah kramat nya ijazah jokowi asli nya jokowi orang no berani ijazah nya kasih palsu mahal ijazah kertas,2025-05-01T02:57:40Z,0,1
Ijasah_ditunjukan_user_20206,knp era jokowi aja ijazah dipermasalahkan kl mempermasalahkan ijazah presiden asli ga knp ga presiden aja sklian trs ijazahnya kumpulin trs bikin museum bukti sejarah,2025-05-01T02:56:59Z,0,1
Ijasah_ditunjukan_user_20286,urusan ijazah aja serumit,2025-05-01T02:52:14Z,0,1
Ijasah_ditunjukan_user_20297,tunjukan ijazah penuntut saksikan hadir,2025-05-01T02:51:51Z,0,1
Ijasah_ditunjukan_user_20333,ijazah jokowi asli cuman photo nya orang sdh tau,2025-05-01T02:50:08Z,0,1
Ijasah_ditunjukan_user_20334,sibuk urusan ijazah orang ijazah yg melaporkan bener sesuai keahliannya kah,2025-05-01T02:50:07Z,0,1
Ijasah_ditunjukan_user_20339,klo pk roy uda ijazah pk jokowi palsu yg mengeluarkan ijazah yg gugat masarakat pk roy orangnya pintar gk pintar,2025-05-01T02:49:45Z,0,1
Ijasah_ditunjukan_user_20364,pendapat rasah bhwa ijazah dasar legalitas akurat dri ending dri sistem proses prosedur akademis yg tempuh sesuai ketentuan ketetapan yg brarti ijazah kebenaran stiap wisudawan dri perguruan bersangkutan kecuali terbit ijazah lantas tdak namanya buku registrasi alumni pda jurusan sesuai ijazah yg dimiliki mka sja klarifikasi verifikasi kebenarannya scara akurat krna blum kesalahan kekeliruan dll dsb mkanya sja prlu luruskan mencari kebenaran sesuai tdak prlu ditambah tdak prlu kurangi,2025-05-01T02:48:10Z,0,1
Ijasah_ditunjukan_user_20381,negara pokus memajukan negaranya sibuk ngurusin ijazah,2025-05-01T02:47:22Z,0,1
Ijasah_ditunjukan_user_20396,ny jgn trlalu kepo klian dgn ijazah org jg manfaat klian tntang ijazah pk jokowi ngotot hrs tunjukan keaslian ijazah pk jokowi nampak bnr klian benci sm pk jokowi ny skrg,2025-05-01T02:46:33Z,0,1
Ijasah_ditunjukan_user_20403,logika berpikir nya roy suryo dkk ijazah meneliti keaslian ijazah mengambil kesimpulan asli gitu klo ijazah jokowi diserahkan meneliti kesimpulan ijazah jokowi asli palsu jokowi melaporkan orang tuduhan roy suryo dkk disibukkan meneliti skripsi jokowi hasilnya skripsi nya nyelenej ga lucu meneliti foto kopi ijazah masyarakat milik jokowi mengambil kesimpulan barang tangan adakan penelitian khusus ijazah asli jokowi dipegang jokowi kesimpulan jokowi melaporkan tuduhan ijazah palsu miliknya dilaporkan,2025-05-01T02:46:13Z,0,1
Ijasah_ditunjukan_user_20408,kalo tunjukkan ya media tv ijazah asli jokowi tampilkan minimal ijazah asli seangkatannya ijazah asli jokowi asli,2025-05-01T02:46:01Z,0,1
Ijasah_ditunjukan_user_20409,kegaduhan terkait ijazah palsu tunjukin tu ijazah diuji aapkah sesimpel aja melaporkan dgn dalih pencemaran nama menjebak rakyat yg peka mencurigai ijazah palsu orang no yg menjabat priode lucu,2025-05-01T02:45:56Z,0,1
Ijasah_ditunjukan_user_20424,pertarungan iptek telematika digital porensi obyek asli tdk asli ijazah fak hukum ugm penyidik iptek teruji obyektip ahli datengkan negeri spy jeobyetipan hasil penelitian sarntifik yg pertanggung wabkan scr hukum jokowi bawa ijazah aslinya polda metro dg uji keasliannya dg ahleniptek telematika digital porensik selesai,2025-05-01T02:45:04Z,0,1
Ijasah_ditunjukan_user_20429,bawa ijazah asli ya tujukan publik klu yg pitnah proses gitu ajh repot,2025-05-01T02:44:41Z,0,1
Ijasah_ditunjukan_user_20447,stlh coba sby prabowo tunjukan ijazah berani ga,2025-05-01T02:43:37Z,0,1
Ijasah_ditunjukan_user_20464,negara konoha lucu ijazah masalahkan giliran korupsi bungkam,2025-05-01T02:42:47Z,0,1
Ijasah_ditunjukan_user_20518,senyum nya roy panci terpaksa sdh sadar ijazah bpk jokowi asli,2025-05-01T02:40:18Z,0,1
Ijasah_ditunjukan_user_20556,ijazah oplosan hilang beritanya,2025-05-01T02:38:47Z,0,1
Ijasah_ditunjukan_user_20570,negara udah sibuk teknologi terbaru indonesia ngurusin ijazah,2025-05-01T02:38:19Z,0,1
Ijasah_ditunjukan_user_20602,mas roy dekan tunjukan foto copy tdk tunjukan ijasah asli lembar asli dipegang jokowi sbg pemilik penuduh hrs tunjukan asli foto copy penuduh berani tdk asli palsu sdh bukti penuduh penuduh berani tunjukan yg asli,2025-05-01T02:37:00Z,0,1
Ijasah_ditunjukan_user_20607,sederhana jokowi ijazah asli terang benderang orang curiga repot,2025-05-01T02:36:41Z,0,1
Ijasah_ditunjukan_user_20613,buk pembawa acara ngak dipersidangkan asli tdknya ijazah trus pengadilan mrmbahasbttg pencemaran nama bmaka ikazah gak masyarakat tau ijazah mantan presidennya dikatai mencari cari kesalahan dilaporkan terkait penceran na mbak presenter,2025-05-01T02:36:29Z,0,1
Ijasah_ditunjukan_user_20654,aneh bgt gara jokowi ga nunjukkan ijazah ungkit,2025-05-01T02:34:50Z,0,1
Ijasah_ditunjukan_user_20656,alangkahbaiknya ijazah yg dipegang jokowi disita bareskrim diteliti pemeriksa independen,2025-05-01T02:34:43Z,1,1
Ijasah_ditunjukan_user_20668,tunjukan ijazah asli tunjukan wartawan orang simple ijazah asli asli ya cari pengacara dll bela ya,2025-05-01T02:34:18Z,0,1
Ijasah_ditunjukan_user_20729,membuktikan ijazah simpel klo gampang ajak ketemu tunjukkan klo khawatiran takut apain ijazah nya panggil menguji pemilik ijazah bikin kesepakatan didepan notaris disalahgunakan selesai,2025-05-01T02:31:51Z,0,1
Ijasah_ditunjukan_user_20732,asli itupun nanganin netral ijazah udah tunjukkan pengadilan poto copy penjarakan orang bukti kuat,2025-05-01T02:31:48Z,0,1
Ijasah_ditunjukan_user_20735,ngurusin ijazah org mending nyari duit anak makan,2025-05-01T02:31:39Z,0,1
Ijasah_ditunjukan_user_20783,aneh niih roy suryo org fotony wisuda dg teman ny gak ijazah palsu pikirannya d ijazah milik pribadi d an giliran d tangkap menunduk,2025-05-01T02:29:42Z,0,1
Ijasah_ditunjukan_user_20788,china udah robot indonesia masi sibuk urusin ijazah,2025-05-01T02:29:21Z,0,1
Ijasah_ditunjukan_user_20642,mempermasalahkan cuman gerombolan kadrun rakyat mempermasalahkan ijazah jokowi asli palsu,2025-05-01T02:29:11Z,0,1
Ijasah_ditunjukan_user_20855,sbaiknya si roy panci diapakn krn fihak ugm yg kluarin ijazah aja sdh ngaku bhw ijazah asli tp si panci ttp kekeh palsu sbaikny tv medsos stop aja britakn krn hny bikin gaduh gk manfaatny,2025-05-01T02:26:03Z,0,1
Ijasah_ditunjukan_user_20859,roy surya menirukan jokowi lho ijazah aslinya hehe benci bgt kayanya,2025-05-01T02:26:00Z,0,1
Ijasah_ditunjukan_user_20867,ijazah nunjukin kaya aurat,2025-05-01T02:25:38Z,0,1
Ijasah_ditunjukan_user_20913,kesengajaan mengulur ngulur seandainya dikeluarkan ijazah asli potocpy sma kuliah ramai,2025-05-01T02:23:23Z,0,1
Ijasah_ditunjukan_user_20867,selevel polisi memeriksa ijazah jokowi pengetahuan ijazah pengetahuan aslian ijazah,2025-05-01T02:23:13Z,0,1
Ijasah_ditunjukan_user_20954,negara bodoh maslah ijazah bertahun revolusi negara,2025-05-01T02:21:25Z,0,1
Ijasah_ditunjukan_user_20841,ijazah ijazah ijazah roy suryo gmna yahh sok iye,2025-05-01T02:21:23Z,0,1
Ijasah_ditunjukan_user_20969,prediksi boss klu jokowi tunjukan ijazah asli roy cs cari cari kesalahan yg ijazah buruan penjara roy cs selesai ijazah jokowi,2025-05-01T02:20:41Z,0,1
Ijasah_ditunjukan_user_20988,tunjukan ijazah masyarakat kalo asli biar selesai menjadikan polemik,2025-05-01T02:19:56Z,1,1
Ijasah_ditunjukan_user_20998,kebodohan pelihara negara menciptakan nagara ngurusi ijazah bodoh ngk ijazah pk karno harto pk habibi bu mega pk sby nyerang pk jokowi motifnya sakit hati,2025-05-01T02:19:35Z,0,1
Ijasah_ditunjukan_user_21008,kalo ijazahnya asli bawa aja dipengadilan persidangan roy suryo dkk uji forensik dibawa ijazah asli sd smp sma sarjana jokowi hadir hakim dlm persidangan takut doang asli palsu ijazahnya rakyat indonesia percaya puas ijazahnya jokowi asli,2025-05-01T02:19:17Z,0,1
Ijasah_ditunjukan_user_21053,ijazah jokowi keluarkan pd jaman pratikno jd rektor ugm jd sdh jls persoalanx,2025-05-01T02:16:38Z,0,1
Ijasah_ditunjukan_user_21055,ijazah asli repot,2025-05-01T02:16:33Z,0,1
Ijasah_ditunjukan_user_21064,ijazah bpk jokowi tunjukkan si roy kawan cari celahnya,2025-05-01T02:16:09Z,0,1
Ijasah_ditunjukan_user_21049,klo mulyono menunjukan ijazah asli nya segaduh wajar klo keaslian ijazah beliu pemimpin negara yg pembuat gaduh mulyono,2025-05-01T02:13:58Z,1,1
Ijasah_ditunjukan_user_21149,ijazah diisukan ijazah buatnya,2025-05-01T02:12:06Z,0,1
Ijasah_ditunjukan_user_21215,biyar ijazah kokowi asli tetep percaya pokoknya ribuuut,2025-05-01T02:09:16Z,0,1
Ijasah_ditunjukan_user_21200,asli palsu ijazah bermaterai buku induk ugm ga da nama jokowi negeri ancur tukang kayu ya tamatan sd ga sekola alias buta hurup,2025-05-01T02:09:15Z,0,1
Ijasah_ditunjukan_user_21247,masyarakat rakyat aja ijazah asli palsu gak untungnya beras beli lo aja yg lemes rewel,2025-05-01T02:07:31Z,0,1
Ijasah_ditunjukan_user_21257,roy dibayar mahal bikin gaduh jokowi pdi perjuangan bicara kalo emang ijazah palsu jokowi pdi tau merwka diam aja jangan² ijazah roy beli skipsinya beli roy kebalik,2025-05-01T02:06:52Z,0,1
Ijasah_ditunjukan_user_21287,bank suryo diuji forensik ketahuan ijazah asli palsu pemalsuan dilindungi penguasa preman indonesia,2025-05-01T02:05:09Z,0,1
Ijasah_ditunjukan_user_21318,gak pembahasan lainkah bg roy klo ijazahnya palsu bahas ijazah ijazah,2025-05-01T02:03:13Z,0,1
Ijasah_ditunjukan_user_21345,emang dah asli udah uji,2025-05-01T02:01:26Z,0,1
Ijasah_ditunjukan_user_18972,kampus menguji ijazah mengeluarkan ijazah asli pembuat ijazah palsu,2025-05-01T01:59:46Z,0,1
Ijasah_ditunjukan_user_21389,ijazah berkacamata,2025-05-01T01:59:37Z,0,1
Ijasah_ditunjukan_user_21390,sih urusin ijazah ijazah,2025-05-01T01:59:36Z,0,1
Ijasah_ditunjukan_user_21404,kirain ijazah nembak ternyta ijazah palsu usut bnyak orang ijazah nya nembak,2025-05-01T01:59:03Z,0,1
Ijasah_ditunjukan_user_21417,mantap jokowi melaporkan ijazah aslinya tahan polda pbukrian pembuktian hak bathil,2025-05-01T01:58:26Z,0,1
Ijasah_ditunjukan_user_21471,ijazah plsu blng asli,2025-05-01T01:54:53Z,0,1
Ijasah_ditunjukan_user_21526,emang ijazah jokowi yg asli,2025-05-01T01:52:36Z,0,1
Ijasah_ditunjukan_user_21576,analisa bokep analisa ijazah,2025-05-01T01:49:52Z,0,1
Ijasah_ditunjukan_user_21583,roy lu butuh ijazah gw ga teliti keasliannya,2025-05-01T01:49:32Z,1,1
Ijasah_ditunjukan_user_21416,desak jokowi tunjukkan ijazah publik,2025-05-01T01:49:17Z,0,1
Ijasah_ditunjukan_user_21591,si mulyono nunjukin ijazah ko sm kroni² nya yg bs dibayar trs lgsg nyembah² lgsg membenarkan kl ijazah asli kocakkkkk,2025-05-01T01:49:03Z,0,1
Ijasah_ditunjukan_user_21453,mentok nanya ijazah jokowi tebal kertasnya sesuai ketebalan yg asli,2025-05-01T01:48:30Z,0,1
Ijasah_ditunjukan_user_21615,semoga ijazah jokowi asli congor bungksm mulutnya,2025-05-01T01:47:34Z,0,1
Ijasah_ditunjukan_user_21622,ijazah asli skripsinya bodong,2025-05-01T01:47:04Z,0,1
Ijasah_ditunjukan_user_21686,logika hukum nya si penuduh yg membuktikan nuduh ijazah jokowi palsu roy panci ijazah asli jokowi pembanding logika hukum indonesia jokowi yg hrs nunjukin ijazahnya roy guoblok,2025-05-01T01:43:27Z,0,1
