author,text,published_at,like_count,cluster
user_4542,masyarakat sepakat kau layak utk hukum,2025-05-05T14:08:09Z,0,16
user_4574,matamu roy sprti orang ngantuk sprti orang lunglai roy tunggu kau kau penjara,2025-05-05T13:17:25Z,0,16
user_4604,rismon suryo au memangnya yg tau sekolah kulia k iri ya pa jokowi mulut omong kosong penjara kau dgn org dipenjarakan tau enak ngomong suryo kau kau tuhan allah pemilik kehidupan setang manusia sombong,2025-05-05T13:16:08Z,1,16
user_4652,hak kau royko suryo cari tau ijazah jokowi haaaa orang udah stadium super berat,2025-05-05T12:09:34Z,0,16
user_4662,kau gak hak tau keaslian ijazah,2025-05-05T11:54:31Z,0,16
user_4726,setan kau mengajokan nkri malu kau,2025-05-05T09:27:18Z,0,16
user_4855,among kau roy panci,2025-05-05T03:53:14Z,0,16
user_4897,hei roy umpama klo bilang kau laki laki palsu kau langsung tunjukan burung mu,2025-05-05T02:01:38Z,0,16
user_4925,roy panci kau takut mulutmu harimaumu shok shokan tuduh ijazah palsu tunjukkan kau ijazah jokowi rasakan akibat kelakuanmu mulut baumu cs csmu mendekam hotel prodeo kau dibantai tahanan disana selamat bertapa gua prodeo,2025-05-05T01:12:56Z,0,16
user_4930,udlah kebui aja kau roy,2025-05-05T01:05:14Z,0,16
user_4960,masyarakat menilai jokowi presiden kau aja cari alasan kejujuran kek niat njelekin kog cincong,2025-05-04T23:54:46Z,0,16
user_5000,sombong kau roy masuk bui kau nant cengengas cengenges kau yaa hukum seberat beratnya,2025-05-04T22:04:07Z,0,16
user_5050,suryo masuk lg kau penjara ngajak lg,2025-05-04T18:04:54Z,0,16
user_5080,anjrittt ahli telematian mampusss kau,2025-05-04T17:03:04Z,0,16
user_5094,lari kau bodat kau bawak mbah mu amin rais,2025-05-04T16:29:03Z,0,16
user_5100,masyarakat setuju kau dkk tangkap,2025-05-04T16:16:30Z,0,16
user_5110,hati hati kau mulyono pengadilan dunia dibeli uang pengadilan akhirat beli apapun tertawalah kau dunia yg akhirat kau mempertanggung jawabkan perbuatan kau,2025-05-04T15:59:17Z,0,16
user_5324,roy yangan bawa nama masyarakat kau manusia kerdil,2025-05-04T12:37:04Z,0,16
user_5365,mampusss kau penjara aja,2025-05-04T11:51:19Z,0,16
user_5372,roy suryo mulutmu harimaumu takutlah karma alloh sombong kau,2025-05-04T11:44:18Z,0,16
user_5428,roi surio kau orang sakit hati gak kau urusin orang dirimu urus,2025-05-04T10:31:50Z,0,16
user_5425,royi otak lu enda ruba kau sok ahli,2025-05-04T10:30:20Z,0,16
user_5471,hak mu kau lihat ijasa orang,2025-05-04T09:29:42Z,0,16
user_5505,orang tukang fitnah mampus kau kena batunya rasain lo,2025-05-04T08:37:44Z,0,16
user_5510,sembunyikan pandai ngomong kau kau memfitnah orang babi kau politik orang tua udah gak zaman,2025-05-04T08:30:31Z,0,16
user_5512,asuuu kau roy suryo kerjaan aja kau dasar iri hati,2025-05-04T08:28:07Z,0,16
user_5555,kau bicara pinter panci tololmu akut rakyat yg kau bilang mendukungmu,2025-05-04T07:26:29Z,0,16
user_5593,masuk penjara roy suryo mampus kau pengujar kebencian abadi,2025-05-04T06:27:52Z,0,16
user_5604,ngak kerjaan kau roy suryo penyakit hati kau iri dengki mu jokowi lapor org org roy suryo antek antek nya org roy suryo ngak waras,2025-05-04T06:08:13Z,0,16
user_5724,berita gak berbobot roy km perangkap kau kena bencana jahat kau roy,2025-05-04T03:04:16Z,0,16
user_5747,mantan napi bicara kejujuran roy roy beralibi kau dgn kakek amin,2025-05-04T02:36:10Z,0,16
user_5864,pansos kau suryono,2025-05-03T23:23:04Z,0,16
user_5971,suka suka kaulah roi panci sebentar kau masuk penjara penjara kau ngomong hukum adil diskriminasi kau ngomong roi panci,2025-05-03T17:15:03Z,0,16
user_6030,mampus kau roi suriyo,2025-05-03T15:39:54Z,0,16
user_6080,gak kerjaan kau suryo rakyat menilai kau gak waras,2025-05-03T14:54:39Z,0,16
user_6158,dingin telor kau roy,2025-05-03T13:52:32Z,0,16
user_6189,lancang manusia busuk mmg tdk kerjamu ya roy suryo ijazah org kau ungkit kau kerja yg ut kel biar makmur urusan org cari kesalahan org dasar manusia hati yg tdk beriman,2025-05-03T13:32:07Z,0,16
user_6223,kau ngomong kau kau roy masyarakat geli,2025-05-03T13:06:58Z,0,16
user_6244,kau suryo bacot lagu indonesia raya aja gk hapal,2025-05-03T12:50:11Z,0,16
user_6258,roy suryo kau mantan mentri bodoknya ampun,2025-05-03T12:20:47Z,0,16
user_6299,roy suryo woy masyarakat kau kelompok sakit hati kau bencinya jokowi kau laporkan ijazah palsu kau laporkan mencari alibi wakil presiden laporkan rakyatnya bahlul kau roy pakar tele kau suryo suryo,2025-05-03T12:04:46Z,0,16
user_6338,banget panci penipu berkedok ilmuwan kau kena batunya,2025-05-03T11:36:18Z,0,16
user_6376,kalua kau tdak laporkan cari klau kau cari masaalah kau jga,2025-05-03T11:10:44Z,0,16
user_6441,pentingnyamenunjukkan izasah jokowi kau,2025-05-03T10:12:25Z,0,16
user_6439,kau roy cs masukkan sampaibusuk penjara bgmn memfitnah ngak pidanakan,2025-05-03T10:10:36Z,0,16
user_6722,roy suryo ngeles membawa bawa jokowi melapor mencari dukungan dr kau yg mengembalikan panci yg kau ambil,2025-05-03T06:32:01Z,0,16
user_6735,tunggu kau suryo menekam penjara,2025-05-03T06:22:50Z,0,16
user_6764,roy suryo tkutkan klau penjara suka fitnah robek kau mlut bkin gaduh aja negri,2025-05-03T06:04:30Z,0,16
user_6831,roy roy kau cariiii coba kau tunjukan solusi indonesia maju ilmiah yg kau mengurusi urusan receh roy,2025-05-03T05:32:47Z,0,16
user_6847,yg kau pikirnya anak anak jokowi roy suryo ijazah mu langsung gtu mantan presiden ri ajh kau,2025-05-03T05:21:28Z,0,16
user_6311,mampus kau suryo dkk hotel prodeo,2025-05-03T03:42:22Z,0,16
user_7169,terima aja roy perbuatan busuk mu membusuk kau dkk dlm penjara,2025-05-03T01:57:05Z,0,16
user_7208,panci ee roy suryo kau bicara lantang tunggu sebentar kau meringkuk tahanan,2025-05-03T01:29:02Z,0,16
user_7280,eh roy kau ngak sadar ya klu kalianemfitnah jokowi rusak ya nama jokowi kau bilang jokowi tega mempidanakan org yg membolak balikan fakta dasar tukang fitnah kau minum air nanah neraka ya roy,2025-05-03T00:50:18Z,0,16
user_7374,panik kau dekkk,2025-05-02T23:56:58Z,0,16
user_7414,maunya nyalahin orang giliran disalahin bekas kasihan manusia gak beradap kau roy surio urgensi nya kau tunjukkan ijazah pintar gak berguna,2025-05-02T23:33:22Z,0,16
user_7469,menilai bodoh ga usahpke insyaallah kau suryo panntek,2025-05-02T22:44:28Z,0,16
user_7511,sdh gini dibilang jokowi tega pidanakannya gembar gembor hujat nangislah kau roy,2025-05-02T22:00:33Z,0,16
user_7542,diam aja kau roy suryo bising aja kau,2025-05-02T21:11:06Z,0,16
user_7551,masyarakat tau sebiadab mulutmu roy suryo kau aja gak berguna masyarakat jokowi berjasa warga yg nya,2025-05-02T20:50:41Z,0,16
user_7573,klo tau kau roi surio harap tau klo kau pintar hebat kau ganti dr mentri,2025-05-02T19:57:28Z,0,16
user_7700,setuju proses hukum biar mampus kau,2025-05-02T17:10:25Z,0,16
user_7726,kau menteri nggak kinerja mu roy roy,2025-05-02T16:52:32Z,0,16
user_7929,kau yg meng hasut masyarakat,2025-05-02T15:03:34Z,0,16
user_7932,roy suryo masrakat kau kau bikin gaduh rakyat indonesia roy suryo kelompok nya suka bikin fitnah,2025-05-02T15:00:46Z,0,16
user_8070,pakar panci nrengenges takut masuk penjara masyarakat klo lo lo pads dipenjars lo bilang jokowi nunjukin ijazahnya kau hinakan keseluruh dunia perempuan mulut anjing menghinakan jokowi kaubels jadiorang lemes mulut didepan tuhan ijasahasli tdktahu pd koar panci kau rasakan prodeo,2025-05-02T14:10:58Z,0,16
user_8081,suryo kau banciii,2025-05-02T14:07:16Z,0,16
user_8081,kau suryo termakan perangkap hahahaaaaaa,2025-05-02T14:06:42Z,0,16
user_8137,lucu kesalahan dlm penulisan nama dosen pembimbing skripsi jokowi koreksi emangnya kau woiiii,2025-05-02T13:49:23Z,0,16
user_8210,wajar rempong kau jadikan alasan yg gak,2025-05-02T13:27:13Z,0,16
user_8255,menebar kebencian memfitnah kau menghina merendahkan suka ria dgn bangganya kelompok mu suryo panci giliran laporkan kau bilang mantan presiden bla bla bla kau merendahkan menghina mencaci maki menghujat sang mantan presiden dgn enteng nya beban dosa kau ajak masyarakat membenci mantan presiden nikmati duhai suryo panci,2025-05-02T13:17:04Z,0,16
user_8261,sibuk kali kau suriyo urus aja pribadimu org udah jd walikota sdh jd gubernur sdh presiden kau sirik banget si kau mesti jujur jokowi samamu skrg geger kau cuwreeeeeh,2025-05-02T13:13:53Z,0,16
user_8294,panik kau roy suryo,2025-05-02T13:08:19Z,0,16
user_8301,mampus kau roy suryo sianipar jebloskan penjarah jgn kasih biar orang pengaco sperti bikin resah masyarakat sj,2025-05-02T13:07:04Z,0,16
user_8321,ngak tau malu kau roy,2025-05-02T13:00:05Z,0,16
user_8336,kau roy nama masyrkt sluruhnya gak kau jokowi sdh membuktikan indonesia,2025-05-02T12:56:41Z,0,16
user_8476,kau narasi jokowi melaporkan roy suryo rakyat udah pintar woy jgn narasi goblokkkk,2025-05-02T12:23:04Z,0,16
user_8485,kau roy seenak hatimu dimata hukum,2025-05-02T12:20:05Z,0,16
user_8497,roy kau nda untungnya presiden jokowi orang masyarakat indonesia uda pintar roy suryo tu penghasut ricuh,2025-05-02T12:18:10Z,0,16
user_8598,lapor apanya kau tunjukkan suratnya sdh,2025-05-02T11:54:30Z,0,16
user_8640,roy suryo yg memfitnah tdk bole hukum enak aja kau roy suryo kau yg data palsu roy suryo hukum berat mantan residivis napi,2025-05-02T11:46:02Z,0,16
user_8643,kau jagan panik sdh roy,2025-05-02T11:45:20Z,0,16
user_8732,bagus kau penjara biar gak yg mengadu domba,2025-05-02T11:25:59Z,0,16
user_8742,kau roy suryo dkk hotel prodeo mu kau urusi terima kasih jokowi kasih paham roy suryo dkk secepatnya roy suryo dkk hukuman setimpal prbuatannya,2025-05-02T11:23:43Z,0,16
user_8787,enak aja roy panci bacot lihat lg podcastmu roy kau olahmu yg mencabik nama joko w keluarganya coba klo pd kau dipenjara roy nya,2025-05-02T11:13:37Z,0,16
user_8805,roy surya jgn kau informasi maaf,2025-05-02T11:09:19Z,0,16
user_8746,nyonyor mulut roy suryo gak sok ahli masuk kandang kau,2025-05-02T11:09:11Z,0,16
user_8878,yg yg kau tanam padti kau memetiknya mult ngebacot diperingatkan madih ngeyel ya tanggung srmua,2025-05-02T10:43:02Z,0,16
user_8968,tinggal menunggu pakai baju orange kau maling panci,2025-05-02T10:25:16Z,0,16
user_8985,eeeee roy rakyat yg yg kau,2025-05-02T10:19:38Z,0,16
user_9065,sok paten kau roy suriyo jgn kau bawa nama masyarakat bnyk masyarakat yg gak suka sm kau,2025-05-02T10:05:20Z,0,16
user_9263,lulusan ugm gak hapal lagu indonesia raya memalukan kau roy,2025-05-02T09:11:12Z,0,16
user_9265,lu panik kali roy masuk penjara aja kau,2025-05-02T09:10:48Z,0,16
user_9326,kor kau tego kau masuk penjarah kau hina bpk jokowi kau sur roy kau,2025-05-02T08:55:21Z,0,16
user_9375,roi kau takut mulutmu harimau mu tobat,2025-05-02T08:43:02Z,0,16
user_9526,pucat kau roy,2025-05-02T08:11:38Z,0,16
user_9541,roy bawa nama masyarakat masyarakat yg kau maksud urus loe sono,2025-05-02T08:08:55Z,0,16
user_9549,bacoot kau suryo kau masuk penjara semoga hukum mati kr org ky kau suryo sampah rakyat yg bergaya sbg org pintar penjarakan suryo jokowi sdh byk membangun indonesia kau suryo membangun pa kekacauanlahhh yg kau bangun liat skr pa yg,2025-05-02T08:07:48Z,0,16
user_9652,tunggula roy rismon ibuk mulut nya mompina penjara monanti kau nangis dipenjara,2025-05-02T07:46:57Z,0,16
user_9743,rifai kau terjebak korban kau bodoh duniamu kau kau gagal alias dungu,2025-05-02T07:34:37Z,0,16
user_9778,masyarakat menilai kau brengsek surio,2025-05-02T07:29:07Z,0,16
user_9778,gak berkelit surio diketek menjijikkan kau menteri panci,2025-05-02T07:23:46Z,0,16
user_9895,masyarakat roy panci diproses hukum roy panci teriak kriminalisai diskriminasi kau perbuat kau pertanggung jawabkan,2025-05-02T07:14:57Z,0,16
user_9898,nuduh dimedia kau roy suryo klarifikasi langsung jokowi fitnah menggiring opini masyarakat menyerang matillah kau dipenjara,2025-05-02T07:13:26Z,0,16
user_9916,kau menunduk enak,2025-05-02T07:11:37Z,0,16
user_9916,membusuk kau dipenjaja,2025-05-02T07:10:36Z,1,16
user_9997,senyum kau roy masuk bui,2025-05-02T07:01:00Z,0,16
user_10014,mulutmu harimaumu triak giliran dlporkan ampunan kocak kau,2025-05-02T06:58:49Z,0,16
user_10063,roy suryo memalukan olah berlindung tameng g laporkan menjijikan kau kawan berani berbuat g berani bertanggung,2025-05-02T06:54:07Z,0,16
user_10157,manusia laknat kau roy suryo,2025-05-02T06:40:01Z,0,16
user_10288,membuka permasalahan kau roy suryo koplok kawan kawan mu janngan kau kait rakyat muncung provokator mengatas namakan dasar munafik busuk barisan sakit hati kau,2025-05-02T06:22:58Z,0,16
user_10353,kau hak mu ijazah jokowi kau badan hukum kah wkwkwkw royy royy kebanjiran kebencian,2025-05-02T06:17:24Z,0,16
user_10375,modar kena kau kena lapor pinter jokowi diam nukan kalah,2025-05-02T06:13:42Z,0,16
user_10391,roy setan kau libatkan masyarakat menilai masyarakat bnyk kerjaan gak urusin yg masyarakat nilai fakta zaman pemerintahan jokowi bagus hebat,2025-05-02T06:11:53Z,0,16
user_10396,jd takut panik bilang ijazah palsu kicep kau panik kau pa roy suryo tuduhan ngga berdasar ngapain sampe ijazah tunjukin,2025-05-02T06:11:32Z,0,16
user_10483,ijasahnya palsu asli tdk kau tujuanmu yg nggak muter² bang bang,2025-05-02T06:02:26Z,0,16
user_10501,suryo yg percaya mulutmu suryo panci dapur kau libas ampun deh tipe raisah malu,2025-05-02T06:00:09Z,0,16
user_10517,kau yg berbuat kau yg bertanggung kau bawa masyarakat,2025-05-02T05:58:32Z,0,16
user_10560,masarakat yg yg kau bilang roy panci masarakat pengikut mu masaraka seprti yg kau bilang roy panci,2025-05-02T05:53:41Z,0,16
user_10663,bawak masyarakat kau buktikan aja tuduhan mu suryo,2025-05-02T05:39:18Z,0,16
user_10706,cemen kau roy giliran dilaporkan kau suruh masyarakat yg menilai mantan presiden kau bilang kriminalisasi ibu²,2025-05-02T05:33:40Z,0,16
user_10715,masyarakat yg wakili roy nama masyarakat aibmu kau umbar,2025-05-02T05:32:24Z,0,16
user_10779,kali ceritamu roy suryo panci dandang dll dah kau balikan,2025-05-02T05:22:03Z,0,16
user_10781,mampus kau roy suryo kena pasal berlapis memcemarkan nama jokowi ugm rasakan pembalasannya,2025-05-02T05:21:45Z,0,16
user_10786,roy surio membusuk penjara masyarakat roy membusuk kau,2025-05-02T05:21:17Z,0,16
user_10828,si suryo ketakutan bencongkah kalo penjahat ya hrs penjara paham kau suryo,2025-05-02T05:14:15Z,0,16
user_10904,roy suryo salahnya pidanakan jokowi pidanakan melangar hukum kau bertanggung leluarga tsb kau bilang biar masyarakat menilai masyarakat orang bodoh sdh tau tukang fitnah otak pikiran dah rusak berbohong malu ganti baju orange mudah mudahan pake baju orange timbul perubahan sadar perbuatan hina,2025-05-02T05:01:21Z,0,16
user_11037,tolol kau menyebarkan berita bohong korban mengambil jalur hukum kau mantan presiden memidanakan kalo tdak pidanakan yaa berita bohong sy tdak suka jokowi kali sy lihat terlahir mencari cari kesalahan,2025-05-02T04:45:14Z,0,16
user_10959,nangis kau roy suryo kerja cari keburukan org sj cari pembelaan lg dng dlil dasar,2025-05-02T04:34:13Z,0,16
user_11206,hoi panci ditunjukipun ijasah samamu kau ngeyel bilang palsu buktikan tuduhanmu kentelemen kau jgn ngeles ketakutan kau oanci,2025-05-02T04:20:50Z,0,16
user_11291,kapokmu kpn kau roy sebentar membusuk penjara,2025-05-02T04:10:02Z,0,16
user_11428,selamat ot masuk bui kau,2025-05-02T03:53:35Z,0,16
user_11502,kau tertawa roy suryo gk mendekam penjara seumur hidup,2025-05-02T03:43:05Z,0,16
user_11599,masyarakat menilai kau hukum biar gk penyakitt masyarakat roy suryo,2025-05-02T03:27:33Z,0,16
user_11654,hak kau lihat ajiazah jokowi dasar berhati jahat,2025-05-02T03:17:02Z,0,16
user_11671,seenak prutmu omong ya sdh grogi kau,2025-05-02T03:13:51Z,0,16
user_11672,wallahi hancur lebur kau dinasti jokowi daging ulama beracun dzolim nya rezim kau habibuna rizieq syihab persatu allah hinakan pembenci nya yg awali allah hina dinakan si sambo cs pangkat si sambo berkuasa si sambo tp menyakiti hati dzuriyyah rasulullah pembantaian km allah hinakan sekeluarga membusuk penjara kau jokowi antek kau allahuakbar,2025-05-02T03:13:49Z,0,16
user_11671,jokowi sdh berprestasi d ok negara in roy kau prestasi mu panci ya,2025-05-02T03:10:39Z,0,16
user_11691,wajah wajah pencundang penjilat kotoran sesungguhnya memalukan orang yg mulia dihadapan tuhan kau hancurkan terkincit kincit kau hinakan wajahmu halnya hewan penjilat,2025-05-02T03:09:27Z,0,16
user_11671,bukn gampang maumu bro kau sdh menghina dll kau hukum dkk,2025-05-02T03:07:56Z,0,16
user_11654,roy panci suryo wooi kelakuan kau sungguh memfitnah mantan presiden ri yg dicintai rakyat dg mulut busukmu semoga tulah menimpa kau dkk jahatmu,2025-05-02T03:05:49Z,0,16
user_11736,pembuktian masuk penjara si panci ud basi roy ijazah palsu jokowi busuk aja kau d penjara,2025-05-02T03:00:50Z,0,16
user_11795,pengacut kau roy,2025-05-02T02:48:26Z,0,16
user_11796,panik kau roy,2025-05-02T02:48:04Z,0,16
user_11965,marga sianipar lubis isinya modelan sampah woi roy membusuk kau d penjara panci,2025-05-02T02:06:48Z,0,16
user_12009,masarakat lbih percaya pda ugm dri pda kau roy dasar otak sakit hati kau,2025-05-02T01:55:33Z,0,16
user_12186,roy suryo kau bidik utk sel hatimu sakit,2025-05-02T01:12:43Z,0,16
user_12189,kau baca komen roy kau bawa msyarakat kau manusia penipu kau penjara manusia kau hidup bikin rugi keluarga kau jangam bawa masyrakat masyarakat seruju kau penjara kau nangis dukungan pa prabowo kasian kau kau dasar manusia suka cari ketenaran krn kau tenar negri manusia iri tau kau,2025-05-02T01:11:33Z,0,16
user_12314,cakap kau roy suryo kau ketahuan korupsi ngacalah kau rok suryo bodat,2025-05-02T00:44:01Z,0,16
user_12314,cakap kau roy suryo kau ketahuan korupsi ngacalah kau rok suryo bodat,2025-05-02T00:44:02Z,0,16
user_12323,kau hak,2025-05-02T00:41:00Z,0,16
user_12272,pengecut kua roi berani mencurigai orang penghinaan jokowi presiden indonesia gara gara kau yg giring orang kau roi gaduh kau takut penjara kau bilng jokowi penjarakan mulut mu mu penjarakan roi pengecut skarng kau bangga kau lulusan ugm kau bangga jokowi lulusan ugm presiden takut penjarakan sepahit apapun penjarakan orang orang,2025-05-02T00:32:32Z,0,16
user_12410,dasarnya kau hormati suryono tunjukin muke lu ijasa asli jokowi,2025-05-02T00:23:29Z,0,16
user_12509,mampus elu roy ele ngomong jokowi tega melaporkan ibuk rakyatnya elu membingungkan skrg jokowi sdh rakyat setatusnya elu yg kau dungu kau ya,2025-05-01T23:58:17Z,0,16
user_12706,jgan kau masarakat yg mantan menteri panci,2025-05-01T22:57:49Z,0,16
user_12706,mamus kau mentri panci karna gak terpakai pemerintahan,2025-05-01T22:56:30Z,0,16
user_12730,pandai kau roti menyala de,2025-05-01T22:48:34Z,0,16
user_12732,roy suryo menjatuhkan orang kau tunjukan lu ya gw masyarakat negara indonesia memantau,2025-05-01T22:48:13Z,0,16
user_12936,masyarakat senang jokowi ambil tindakan kau suryo penilayan masyarakat,2025-05-01T19:59:21Z,0,16
user_12968,roy kau gugat ugm mengeluarkan ijasa palsu gk roy saking pintarnya bodohkan media,2025-05-01T19:24:28Z,0,16
user_13012,wooiii suryo sblm prabowo purna tugas coba kau skrng ijazahnya asli palsu jgn nnti prabowo purna tugas kau antek mu koar koar usut prabowo itupun klau kau laki jantan kau antek berbuat nkri jgn jdi manusia banci suryo yg trhormat,2025-05-01T18:45:12Z,0,16
user_13037,ditubnjukkan babi aja wi dasar penipu kau,2025-05-01T18:31:31Z,0,16
user_13179,kau ketawa besok kau menangis mulutmu sifatmu gak kau jaga,2025-05-01T17:26:49Z,0,16
user_13264,aura muka kau pucat,2025-05-01T16:56:11Z,0,16
user_13290,bacot kau roy,2025-05-01T16:44:04Z,0,16
user_13310,gemetaran kau leee mulut bunyi mempidanakan kau kepala karna kau orangnya songong sok pintar sok tau meremehkan kemampuan orang pendapatmu yg,2025-05-01T16:39:48Z,0,16
user_13294,bawak rakyat kau roiii,2025-05-01T16:39:39Z,0,16
user_13348,gila kau roy masyarakatlah yg menilai kau oantas penjarakan itupun penjarakan biar kapok gak bunyi org yg sakit hati,2025-05-01T16:29:38Z,0,16
user_13367,jokowi terbukti jasanya palsu la kau roy suryo masuk rumah penjara,2025-05-01T16:20:45Z,0,16
user_13387,kau nama masyarakat royyyyy,2025-05-01T16:13:15Z,0,16
user_13445,halah ngeles aja kau suryo busuklah enjara,2025-05-01T15:59:02Z,0,16
user_13655,indonesia maju orang menganggap pintat pintarnya nggak karuan ngeyel tok nggak manfa at nya negara bangsa sadar kau suryo pintar buatlah utk kemajuan bangsa negara menyudutkan orang sdh berjuang utk nrgara bangsa sadarlah kau suryo,2025-05-01T15:15:53Z,0,16
user_13691,mk siaf lahh kau pake rompi kuning,2025-05-01T15:09:44Z,0,16
user_13787,monyong mu roy uda provokasi berita hoax bilang yg mampus kau roy utk tinggal terali besi,2025-05-01T14:52:56Z,0,16
user_13882,kau ngatur jokowi panci,2025-05-01T14:34:51Z,0,16
user_13963,bau bau ketakutan roy suryo kau,2025-05-01T14:20:38Z,2,16
user_14004,modar kau roy,2025-05-01T14:13:04Z,0,16
user_14023,masyarakat mn yg dukung kau roy,2025-05-01T14:08:10Z,0,16
user_14026,modyar kau roy suryo ketakutan dasar gak tau malu rou panci,2025-05-01T14:07:49Z,0,16
user_14214,kau pembukaan jokowi presiden tapikan menjabat,2025-05-01T13:30:15Z,0,16
user_14389,kau roy kau jokowi seakan beci gk obat nya kau mencar kesalahan orang jokowi menjabat kau menjatuhkan y waras dikit roy,2025-05-01T12:59:36Z,0,16
user_14428,roy kmu kh dlu kau lupa hafal pancasila kau niii,2025-05-01T12:52:44Z,0,16
user_14490,roy roy kau ngleles kau menjelek jokowi tunggu aja kau pakai rompi orange pembuktian ilmiah dlm pembuktiannya tinggal ugm keputusan jokowi kuliah lulus ijazah selesai jokowi ijasah ugm,2025-05-01T12:40:46Z,0,16
user_14530,kau bang for karna mulutmu ember,2025-05-01T12:33:05Z,0,16
user_14550,bacot kau panci,2025-05-01T12:26:25Z,0,16
user_14676,kali alasan suryo tu coba kau tunjukan ijazahmu ga,2025-05-01T12:06:34Z,0,16
user_14872,hayooo kemana kau roy suryo senyum hati ente gelisah cemas kau dek,2025-05-01T11:40:17Z,0,16
user_14961,yg kepo kau rismon suryo,2025-05-01T11:26:46Z,0,16
user_15070,provokator rusuh yaa diadili emang hukum cuman kaum adam aneh kau suryo diadili yaa melanggar hukum bodoh kau suryo kayaknya udah berlindung dgn jual nama,2025-05-01T11:05:39Z,0,16
user_15080,sial kau roy penjarahkan kau biar kapok perduli ajar,2025-05-01T11:04:16Z,0,16
user_15139,roy suryo cma masyrakat kadrun yg dukung kau babi,2025-05-01T10:53:28Z,0,16
user_15203,kena kau egi roy cs,2025-05-01T10:43:18Z,0,16
user_15261,ekonomi lesuh nya bernuat negara bikin kacau hebat mu tidur kursi dpr gitu tdk kau pakar telematika kau sdr yg gelar dirimu pantaslah kau masuk penjara,2025-05-01T10:36:10Z,0,16
user_15222,roy ga bacot kau bohongnya ikutu sidang pengadilanmu,2025-05-01T10:34:49Z,0,16
user_15320,kau yg bodoh roy panci kau kena perangkap jokowi jau dipancing krn ulah aroganmu skeg kau mamam tuh hasilnya,2025-05-01T10:25:07Z,0,16
user_15329,cakap kau panci,2025-05-01T10:24:13Z,0,16
user_15388,knpa roy suryo sllu d bawa nama masyarakat urusanmu urusan orang anjing kau babi kau sllu masyarakat yg bawa d,2025-05-01T10:14:34Z,0,16
user_15454,gak semudah roy kau tunjukkqn ijaah tunjukkan kau bwrbuat jahat tunuan utama mu bikin gaduj kau tenar anggap pakar,2025-05-01T10:03:24Z,0,16
user_15590,mulut comberan kau suryo gx wewenangmu identitas ijazah orang,2025-05-01T09:45:15Z,0,16
user_15627,trus ajasah yg roy suryo disebutt pakar telematika namanya melecehkan ato menghina nggak sesimpel kau anggap tinggal,2025-05-01T09:40:14Z,0,16
user_15628,roy suryo kau sih mantan napi sok sok an lihat dirimu sumbang sih mu negara korupsi,2025-05-01T09:40:00Z,0,16
user_15676,dak podcas alasan tudingan palsu suda jlas kpu sblm jdi wai jdi gub president knapa kau bilang ugm goyah kau dalil menyalahkan inginnya kau ijazah p jokowi palsu berartu kau suryo yg asli yah hukum yg sslah fitnah biar,2025-05-01T09:30:45Z,0,16
user_15741,heboh kali kau roy,2025-05-01T09:18:56Z,0,16
user_15885,dasar penipu kau kang roy,2025-05-01T08:58:35Z,0,16
user_16000,masarakat yg kau omong roy,2025-05-01T08:42:38Z,0,16
user_16009,roy roy ketakutan kliatan ketakutan bgt lu orang jgn suka memfitnah siap² yg kau tabur kau tuai jaga lidahnya,2025-05-01T08:40:37Z,0,16
user_16093,masyarakat kau bawa bawa roy panci yg kau dihukum sesuai yg berlaku karna kau tukang hasut penuh kebencian,2025-05-01T08:30:49Z,0,16
user_16000,woi roy kau ni,2025-05-01T08:21:32Z,0,16
user_16260,masyarakat kau bawa suryo orang repot ijasah orang,2025-05-01T08:08:38Z,0,16
user_16284,pertamyaanya hak mu roy suryo presiden ijasahnya cek yg ajar brengsek dirimu mu mengintimidasi mencari pembuktian keaslian ijasah aja penuh fitnah kau rumah jokowi kau penasaran jokowi aan pertimbagkan kau ajakoar koar med sos dirimu sehat gila roy suryo udh kaya anak cacing kena abu dirimu,2025-05-01T08:05:43Z,0,16
user_16391,masarakat yg roy panci gak bawa nama masarakat cuman segelintir orang yg percaya kau,2025-05-01T07:51:41Z,0,16
user_16473,kebodahanmu jg kau tunjukin,2025-05-01T07:41:09Z,0,16
user_16480,roy roy tdk kerjaan cari sensasi yg kau utk negara roy nyanyi aja,2025-05-01T07:39:47Z,0,16
user_16493,roy suryo ampun sombong nya nnti kau menangis,2025-05-01T07:38:04Z,0,16
user_16607,panci klo kau trbukti brslah kau wajib penjarakan,2025-05-01T07:24:14Z,0,16
user_16686,roy suryo kau bawa bawa nama rakyat dirimu gerombolanmu dirimu dituntut hukum bentuk pencemaran nama kau pakai nama rakyat dirimu terpojok,2025-05-01T07:13:50Z,0,16
user_16794,dipidanakan kau profokator,2025-05-01T06:58:40Z,0,16
user_16904,bentar kau tangkap,2025-05-01T06:50:14Z,0,16
user_16965,bikin kepo ya kau panci cocoknya kau dipenjara,2025-05-01T06:44:11Z,0,16
user_16966,panik kau royyy royyy,2025-05-01T06:43:49Z,0,16
user_16971,kau aja dipenjara menghina lagu kebangsaan roy suryo,2025-05-01T06:42:45Z,0,16
user_16930,ya iyalah remon dr tipu orang jahat sepertimu tunggu kau hidup jeruji besi,2025-05-01T06:38:10Z,0,16
user_17031,roy ktmbng kau ngoceh mnding urus yg,2025-05-01T06:37:10Z,0,16
user_17118,kau rupaya royi dinegara mengatur mantan presiden ijajah nya kau dihum sampe mampus,2025-05-01T06:29:19Z,0,16
user_17237,roy kau pewaris sifat iblis kau puas fitnahmu kau menghasut rakyat lemah berpikir,2025-05-01T06:17:16Z,0,16
