author,text,published_at,like_count,cluster
user_17316,sebentar penjakan si roy rismon thifa seumur hidup warga negara indonesia mendoakan semoga jokowi orang g tumbangkan kau tabur kau tuai,2025-05-01T06:10:08Z,0,16
user_17382,hukum su roy suryi secepat nya bikin ulah aja kau,2025-05-01T06:03:24Z,0,16
user_17423,pengacara biadab bermoral kau pengacara bro otak mu uang penipu kau bela berusaha keras menutupinya bro,2025-05-01T06:01:33Z,0,16
user_17396,kriminalisasi roy suryo biji mata kau udh nuduh sebar analisa yg memperkeruh situasi bilang gitu panik kau,2025-05-01T05:54:09Z,0,16
user_17652,masyarakat menilai kau penggacau republik,2025-05-01T05:42:49Z,0,16
user_17654,bahasa kau edukasi profesi ngontrak banget,2025-05-01T05:42:29Z,0,16
user_17683,masarakat yg pro kpda bapa jokowi kau roisuro jgn mengatasnamakan masarakat,2025-05-01T05:39:27Z,0,16
user_17709,mantap pokoe udah udah takut eh roy kau kepintaran mu kebodohan,2025-05-01T05:37:31Z,0,16
user_17713,roy babi jujur gak kau sibuk kejujuran orang,2025-05-01T05:37:23Z,0,16
user_17720,lambemu royyyyy kau menuduh tpi fitnah,2025-05-01T05:36:51Z,0,16
user_17767,blunder trus kau roy suryo,2025-05-01T05:33:57Z,0,16
user_17891,bodat klarifikasi ugm njir kau gak percaya asik palsu aja yg kau bil dahal kau ahli telematika,2025-05-01T05:24:58Z,0,16
user_17892,bambang tri tlah menunggumu roy kau percaya sma bambang tri kau tlah terjebak sakit hatimu membakar dirimu bodoh kau,2025-05-01T05:24:50Z,0,16
user_17899,roi kau bilang kau ahli it coba ijaza kau tunjukan kau perguruan it kau aja penipu giring opini rakyat rakyat udah tau kalao kau sampah negara ijaza jokowi terbukti asli ganti target gibran terbar isu ijaza gibran palsu dll udahlah sekenario udah kebaca rakyat karna karna mencari kebenaran melaikan balas dendam jokowi karna dendam pribadi jokowi yh bilang aja grombolan sakit hati,2025-05-01T05:24:13Z,0,16
user_18098,roy suryo lambe mu bawa masyarakat kau kelompokmu,2025-05-01T05:08:24Z,0,16
user_18177,tdk jabat difitnah mllu maux orang iri dengki pendendam aj yg kau lakukan suryo cs bntr lg karma yg mo kau trima suryo cs,2025-05-01T05:02:22Z,0,16
user_18288,uda takut kau lari kemana² ceritamu enak kali kau memfitnah orang tinggal bilang tunjukan aja manusia gak tukang curi panci,2025-05-01T04:53:37Z,0,16
user_18334,gak simpel roy kau menuduh,2025-05-01T04:50:22Z,0,16
user_18432,roy suryo kalah kau,2025-05-01T04:36:21Z,0,16
user_18673,mulut mu roy kau rakyat gak butuh kau jasamu negeri,2025-05-01T04:28:52Z,0,16
user_18678,mampus kau panci bentar masuk penjara kasihan keluarga mu,2025-05-01T04:28:43Z,0,16
user_18684,masyarakat yg menilai jgn kau bawa masyarakat eew muka bodoh kau sj yg tdk kerja cari sj kau,2025-05-01T04:28:18Z,0,16
user_18734,panik kau dek panik,2025-05-01T04:25:51Z,0,16
user_18835,mampus kau roy,2025-05-01T04:19:56Z,0,16
user_18730,roy suryo bawa rakyat kau bikin rusuh aja,2025-05-01T04:11:28Z,0,16
user_19116,tobat kau roy kau hidup mu cuman mencari kesalahan orang hukum tdk mengenal prempuan laki mata hukum lgi kau memfitnah logikanya klau orang masuk kerja toko pake ijasa asli tau kerja keliling servis pake ijasa presiden pakai ijasa asli roy sakit hati karna ganti mentri jeruji kau,2025-05-01T04:02:37Z,0,16
user_19177,manusia pikiran hatinya kotor ya roy pikir pakai logika mencalonkan pejabat mang melengkapi data hijasah kau pikir yng mengecek data jokowi mendaftar pejabat negara bodoh berfikir pakai logika kau roy,2025-05-01T03:58:39Z,0,16
user_19202,oii panci kau ahli telematika kau tamatan ugm ilmu kesehatan nipu ni yeee jlogok panci,2025-05-01T03:57:16Z,0,16
user_19243,roy suryo mu konyol kau spya masyarakat indonesia tau presiden memenjarakan kau bilng bagitu sadar presiden pakai ijasa palsu krna jokowi pake ijasa palsu karna berdasarkan sakit hati,2025-05-01T03:53:23Z,0,16
user_19359,panci kau tu bekin gaduh repoblik kau masyrakat percaya kau kah msyrakt suda pintar menbedakan bohong kau seorg pembohong ulung negeri,2025-05-01T03:47:18Z,0,16
user_19438,kau roy cari,2025-05-01T03:42:34Z,0,16
user_19527,kau suryo mbah sepuh mu,2025-05-01T03:36:58Z,0,16
user_19700,apapun pemilik ijazah asli diterima penuduh ijazah palsu penuduh silahkan rumuskan syarat membuktikan asli mengaku ahli mengakui ahli kau sopan dipidanakan kampungan kau rai panci,2025-05-01T03:23:04Z,0,16
user_19804,roy suryo kau bilang kau peniliti hasil penelitianmu bemanfat bangsa negara penelitiamu berguna barisan orangs sakit hati,2025-05-01T03:20:10Z,0,16
user_19859,gak playing victim bang roy kau kau yg nyari² kesalahan tunkukkan kau bilang ijasah palsu kau bilang mantan presiden mempidanakan ibu² gelombolanmu pidanakan biar kapok,2025-05-01T03:16:27Z,0,16
user_19975,roy kau berkelit kaubsdh ijazah jikowi palsu laun dasar kau,2025-05-01T03:09:25Z,0,16
user_19804,roy suryo kau negara dibandingkan jokowi kau mentri aja nyolong panci milik negara,2025-05-01T03:09:06Z,0,16
user_20065,roy gak terima laporan bpak jokowi gak laporkan roy hahahahahehehehe orang ketakutan bug berani mensos media tujukan jantanmu tunjukan lakikmu brani mensos hahahaha aq tunggu kau stelah dipengadilan aq keburu kau pakai baju tahanan seumur hidup royaamiinnn,2025-05-01T03:04:56Z,0,16
user_20069,bacot kau,2025-05-01T03:04:49Z,0,16
user_20079,jebloskan si roy yg sok pinter jgn bawa masyarakat kau,2025-05-01T03:04:32Z,0,16
user_20216,ya allah tunjukan kuasamu kebenaran kau buka kebusukan hancur ditelan amin,2025-05-01T02:56:06Z,0,16
user_20259,perempuan laporkan kau kepo orang pung barang,2025-05-01T02:51:18Z,0,16
user_20317,curiga kau diam sel tahanan bebas tampang kau ijazah palsu asli mempermalukan keluarga jokowi rasain loe kena batunya jokowi diam kali beraksi,2025-05-01T02:50:56Z,0,16
user_20323,mampussss kau,2025-05-01T02:50:38Z,0,16
user_20330,mampus kau roy suryo terkubur penjara ayo yg berakal sehat bersatu indonesia maju,2025-05-01T02:50:15Z,0,16
user_20582,terserah kau mbacot roy sukro aja kau tidur jeruji tidur hiahahahaha,2025-05-01T02:38:01Z,0,16
user_20674,kau jgn sombong rs kau yg bikin gaduh slma smoga kau penjara seumur hidup,2025-05-01T02:34:09Z,0,16
user_20737,ketakutan kau kau blglah dilaporin dimata hukan trangender aja melanggar hukum,2025-05-01T02:31:38Z,0,16
user_20775,mampus kau roy kau jahat mampuss,2025-05-01T02:30:01Z,0,16
user_20845,aneh kali kau tu kau anggap kpu indonesia bodoh gila uang roy cs kerjaan,2025-05-01T02:26:26Z,0,16
user_21052,masyarakat indonesia tau kalo kau roy penipu masyarakat yg percaya kau masyarakat bodoh yg mbela kau,2025-05-01T02:16:41Z,1,16
user_21309,sdh roy kau influencer influencer yg menyebar fitnah mendekam seumur hidup penjara lihat,2025-05-01T02:03:37Z,0,16
user_21312,roi suryo kepinteran kau sumbangkan kemajuan bangsa kau kepinteran kau yg kau kau dapatkan kau buang energi aja ego kau aja kau tonjol renungkan dirimu roi suryo,2025-05-01T02:03:31Z,0,16
user_21329,roy roy lagu indonesia raya aja kau gk hapal,2025-05-01T02:02:40Z,0,16
user_21372,x bicara mu rs kau nuduh kau buktikan,2025-05-01T02:00:10Z,0,16
user_21708,si roy berkaca dgn ya memaksa orang jujur khusus dirimu roy suryo kau jujur hidupmu kau menjabat,2025-05-01T01:40:01Z,0,16
user_21760,siaplah kau roy surya masuk sel,2025-05-01T01:39:10Z,0,16
user_21763,kau roy gak dilapor congormu gak remnya dilapor kau menyalahkan jokowi dilaporkan pembungkaman dibiarkan ngelunjak batas,2025-05-01T01:39:05Z,0,16
user_21830,kayak nya rismon cs pengalihan isu aza kau,2025-05-01T01:35:33Z,0,16
user_21830,remrh temen brantas korupasi rismin roy mengalihkan isu kau gonlok kau kau koripsi keluarga mu kena,2025-05-01T01:34:59Z,0,16
user_21853,kau jokowi tunjukan ijasa kau kau tunjukan ijasa kau masyarakat tuduhan fitnah kau lakukan jalur hukum bro,2025-05-01T01:34:12Z,0,16
user_21601,kau aja yg sibuk raimu suryo ngapain ngurusi ijazah orang urusi aja dirimu coba kali kau kentut,2025-05-01T01:32:57Z,0,16
user_22043,si roy siap² kau masuk bui,2025-05-01T01:24:28Z,0,16
user_22110,roy kau sisp neraka,2025-05-01T01:20:59Z,0,16
user_22385,selesai kau bro roy,2025-05-01T01:07:07Z,0,16
user_22633,curiga aja smpe kau pindah alam,2025-05-01T00:55:16Z,0,16
user_22760,kau roy suryo pengecut bertanggung integritas salah menghasut coba sembunyi dibelakang ibuk yg berensek dasar malu,2025-05-01T00:49:35Z,0,16
user_22762,ngeyel kau roy suryo dajjal,2025-05-01T00:49:25Z,0,16
user_22809,rasakan kau roy panci tua dipenjara kau,2025-05-01T00:46:42Z,0,16
user_22822,memangnya jokowi tunjukan ijasah asli kau roy surya,2025-05-01T00:46:11Z,0,16
user_22822,bawa bawa masyarakat indonesia roy surya dukung kau,2025-05-01T00:45:12Z,0,16
user_22822,roy surya bertobat kau,2025-05-01T00:44:41Z,0,16
user_22924,bayar brp kau kakacauan wilayah jokowi bodat kau,2025-05-01T00:40:10Z,0,16
user_22934,ketakutan kau roy pake ngancem pengecut kau,2025-05-01T00:39:48Z,0,16
user_22988,masyarakat yg kau wakili si roy,2025-05-01T00:36:53Z,0,16
user_23058,andalan joki gak salah kau betanggung ngomong pembelajaran utk masyarakat,2025-05-01T00:34:04Z,1,16
user_23015,heyy panci kriminalisasi kau yg gembar gembor ijazah jokowi palsuroy roy cb jau ijazah megawati sby kau,2025-05-01T00:33:28Z,0,16
user_23095,kali kau kena roy pamci,2025-05-01T00:32:38Z,0,16
user_23015,heyy panci kriminalisasi kau yg gembar gembor ijazah jokowi palsu,2025-05-01T00:30:29Z,0,16
user_23224,awas kau roy suryo ditangkap sok an pingsan,2025-05-01T00:26:36Z,1,16
user_23015,heeey roy hak mu ijazah dokumen pribadi seseorg kau gerombolan tg kuranf jerjaan kau usil kerjaan usil kerjaan dajjal,2025-05-01T00:24:45Z,0,16
user_23306,kerjaan masarakat yg nilai kau yg bikin masala,2025-05-01T00:22:42Z,0,16
user_23349,kau roy suryo munafik raja hoax kau penjarakan terlu berkobar media sosial,2025-05-01T00:20:56Z,0,16
user_23436,susah kalo dgr orang dungu bawaa an nya roy suryo siap² aja kau kembsli masuk bui kaga usa ngoceh kebanyakan malu kau ngom ng persidangan kag ngomong,2025-05-01T00:17:19Z,0,16
user_23481,beralasan bilang pidanakan tu la kau tabur tu la yg kau tuai berani berkoar fitnah terima aja,2025-05-01T00:14:41Z,0,16
user_23506,selesai kau roy suryo cs gaduh,2025-05-01T00:13:39Z,0,16
user_23488,lha lucu otk kau rs fitnah laporkan gx main nyawa kau melayang,2025-05-01T00:09:55Z,0,16
user_23628,ijasahmu roy kemedia orang yg kau suruh,2025-05-01T00:08:08Z,0,16
user_23723,jgn prasangka buruk kena kau,2025-05-01T00:03:19Z,0,16
user_23796,ngk usaha lawan jokowi kalah kau roy suryo tu raja raja nya diatur nya indonesia undang aja rubah jenazah,2025-04-30T23:59:56Z,0,16
user_23923,bacot kau rs wkwkwk semoga terbukti kau tahan,2025-04-30T23:53:14Z,0,16
user_24013,bacot kau roy aza,2025-04-30T23:48:10Z,0,16
user_24029,roy roy lagakmu jokowi unjuk taring kau cengengesan berdosa,2025-04-30T23:47:34Z,0,16
user_24075,roy coba tunjukan ijazah mu klw mmg kau pakar telematika dr kau dpt gelarmu lol,2025-04-30T23:45:20Z,1,16
user_24246,kau pasang jebakan kau terperangkap menghadapi keputusan hukum,2025-04-30T23:36:38Z,0,16
user_24256,ngeles si suryo hak orang tdk izasahnya rakyat muak ngelihat kau roy,2025-04-30T23:36:18Z,0,16
user_24192,ya roy biar masarakat menyaksikan kebodohan kau kejhatan kau roy ok bravo pa jokowi,2025-04-30T23:25:53Z,0,16
user_24516,maling panci kau suryo,2025-04-30T23:22:56Z,0,16
user_24516,ngeles kau roy maling mem pidanakan,2025-04-30T23:22:19Z,0,16
user_24607,roy kau jgn suka bikin fitnah,2025-04-30T23:17:45Z,0,16
user_24607,roy kau jgn suka bikin fitnah,2025-04-30T23:17:32Z,0,16
user_24629,bacrit kau roy,2025-04-30T23:16:26Z,0,16
user_24681,pidanakan kau melanggar hukum penjarakan,2025-04-30T23:13:31Z,0,16
user_24690,kena kau munapik penjarakn tu pesakitan tu sehat jokowi,2025-04-30T23:13:06Z,0,16
user_24850,roy suryo mu kau pembuat onar negeri kau penebar fitnah biadab kau,2025-04-30T23:05:30Z,0,16
user_24873,geram mendengar omonganmu roy suryo lappet kau,2025-04-30T23:04:01Z,0,16
user_24919,kau tanam kau tuai gak perduli nenek penghinaan nama hukum nya biar ber hati dalm melangkah,2025-04-30T23:01:15Z,0,16
user_24977,bodoh kau roy suryo yg kali heboh koar koar gx gunanya,2025-04-30T22:57:40Z,0,16
user_25156,masyarakat dah tau kau tukang fitnah pk roy suryo,2025-04-30T22:45:53Z,0,16
user_25160,roy jokowi sadar kau merusak negeri kau klak mati mulyono jgn pikir nya,2025-04-30T22:45:27Z,0,16
user_25227,kau kurung,2025-04-30T22:41:34Z,0,16
user_25305,sok pintar kau panci,2025-04-30T22:36:56Z,0,16
user_25374,rasain kau roi tobat kau tidur sel penjara,2025-04-30T22:32:02Z,1,16
user_25399,orang kyk roy surya dkk gk percaya sombong orng sombong gk percya kbnran roy roy ngaku rakyat tpi kau jht sma pemimpin kau ketakutan masuk jeruji besi trs nnti pura sakit,2025-04-30T22:30:46Z,0,16
user_25411,ijazah nya cuman ni tunjukkan polisi tau polisi tunduk kau jokowi,2025-04-30T22:29:58Z,0,16
user_25544,roy suryo bahasamu jd kek org licik lebuh busuk kau,2025-04-30T22:19:30Z,0,16
user_25614,roy kau koar koar dilaporkan polisi ngambek pidanakan,2025-04-30T22:15:12Z,0,16
user_25567,busuk kau kodok penjara kau roy,2025-04-30T22:14:29Z,0,16
user_25642,roy surya kau buta hati kah kau lihat pa jokowi lewati jenjang kepemimpinan walikota gubernur presiden biodata beliau terverifikasi semoga kau roy suryo hukum menantimu,2025-04-30T22:13:29Z,0,16
user_25649,pasrah gpp ngomongnya mlempem jumawa kau roy,2025-04-30T22:13:01Z,0,16
user_25651,file ijaza yg diambil twitter dijadikan bahan uji asli nggaknya ijaza roy roy uji ilmiah forensik file asli roy roy kocak kau gini digelari ahli telematika kek nenek nenek kek diduga melanggar hukum mempertanggung jawabkan roy yg melapor terlapor kocak lg kau,2025-04-30T22:12:57Z,0,16
user_25745,roy roy mantan presiden memenjarahkan lantas presiden memalsukan korupsi memenjarahkan kau dimana kau muda roy roy,2025-04-30T22:04:56Z,0,16
user_25760,sok wakili masarakat kau roy bawa nama masyarakat kau roy,2025-04-30T22:03:28Z,0,16
user_25856,mampus kau roy suryo,2025-04-30T21:54:07Z,0,16
user_26001,rakyat indonesia kau roy manusia sejenismu patut diproses hukum,2025-04-30T21:34:41Z,0,16
user_26068,mampus kau roy panci,2025-04-30T21:26:39Z,0,16
user_26205,roy roy emang hukum mengenal laki laki perempuan kek kau ni roy belajar kau roy roy berpikir,2025-04-30T21:06:09Z,0,16
user_26233,kocak tinggal tunjukkan ajaa lol intinya kau jokowi kau pion orang yg mengkritik negara,2025-04-30T21:00:01Z,0,16
user_26299,mampus kau roy suryo,2025-04-30T20:50:25Z,0,16
user_26469,jd maksud mu gk bs diseret pengadilan salah preming terzolimi ni si roy pekok kau roy jgn pura patah leher kau kyk yg kemarin ditahan pura sakit kau,2025-04-30T20:19:27Z,0,16
user_26542,kau tuh orang konyol roy suryono,2025-04-30T20:08:12Z,0,16
user_26565,walaaaa master panci weleeee sdh tebar fitnah mister panci skrg kau brrkelit takut penjara taiiiiiii kau masyarakat muak muntah lihat muka gerombolan,2025-04-30T20:04:26Z,0,16
user_26591,laporkan aja roy suryo sok tau aja kau kali koment kau,2025-04-30T20:00:30Z,0,16
user_26614,alhamdulilah hoi roy suryo rakyat menilai rombongan kau brengsek mampuslh kau rombongan kau stepmen kau gini takut ya mskanya jgn nyinyirr mulut tu oke terimakasih jokowi jgn kendor,2025-04-30T19:58:51Z,0,16
user_26710,modiar kau roy,2025-04-30T19:44:17Z,0,16
user_26724,kyanya roy bikin ribet gwe ajarin ya kalo kau pengen liat ijazah asli jokowi simpell kau berkunjung rumah jokowi trus kau ngomong langsung jokowi liat ijazahnya asli palsu kau ngomong publik asli palsu gitu aja repppphoootttt blablabla medsos wkwkkwkw,2025-04-30T19:41:42Z,0,16
user_26882,kau roy csmu pake baju shopee mulutmu harimaumu,2025-04-30T19:20:21Z,0,16
user_27005,ketawa kau seluas nya krn ijazah jkwi terbukti asli periksa menangis kau roy besti mu penjara,2025-04-30T19:04:32Z,0,16
user_27048,ijazah kau bro suryo silahkan tunjukkan jgn cincong doang ente,2025-04-30T18:59:53Z,0,16
user_27054,menilai babi asuu kau binatang lo pembenci lo kena getah nya,2025-04-30T18:59:19Z,1,16
user_27320,modyar kau ray sur,2025-04-30T18:34:20Z,0,16
user_27349,roy suryo panik ketakutan mudah n kau cepat pake baju orange,2025-04-30T18:31:26Z,0,16
user_27463,pura pura tegar kau suryo panci,2025-04-30T18:18:45Z,0,16
user_27479,sejatinya ciut nyalimu roy dlm hitungan kau pastikan nyungsep penjara kau roy,2025-04-30T18:17:19Z,0,16
user_27507,ibuk nenek klu ya salah salah loh roy suryo karyok kau mengambil simpati masarakat gak masarakat yg aka bela kau roy karyok,2025-04-30T18:15:16Z,0,16
user_27510,semoga busuk kau penjara roy,2025-04-30T18:14:58Z,0,16
user_27597,kepo bgt kau roy penjarakan,2025-04-30T18:07:52Z,0,16
user_27633,kau kuliah ugm kau percaya ugm gimana kau ni roy,2025-04-30T18:04:18Z,0,16
user_27710,jujurlah bos kau diadili diakherat sebanding dg ijazah palsu yg kau bela penyesalan diakhir,2025-04-30T17:58:29Z,0,16
user_27717,mamposss kau dilaporkan,2025-04-30T17:58:05Z,0,16
user_27757,lawan pembenci kau salah hidup susah mending diemin ajah,2025-04-30T17:55:09Z,0,16
user_27760,soknpintar kau pancii ngomong nya face recognition pembuatnya manusia sok terzolimi berulang masyarakat mrncari simpati masyarakat manusia kerdil sumbu oendek kau roy maling panci,2025-04-30T17:54:43Z,0,16
user_27765,ketar ketir mamfus kau roy hahahaha kau emang iqnya kek habib palsu yaman otak otak tll,2025-04-30T17:54:28Z,0,16
user_27800,roy toik jgn kau berlindung ilmiah takut mu kau ngak sadar brapa thn kau kejar ijazah jokowi klo brani y y lawan,2025-04-30T17:51:00Z,0,16
user_27832,otak kau suryo,2025-04-30T17:47:55Z,0,16
user_27839,aja kau roy skarang kau cengar cengir kau nangis,2025-04-30T17:47:29Z,0,16
user_27859,roy suryo otak nya ijaza jokowi ijaza nya simpan bakar koq repot otak lo ndekam penjara stelah kau ketawa spuas nya kau,2025-04-30T17:46:00Z,0,16
user_27906,masyarakat bro yg mendukungmu mimpi kau,2025-04-30T17:29:19Z,0,16
user_28172,roy roy masyarakat menilai kau penghasut penilaian masyarakat,2025-04-30T17:22:40Z,0,16
user_28180,kau roy yg nunjukkan ijazah p jokowi palsu,2025-04-30T17:21:49Z,0,16
user_28204,halah roy sadarlah kau ketawa mu dlm kesedihan,2025-04-30T17:19:41Z,0,16
user_28240,gak kepala negara gak kau terbukti kau tukang fitnah provokator ujaran kebencian dll ketawamu terdengar tangisan,2025-04-30T17:16:58Z,0,16
user_28240,koq berbicara mempidanakan simpel ungkapan ungkapan dimedia udah kelewatan roy panci emang layak kau dipidanakan terkesan kau yg korban,2025-04-30T17:11:51Z,0,16
user_28350,masyarakat dah tau kau suryo yg mbuat gaduh menuduh rasain kau,2025-04-30T17:10:58Z,0,16
user_28534,kemarin kemana aja suryo nyanyi lagu kebangsaan gabisa kau,2025-04-30T16:58:15Z,0,16
user_28551,mulutmu harimaumu wajarkau penjarakan kau percaya kapu yg indonesia omonganmu kau pertanggung jawabkan,2025-04-30T16:57:22Z,0,16
user_28596,masyarakat sdh muak sm kau suryo,2025-04-30T16:55:10Z,0,16
user_28680,ngk pnting tuk d bahas asli emng gue peduli udah periode hbis drama aplagi roy udah puluhan kli loh orang mnyerang jokowi hbis ijazah palsu mnyusul sinetron dgn judul yg silhkan cari materi skripsi d trbaru d internet fufufafa kau yg mnerbitkankan kau sutradaranya kasihan si aktor akl jokowi kluarga ganti peran dlm film film kau,2025-04-30T16:50:30Z,0,16
user_28684,ijasah asli mampusla kau roy suryo bawala koper u salinan dipenjara,2025-04-30T16:50:09Z,0,16
user_28512,mampus kau roy suryo dipenjara kau sebentar,2025-04-30T16:49:39Z,0,16
user_28707,masyarakat indonesia nya si suryo taubat kau suryo,2025-04-30T16:48:12Z,0,16
user_28735,kau memperalat masyarakat,2025-04-30T16:46:58Z,0,16
user_28691,kau ygn gatur roy,2025-04-30T16:46:39Z,0,16
user_28735,sengaja mempermainkan kau kau manusia mainan,2025-04-30T16:42:35Z,0,16
user_3356,mampus kau suryo setan membusuk kau penjara,2025-04-30T16:41:58Z,0,16
user_28742,roy universitas mu kau jelek kualat kau trima aja imbas nya roy kau suruh rakyat menilai kau pikir rakyat indonesia tolol aduhhh tampang mu aja mencermin kelakuan mu,2025-04-30T16:40:48Z,0,16
user_28844,kau dikit dikit bawa masyarakat roy roy kau tu sampah jgan bacot masyarakat,2025-04-30T16:39:47Z,0,16
user_28810,kau bawa nama suryo takut kau yaaa,2025-04-30T16:38:59Z,0,16
user_28865,penjara kau roy suryo muak liat wajahmu mantan narapidana,2025-04-30T16:38:52Z,0,16
user_28921,menfitnah jokoei mendiskreditkan jokowi giliran laporkan polisi eh bilangnya kriminalisasi enak hidup lu yg kau tabur yg kau tuai roy suryo,2025-04-30T16:35:46Z,0,16
user_28927,ya udah kau biar aja didalam,2025-04-30T16:35:33Z,0,16
user_28688,wkwk mulyono panik bgt takut bgt kerakyat media keliatan bgt kalo palsuuu yg penasaran dgn ijazah kau rakyat indonesia aparat penegak hukum polisi kau dinomer duakan utamakan masyarakat indonesia rakyat kalean jgn mendzolimi rakyat kau kena kutuk alam semesta tuhan dikehidupan kau kedepan suara rakyat suara tuhan,2025-04-30T16:35:32Z,0,16
user_28810,suryo bawa nama masyarakat yg urusan kau bawa nama masyarakat rakyat takut kau,2025-04-30T16:35:29Z,0,16
user_28953,bacot kau roy suryo,2025-04-30T16:34:31Z,0,16
user_28965,surio kau gak hak badoh kau,2025-04-30T16:33:52Z,0,16
user_28810,tenang kau suryo pengadilan,2025-04-30T16:33:47Z,0,16
user_28735,berkembang kau yg mengembangkan isu palsu roi bodoh kali kau,2025-04-30T16:32:31Z,0,16
user_28994,biar kau roi suryo mulutmu harimaumu tunggu aja kau masuk hotel prodeo,2025-04-30T16:30:52Z,0,16
user_29040,roy suryo kekonyolan terbesarmu menganggap anggota masyarakat bodoh kekonyolanmu kau kekonyolanmu ketiga kau malu kekonyolanmu kempat kau menganggap dirimu pintar sesungguhnya kau bodoh kekonyolanmu kau menganggap pendapatmu kekonyolanmu keenam kau menganggap hak kewenangan mengusik hak privacy orang kekonyolan kau lakukan roy cepatlah sadar bertobat membikin kegaduhan mengganggu masayarakat,2025-04-30T16:29:32Z,0,16
user_29159,maling panci malu in ja kau oy,2025-04-30T16:22:57Z,0,16
user_29173,udah ketakutan kau sury,2025-04-30T16:22:26Z,0,16
user_29190,kau bawa anjink ga babi,2025-04-30T16:21:38Z,0,16
user_29215,si roy mending kau tidur diam kau omong masyarakat menilai sy masyarakat menilai kau roy tdk bedanya manusia yg gagal fokus kau sakit hati karna menjabat salati jabatan kau dasarnya sakit hati,2025-04-30T16:20:37Z,0,16
user_29232,mampus kau roy,2025-04-30T16:19:44Z,0,16
user_29342,roy suryo yg sdh kau bangsa sumbangsihmu pd negara puntar bikin gaduh rencana yg kau lakukan berpolitiklah yg jentel,2025-04-30T16:14:10Z,0,16
user_29344,bacot kau suryo skrg persilahkan jokowi melaporkan rakyatnya,2025-04-30T16:14:08Z,0,16
user_29323,tkt kau panci jokowi bkn presiden lg udah jd rakyat jd hak melaporkan krn kau tkg mengaduh domba,2025-04-30T16:10:43Z,0,16
user_29494,ga bawa nama masyarakat kau roy suryo dn masyarakat yg yg kau maksut roy suryo,2025-04-30T16:07:07Z,0,16
user_29520,suryo tdk nyinyir y jokiwi sdh ckp sabar slma kau hina kau fitnah skrng jokowi sdh nurutin kemauan geeombolanu msh jg nyinyir,2025-04-30T16:05:59Z,0,16
user_29526,ugm mengakuin yg kau difisiknya perlihatkan mu roy suryo wakakakkakaka,2025-04-30T16:05:51Z,0,16
user_29537,memangnya kau roy jokowi menunjukan izajahnya kau,2025-04-30T16:05:22Z,0,16
user_29431,masyarakat menilai roy panci mulutmu otakmu pikiranmu hati layak contoh pnilaian masyarakat kau yg lucu roy ibuk kau hasud roy cs mata madyarakat,2025-04-30T16:02:47Z,0,16
user_29613,mampus kau rs wkwkwk kau terjebak permainan mu,2025-04-30T16:01:26Z,0,16
user_29622,roy suryo cs gara kau komentar byk yg lucu dn kocak kau media sosial runyam roy roy kau baca smua komentar orng goblok sma nya dgn kau goblok,2025-04-30T16:00:59Z,0,16
user_29849,skrg cengar cengir kau roy kau nangis dasar penghasut,2025-04-30T15:50:44Z,0,16
user_29927,udah fitnah bossss penilitian pala kau tu coba kau yg hujat tu kau bertindak mikir otak kau tu bossss,2025-04-30T15:47:18Z,1,16
user_29928,kasian kau rooooyyy,2025-04-30T15:37:06Z,0,16
user_30152,roy panci ngomong kejujuran kau jujur panci kau tilep,2025-04-30T15:36:36Z,0,16
user_30223,kau raja panci raja sel,2025-04-30T15:32:18Z,0,16
user_30240,ngomong nya muntal muntal kau roy kau makai baju orenb,2025-04-30T15:31:26Z,0,16
user_30535,ngaca kau roy kau yg palsu ngakunya pakar telematika eh s jurusan komunikasi pakar it ngaku pakar kau roy membaca phsikologi jokowi aja kau gak kejebak pakar pslsumu penjara th,2025-04-30T15:19:26Z,0,16
user_30663,rakyat yg kau tinggal nusakambangan roy paham,2025-04-30T15:13:43Z,0,16
user_30719,emang kau tunjukkan ijasah kau,2025-04-30T15:11:44Z,0,16
user_30791,woooiiiii suryo panci kau nda alasan and theori by mulut mu cengar cengir kau sdh hancur and berguna nkri to much wrong reasons loe suryo get ready to live in prison suryo roy akui kesalahan loe nda pamer kebodohan loe kau diperlakukan jokowi loe ngamuk orang loe bae ngana suryo,2025-04-30T15:08:52Z,0,16
user_30902,roy suryo ngajak orang bicara jujur orang jujur panci tolong kau kalo kau ahli kejujuran,2025-04-30T15:04:30Z,0,16
user_30940,mas roy masyarakat yg masyarakat berpihak k pbk jokowi mampus kau ntar lgi msk bui,2025-04-30T15:02:51Z,0,16
user_31025,pepatah mulut mu harimaumu mampus kau surio,2025-04-30T14:59:23Z,0,16
user_31062,roy suryo uda ketakutan bodok kau kali kau penjara,2025-04-30T14:58:11Z,0,16
user_31138,klu ngga pidanakan jgn cerita kau roy,2025-04-30T14:55:56Z,0,16
user_31255,modyar kau roy panci,2025-04-30T14:52:39Z,0,16
user_31261,roy kau iri to,2025-04-30T14:52:28Z,0,16
user_31301,masyarakat muak dg kau roy sak grombolanmu emang ijazah pasalnya dasar panci,2025-04-30T14:51:15Z,1,16
user_30865,hai roy panci pejabat ga kau persatu kau ijazahnya mantan presiden yg hidup,2025-04-30T14:49:44Z,0,16
user_31395,kebanyakan bicara sebentar kau masuk penjara suryo,2025-04-30T14:47:23Z,0,16
user_31417,proses hukum gk pandang pria wanita hai roy suryo ngomong yg mulutmu panci ember kau sdh bikin gaduh masyarakat indonesia kau roy suryo sdh mencemarkan nama jokowi dodo semoga roy suryo cs cepat proses biar kapok kelakuanya,2025-04-30T14:46:48Z,0,16
user_31732,mampuus kau roy suryo nginep rumah penjara,2025-04-30T14:36:35Z,0,16
