author,text,published_at,like_count,cluster
user_105,kor kau amin rais,2025-05-26T15:45:38Z,0,16
user_130,udah periode presiden skrg kau koar koar roy panci gak,2025-05-25T15:06:04Z,0,16
user_189,orang awam simple nya gak kau rooy basi,2025-05-23T17:13:14Z,0,16
user_23,tolong jok tunjukn ijazah mu kebohongan yg kau kau kebohongan jok tobat jok jijik liat kao,2025-05-21T21:37:17Z,0,16
user_23,tunjukan jok kau pembuat gaduh negara,2025-05-20T23:41:04Z,0,16
user_23,jok tunjukan ijazah mu kau gaduh negri,2025-05-20T23:40:18Z,0,16
user_23,tunjukan jok jgn gaduh indonesia kau,2025-05-20T23:39:50Z,0,16
user_478,amin amin insaf udah tua kau stop memfitnah pk jokowi,2025-05-11T15:42:33Z,0,16
user_503,nasihat panda karni bagus kau ambil,2025-05-10T17:46:56Z,0,16
user_510,silfester brp duit kau dibayar klo kau smpkan insitusi resmi insitusi resmi orang nya jokowi,2025-05-10T16:33:00Z,0,16
user_1265,bang karny kau tidal netral kau nampak kali berpihah,2025-05-05T08:41:15Z,0,16
user_1265,roy suryo kau takabur bro,2025-05-05T07:43:33Z,0,16
user_335,jgn dok hebat kau kau dibayar jokowi penghianat kau muak mukamu penjilat yg omong kosong manfsstmu dinegara gk bro,2025-05-04T06:34:56Z,1,16
user_1453,muak kau,2025-05-03T07:45:16Z,0,16
user_1534,roy suryo bikin muakk nyanyi indonesia raya aja salah kau royy royy ngaku pakar pulak,2025-05-02T17:19:46Z,0,16
user_1630,kau plintir kalo kau hukum jgn bawa kemana,2025-05-02T02:40:18Z,0,16
user_1696,tai kau suryo,2025-05-01T15:50:04Z,0,16
user_1773,tunjukan aja klw penipu kau ijazah aslimu,2025-05-01T07:40:47Z,0,16
user_1811,roy panci cs dikarungi masuk jebakan batman masuk kandang kau,2025-05-01T02:02:29Z,1,16
user_1919,kakek panda isu sentral kau pung triliyun cash diumpetin berita autentik sebutkan muaranya muaranya kejujuran integritas integritas yg kau angkanya minim integritas rusak kau pensiun aja pung ngga kau beritakan berita kejahatan spektakuler apapun heboh apapun ngga react masyarakat,2025-04-30T14:53:44Z,0,16
user_2084,kau yg nama roi tdk pake negara,2025-04-29T16:32:14Z,0,16
user_2185,yg bahaya kau,2025-04-29T09:18:31Z,1,16
user_2260,habis kau mulyono,2025-04-29T00:19:42Z,1,16
user_2277,amien akherat kau,2025-04-28T21:51:05Z,0,16
user_2308,silperkuin ga nyambung berantas korupsi brantas narkoba org bahas ijasah palsu kau tunjukan yg asli nya kau yg berbelit belit,2025-04-28T18:27:13Z,1,16
user_2317,manusia kau membela yg berbohong berat dosa mu yg berbohong tanggung dosa jariah mu kau menzolimi orang orang,2025-04-28T17:45:25Z,15,16
user_2332,masuk kau roy thn biar kau rasin thn penjara jokowi merasakan thn mempin negara,2025-04-28T16:45:03Z,0,16
user_2785,hati kau roy suryo melawan negara gulung kau sebentar,2025-04-27T15:39:51Z,0,16
user_2951,mas roy kau intelektual coba menyelesaikan yg negara bicara ijazah sajs mas roy berdebat,2025-04-27T12:33:24Z,0,16
user_2983,jakob hasibuan kau ngomong kayak bau kentut olah rakyat indonesia bodoh kau bilang ijazah jokowi presiden buruk rakyat indonesia kau tau korban ditahan ijazah jokowi ijazah jokowi ngak,2025-04-27T11:08:52Z,0,16
user_3024,haiiiiii roi suryo kau pecabat siiiii ko sombong semoga kau dilaknat ileh yg maha kuasa kau bikin gaduh,2025-04-27T10:02:58Z,0,16
user_3117,otak silpester tumpul kali kau,2025-04-27T07:28:02Z,0,16
user_3172,binatang kau amin rais,2025-04-27T05:59:12Z,0,16
user_3335,panda kau yg angkat jokowi tau asli ap gak koar,2025-04-27T01:28:33Z,0,16
user_3341,kau pengacara duit duit,2025-04-27T01:20:11Z,0,16
user_3707,halo silvester kau anak merah putih anak merah putih anak merah putih kau kau numpang bacot cari cuan cuan cuan cuan,2025-04-26T15:36:47Z,0,16
user_3713,roy suryo inget gak nyanyi indonesia raya stadion live tv kau hafal,2025-04-26T15:32:04Z,0,16
user_3794,gak percaya kau kakek tobat kek umur mu kau meninggal,2025-04-26T14:51:25Z,0,16
user_3978,sdh presiden aja sokk molyono molyono kau bayar pengacara ya kau belah lh pembohong,2025-04-26T12:57:55Z,0,16
user_3995,kau roy menuduh praduga,2025-04-26T12:46:56Z,0,16
user_3994,woy jokowi kau wajib ijazahmu kau presiden negeri kau tukang kayu ngga yg nanya ijazahmu,2025-04-26T12:46:02Z,0,16
user_3949,hoaks bahaya disebar kena uu ite loh ayo roy sadarlah kau,2025-04-26T10:49:27Z,1,16
user_4246,mulyono kau tdk bs membohongi allah hatimu tenang gelisah krn kau tau dirimu,2025-04-26T08:45:54Z,0,16
user_4278,untungnya kau usik tau kau sepeli sja ko dibahas byang energi aja,2025-04-26T08:19:26Z,0,16
user_4457,kau amin rais sdh ompong,2025-04-26T05:35:02Z,0,16
user_4562,silfester kau dijadikan jokowi cik bersemangatnya belain gibas jokodok,2025-04-26T04:22:21Z,0,16
user_4705,ya kau roy panci laporkan,2025-04-26T02:36:07Z,0,16
user_4948,kau plester anak bangsa karna gonggong trus,2025-04-25T20:55:25Z,0,16
user_5091,penjilat jokowi mantap kau keluarga kau makan hasil haram kau azap nya,2025-04-25T17:58:52Z,1,16
user_5223,jokowi jokowi sudahla kau ngapai kau takut tunjukkan aja kau mmg pake alasan blg ditnjukkan gitu aja gk adabnya nnti org pembuktian ijazah lucu kau ya kau presiden sembarangan jabatan kau jabatan ecek kecuali jabatan kau kepala lorong presiden loh org no indonesia mmg org penipu bnyk alasanya ya,2025-04-25T16:37:38Z,2,16
user_5261,roy cakap nnti disuruh keberkrim pura sakit kau roy,2025-04-25T16:21:47Z,0,16
user_5388,berbelit belit srpele tunjukan ijazah ijazahmu kau bangga amamatermu tunjukan kau ragu ijazahmu,2025-04-25T15:31:06Z,3,16
user_5395,ijazah koq remeh temeh gak sekolah kau ijazah kau anggap remeh temah tinggal ijazah palsu suap kanan kiri lulus test administrasi,2025-04-25T15:18:53Z,1,16
user_5612,pengecut jokodok gak dateng pengadilan liat roy suryo yg kau laporkan tom hadir sidang kau jokodok gak berani hadir takut takut lemah kau jokodok,2025-04-25T13:57:49Z,0,16
user_5881,silfester kau,2025-04-25T11:58:10Z,1,16
user_5858,kau layak hukum biadap roi surio pengkianat kau kawan kawan mu biadap,2025-04-25T11:33:56Z,0,16
user_5966,hai silferter ajang bilang prabowo gibran memberantas korupsi koropsi kepala kau,2025-04-25T11:14:02Z,1,16
user_5971,ketawa roy kayak kuntilanak tenang roy kau msuk penjara lawan grandmaster pecatur politik kali menang,2025-04-25T11:07:42Z,0,16
user_5971,omon omon aja kau roy kau kalah masuk penjara,2025-04-25T11:04:18Z,0,16
user_6004,udah dgn mata kepala yg kau lihat asli palsu uji,2025-04-25T10:45:36Z,1,16
user_6074,hancurlah kau dr roy ugm melaporkan,2025-04-25T09:30:03Z,0,16
user_6149,terserah kau ajalah,2025-04-25T08:58:01Z,0,16
user_6174,roy roy kau namakan masyarakat,2025-04-25T08:40:19Z,0,16
user_6195,halooo sifelter kau orang patung sieh,2025-04-25T08:25:28Z,1,16
user_6266,membusuk dipenjara kau roy suryo,2025-04-25T07:46:24Z,0,16
user_6461,panci mesum pinter kowar kowar tunggu kau mendekam penjara biadab kau,2025-04-25T06:25:37Z,0,16
user_6479,allah swt kau dlm tujuan busukmu roy panci kau menghibah memfitnah menghancurkan betapa busukmu roy panci smg allah swt memcabut lidah dri mulut busukmu bgtu detail rinci kau panci sebutkan aib org yg blom bnar fitnah aamiin ya mujibasailin,2025-04-25T06:17:04Z,0,16
user_6577,ruginya nunjukkan ijaza orang bodoh kau,2025-04-25T05:42:11Z,0,16
user_6644,udalah jurus yg kau bela jokowe berlaku mu menenangkan orang yg sekolah aja sp yg lulusan sarjana dengar mu berlaku salah sp amati lee suai fakta observasi wsslm haaaa pngen sp kasih kau gelar lulusan sarjana nya penjilat alis goublok kin ijajah mu hhasil beli kau yg bela jokowi kuliah sabtu minggu wsslm haaaa,2025-04-25T04:58:17Z,0,16
user_6713,skarang ketawa kau panci tunggu sebentar kau nangis kau nangis maaf sya berharap jokowi jgn kasih maaf evek jera pembenci mu,2025-04-25T04:10:28Z,0,16
user_6739,heee silfer kau yg nol otakmu,2025-04-25T03:59:10Z,0,16
user_6739,andi silfer moral emang beli dgn uang jabatan betapa konyolnya argumen nte permasalahan sesimple ribet arti ugm bangga almamaternya presiden ijazah yg privacy ngelamar kerja wajib ijazah asli andi silfer gak malu kau sm anak keluarga kau coba merenung rezeki jabatan sdh sdh diatur tp gak kek kau nyarik rezeki jabatan,2025-04-25T03:41:57Z,0,16
user_6856,kau salah pecundang,2025-04-25T02:50:48Z,0,16
user_6910,alumni memalukan kau roy,2025-04-25T02:20:35Z,0,16
user_6910,kau gruduk orang acara ilc mutu,2025-04-25T02:17:27Z,0,16
user_7218,ee ayam hoak kau coba pegang bau hoak tetep kau instansi yg bilang ee ayam,2025-04-24T23:32:51Z,0,16
user_7241,roy kau manusia malu jowo kog malu masuk penjara mulut mu,2025-04-24T23:19:19Z,0,16
user_7206,kau jokodok pembohong,2025-04-24T23:05:07Z,0,16
user_7472,pekok lo wi jokowi bilang nama kau wi,2025-04-24T20:23:22Z,0,16
user_7527,roy berilmu menebar kebencian kalo niat berpolitik mainkan politik cerdas main kau lawan bandingan mu x kau lawan jokowi politik kebencian mu g menang kau ujungnya buang enegi koruptor panci vs mantan presiden semut menertawakan,2025-04-24T19:29:15Z,0,16
user_7577,roy kau kau jokowi tujukan ijasahnya kau lucu skali kau roy,2025-04-24T19:02:31Z,0,16
user_7684,roy roy wajah kau aja udah iblisnya pake bawak nama allah udah kau menabur kebencian menzolimi islam udah orang salah aja maafkan,2025-04-24T18:11:31Z,0,16
user_7763,roy palsu yg asli disimpan jokowi semangat kali kau roy,2025-04-24T17:47:06Z,0,16
user_7842,bangga kau penghujat fropokator,2025-04-24T17:26:58Z,0,16
user_7916,sepele gundul mu kui ijazah mantan orang nomor nkri level mu kalo kau ma peduli,2025-04-24T17:05:10Z,2,16
user_7924,panda kau gak dilarang orang berjuang,2025-04-24T17:03:06Z,0,16
user_8003,iya presiden yg buruk thn merdeka hai pengacara kau berjuang yg salah kau lahirkan keturunan,2025-04-24T16:48:24Z,0,16
user_8164,kau yg hoax silverter,2025-04-24T16:14:51Z,0,16
user_8209,hai kau tdk ijaza palsu mata normal photo mu,2025-04-24T16:07:26Z,0,16
user_8559,bacot brow kau berubah,2025-04-24T15:01:09Z,0,16
user_8744,yakup kau ijazah jokowi mata kepala kau ijazah asli palsu,2025-04-24T14:31:49Z,0,16
user_9120,mulyono kena kau,2025-04-24T13:29:53Z,0,16
user_9147,suryo kau edit,2025-04-24T13:23:04Z,0,16
user_9239,silpester ngomong kau,2025-04-24T13:09:35Z,0,16
user_9362,kau terbukti ijazah jokowii palsu cabut uang pensiunan n rumah,2025-04-24T12:44:34Z,0,16
user_9405,roy suryo lupa ya kau dikasih panggung habis habis kau kena jebakan,2025-04-24T12:34:54Z,1,16
user_9472,remeh temeh kepala otak kau tu,2025-04-24T12:24:08Z,0,16
user_9570,woi panda kau do pdip partai terkorup ri,2025-04-24T12:07:26Z,0,16
user_9665,selamat ginting maksudnya presiden perintahkan kapolri utk lakukan uji porensik pengadilan mengintervensi hentikan lanjutkan prabowo ngomong yg kau pahami kau berpura netral sbenarnya kau berpihak pembenci bawa presiden korsel diseret pengadilan seakan jokowi sdh bersalah pengadilan tdk berani mengadilinya jinkkk dah yg si karni gak tujuannya bikin forum berat sebelah ilc kayak forum sampah aja,2025-04-24T11:51:58Z,0,16
user_9085,barengsek kau jokowi,2025-04-24T11:38:46Z,0,16
user_10104,remeh temeh kau haha ya sdh ribet skali,2025-04-24T10:27:00Z,0,16
user_10106,fitnah pencemaran nama bawa ranah hukum kau jokowi,2025-04-24T10:26:52Z,2,16
user_10127,sajja kau panci buktikan pengadilan,2025-04-24T10:22:58Z,0,16
user_10217,upload pulak pokok fafufafa roy fitnah pokok kau no dihukum,2025-04-24T10:02:58Z,0,16
user_10480,oke lihat betapa efeknya ijazah palsu dengar kau,2025-04-24T09:13:41Z,0,16
user_10495,kasihan kau silfester matutina kau ngotot belai junjungan mu sang penipu,2025-04-24T09:10:43Z,0,16
user_10495,kasihan kau silfester matutina kau ngotot belai junjungan mu sang penipu,2025-04-24T08:55:43Z,1,16
user_10292,kau ajalah manggil kalok kagak,2025-04-24T08:54:00Z,0,16
user_10631,semoga terwujud kau panci cita mu rompi oranye yg selamaat menikmati tua mu prodeo,2025-04-24T08:45:57Z,0,16
user_10769,orang bodohnya kau melamar pekerjaan ya,2025-04-24T08:08:20Z,0,16
user_10949,ndak data dungu kau silpestretaswan,2025-04-24T07:52:17Z,0,16
user_10874,hancurlah kau jokowi,2025-04-24T07:43:21Z,0,16
user_11224,kau silverster yg janjikan kel jokowi muliono kau mati matian bela udah kalah kau bg rocky gerung berdebat scr intelektual,2025-04-24T07:16:07Z,0,16
user_11339,salah org kau silfester ancam roy suryo pidana hukum nggak getar jiwa a roy suryo orang pintar kau yg universitas gaib emang berat mengungkap lawan a negara yg dikendalikan china,2025-04-24T07:01:57Z,0,16
user_11453,kau jahanam jokowi kau rakyat menderita,2025-04-24T06:49:53Z,0,16
user_11460,ngomong kau silitpester,2025-04-24T06:48:53Z,0,16
user_11519,udah menipu orang klu emang ajazah kau napa gk kau hadirkan persidangan dasar pembuat gaduh kau bang roy emang cerdas ya usut tuntas si raja bohong yg membela nya penjarakan karna udh membela orang yg salah oh ya silvertina kau blg gak sembarangan bang roy trus bambang tri gus nur penjara perliha ijazah asli klu blom orang udh penjaran biadab trimakasih,2025-04-24T06:39:35Z,0,16
user_11636,terbukti jokowi ijazahnya palsu lari sylfester kau,2025-04-24T06:27:05Z,0,16
user_11068,fitnah kau kasi liat la izajah mu,2025-04-24T06:26:20Z,0,16
user_11694,jngan d tunjukan mul ijazah kau t palsu,2025-04-24T06:08:25Z,0,16
user_11852,silfester bongok roy pakar kaya kau penjilat ulung,2025-04-24T06:01:58Z,0,16
user_11976,kau jual panci aja roy,2025-04-24T05:47:01Z,0,16
user_11988,x cerita kau susah kau cari makan pembohong mahkluk yg,2025-04-24T05:46:01Z,0,16
user_11990,kau lihat statemen bodoh buktinya roy suryo dn kawn kawan lihat ga dikasi,2025-04-24T05:45:52Z,0,16
user_12050,semangat roy suryo suarakan dugaan mu lantangkan adu domba mu kebenaran berpihak yg kau sesali kau kena batu nya,2025-04-24T05:38:52Z,0,16
user_12189,silfelter tobat kau jgn bersembunyi dibalik keterbukaan kau kebusukan pribadi sok tau sok bener,2025-04-24T05:18:58Z,0,16
user_12302,silfester kau nol,2025-04-24T05:06:40Z,1,16
user_12395,kau milad buritnya silfester,2025-04-24T04:57:15Z,0,16
user_12409,ketawalah sepuasnya kau roy suryo ketawamu tangisanmu penjara seumur hidup penyesalan datangnya,2025-04-24T04:49:42Z,0,16
user_11299,uangku paslu silahkan butikan tp jgn kau liat uangnya,2025-04-24T04:46:15Z,0,16
user_12514,kau kau masok maling panci,2025-04-24T04:44:49Z,0,16
user_12194,muda pembohong sayang kau pengacara muda suka berbohong,2025-04-24T04:39:22Z,0,16
user_12215,panda jujur dgr mul ga malu kau,2025-04-24T04:21:25Z,0,16
user_12215,telak kau as roy,2025-04-24T04:10:12Z,0,16
user_12964,endasmu roy panci sdh kau kembalikan,2025-04-24T04:03:07Z,0,16
user_13001,roy udah sibuk kali kau ngurus ijazah kebencian mu,2025-04-24T03:59:47Z,0,16
user_13210,tunggu aja dikit lg kau menangis roy suryo,2025-04-24T03:42:52Z,0,16
user_13328,kau tipu mentah² rakyat indonesi,2025-04-24T03:31:10Z,0,16
user_13328,tau malu kau jokowi,2025-04-24T03:30:41Z,0,16
user_12926,lari kemana kau joko widodo pemalsuan ijazahmu terungkap,2025-04-24T03:22:24Z,0,16
user_13525,kau memegang skripsi kau menyebarkan hoax roy suryo gimana pendapatmu hoax foto jokowi kau jumanto,2025-04-24T03:16:54Z,0,16
user_13527,kau bohong pengadilan tempo ngak bawa,2025-04-24T03:16:38Z,0,16
user_13563,omongan kau yg nol,2025-04-24T03:14:01Z,0,16
user_13296,muter jokowi klau palsu udah terima hukum kau terima,2025-04-24T03:12:19Z,0,16
user_13692,kewajibn gimna jokowi lo udah jdi presiden dasar manusia laknat kau rakyat kau kibulin,2025-04-24T03:03:04Z,0,16
user_13884,silfister kau pembela dipihak orang jujur membela rakyat,2025-04-24T02:32:11Z,0,16
user_13360,fitnah kau blg kau tunjukkanlah biar jgn fitnah org kau,2025-04-24T02:32:05Z,0,16
user_14273,berbuatlah sesukamu kelak kau mati kau pertanggung jawabkan akhirat,2025-04-24T01:33:53Z,0,16
user_14300,pa jokowi rakyatbs kau bohongi kau tipu kau bs membohongi allah jokowi,2025-04-24T01:23:19Z,0,16
user_85,bagus panci krn kau org terdungu ternyinyir masyarakat gak menilai dirimu utk uda tau kau sgrombolan serigala berbulu domba,2025-05-26T22:43:46Z,0,16
user_97,hhhhhh pandai kau ngomong bolak mu roy roy setuju dgn jokowi melapor org bosan dgn ocehan mu roy,2025-05-26T09:16:31Z,0,16
user_173,kontut kau jatuh jokowi kalimantan ni,2025-05-23T14:11:52Z,0,16
user_285,sy mu bilang mahkluk pembenci jokowi otaknya dgn netanyahu memalukan kau roy,2025-05-21T15:43:40Z,0,16
user_325,suka kali memutar balikkan fakta cari kau nyuruh orang nunjukkan ijazahnya,2025-05-21T07:58:40Z,0,16
user_389,oy roy lolo kau tuhh buyan,2025-05-20T16:06:43Z,0,16
user_398,bacot kau roy roy,2025-05-20T14:08:08Z,0,16
user_532,roy suryo kau masyrakat ntt menilai kau roy suryo ori hati dendam yg kau simpan jokowi keluarganya,2025-05-19T11:49:15Z,0,16
user_581,jokowi prestasi dr ujung timur pulau rote kau roy suryo prestasimu bangsa dikasi kesempatan jd menpora habis peralatan menpora kau curi emang yah otak kl sdh kotor suka nonton bokep ya isinya kayak otak kau roy,2025-05-19T00:40:38Z,0,16
user_640,waras kau roy suryo kau ahlinya wewenangmu,2025-05-18T08:32:08Z,1,16
user_653,takut klau asli omongan mu aja masak mantan presiden memenjarakan orang kn kau ya asli ya kau tanggung resikonya,2025-05-18T05:10:37Z,0,16
user_677,kepiintatan mu derita mu roy suryo perdata pidana biar kau roy suryo masuk kau kau roy surya,2025-05-17T17:16:06Z,0,16
user_677,selesai kau roy suryo selesai cerita manismu anis selesay kau roy suryo tunggu kau pakey baju orens,2025-05-17T17:13:07Z,0,16
user_677,cerita kau selesai kau roy suryo delig mu ijasah kau mencampuri ptibadi oarang sok tau kau,2025-05-17T17:11:30Z,0,16
user_737,kau roy suryo untungnya rakyat negara kau pingin tau izazah jokowi maksud tujuan kau rekan kau,2025-05-17T04:51:57Z,0,16
user_764,tertawalah kau sepuas nya roy suryo nampak gimik bicaramu sepele orang tuhan maha maha mendengar karna orang yg kau fitnah bnyk bersabar diam ttp kesabaran manusia batasnya,2025-05-16T19:44:40Z,0,16
user_888,masroy dasar otakmu kau tarok dilututmu,2025-05-15T17:05:22Z,0,16
user_942,tuh lihat muka roy suryo mimik setres pangkat suryo hak mu ngotot jokowi kau suru tunjukan izajah nya kau urusan mu,2025-05-15T10:16:21Z,0,16
user_1002,woyyy suryo jgn bawa rakyat kau rakyat yg kau maksud,2025-05-15T00:42:22Z,0,16
user_1006,sibuk receh cari popularitas kau suryo rakyat bosan lihat ulah norak,2025-05-15T00:04:27Z,0,16
user_1067,muncungmu roy tdk kau manusia yg senantiasa bikin rusuh kau pakai kau nkri sdh selesai masamu semenjak buang partai demokrat,2025-05-14T13:41:58Z,0,16
user_1071,kau,2025-05-14T13:33:31Z,0,16
user_1072,panci bawa bawa masyarakat kau sayembara balas dendam engkau sdh residifis,2025-05-14T13:29:46Z,0,16
user_1076,kau hak dgn ijasah jokowi,2025-05-14T13:19:40Z,0,16
user_1029,kau bodoh roy suryo ga sadar kau yg kau lawan sok paten kau skrg ketakutan kau akibat org yg intelek tp ga kerjaan pala ijazah presiden kau usik aja kau usik ijazah yg,2025-05-14T11:36:48Z,0,16
user_1124,komentar roii panci onar kau diindonesia,2025-05-14T08:51:22Z,0,16
user_1147,penjarakan mreka sekrng ketar ketir trus knapa kau tukang kepo kau tunggu,2025-05-14T06:00:27Z,0,16
user_1187,jokowi kau manusia licik penipu pembohong malu,2025-05-14T03:38:16Z,0,16
user_1189,roy panci ngeles mantan presiden wio roy srbsiknya kau diam sdh bmu yg hsnya gaduh doang tsk bermanfaat tdk kau negeri gaduh,2025-05-14T02:53:47Z,0,16
user_1312,sikit biar masyarakat yg menilai masyarakat dasar ular licik kau penjara urusanmu,2025-05-13T12:05:10Z,0,16
user_1436,hey roy suryo bahasamu kau ketakutan jd penghuni lp,2025-05-12T20:38:10Z,0,16
user_1439,roy jgn suka suna ngomonv kau biar rakyat yg menilai rakyat yg menilai kau kesalahanmu,2025-05-12T19:34:00Z,0,16
user_1530,jual masarakat kau ni,2025-05-12T12:10:03Z,0,16
user_1560,kepentingan roy panci ditunjukkin ijazah jokowi kau klu wapres presiden coba nyapres yo suryo,2025-05-12T09:46:05Z,0,16
user_1607,ha ha ha terserah kau mulyono intinya kau busuk kau ijazah ha ha ha trik apapun warga negara jijik kau pembohong,2025-05-12T01:08:28Z,0,16
user_1669,hei roy panci kau gk percaya ugm kau lulusan ugm megok lu,2025-05-11T15:22:32Z,0,16
user_1669,hei kau udah stres roy suryo udh dibilang asli kau dak percaya jgk ngeyel kau nyalah jokowi melapor mempenjarakan preeeeeeet,2025-05-11T15:19:44Z,0,16
user_1674,ilmu pengetahuan mas suryo yg fitnah yg kau tunjukkan publik,2025-05-11T14:46:52Z,0,16
user_1676,gaduh kau membalikkan fakta,2025-05-11T14:21:16Z,0,16
user_1683,lgian ngapain kau ngurus ijasah orang sdangkn kau ngurus ank binimu aja g pecus dasar otak penuh panci kau,2025-05-11T13:53:00Z,0,16
user_1707,si tilol aja bikin ribut negara kau orang berpendidikan,2025-05-11T11:41:07Z,0,16
user_1719,mampus kau roy suryo dg ken yg sereeeetttttt penjara nyinyirrr,2025-05-11T10:31:10Z,0,16
user_1750,lh kau roy panci brgabung dgn orang pnjara,2025-05-11T07:37:59Z,0,16
user_1879,klo uda terdesak kau bilang kriminalisasi,2025-05-10T15:29:36Z,0,16
user_1896,ya kau buktikan lh roy suryo klw ijasah jokowi palsu,2025-05-10T14:00:22Z,0,16
user_1962,manusia bodoh si roy kau membusuk penjara,2025-05-10T08:59:48Z,0,16
user_2067,masyarakat indenesia mendukung jokowi kau roy jgn membawa nama masyarakat kau putar kau bawa nama masyarakat bangsat kau biadab,2025-05-10T02:22:48Z,0,16
user_2146,udalah pulanglah kau roy cuci piring dirumahmu,2025-05-09T16:38:07Z,0,16
user_2161,kau yg katax lulusan ugm otok mu ky anak tv sajah kau roy surya dasar manusia gk otak,2025-05-09T15:33:33Z,0,16
user_2195,mulutmu roa suryo kau ijazahmu lo ijazahku ayo tunjukkan ijazahmu roy,2025-05-09T13:26:53Z,0,16
user_2211,bangga nya kow roy dengn ijazah kau,2025-05-09T12:15:06Z,0,16
user_2259,rakyat indonesiaa enggakenilai kau panci tangkap,2025-05-09T09:01:50Z,0,16
user_2346,kalo tunjukkan kau bilang palsu,2025-05-09T04:03:04Z,0,16
user_2446,kau masok penjara mampos lu,2025-05-08T17:40:49Z,0,16
user_2464,rs sok kau nyanyi indonesia raya kau salah kau sok pintar geregetan kau sombong kau prestasimu utk indonesia rs,2025-05-08T16:14:00Z,0,16
user_2491,enak kau roy,2025-05-08T14:54:28Z,0,16
user_2532,roy suryo tukang putar kmrin ngotot giliran sdh dilaporkan persalahkan jokowi krn pidanakan kau maunusia bkn,2025-05-08T12:10:20Z,0,16
user_2570,ungkit izasah jokowi kn jokowi negara jd masyrakat lh teladan emang orang jujur roy lihat janga tiru gaya anies bro gak cocok rakyat menilai jokowi mantap ko kau nggak geger urus aja gak kau,2025-05-08T10:11:34Z,0,16
user_2599,malu kau suryo kau belajar jokowi,2025-05-08T07:00:52Z,0,16
user_2709,udah jngn ngeyel kau roy suryo masuk penjarah la kau,2025-05-07T22:36:18Z,0,16
user_2760,busuk ati kau roy,2025-05-07T18:00:14Z,0,16
user_2760,busuk hati kau suryo kau kasi pelajaran,2025-05-07T17:58:03Z,0,16
user_2760,nangis kau emang naas kau kau salah orang bep,2025-05-07T17:55:17Z,0,16
user_2805,masyarakat tau kau pembuat hoax roy roy,2025-05-07T16:17:43Z,0,16
user_2890,roy surio aja gigi mu kau tonjolkan kau pikir senyum mu berguna bicara mu aja kayak bocah umur yg berteman dgn mu,2025-05-07T14:48:15Z,0,16
user_2947,jokowi walikota kau tdk protes omong kosong sj km bilang sakit tdk mentri,2025-05-07T14:04:42Z,0,16
user_2959,kau roy suryo sja diproses hukum,2025-05-07T13:54:02Z,0,16
user_2997,enak x kau ijazah orang kau yg sibuk skrg persiapkan dirimu utk mempertanggungjawabkan perbuatanmu yg merendahkan jokowi,2025-05-07T13:13:42Z,0,16
user_3008,kau bilang masyaallah memfitnah orang ko nya biar nama jokowi lho,2025-05-07T13:00:30Z,0,16
user_3020,kor kau roy kau kau kerja kau kau pesak kau,2025-05-07T12:43:14Z,0,16
user_3101,masyarakat yg kau wakili roy becek,2025-05-07T10:58:43Z,0,16
user_3206,aja x kau bilang persen kenyataan nya salah persen,2025-05-07T08:52:37Z,0,16
user_3214,sibuk ngurusin orang kapok kau,2025-05-07T08:37:24Z,0,16
user_3251,hai roy suryo berhenti ngebacot mulut kau busuk bau bangkai selamat aja kau masuk penjara seumur hidup ngomong kayak orang gak pendidikan,2025-05-07T07:48:25Z,1,16
user_3296,panci ijazah selesai kau dipejara gempor,2025-05-07T06:53:50Z,0,16
user_3331,diam kau panci bikin ribut aya kau taiiii,2025-05-07T06:00:14Z,0,16
user_3410,mampus lh kau jokowi d lawan,2025-05-07T04:36:36Z,0,16
user_3415,faham modar kau roy roy penjara menunggumu baju orengs,2025-05-07T04:20:11Z,0,16
user_3430,mampus kau,2025-05-07T04:11:36Z,0,16
user_3507,menilai kau tukang fitnah,2025-05-07T01:46:54Z,0,16
user_3561,perempuan kau roy suryo binatang kai,2025-05-06T23:21:17Z,0,16
user_3595,roisorio kau kau trus yg bilang mantan presiden memenjarakan orang,2025-05-06T21:14:00Z,0,16
user_3650,kau masuk bui,2025-05-06T17:40:15Z,0,16
user_3665,hei roi soro kau dukung jokowi engkau pura memusuhnya kau jgn membihongi hati nuranimu kau rasakakn akibatnya,2025-05-06T17:08:11Z,0,16
user_3667,roy kau pintar yg pintar kau pintar mamasih,2025-05-06T17:04:52Z,0,16
user_3711,roy suryo coba kau ijasah prabowo palsu asli nyali ga lo panci banci,2025-05-06T15:27:41Z,0,16
user_3807,kau yg diseret,2025-05-06T13:28:43Z,0,16
user_3804,berlindung nama masyarakat kau yg baper,2025-05-06T13:28:10Z,0,16
user_3816,kau roy suryo masuk penjara pengikutmu,2025-05-06T13:18:55Z,0,16
user_3905,menut sy kau yg keberatan karna kau ngotot bilang palsu palsu,2025-05-06T11:24:51Z,0,16
user_3957,roy suryo kau sibuk buka aib orang ngurus ijazah palsu jokowi maumu sakit hati kau ya dipecat,2025-05-06T09:55:33Z,0,16
user_4184,da takut kau suryo td bilang kriminallisasi jokowi dgn laporan polisi klu ngak takut jgn bilang kriminalisasi roy dunggu tar masuk penjara kau rismon tifa egi s manusia tolol yg otak dangkal,2025-05-06T02:28:01Z,0,16
user_4303,kau tabur kau petik roy suryo cs berkat kepahitan hati kedunguan,2025-05-05T22:07:19Z,1,16
user_4390,kau tu ubah propokator,2025-05-05T17:06:59Z,0,16
user_4422,cakap kau roy percaya dgn mulutmu kau atur jokowi ijazahnya kau muaaaaaaak,2025-05-05T16:13:38Z,0,16
user_4451,bikin kau suryo masarakat udah menilai,2025-05-05T15:41:05Z,0,16
user_3480,klau roysuryo kau yg koo skarang salahkan orng,2025-05-05T15:03:17Z,0,16
user_4487,roy suryo kau yg bohong orang tau sasi jakta yg barengan nya skolah kuliah dasar biadab roy suryo kereminalisasi kau biadab,2025-05-05T14:54:11Z,0,16
