author,text,published_at,like_count,cluster
debat_tv_one_user_5,kesini nonton si badut ternak mulyono,2025-06-01T14:32:12Z,0,15
debat_tv_one_user_23,si mulyono adili nya,2025-05-31T09:00:09Z,1,15
debat_tv_one_user_23,rakyat persen ijazah si mulyono palsu,2025-05-31T08:59:25Z,1,15
debat_tv_one_user_53,ugm pengecut ga kali undang tau bersalah ugm universitas gank mulyono,2025-05-29T02:30:42Z,0,15
debat_tv_one_user_164,masy ijazah mulyono palsu,2025-05-24T15:28:42Z,0,15
debat_tv_one_user_295,gmana kasusnya tuntas kapolri nya aja anak buah mulyono,2025-05-19T16:00:28Z,0,15
debat_tv_one_user_23,ternak mulyono permukaan,2025-05-18T21:55:10Z,0,15
debat_tv_one_user_315,ternak mulyono,2025-05-18T21:16:18Z,0,15
debat_tv_one_user_23,mulyono raja pembohong sedunia,2025-05-15T08:07:57Z,0,15
debat_tv_one_user_419,ugm universitas geng mulyono,2025-05-13T19:27:30Z,0,15
debat_tv_one_user_473,mulyono mulyono,2025-05-11T16:14:43Z,0,15
debat_tv_one_user_479,ngga kalo tunjukin ijazah yaa tunjukin aja kalo lurus dna jujur ngga cingcong mulyono,2025-05-11T15:36:04Z,1,15
debat_tv_one_user_527,disogok brapa antek antek mulyono,2025-05-10T12:05:57Z,0,15
debat_tv_one_user_547,duuuh heran gw pembela mulyono ane kocak lu,2025-05-10T01:28:36Z,0,15
debat_tv_one_user_23,ternak mulyono tolong kasi panggung orang pn enek liatnya akal,2025-05-08T12:19:29Z,0,15
debat_tv_one_user_23,plis adili mulyono nusa bangsa,2025-05-07T18:11:50Z,0,15
debat_tv_one_user_23,sepele hey plester tunjukan ijazah nya mulyono rakyat sepele tinggal tunjukan dasar pembohong,2025-05-06T12:35:02Z,0,15
debat_tv_one_user_1285,silfester bayar ya mulyono,2025-05-05T03:04:08Z,1,15
debat_tv_one_user_1321,seandainya pdip gk mengorbitkan mulyono pastikan negara damai sejahtera aman sentosa,2025-05-04T15:17:07Z,1,15
debat_tv_one_user_1357,fufu fafa aja dibongkar roy suryo ketua projo budi ari mentri kominfo bilang umumkan fufufafa asli sampe skr kagak bs menangkal kl fufufafa gibran udh deh gk kebohongan yg sempurna emang dr mulyono kel pembohong yg dr mulut mulyono kebohongan kebohongan mulyono dikantong sy ribu triliun duitnya dikantong sy ktnya sampe skr wujud duit nya siluman kebohongan mulyono sdh unit mbl esemka pesan oktober launching sampe skr hantu yg pake mbl esemka jejak digital nyata tinggal tonton ucapan mulyono yg bohong dr sekian byk kebohongan mulyono,2025-05-04T05:36:11Z,0,15
debat_tv_one_user_1435,circle mulyono level iq nya jongkok njirr,2025-05-03T12:53:06Z,1,15
debat_tv_one_user_1490,biang kerok korupsi negara ya si empunya ijazah palsu mulyono raja tipu orang korupsipun takut moral bejat dicontohkan mantan ri,2025-05-03T01:02:24Z,1,15
debat_tv_one_user_1512,kalo mulyono gak bersedia iy namanya takut mulyono gimana sih mulyono,2025-05-02T20:07:45Z,1,15
debat_tv_one_user_1561,ternak mulyono,2025-05-02T14:57:14Z,1,15
debat_tv_one_user_1592,silveter ternak mulyono pantes bela mati an,2025-05-02T11:53:09Z,1,15
debat_tv_one_user_1687,ribet mulyono kasih liat ijasah ampun dahh pemecah bangsa mah,2025-05-01T16:37:41Z,1,15
debat_tv_one_user_1692,pendukung si mulyono ngebacot gw enek ya,2025-05-01T16:10:39Z,1,15
debat_tv_one_user_1827,kebohongan ijazah palsu mulyono dikuliti abis abisan sm suryo mantappp penjelasannya bs dterima akal sehat,2025-04-30T23:50:57Z,0,15
debat_tv_one_user_1858,jgn takut ternak ternak mulyono,2025-04-30T17:41:51Z,1,15
debat_tv_one_user_1927,ternak,2025-04-30T14:46:38Z,1,15
debat_tv_one_user_2134,lihat orang munafik yg membela kawannya yg munafik kebenaran jalannya bodoh i ijazah palsu mulyono menuntut mulyono membuktikan masyarakat ijazahnya asli terbukti palsu menuntut jokowi mulyono adili seadil adilnya bohongi terima mantan presiden ijazahnya palsu busuk,2025-04-29T14:48:13Z,0,15
debat_tv_one_user_2170,lapor polisi sisselfer bodohh polri ri herdernya mulyono,2025-04-29T11:18:55Z,2,15
debat_tv_one_user_2170,bodohnya sisselfer polri antek nya mulyono bareskrim herdernya jokowi mulyono pkiiiiiiiii,2025-04-29T11:13:14Z,2,15
debat_tv_one_user_2215,ijazah asli tunjukanlah roy suryo terbungkam proses hukum sesimpel mulyono,2025-04-29T06:11:06Z,1,15
debat_tv_one_user_2218,ternak mulyono jngn melawam ahli it mampuz,2025-04-29T05:52:27Z,1,15
debat_tv_one_user_2234,mulyono fufufafa simbol kemunduran bangsa,2025-04-29T04:23:37Z,2,15
debat_tv_one_user_2236,wo dasar mulyono pembohong nggk izazah asli kebohongan,2025-04-29T04:12:36Z,2,15
debat_tv_one_user_2260,habis kau mulyono,2025-04-29T00:19:42Z,1,15
debat_tv_one_user_2328,pemuja mulyono nggak mikir mulyono drs ir kebohongan jokowi esemka dsb ampun mmng termul,2025-04-28T16:54:28Z,1,15
debat_tv_one_user_2334,pengacara mulyono kntol,2025-04-28T16:39:14Z,1,15
debat_tv_one_user_2379,ternak mulyono guoooblok,2025-04-28T13:42:53Z,3,15
debat_tv_one_user_2454,akui aja luhh si mulyono,2025-04-28T10:14:21Z,0,15
debat_tv_one_user_2598,yg ijazah mulyono asli dipidanakan karna pembohongan publik,2025-04-27T23:56:38Z,0,15
debat_tv_one_user_2616,ewako mas roy kasih faham tu ternal mulyono,2025-04-27T22:32:46Z,0,15
debat_tv_one_user_2618,ternak mulyono membuktikan nyata,2025-04-27T22:08:49Z,0,15
debat_tv_one_user_2712,ternak mulyono bahas halusinasi wkwkw ente halusinasi mobil smka,2025-04-27T17:12:55Z,0,15
debat_tv_one_user_2725,mulyono jarang sholat,2025-04-27T16:57:51Z,1,15
debat_tv_one_user_2779,uji forensik ijazah mulyono,2025-04-27T14:10:28Z,0,15
debat_tv_one_user_2924,nih ternak mulyono nggak yg komen,2025-04-27T13:05:05Z,0,15
debat_tv_one_user_2946,usut kebohongan mulyono,2025-04-27T12:41:05Z,0,15
debat_tv_one_user_3122,ternak mulyono sok pintar lam dikasi bicara bloonnya,2025-04-27T07:25:44Z,1,15
debat_tv_one_user_3128,penjilat cari akal membela mulyono,2025-04-27T07:08:58Z,0,15
debat_tv_one_user_3156,presiden disponsori mulyono kapolri dipilih mulyono panglima dipilih mulyono kpu gajih dinaikin mulyono mk adik ipar mulyono pastikan rakyat yg bertindak adili konoha mulyono yg menang mesti pengadilan international sprt nya,2025-04-27T06:25:09Z,7,15
debat_tv_one_user_3198,buzzer mulyono ngotot palsu,2025-04-27T05:14:04Z,0,15
debat_tv_one_user_3317,kalo roy suryo dkk sampe kriminalisasi penjara pembuktian ijazah perangkat penegakan keadilan sdh beli mulyono genk,2025-04-27T01:58:20Z,0,15
debat_tv_one_user_3388,pengacara mulyono cari duit,2025-04-27T00:07:56Z,0,15
debat_tv_one_user_3410,masak pemalsuan yg pejabat negara dianggap remeh temeh penjilat mulyono emang zonk omongannya,2025-04-26T23:14:22Z,0,15
debat_tv_one_user_3428,modelnya mulyono cmn jebolan esde,2025-04-26T21:48:04Z,0,15
debat_tv_one_user_3464,kasihan lihat orang penjilat mulyono plonga plongo kasihan ga kelas hadir situ hahaha,2025-04-26T20:08:25Z,0,15
debat_tv_one_user_3483,silahkan semau perut penyembah mulyono mulut berbusa busa selamat manusia suci,2025-04-26T19:22:22Z,0,15
debat_tv_one_user_3539,ternak mulyono mengedepankan otot ngotot logika ilmiah akademisi tdk,2025-04-26T17:59:13Z,0,15
debat_tv_one_user_3561,dah ulti sm roy suryo sadis x pinokio bernama mulyono jowoki tidur nya ga nyenyak skrg,2025-04-26T17:37:40Z,0,15
debat_tv_one_user_3580,ternak mulyono sayangnya rg tdk diundang tdk hadir babak belur yg ngajak berantem,2025-04-26T17:12:07Z,0,15
debat_tv_one_user_3623,maju mas roy tegakan kebenaran biar pendukungnya mulyono malu,2025-04-26T16:35:57Z,0,15
debat_tv_one_user_3636,maju buang takut mulyono perusak negri mental tempe,2025-04-26T15:55:43Z,0,15
debat_tv_one_user_3692,asli tinggal tunjukin aja aja repot mulyono mulyono,2025-04-26T15:47:27Z,0,15
debat_tv_one_user_3772,sadis banget ya mulyono org jujur pinter dipenjara in gampang banget menjarain org ga bersalah ngalah in pki mulyono sadisnya,2025-04-26T15:03:26Z,0,15
debat_tv_one_user_3756,ga memaksa org si mulyono pejabat publik suka ga suka ya dibuktikan,2025-04-26T14:48:01Z,0,15
debat_tv_one_user_3756,berak konstitusi mulyono ngacak ngacak konstitusi,2025-04-26T14:43:45Z,0,15
debat_tv_one_user_3700,tangkap smua croni nya mulyono seret penjarakan hukum mati,2025-04-26T14:43:26Z,0,15
debat_tv_one_user_3815,maju bang roy takut dajal mulyono laknatullah,2025-04-26T13:50:14Z,0,15
debat_tv_one_user_3923,mulyono manusia gila yg president indonesia,2025-04-26T13:30:44Z,0,15
debat_tv_one_user_3938,tuh yg bela jokowi mati an cari makan dgn kacung ternak mulyono,2025-04-26T13:22:39Z,0,15
debat_tv_one_user_3943,narsum yg bicara pemaparan data ilmiah yg yg pakai asumsi narasi simpel ijazah yg asli diuji keabsahannya ditutup i kebohongan ternak mulyono argumennya aja gak kasih data ilmiah,2025-04-26T13:19:20Z,0,15
debat_tv_one_user_3943,narsum yg bicara pemaparan data ilmiah yg yg pakai asumsi narasi simpel ijazah yg asli diuji keabsahannya ditutup i kebohongan ternak mulyono argumennya aja gak kasih data ilmiah,2025-04-26T13:15:47Z,0,15
debat_tv_one_user_3979,ugm universitas genk mulyono universitas gemar menipu universitas gajah manut bikin maluuuu boikot ugm,2025-04-26T12:30:03Z,0,15
debat_tv_one_user_3993,kabur tuh mulyono nnti pas persidangan ijazah palsu kemaren pas persidangan penggugat esemka aja kabur kwkwk,2025-04-26T12:11:21Z,0,15
debat_tv_one_user_4051,guguk peliharaan mulyono kejang² kepanasan,2025-04-26T12:04:01Z,0,15
debat_tv_one_user_4082,penjilat mulyono kalap,2025-04-26T11:45:01Z,0,15
debat_tv_one_user_4134,golongan mulyono gemar memenjarakan orang,2025-04-26T10:42:55Z,0,15
debat_tv_one_user_4137,bazer pki yg percaya mulyono,2025-04-26T10:41:17Z,0,15
debat_tv_one_user_4172,aneh bela mulyono,2025-04-26T09:59:13Z,0,15
debat_tv_one_user_4215,pararunten ijazah mulyono terbukti palsu ibunda bs pelayanan perawatan lbh dirawat rumah sakit dgn bpjs isu fungsinya ya biar mulyono ttp eksis,2025-04-26T09:10:58Z,0,15
debat_tv_one_user_4246,mulyono kau tdk bs membohongi allah hatimu tenang gelisah krn kau tau dirimu,2025-04-26T08:45:54Z,0,15
debat_tv_one_user_4289,liat bualan ternak mulyono,2025-04-26T08:04:24Z,0,15
debat_tv_one_user_4306,sekolah susah pas lg guru disuruh tesis mulyono utk nipu rakyat,2025-04-26T07:52:07Z,0,15
debat_tv_one_user_4358,kuliah ugm tinggal tunjukkan ijasah nya bukti² dukung mengenyam kuliah ugm gitu gitu aja ribet mulyono,2025-04-26T07:03:08Z,0,15
debat_tv_one_user_4420,ijaza mas mulyono palsu su su asli keluarkan meredam masyarakat,2025-04-26T06:08:19Z,0,15
debat_tv_one_user_4426,ternak mulyono ngomong nya bertele,2025-04-26T06:03:50Z,0,15
debat_tv_one_user_4446,mulyono si tukang tipu,2025-04-26T05:45:38Z,1,15
debat_tv_one_user_4472,bela mulyono ya,2025-04-26T05:27:20Z,0,15
debat_tv_one_user_4497,si pembela mulyono ko lucu smua yaa,2025-04-26T05:12:50Z,0,15
debat_tv_one_user_4555,ternak mulyono ga mudeng alias ngeyel udah teknis digital forensik,2025-04-26T04:26:24Z,0,15
debat_tv_one_user_4555,ternak mulyono ga mudeng alias ngeyel udah teknis digital forensik,2025-04-26T04:26:10Z,0,15
debat_tv_one_user_4559,roy ngalah penjilat mulyono gerombolan sdmnya,2025-04-26T04:23:57Z,0,15
debat_tv_one_user_4599,jgn blg yg dukung mulyono sm fufufafa diadili barisan sakit hati pendukung yg aq pribadi ga dukung krn sdh jijik sm politik ga urus yg berkuasa tp sdh ga lazim woiii sampe kpan mw dibodoh i sm org yg mukanya bodoh tp licik adili mulyono n antek nya wlwpun sulit gila hebat bener si mulyono muka idiot tp licik kalaula lepas dr hukum dunia inget ya hukum akhirat,2025-04-26T03:53:55Z,0,15
debat_tv_one_user_4606,skandal terbesar melebihi liga korupsi konoha intitusi pendidikan partai pengusung pengadilan hukum ormas dll cek digital forensik skripsi mulyono febuari mulyono universitas genk mulyono,2025-04-26T03:50:40Z,0,15
debat_tv_one_user_4627,mulyono mulyono,2025-04-26T03:36:41Z,0,15
debat_tv_one_user_4651,hi silvester dimana hati nuranimu mulyono berijasah palsu membohongi rskyst infonesia ternak buzzer nya manusia layak dibunuh karakternya,2025-04-26T03:13:16Z,0,15
debat_tv_one_user_4652,bagusnya sih terbukti palsu prabowo bebannya ringan pokok prabowo terhindar kudeta mulyono,2025-04-26T03:11:35Z,0,15
debat_tv_one_user_4686,ternaknya mulyono kebakaran jenggot,2025-04-26T02:49:34Z,0,15
debat_tv_one_user_4666,orang indonesia bohongin mulyono,2025-04-26T02:21:49Z,0,15
debat_tv_one_user_4763,ooo kau ternak mulyono si tukang bohong tukang ngibul ucapannya yg terbuktikan,2025-04-26T01:49:43Z,0,15
debat_tv_one_user_4806,palsu si mulyono bilang a tp kenyataan b,2025-04-26T01:02:23Z,0,15
debat_tv_one_user_4845,penjilat dubur mulyono fufufafa pasang badan masyarakat cerdas,2025-04-26T00:17:24Z,1,15
debat_tv_one_user_4853,manusia penjilat knp undang ilc ternak mulyono,2025-04-26T00:01:07Z,0,15
debat_tv_one_user_4925,anjing mulyono menggonggong nada,2025-04-25T22:03:36Z,0,15
debat_tv_one_user_4961,vote yu yg mendukung d selidiki ijazah mulyono silahkan yg gk dukung silahkan,2025-04-25T20:34:00Z,0,15
debat_tv_one_user_5000,panda nababan cari ilmu selamat menekan roy surya koar karna gerombolan pdip tau ijazah mulyono palsu,2025-04-25T19:27:14Z,0,15
debat_tv_one_user_5027,argumen ternak mulyono gak isinya isi kepala jilat teros sampek bersih,2025-04-25T18:59:12Z,1,15
debat_tv_one_user_5050,penjilat mulyono parah bener ya,2025-04-25T18:35:40Z,1,15
debat_tv_one_user_5078,pret silger silver penjilat ngomong mu berbelit belit memutar balikkan kebusukan mulyono,2025-04-25T18:06:22Z,1,15
debat_tv_one_user_23,silpester ternak mulyono,2025-04-25T18:01:01Z,1,15
debat_tv_one_user_5093,silvester tu ternak mulyono,2025-04-25T17:57:45Z,1,15
debat_tv_one_user_5102,palsu mulyono kena hukuman terpaksa bebaskan yg dipenjara kena pasal pemalsuan,2025-04-25T17:51:25Z,1,15
debat_tv_one_user_5105,universitas gerombolan mulyono,2025-04-25T17:46:05Z,0,15
debat_tv_one_user_5105,kebohongan lahirlah kebohongan yg yg mulyono hancur mulyono keluarganya,2025-04-25T17:44:11Z,0,15
debat_tv_one_user_5115,ternak mulyono yg ilc membela nggak ilmunya,2025-04-25T17:40:35Z,1,15
debat_tv_one_user_5203,pecundang si mulyono,2025-04-25T16:48:25Z,0,15
debat_tv_one_user_5225,ngomong ternak mulyono emang belibet muter kaya kemidi,2025-04-25T16:36:29Z,1,15
debat_tv_one_user_5232,awas kabur mulyono,2025-04-25T16:30:46Z,0,15
debat_tv_one_user_5267,kapolri ganti harap mulyono tersentuh hukum,2025-04-25T16:21:10Z,0,15
debat_tv_one_user_5277,nara sumber ilc ternak mulyono asli,2025-04-25T16:16:06Z,1,15
debat_tv_one_user_5345,kasihan yaaa negara acak mulyono,2025-04-25T15:43:45Z,1,15
debat_tv_one_user_5353,ternak mulyono keren,2025-04-25T15:41:17Z,1,15
debat_tv_one_user_5505,cacing cacing mulyono muka penjilat,2025-04-25T14:44:37Z,1,15
debat_tv_one_user_5513,pendukung mulyono gak tau malu,2025-04-25T14:43:58Z,0,15
debat_tv_one_user_5583,pnjilatnya mulyono,2025-04-25T14:12:43Z,0,15
debat_tv_one_user_5413,percaya mulyono tukang ngibul bul kibal kibul hujan batu hr mlm,2025-04-25T14:12:19Z,0,15
debat_tv_one_user_5596,sungguh memalukan ijasah mulyono bodong,2025-04-25T14:07:31Z,0,15
debat_tv_one_user_5599,polisi hakim jaksa engak menghukum mulyono kerna udah makan amlopnya mulyono,2025-04-25T14:06:56Z,0,15
debat_tv_one_user_5667,mulyono presidennya parcok percaya,2025-04-25T13:36:29Z,1,15
debat_tv_one_user_5601,haddeh mulyono mulyono,2025-04-25T13:32:05Z,1,15
debat_tv_one_user_5715,jokowidodo mulyono samsul silpsetre dkk mania nya aji mumpung tdk kali okayy,2025-04-25T13:20:05Z,0,15
debat_tv_one_user_5775,woi jokowidodo mulyono samsul sipetre mania nya dkk aji mumpung tdk kali okayy,2025-04-25T12:51:00Z,1,15
debat_tv_one_user_5777,mulyono penuh kepalsuan,2025-04-25T12:49:40Z,0,15
debat_tv_one_user_5779,bicara pasukan bodrex mulyono emang kudu menurunkan frekuensi,2025-04-25T12:49:04Z,0,15
debat_tv_one_user_5783,menduga srategi senyap penjilat mulyono berusaha matimatian untk fufufafa presiden,2025-04-25T12:47:36Z,1,15
debat_tv_one_user_5831,sang pencetus kebohongan publik sang maestro mulyono,2025-04-25T12:28:49Z,1,15
debat_tv_one_user_5787,si andi pake nanya kasmujo pembimbing skripsi dosen pembimbing akademik tonton aja ndi video bualan nya si mulyono cerita ttg pembuatan skripsi om roy lupa donk om video cerita mulyono si mul ngomong skripsi menceritakan ttg galaknya kasmujo kasmujo diakui mulyono pembimbing skripsi nya fix,2025-04-25T12:21:12Z,2,15
debat_tv_one_user_5864,alhamdulillah ilc semoga tdk kekang kayak zamanya mulyono,2025-04-25T12:04:30Z,68,15
debat_tv_one_user_5867,penjilat mulyono plongga plonggo,2025-04-25T12:04:07Z,2,15
debat_tv_one_user_5876,liat komenan aja aja mendukung mas roy lu silfester cma didukung ternak mulyono yg pling persen yg komen,2025-04-25T11:46:51Z,0,15
debat_tv_one_user_5927,si felters bilang gaduh yg membalikkan fakta sebenar nya yg bikin gaduh tuh mulyono si felters nyuruh mulyono bawa lihatin poto ijazahnya aja takut jambret kabur kena angin ngiliat ijazahnya jokowi knp ga suruh jokowi ngelihatin koplok haus uang si felters,2025-04-25T11:35:35Z,0,15
debat_tv_one_user_5951,silvester dungu bantahanya nyambung esensi pembicaraan dikasih sm mulyono penjilatnya mulyono,2025-04-25T11:20:47Z,1,15
debat_tv_one_user_5935,kacau berpikir yg bela mulyono,2025-04-25T11:20:13Z,1,15
debat_tv_one_user_5955,mulyono mbulet,2025-04-25T11:18:41Z,2,15
debat_tv_one_user_6037,sebelah kiri kasak kusuk kasih kode haha mulyono,2025-04-25T10:27:46Z,0,15
debat_tv_one_user_6133,ijazah jokowi palsu autang jokowi jd presiden tanggung mulyono ternak nya rakyat indonesia,2025-04-25T09:11:07Z,0,15
debat_tv_one_user_6192,drs ir sumitro soemitro tanggal kosong dosen pembimbing beda ngeles coba pemuja mulyono,2025-04-25T08:30:30Z,1,15
debat_tv_one_user_6243,ternak si fir au solo ijazah palsu plangaplongo gak data ilmiah tangkap si mulyono adili si fir au solo,2025-04-25T07:56:44Z,2,15
debat_tv_one_user_6280,mulyono nyimak nonton,2025-04-25T07:42:25Z,0,15
debat_tv_one_user_6282,ternak mulyono hadir,2025-04-25T07:42:02Z,0,15
debat_tv_one_user_6302,ternak mulyono habis habis membela kaidah ilmu,2025-04-25T07:35:13Z,1,15
debat_tv_one_user_6310,buzzer dekan rektor ugm biadab rekayasa manipulasi ijasah pasang badan penjilat cebokin mlyono jabatan menteri komisaris ternak mulyono buzzer,2025-04-25T07:19:26Z,0,15
debat_tv_one_user_6336,ayo alumnus ugm bersuara kebenaran menyelamatkan ugm permainan politik mulyono marwah ugm terjaga,2025-04-25T07:13:13Z,0,15
debat_tv_one_user_6345,memalukan belain mulyono intelek kosong pembelaanmu,2025-04-25T07:07:20Z,0,15
debat_tv_one_user_6356,kebanggaan alumni ugm mulyono gak bangga,2025-04-25T07:04:34Z,16,15
debat_tv_one_user_6381,ternak mulyono ngotot banget ya bukti uda jelasssss,2025-04-25T06:56:12Z,0,15
debat_tv_one_user_6389,ternak mulyono bingung ngejalsin bohongan,2025-04-25T06:52:57Z,0,15
debat_tv_one_user_6449,pembela ijazah mulyono bawa data jgn omon omon,2025-04-25T06:29:28Z,0,15
debat_tv_one_user_6457,pemuja mulyono kosong yg ngomong keras salah,2025-04-25T06:27:06Z,0,15
debat_tv_one_user_6496,ribet banget mulyono tunjukin ijasah aja susah bikin gaduh,2025-04-25T06:11:06Z,0,15
debat_tv_one_user_6550,pengacara mulyono stres tu olol gila,2025-04-25T05:52:06Z,0,15
debat_tv_one_user_5979,ilc g tayang tv one mulyono,2025-04-25T05:41:23Z,0,15
debat_tv_one_user_6471,seret mulyono biadap,2025-04-25T05:36:24Z,0,15
debat_tv_one_user_6600,adili jokowi mulyono polisi gak tidur,2025-04-25T05:32:21Z,0,15
debat_tv_one_user_6603,jubir mulyono malu,2025-04-25T05:31:15Z,0,15
debat_tv_one_user_6639,rakyat masuk kaum bodoh mulyono,2025-04-25T05:01:43Z,18,15
debat_tv_one_user_6666,bener negara biang kerok nya mulyono cs prabowo aja takut doi,2025-04-25T04:41:37Z,0,15
debat_tv_one_user_6686,diam nya prabowo tau sikap presiden yg mulyono meresahkan bikin gaduh masyarakat tp presiden diam campur menyelesaikan,2025-04-25T04:26:13Z,0,15
debat_tv_one_user_6634,ribu triliyun ijazah mulyono palsu,2025-04-25T04:22:40Z,0,15
debat_tv_one_user_6704,usut tuntas tangkap pidanakan adili si mulyono alias jokowi sontoloyo cs,2025-04-25T04:16:25Z,0,15
debat_tv_one_user_6717,kocak nih mulyono open house iya gaduh ijazah ga nunjukin,2025-04-25T04:08:27Z,0,15
debat_tv_one_user_6743,pendukung mulyono sma dungu nya panutan ngomong asik slh,2025-04-25T03:56:38Z,0,15
debat_tv_one_user_6381,yg suka bohong a mulyono b mukidi c mulyo ono d muki idi,2025-04-25T03:48:45Z,1,15
debat_tv_one_user_6763,masyarakat jg dalang keruwetan kegaduhan bangsa cm mahluk aja ga mulyono,2025-04-25T03:44:14Z,0,15
debat_tv_one_user_6778,andi curhat pokoknya bela mulyono dijamin b o,2025-04-25T03:38:27Z,0,15
debat_tv_one_user_6778,cari foto dumatno wisuda foto wisuda mulyono kayaknya,2025-04-25T03:26:07Z,0,15
debat_tv_one_user_6785,lucu ngelihat ternak mulyono,2025-04-25T03:20:07Z,0,15
debat_tv_one_user_6838,ayo rakyat indonesia dukung roy suryo mulyono izasah nya palsu,2025-04-25T02:55:11Z,0,15
debat_tv_one_user_6866,ugm universitas genk mulyono,2025-04-25T02:45:13Z,0,15
debat_tv_one_user_6867,cobalah ilc panggil paksa ugm hadir utk klau ternak mulyono yg bucara bnyak ngawurnya,2025-04-25T02:45:05Z,0,15
debat_tv_one_user_6876,piaraan mulyono kemana yg tetep kukuh kedunguannya,2025-04-25T02:39:53Z,0,15
debat_tv_one_user_6912,sil plaster tukang plaster keburukan mulyono,2025-04-25T02:19:08Z,0,15
debat_tv_one_user_6932,ngotok nembla mulyono malu anak istri,2025-04-25T02:10:38Z,0,15
debat_tv_one_user_6949,politik mulyono licin banget,2025-04-25T02:03:11Z,0,15
debat_tv_one_user_6982,heran lihat yg pendukung si mulyono otak narasinya kosooong,2025-04-25T01:39:51Z,1,15
debat_tv_one_user_6996,gunanya laporkan melapor partai nya si mulyono,2025-04-25T01:31:51Z,0,15
debat_tv_one_user_7011,kalo ijasahnya menguap orang masuk bui kepung rumah mulyono penjuru,2025-04-25T01:23:23Z,0,15
debat_tv_one_user_7053,ternak mulyono munafik silvester tukang bersipat lidah narasi,2025-04-25T01:03:03Z,0,15
debat_tv_one_user_7149,mulyono sentuh anaknya berkuasa bro,2025-04-25T00:09:30Z,0,15
debat_tv_one_user_7168,bukti sdah si sangkal sam ternaknya mulyono woi ternak tinggal kau bilang tuanmu mulyono tunjukin ijazah aslinya publik selesai yg gaduh tuanmu mulyono penjilatnya,2025-04-24T23:58:42Z,0,15
debat_tv_one_user_7198,ayo alumni ugm speak up and stand up for your almamater mohon maaf gara segelintir oknum pembela mulyono ugm berubah universitas gundik mulyono,2025-04-24T23:45:58Z,0,15
debat_tv_one_user_7205,ketahuan yg ternak mulyono,2025-04-24T23:44:07Z,0,15
debat_tv_one_user_7209,mulyono kewajiban tunjukkan ijazah ngawur kewajiban,2025-04-24T23:39:51Z,0,15
debat_tv_one_user_7210,ijazahnya mulyono palsu dilapor diduga memalsukan data ijazah nya,2025-04-24T23:39:06Z,0,15
debat_tv_one_user_7217,siapkan penjara pulau terpencil mulyono membantunya memalsukan ijazah sma drs ir pandang bulu isi kabinet si mulyono,2025-04-24T23:33:56Z,1,15
debat_tv_one_user_7227,mulyono hasil teknologi kayu gepeto boneka pinokio,2025-04-24T23:28:47Z,0,15
debat_tv_one_user_7231,narsum pembela mulyono yg berkaca mata dungu,2025-04-24T23:26:28Z,0,15
debat_tv_one_user_7140,ugm usut geng mulyono,2025-04-24T23:18:00Z,0,15
debat_tv_one_user_7270,degil kali si mulyono,2025-04-24T23:02:54Z,0,15
debat_tv_one_user_6967,ugm universitas geng mulyono,2025-04-24T22:24:12Z,0,15
debat_tv_one_user_7333,gk point gk perdebatan yg mendidik bermanfaat dangkal nalar berfikir logika ternak mulyono,2025-04-24T22:18:41Z,0,15
debat_tv_one_user_7334,undang silfester preman bayaran nasi bungkus mulyono,2025-04-24T22:18:28Z,4,15
debat_tv_one_user_7337,ternake mulyono jongos plonga plongo,2025-04-24T22:11:54Z,0,15
debat_tv_one_user_7457,mantan presiden disegani dihormati rakyat si mulyono bahan bulian lawakan masarakat,2025-04-24T20:41:03Z,0,15
debat_tv_one_user_7466,perbedaan pendapat pro kontra dimasyarakat wajar perbedaan diartikan penghasutan mulyono tim hukumnya mulyono tim hukumnya penjara penghasutannya polisi artikan melapor bareskrim mempenjarakan ilmu pengetahuan ahli seandainya polisi mempejarakan ilmu pengetahuan polisi terhasut tindakan melawan hukum,2025-04-24T20:28:22Z,0,15
debat_tv_one_user_7478,mulyono bener ya cepet kasih unjuk,2025-04-24T20:18:45Z,0,15
debat_tv_one_user_7478,asli ya mulyono,2025-04-24T20:18:09Z,0,15
debat_tv_one_user_7478,tunjukan aslinya gak negarawan banget si mulyono nih,2025-04-24T20:09:42Z,0,15
debat_tv_one_user_7502,komen ak lihat muak ngeliat kelakuan mulyono,2025-04-24T19:49:09Z,0,15
debat_tv_one_user_7518,mulyono emang daya hancurnya luarbiasa,2025-04-24T19:37:42Z,0,15
debat_tv_one_user_7560,abraham lincoln belajar mukidi alias mulyono dikonoha membohongi jutaan rakyat,2025-04-24T19:08:47Z,0,15
debat_tv_one_user_7532,mulyono stresss banget ijazah asli salahnya itukan mulyono asli buatnya percetakan yg sdh modern yg sangka printer tinta sih ketingalan jaman brooooo,2025-04-24T18:58:52Z,0,15
debat_tv_one_user_7564,polisi bwh sigit dn hakim pilihan mulyono jokowi ttp dilindungi hnya rakyatlah yg tegangan kejujuran,2025-04-24T18:51:48Z,0,15
debat_tv_one_user_7620,ternak mulyono coba tolong cebong cebong ngumpul,2025-04-24T18:40:00Z,0,15
debat_tv_one_user_7621,kelompok roy suryo beda kelas kelompok ternak mulyono,2025-04-24T18:38:48Z,0,15
debat_tv_one_user_7611,yah pendudukung mulyono hukimnya aman jdinya parah indonesia kbnyakan pda jdi penjilat,2025-04-24T18:34:44Z,1,15
debat_tv_one_user_7641,jijik lihat penjilat dn cebokernya mulyono lucu hiburan ketololan,2025-04-24T18:29:20Z,1,15
debat_tv_one_user_7646,mulyono kang bokis malu,2025-04-24T18:27:35Z,1,15
debat_tv_one_user_7677,ri sejahtera rukun damai jebloskan mulyono jongos piaraannya penjara,2025-04-24T18:15:01Z,1,15
debat_tv_one_user_7683,lihat silvester inget ali ngabalin wkwkwk tayangkan tv biar anak cucu rakyat indonesia mengenang ternak mulyono bebegig,2025-04-24T18:12:02Z,1,15
debat_tv_one_user_7699,kalo simple mulyono tunjukan mengadukan simple kebohongan rumit berbelit,2025-04-24T18:07:06Z,1,15
debat_tv_one_user_7708,ternak mulyono kebanyakan gaya ilmu akademiknya kosong sok jago kaya hebat pakar,2025-04-24T18:04:03Z,1,15
debat_tv_one_user_7590,aja ijasah liat kasi otakku gk seruet mulyono,2025-04-24T17:59:43Z,1,15
debat_tv_one_user_7739,sylvester penjilat mulyono,2025-04-24T17:54:15Z,1,15
