author,text,published_at,like_count,cluster
Ijasah_ditunjukan_user_32473,ugm mengeluarkn ijazah pertnyaannya ugm memalsukan ijazah klo ugm skripsinya tdk hak ugm ijazah,2025-04-30T14:15:32Z,0,1
Ijasah_ditunjukan_user_32487,seandainya palsu ijazah nya tdk mgkn dr terbuka dipublik tp mgkn direnovasi ijazah asli,2025-04-30T14:15:11Z,0,1
Ijasah_ditunjukan_user_32520,sepak terjang jokowi dunia politik penuh dgn misteri dgn ijazah palsu yg jokowi dr roy suryo dr rismon dr tifa menanggapi postingan kader psi dian sandi utama membuktikan memverivikasi keaslian ijazah postingan kader psi dgn ugm sbg sumber penerbit ijazah jokowi babak pembuktian pengadilan yg terbukti ijazah palsu jokowi ugm mempertanggung jawabkan perbuatannya sdh menghianati rakyat,2025-04-30T14:14:16Z,0,1
Ijasah_ditunjukan_user_1922,kalo fair adil roy panci cs jg hrs meneliti ijazah prseiden wakil presiden ri jokowi ijazah sby ijazah budiono ijazah prabowo ijazah megawati ijazah habibie kalo ijazah tri sutrisno yusuf kalla mumpung orang nya hidup,2025-04-30T14:13:16Z,0,1
Ijasah_ditunjukan_user_32567,meneliti ijazah izin pemilik ijazah tsb,2025-04-30T14:13:09Z,0,1
Ijasah_ditunjukan_user_32569,ijazah nya jokowi tunjukan publik sengaja photo ijazah pake roy panci tinggal adu pengadilan tunjukan publik sumber photo ijazah yg pake roy panci meng klaim sumber dr jokowi,2025-04-30T14:13:05Z,0,1
Ijasah_ditunjukan_user_32612,tunjukan sidang peradilan pembuktian sah ijazah palsu asli perlihatkan resmi publik yg terkait,2025-04-30T14:12:17Z,0,1
Ijasah_ditunjukan_user_32646,roy suryo curiga jokowi sdh menunjukan ijazah aslinya sy sbg rakyat menanggapi bhw org sinting ga otak waras yg ga percaya institusi yg mengeluarkan ijazah sdh kebenaran ijazah jokowi aneh ga warasnya lbh percaya pd hasil copy ijazah yg beredar yg tdk tau usulnya tdk dipertanggung jawabkan,2025-04-30T14:11:24Z,1,1
Ijasah_ditunjukan_user_32725,roy suryo rismon sianipar menganggap ahli forensik digital indonesia lupa ahli forensik digital sertifikat menjalankan keahliannya joeshua sinambela abimanyu rubby alamsyah ahli digital forensik bersertifikat rismon s sertifikatnya pernyataan ahli joushua abimnayu mengakui kebanaran hasil penelitian rismon s terkait ijazah palsu jokowi penelitian ijazah asli cacat hasil editan medsos berulang ulang ahli koment buah pikiran melabelkan asli ijazah jokowi ugm kuliah disitu data data akdemik pribadi jikowi proses perkuliahan rismon s roy suryo angkuh pendapatnya imajinasinya lupa publik parah ahli profesional menilai mematahkan argumen penelitian gotot mempertahankan argumen malu takut eksistensi keahlian ditelanjangi dipengadilan ahli forensik digital ahli bersertifikat diakui publik nasional internasional satunya tujuan mempertahankan argumen dianggap pendukungnya mempengaruhi publik orang orang benci jokowi keluarganya,2025-04-30T14:09:17Z,0,1
Ijasah_ditunjukan_user_32756,penguasa ijazah mah gampang banget masyarakat beli ijazah aja,2025-04-30T14:08:28Z,0,1
Ijasah_ditunjukan_user_32767,masyarakat indonesia ulah enak aja kau roy keliatan kau udah blunder pokoknya tahan terbukti bersalah roy gemar membawa ilmiah ilmiah uji ijazah tangan jokowi menganalisis ijazah aslinya asli aslinya tangan jokowi lucu roy langsung panci liat kau,2025-04-30T14:08:08Z,0,1
Ijasah_ditunjukan_user_32768,tunjukan ijazah aslinya gak bacot rakyat indonesia berhenti jokowi tunjukan ijazah aslinya tunjukan tunjukan ijazah asli jokowi kau bohobgi kau tipu rakyatmu jahat kau raja tipu raja bohong janji borong alat pertanian produk anak bangsa bohong janji borong mobil esemka nipu janji sertifikat tanah rakyat rempang tanah dirampok janji gak hutang negeri hutang menggunung,2025-04-30T14:08:07Z,0,1
Ijasah_ditunjukan_user_32797,ijazah asli dusta berbohong jgnkan ijazah ugm ijazah sd smp sma gk allah membukakan aibmu pendusta,2025-04-30T14:07:24Z,0,1
Ijasah_ditunjukan_user_32808,jokowi punyak hak tdak ijazah roy,2025-04-30T14:07:06Z,0,1
Ijasah_ditunjukan_user_32811,konstitusi diubah skripsi ijazah,2025-04-30T14:07:03Z,1,1
Ijasah_ditunjukan_user_32819,lulusan ugm asli,2025-04-30T14:06:58Z,0,1
Ijasah_ditunjukan_user_32827,kerjaan pakar tematika ijazah d urus,2025-04-30T14:06:49Z,0,1
Ijasah_ditunjukan_user_32835,ijazah jokowi asli yg karna pembenci nya trutama roy,2025-04-30T14:06:34Z,0,1
Ijasah_ditunjukan_user_32849,gedabrus pengacaranya jokowi sepatutnya org otak sehat silahkan tunjukan ijazah jokowi yg asli tunjukan ijazah yg kluarkan dekan pengacara preman mngluarkan parcok menutup kebohongannya,2025-04-30T14:06:10Z,0,1
Ijasah_ditunjukan_user_24407,roy suryo ijazah jokowi palsu ugm ijazah jokowi asli ugm nya palsu polisi ijazah jokowi asli polisinya palsu hakim ijazah jokowi asli hakimnya palsu satunya asli roy suryo maling panci menyangkalnya,2025-04-30T14:05:51Z,0,1
Ijasah_ditunjukan_user_32871,manusia roy kawan otak sungguh percaya asli kecuali ijazah jokowi terbitkan barulah asliiiii,2025-04-30T14:05:45Z,0,1
Ijasah_ditunjukan_user_32872,ijazah sbg syarat pejabat publik bos jd cek forensik,2025-04-30T14:05:40Z,0,1
Ijasah_ditunjukan_user_32890,pembenci jokowi tdk ijazah jokowi asli krena yg mreka ijzah palsu,2025-04-30T14:05:07Z,0,1
Ijasah_ditunjukan_user_32956,jokowi ijazah asli tinggal nunjukan repot,2025-04-30T14:03:27Z,0,1
Ijasah_ditunjukan_user_32769,jokowi tdk fer tunjukkan sj ijazah asli sud selesai joko yg bikin n ribut klo tertutup ad kesan ad something,2025-04-30T14:02:40Z,0,1
Ijasah_ditunjukan_user_33000,akhirx ijazah joko selesai pamer,2025-04-30T14:02:28Z,0,1
Ijasah_ditunjukan_user_33005,lulus foto wisuda ijazah diterima rektor,2025-04-30T14:02:19Z,0,1
Ijasah_ditunjukan_user_33007,inti kisruh sederhana ijazah jokowi diuji asli pidanakan menuduh palsu jokowi dipidana sederhana simpel,2025-04-30T14:02:18Z,0,1
Ijasah_ditunjukan_user_33019,emang kalo dilaporkan getol banget pingin ijazah asli ya ditunggu hukum sudh berjalan indonesia menunggu asli yg palsu,2025-04-30T14:02:09Z,0,1
Ijasah_ditunjukan_user_33057,smua ijazah si joko pesanan smua,2025-04-30T14:01:12Z,0,1
Ijasah_ditunjukan_user_33084,gk asli,2025-04-30T14:00:33Z,0,1
Ijasah_ditunjukan_user_33099,tujuan utama roy suryo gerombolannya asli palsu ijazah jkw ijazah terbukti asli merta pembenci jkw berhenti cari² skenario adl skenario yg direncanakan utk menjatuhkan pengaruh jkw sadar jkw ditakuti asing gmn utk menjatuhkan jkw scr politis pengaruhnya dr rakyat yg mencintai nya,2025-04-30T14:00:11Z,0,1
Ijasah_ditunjukan_user_33106,mohon maaf terlepas orang yg gak kuliah beli ijazah ijazah nya terbitkan kampus data orang tsb forlap dikti ijazah asli palsu seriustanya,2025-04-30T14:00:03Z,0,1
Ijasah_ditunjukan_user_33165,ijazah jokowi asli diadili ijazah jokowi palsu penghianat bangsa,2025-04-30T13:58:55Z,0,1
Ijasah_ditunjukan_user_32925,prasktisnya skrg skripsi krn sdh dibutkikan keasliannya ijazah mrk msh cari selah pelapor mbuktikna keaslian ijazah tsb ngawur hrs skripsi yg tertulis tesis,2025-04-30T13:58:13Z,0,1
Ijasah_ditunjukan_user_33213,orang yg bodoh yg percaya jokowi ijazah asli blm nya,2025-04-30T13:57:49Z,0,1
Ijasah_ditunjukan_user_33240,kasihan joko widodo pensiun ramaikan berita ijazah palsu sih maunya mempermasalahkan ijazah joko widodo ga kerja kali ya,2025-04-30T13:57:13Z,0,1
Ijasah_ditunjukan_user_33255,kalo asli perlihatkan rakyat bodohpun keluarnya ijazah,2025-04-30T13:56:58Z,1,1
Ijasah_ditunjukan_user_33268,aslian stnk samsat aslian ijazah jokowi ugm roy ijazah palsu fotonya foto pk jokowi trus ngapain pk jokowi bikin ijazah yh tempelin foto orang lucu royy,2025-04-30T13:56:45Z,0,1
Ijasah_ditunjukan_user_33289,untungnya menunjukan ijazah asli publik pebenci percaya,2025-04-30T13:56:20Z,0,1
Ijasah_ditunjukan_user_1922,knapa ijazah jokowi yg d korek permasalahkan gmana dgn ijazah presiden ri,2025-04-30T13:56:11Z,0,1
Ijasah_ditunjukan_user_33301,nunjukin ijazah partai coklat,2025-04-30T13:56:08Z,0,1
Ijasah_ditunjukan_user_33312,lanjutkan mundur terbuka terang benderang asli palsu ijazah nya berbelit belit,2025-04-30T13:56:00Z,0,1
Ijasah_ditunjukan_user_32967,tunjukan ijazah publik uji asliannya live,2025-04-30T13:54:20Z,0,1
Ijasah_ditunjukan_user_33400,jokowi kegaduhan sengaja menunda ijazah menunda korban perangkap orang delik pengujar kebencian kejahatan jokowi menunda menunjukan ijazah nya publik proses hukum sederhana membuatnya rumit gaduh menundanya,2025-04-30T13:53:45Z,0,1
Ijasah_ditunjukan_user_33417,ijazah palsu nasional bentuk team khusus melibatkan ahli audit forensik lembar ijazah joko widodo,2025-04-30T13:53:28Z,0,1
Ijasah_ditunjukan_user_33439,pd suryo lihat ijazah aslinya,2025-04-30T13:52:58Z,0,1
Ijasah_ditunjukan_user_33521,gak coyo ijazah ugm nya asli kuliah meragukan,2025-04-30T13:51:01Z,0,1
Ijasah_ditunjukan_user_33548,ijazah skrip kau teman kau ugm mencurigakan roy cobak tunjukkan skripsi ijazah mu,2025-04-30T13:50:32Z,0,1
Ijasah_ditunjukan_user_33550,ijazah sekripsi data mahasiswa ya ijazah ganti uang,2025-04-30T13:50:23Z,0,1
Ijasah_ditunjukan_user_33551,pendapa sy ijazah jokowi ugm yg mengeluarkan seharus nya ijazah jokowi aja yg uji teman nya terima ijazah wajip uji mas roii kejar uang m mbak,2025-04-30T13:50:21Z,0,1
Ijasah_ditunjukan_user_33558,baus klo ngelaporin jdi ketauan ijazah a,2025-04-30T13:50:15Z,0,1
Ijasah_ditunjukan_user_33565,mantap maju bang roy surya kawan kawan rakyat cerdas mendukungmu bongkar usut tuntas ijazah palsu jokowi faktanya ugm jurusan tehnologi kayu fakultas kehutanan jokowi ijazah asli nama ugm hancur alumninya malu bongkar ijazah palsu jokowi,2025-04-30T13:50:07Z,0,1
Ijasah_ditunjukan_user_33142,konstitusi negara aja dirubah bikin ijazah cetek jokowi,2025-04-30T13:49:57Z,0,1
Ijasah_ditunjukan_user_33667,jikowi tunjukkan ijazah aslinya melaporkan penyebar ijazah palsunya menimbulkan kegaduhan,2025-04-30T13:48:05Z,0,1
Ijasah_ditunjukan_user_33702,hahahahhahaa yg sekolah sd smp sma kuliah yg keluarkan ijazah udah instansi yg wewenang mengeluarkan ijazah trus teman kuliah ugm sndr mengeluarkan statmen keaslian ijazah lantas manusia goblok ngeyel,2025-04-30T13:47:19Z,0,1
Ijasah_ditunjukan_user_33732,kalo ugm ga skripsi ya ga ijazah s kalo univ wiraswasta ga skripsi dapet ijazah s yg duit,2025-04-30T13:46:31Z,0,1
Ijasah_ditunjukan_user_33771,ijaxah jokowi sita du periksa ilmiah digital forensik uji karbon singapura independen ijazah sma lulusan smpp ijazah ugm skripsi berkas lengkap kuliah ugm,2025-04-30T13:45:38Z,0,1
Ijasah_ditunjukan_user_33776,ayo jokowi tunjukin izinkan tim forensik pembuktian keaslian ijazah biar semuany asli palsu,2025-04-30T13:45:33Z,0,1
Ijasah_ditunjukan_user_33783,ijazah jokowi asli org tdk suka opini roy suryo menerima akibat mulut sifat yg jahat,2025-04-30T13:45:23Z,0,1
Ijasah_ditunjukan_user_33800,roy suryo blh cengar cengir skrg tunggu sbntr lg bpk bikin fitnah bs dipidana lu yg ngungkit menyebarluaskan media ijazah jokowi palsu sdh ugm dll tp ngotot jokowi menunjukan ijazah emangnya lu wewenang lu,2025-04-30T13:44:48Z,0,1
Ijasah_ditunjukan_user_33868,negara maju ijazah udah ga kemampuan,2025-04-30T13:43:14Z,0,1
Ijasah_ditunjukan_user_33892,berita ijazah negara maju indonesiaku msh bahas curiga ijazah msh curiga an goreng pakar suruh turun bahas ijazah masyarakat menonton ngopi negri formosa,2025-04-30T13:42:28Z,0,1
Ijasah_ditunjukan_user_33894,asli ijazah jokowi,2025-04-30T13:42:27Z,0,1
Ijasah_ditunjukan_user_33902,logika nya warga yg sekolah lulus ijazah foto ijazah berkacamata membagongkan mulyono,2025-04-30T13:42:18Z,1,1
Ijasah_ditunjukan_user_33929,keabsahan ijazah nya asli kejanggalan yg diungkap ijazah kejanggalan yg diuji dibuktikan keabsahannya,2025-04-30T13:41:53Z,0,1
Ijasah_ditunjukan_user_33958,ijazah asli joko wi tunjukkan kefublik suruh jokowi yg nya biar rakyat percaya it u ijazah murni editan alias palsu menunggu kepastian nya jgn berita gk,2025-04-30T13:41:32Z,0,1
Ijasah_ditunjukan_user_33308,stlh ditunjukkn hrs uji n verifikasi smoga ijazah jokowi lulus uji,2025-04-30T13:41:21Z,0,1
Ijasah_ditunjukan_user_32909,jelaaaaassss ijazah jokowi palsu nggak aturan memperbolehkan foto ijazah pakai kacamata wis jelasss foto orangnya ijazah jokowi orang gila,2025-04-30T13:40:41Z,0,1
Ijasah_ditunjukan_user_34026,ijazah jokowi adili gus nur bambang tri ijazah,2025-04-30T13:40:00Z,0,1
Ijasah_ditunjukan_user_34043,bingung ko repot negri urusan jokowi ijazah kasih unjuk aja k masyarakat hub aja teman seangkatan klo bukti ya d tutup ijazah,2025-04-30T13:39:28Z,0,1
Ijasah_ditunjukan_user_34082,kebenaran keadilan ditegakkan nkri ijazah asli dibawa aph aph wajib menyita barang bukti ijazah materi berkaitan keaslian disamping laporan tpumat diterima aph polri diproses laporan,2025-04-30T13:38:39Z,0,1
Ijasah_ditunjukan_user_34090,roy suryo cari kambing hitam menghindar menuduh ijazah jokowi palsu dgn sumber data yg tdk,2025-04-30T13:38:24Z,0,1
Ijasah_ditunjukan_user_34127,dugaan ijazah asli tunjukkan dianggap palsu,2025-04-30T13:37:53Z,0,1
Ijasah_ditunjukan_user_33741,ijazah p jokowi asli,2025-04-30T13:37:45Z,0,1
Ijasah_ditunjukan_user_34146,jokowi pengadilan bawa ijazah asli lihat hakim trs cek forensik keadilan,2025-04-30T13:37:31Z,0,1
Ijasah_ditunjukan_user_34152,ijazah asli selesai zaman orang membuktikan asli palsu,2025-04-30T13:37:25Z,0,1
Ijasah_ditunjukan_user_34172,ijazah d ributin knpa skrang d ributin pas jd walikota knapa pd diam rs mabuk kecubung koruptor tuh d ributin pejabat yg koruptor tuh d ributin laki laki kau sur ijazah kau ributin gak untungnya masyrakat asli palsu bodo masyarakat butuh kerja makan butuh ijazah,2025-04-30T13:37:04Z,0,1
Ijasah_ditunjukan_user_34203,ijazah asli dokumen pendukung ugm ijazah p jokowi dibandingkan disandingkan ijazah teman angkatan fakultas ijazah angkatan fakultas biodata gak ruwet,2025-04-30T13:36:35Z,0,1
Ijasah_ditunjukan_user_34216,rs membuktikan ijazah yg asli yg dipegang jokowi kalo gak pake bajj orange,2025-04-30T13:36:21Z,0,1
Ijasah_ditunjukan_user_34217,pagar laut ijazah palsu yg berkaitan negeri pemilik ijazah yg psn psn proyek pemagaran laut pemilik ijazah jg terindikasi peoyek psn,2025-04-30T13:36:18Z,0,1
Ijasah_ditunjukan_user_34249,roy sryo knp tdk prcaya ugm skripsi ijazah bp jokowi asli roy ngeyel tdk percaya ugm mari tunggu persidangan dbt kusir dgn roy sryo buang mubazir,2025-04-30T13:35:35Z,0,1
Ijasah_ditunjukan_user_34251,ayo tunjukkan ijazah aslinya menuding palsu mendukungmu jokowi,2025-04-30T13:35:34Z,3,1
Ijasah_ditunjukan_user_34276,ijazah oligarki dinasty,2025-04-30T13:35:01Z,0,1
Ijasah_ditunjukan_user_34277,klu ijazah nya asli knp jokowi hrs melibatkan preman bangga klu mang ijazah asli ugm,2025-04-30T13:35:00Z,0,1
Ijasah_ditunjukan_user_34295,ijazah p jokowi asli roy suryo gerombolanya tdk percaya krn hatinya tertutup kebencian yg td ujungya,2025-04-30T13:34:40Z,0,1
Ijasah_ditunjukan_user_34327,ora levellllll tunjukkan ijazah,2025-04-30T13:34:08Z,0,1
Ijasah_ditunjukan_user_34360,ijazah aspal,2025-04-30T13:33:25Z,0,1
Ijasah_ditunjukan_user_34436,ijazah nya uji digital forensik yg roy suryo pd foto ijazah yg sosmed,2025-04-30T13:32:00Z,0,1
Ijasah_ditunjukan_user_34437,pakar telematika ngurusi ijazah kocak aja percaya kocak,2025-04-30T13:31:59Z,1,1
Ijasah_ditunjukan_user_34450,mengeluarkan ijazah jokowi kampus ugm trus gugat terbukti palsu tuntut mengeluarkan ijazah ijazah nya asli roy suryo wajib boxing byon combat,2025-04-30T13:31:45Z,0,1
Ijasah_ditunjukan_user_33190,dipegang jokowi asli dipegang roy suryo cs palsu pintu masuk memalsukan menyebarkan ijazah palsunya masuk katagory pemalsuan dokumen penyebaranya,2025-04-30T13:31:42Z,0,1
Ijasah_ditunjukan_user_33878,indonesia emang byk oknum pejabat ijazah beli asli tp beliii si yg ngg bs d aturr dg duit x lndonesiaku sediiihh,2025-04-30T13:31:21Z,0,1
Ijasah_ditunjukan_user_34492,ijazah tenang ijazah pesan mahu asli palsu tinggal pesan,2025-04-30T13:31:05Z,0,1
Ijasah_ditunjukan_user_34562,ugm mengakui ijazah jokowi asli ugm ijazah jokowi asli rektor wakil rektor ugm bedakan mengakui dng maju mas roy rismon tifa kurnia bg eggi sudjana rakyat mendukung,2025-04-30T13:29:58Z,19,1
Ijasah_ditunjukan_user_512,ijazah jiplakan bikin sesuai kebutuhan,2025-04-30T13:29:52Z,0,1
Ijasah_ditunjukan_user_34572,dibuktikan keaslian ijazah jokowi masyarakat menunggu ijazah nya keep and clear terlanjur viral,2025-04-30T13:29:45Z,0,1
Ijasah_ditunjukan_user_34546,meragukan ijazah rs ugm,2025-04-30T13:28:54Z,0,1
Ijasah_ditunjukan_user_34669,ugm keterangan ijazah jokowi asli pernyataan ugm level trust publik dibanding jokowi yg bicara roy suryo menafikkan,2025-04-30T13:28:02Z,3,1
Ijasah_ditunjukan_user_34683,kau mentri kau ijazah asli kau dasar oblis,2025-04-30T13:27:48Z,0,1
Ijasah_ditunjukan_user_34690,laporkan jokowi rektor ugm yg menyebarkan foto kopi ijazah karna sengaja menyembunyikan kebenaran membiarkan rakyat ricuh keaslian ijazah,2025-04-30T13:27:38Z,0,1
Ijasah_ditunjukan_user_34734,apapun dr langkah p jokowi beliau terjebak posisi yg salah klo ijazah asli aan berkut knp skrang knp bliau membiarkan berlarut dst,2025-04-30T13:26:54Z,0,1
Ijasah_ditunjukan_user_34740,biarlah rakyat menyaksikan menilai ijazahnya ijazah perintah hakim sidang pembuktian ijazah ijazahnya palsu,2025-04-30T13:26:50Z,1,1
Ijasah_ditunjukan_user_34781,yg bambang tri sugik nur dihukum ijazah palsu dihukum pasal ite ujaran kebencian ijazah jokowi tunjukkan nya dihukum ijazah palsu yg tuduhkan ijazah aslinya yg ijazah tunjukkan palsu tidaknya,2025-04-30T13:26:15Z,0,1
Ijasah_ditunjukan_user_34817,klo dr ijazah palsu yg membawa korban bb tri gus nur yg menunjukan ijazah jkw pengadilan klo asli bb tri bersedia tembak kepalanya,2025-04-30T13:25:43Z,0,1
Ijasah_ditunjukan_user_34673,habis ijazah gibran ntar cucunya jokowi turunan,2025-04-30T13:25:25Z,0,1
Ijasah_ditunjukan_user_34860,simple tunjukkan ijazah asli didepan pers kegaduhan,2025-04-30T13:25:10Z,0,1
Ijasah_ditunjukan_user_34862,hai roy suryo sblum ugm tggl april udah men justice ijazah jokowi palsu gk bawa ugm gk muter bacotmu,2025-04-30T13:25:09Z,0,1
Ijasah_ditunjukan_user_34894,masyarakat ijazah rois panci sarjana telematika q tau ijazah nya ding,2025-04-30T13:24:43Z,0,1
Ijasah_ditunjukan_user_34911,mukidi nunjukkan ijazah palsunya gorong asli dgn bayar bayar bayar,2025-04-30T13:24:31Z,0,1
Ijasah_ditunjukan_user_34798,knpa mbuuuleeet tinggal mnunjukan ijazah asli susahnya,2025-04-30T13:24:30Z,0,1
Ijasah_ditunjukan_user_34918,jokowi tunjukkan ijazah penyidik semoga ijazah asli,2025-04-30T13:24:25Z,1,1
Ijasah_ditunjukan_user_34931,ugm jokowi gak ijazah asli berkomentar biar ahli netizen an berpolemik,2025-04-30T13:24:13Z,1,1
Ijasah_ditunjukan_user_34938,mamang mantan presiden jakowi negarawan tunjukan ijazah asli ugmnya publik kewartawan selesai ijazah jakowi palsu sdh membohongi juta rakyat indonesia,2025-04-30T13:24:02Z,0,1
Ijasah_ditunjukan_user_34955,masyarakat udh ijazah jokowi asli,2025-04-30T13:23:41Z,0,1
Ijasah_ditunjukan_user_34958,sumber daya ijazah hasilnya asli pribadi ijazahnya palsu lihat aja nampak bependidikan jokowi dengar bahasa inggris,2025-04-30T13:23:34Z,0,1
Ijasah_ditunjukan_user_34974,yg pd bambang tri gus nur ya ijazah palsu tp dipenjara dg dalil hadir sidang gak nunjukin ijazah yg asli,2025-04-30T13:23:13Z,0,1
Ijasah_ditunjukan_user_34986,ijazah sih mah karna sakit hati wkwkwk,2025-04-30T13:22:59Z,0,1
Ijasah_ditunjukan_user_34988,mendalilkan membuktikan ijazah mulyono palsu orang menuduh ijazah jokowi palsu membuktikan dimana dimana salahnya ijazah aslinya dibuktikan membawa aslinya seumpama asli,2025-04-30T13:22:56Z,0,1
Ijasah_ditunjukan_user_35003,seandaynya yg ijazah nya tp nggak tp yg nggak ijazah justur arti ijazah bang roy haaaaaahaaaaaaaa lucu roy suryo aneh aneh isi jawabanya manusia merdeka pk jokowi gelar pk roy nggak gelar gelarnya cuman ocehan,2025-04-30T13:22:45Z,0,1
Ijasah_ditunjukan_user_35007,calon ketua rt jakarta wajib lulus perlihatkan ijazah sma asli sederajat asli dipilih ketua rt,2025-04-30T13:22:39Z,0,1
Ijasah_ditunjukan_user_35024,sayembara m loh yg membongkar keaslian ijazah jokowi,2025-04-30T13:22:16Z,0,1
Ijasah_ditunjukan_user_35107,lolololo ijazah persidangan permintaan hakim berubah ijazah diserahkan kepolisian utk diteliti plin plan banget lucu kepolisian membutuhkan dikasih ijazah nggak rekayasa,2025-04-30T13:20:48Z,0,1
Ijasah_ditunjukan_user_35109,ijazah asli tolong penjarakan roy biar gk ad,2025-04-30T13:20:46Z,83,1
Ijasah_ditunjukan_user_35115,ijazah aslinya biar mencar cari celah lari kenyataan tinggal perlihatkan selesai mental memalukan,2025-04-30T13:20:38Z,0,1
Ijasah_ditunjukan_user_35164,lingkungan tetangga ku kawan kawan percaya ijazah jokowi palsu asu,2025-04-30T13:19:43Z,0,1
Ijasah_ditunjukan_user_35236,ilmiah kepala lo roy kau yg gaduh dasar ember mulut kau yg kau uji poto ijazah ijazah aslinya bpk jokowidodo dn bpk jokowi nunjukin ijazah gromboln ndak,2025-04-30T13:18:43Z,0,1
Ijasah_ditunjukan_user_35283,ijazah asli diuji forensik ahli menyimpan,2025-04-30T13:18:08Z,0,1
Ijasah_ditunjukan_user_35291,jokowi melapor ijazah asli bedanya ijazah publik melapor nilai jokowi negarawan sejati keras kepala pendendam berbangsa bernegara menambah lawan musuh merangkul ceritanya kekuatan oposisi terkonsolidasi pemilu,2025-04-30T13:17:59Z,0,1
Ijasah_ditunjukan_user_35327,sma pakai kacamata ijazah sma aja foto ga pakai kacamata selesaikan s kimia foto ijazah ga pake kaca mata keaslian dipaksakan,2025-04-30T13:17:19Z,0,1
Ijasah_ditunjukan_user_34249,ugm bilang ijazah bp jokowi asli knp roy sryo tdk percaya ugm,2025-04-30T13:17:13Z,0,1
Ijasah_ditunjukan_user_35368,aneh orang nuduh ijazah palsu jokowi lihat asli jokowi kecuali jokowi tunjukkan ijazahnya ditemukan indikasi kepalsuan klarifikasi almamater ijazah palsu penjarakan penyebar fitnah data pribadi ijazah si panci ngaku ahli it paham bahayanya data pribadi tersebar ijin pemilik data,2025-04-30T13:16:44Z,0,1
Ijasah_ditunjukan_user_35395,lucu kl ijazah knp bgni tinggal kasih jokowi bijak kl bgt,2025-04-30T13:16:16Z,0,1
Ijasah_ditunjukan_user_35419,sdh kadung malu biar ijazah asli dianggap palsu berkepanjangan kebencian membutakan hati nurani memantikan akal waras,2025-04-30T13:15:50Z,20,1
Ijasah_ditunjukan_user_34547,disandingkan ijazah awa jokowi dgn copyan ijazah jokowi diawa dr roy suryo asli,2025-04-30T13:15:34Z,0,1
Ijasah_ditunjukan_user_35436,maju roy suryo rismon tifa yg berani membongkar kepalsuan negeri klo jkw buktikan klo asli ijazah tdk gaduh klo ijazah palsu diselidiki yg terlibat jkw ugm kpu knp lolos verifikasi,2025-04-30T13:15:27Z,0,1
Ijasah_ditunjukan_user_35456,pa jokowi ijazahnya asli olah tenggang ijazah aspal,2025-04-30T13:15:10Z,0,1
Ijasah_ditunjukan_user_35459,stnk asli yg tau samsat ijazah asli yg tau ugm roy suryo,2025-04-30T13:15:08Z,90,1
Ijasah_ditunjukan_user_35507,bawa map coklat ukuran a ijazah ugm asli kayaknya gak muat,2025-04-30T13:14:17Z,0,1
Ijasah_ditunjukan_user_35555,hati cermati ijazah asli proses terbitnya palsu good buka,2025-04-30T13:13:34Z,0,1
Ijasah_ditunjukan_user_35610,jokowi ijazahnya kepolisian asli kepolisian yg menerima tau ijazah jokowi asli palsu,2025-04-30T13:12:42Z,0,1
Ijasah_ditunjukan_user_35622,muka muka panik ternakan abah sengaja kaga lihatin biar mati penasaran gara gara ijazah next abis ijazah nnti cari tau buku nikah jokowi biar puas cari,2025-04-30T13:12:28Z,0,1
Ijasah_ditunjukan_user_35646,jokowi tunjukkan ijazah kepengadilan ahli forensik fotonya sdh aneh masak foto ijazah s sma foto nikah,2025-04-30T13:12:07Z,0,1
Ijasah_ditunjukan_user_35708,dibandingkan foto ijazah joko ditampilkan kader psi ijazah asli,2025-04-30T13:10:54Z,0,1
Ijasah_ditunjukan_user_35717,yg diuji digital forensik rismon foto ijazah yg medsos yg asli dipegang jokowi alangkah baiknya bilan publik ijazah p jokowi palsu,2025-04-30T13:10:43Z,0,1
Ijasah_ditunjukan_user_35723,ijazah politik jing roy,2025-04-30T13:10:40Z,0,1
Ijasah_ditunjukan_user_35735,dikhawatirkan ijazah yg dipertontonkan psidan skripsi ugm palsu utk menjebak,2025-04-30T13:10:22Z,0,1
Ijasah_ditunjukan_user_35743,sdh salahnya jokowi dgn pake pengacara kalo ijazah nya tdk pake pengacara yg pake biaya lihatkan ijazah yg asli clear,2025-04-30T13:10:13Z,0,1
Ijasah_ditunjukan_user_35750,wkwkwk pengacara koplak slalu argumen yg ugm sdh ijazah mulyono asli sederhana knp panik klo org yg menguji keaslian ijazah hello,2025-04-30T13:10:04Z,0,1
Ijasah_ditunjukan_user_35756,kalo jkw jujur keaslian ijazah iya berani lapor yg berkoar,2025-04-30T13:10:00Z,0,1
Ijasah_ditunjukan_user_35859,indonesia ngurusin ijazah palsu yg gunanya kemajuan bangsa negara udah berlomba bikin mobil canggih pesawat canggih ngurusin ijazah,2025-04-30T13:08:26Z,0,1
Ijasah_ditunjukan_user_35860,hak si roy ngotot liat ijazah jokowi ijazah milik pribadi,2025-04-30T13:08:26Z,0,1
Ijasah_ditunjukan_user_35686,ijazah asli ngelaporin yg menganggap mencemarkan nama baiknya,2025-04-30T13:08:15Z,0,1
Ijasah_ditunjukan_user_35886,nggak sabar fakta ijazah jokowi,2025-04-30T13:08:09Z,0,1
Ijasah_ditunjukan_user_35893,cengengas cengenges pegang ijazah jokowi blm bilang asli palsu kau teliti bikinan orang iseng,2025-04-30T13:08:04Z,0,1
Ijasah_ditunjukan_user_35907,ijazah asli tpi miliknya karna poto yg beda,2025-04-30T13:07:49Z,0,1
Ijasah_ditunjukan_user_35970,ijazah jokowi asli jokowi sengaja negara gaduh,2025-04-30T13:06:48Z,0,1
Ijasah_ditunjukan_user_36000,gimana roy ngatur ngatur ugm meributkan ijazah serasa ijazah ugm liwat gitu ijazah kelulusan siswa ugm,2025-04-30T13:06:24Z,9,1
Ijasah_ditunjukan_user_36059,klo ijazah asli tinggal uji ilmiah biar kegaduhan ijazah selesai,2025-04-30T13:05:26Z,0,1
Ijasah_ditunjukan_user_36064,wkwkwkwkwkwk kpu ugm membuktikan ijazah jokowi asli ngotot aja palsu,2025-04-30T13:05:21Z,0,1
Ijasah_ditunjukan_user_36072,kl sy tinggal tunjukan ijazah spya perdebatan souzon,2025-04-30T13:05:12Z,0,1
Ijasah_ditunjukan_user_36094,kalo ijazah nya asli tinggal tunjukin aja publik kanapa bikin ribet,2025-04-30T13:04:54Z,0,1
Ijasah_ditunjukan_user_36182,yg diuji roi suryo bkn ijazah asli foto ijazah internet emangnya roi suryo menguji kewenangannya yg disandang,2025-04-30T13:03:18Z,0,1
