author,text,published_at,like_count,cluster
debat_tv_one_user_12408,dr mukanya si mulyono udah penuh dusta yg ditutupi,2025-04-24T04:55:29Z,0,15
debat_tv_one_user_12410,pencebok mulyono sebenanrya tau curiga keasliannya terlanjur menjilat menikmati mulyono mengabaikan mata tuhan jam ga brenti,2025-04-24T04:55:08Z,0,15
debat_tv_one_user_12415,mulyono takut terbongkar kebohongannya klo terbongkar kebohongannya anak keturunannya malu,2025-04-24T04:54:43Z,0,15
debat_tv_one_user_12444,mulyono oh mulyono mobil smk mul,2025-04-24T04:52:10Z,1,15
debat_tv_one_user_12474,ugm universitas geng mulyono,2025-04-24T04:49:12Z,0,15
debat_tv_one_user_12497,yg gaduh mulyono brooo,2025-04-24T04:46:35Z,0,15
debat_tv_one_user_12498,adili mulyono,2025-04-24T04:46:27Z,0,15
debat_tv_one_user_12511,yaudah anggap aja mulyono lulus kampus ruko,2025-04-24T04:45:15Z,0,15
debat_tv_one_user_12152,keliatan kualitas ternak mulyono ampun menjilat mendungukan didepan publik spt asli putus urat malu,2025-04-24T04:39:14Z,2,15
debat_tv_one_user_12579,andi loyalis buta belain si mulyono,2025-04-24T04:37:21Z,1,15
debat_tv_one_user_12598,sylvester ama andi ternak mulyono sdh buta mata buta hati disuruh cebokin mulyono aja njilati mulyono mati,2025-04-24T04:35:54Z,0,15
debat_tv_one_user_12602,bang karni undang mulyono cari yg pintar dikit bang karni,2025-04-24T04:35:34Z,0,15
debat_tv_one_user_12609,heran manusia malunya mulyono fufufafa penghianat perusak demokrasi indonesia,2025-04-24T04:34:41Z,0,15
debat_tv_one_user_12680,mulyono fufufafa paman yg mk msk bui,2025-04-24T04:27:38Z,0,15
debat_tv_one_user_12718,syarat pendukung mulyono gong mute goblol ngeyel muka tebal,2025-04-24T04:25:07Z,0,15
debat_tv_one_user_12788,ugm universitas geng mulyono,2025-04-24T04:19:07Z,0,15
debat_tv_one_user_12839,mulyono d negarawan pembohong tkang ngibul berdoa semoga terbukti ijazah mulyono palsu,2025-04-24T04:14:28Z,13,15
debat_tv_one_user_12892,penjarakan mulyono penjilat nya,2025-04-24T04:09:20Z,0,15
debat_tv_one_user_12907,univ geng mulyono,2025-04-24T04:08:24Z,0,15
debat_tv_one_user_12928,mulyono perusak tatanan hukum,2025-04-24T04:05:59Z,0,15
debat_tv_one_user_13016,tangkap periksa tu mulyono manusia sok kebal hukum allah semoga membuktikan asli tdknya ahli khusus,2025-04-24T03:58:14Z,0,15
debat_tv_one_user_12299,universitas geng mulyono memalukan pemufakatan jahat,2025-04-24T03:57:24Z,0,15
debat_tv_one_user_13044,silpester kocak ternak mulyono,2025-04-24T03:55:42Z,0,15
debat_tv_one_user_13066,keselamatan kebahagiaan keberanian keempat orang dilaporkan sijokowi mulyono dodo manusia gorong terkutuk,2025-04-24T03:53:48Z,0,15
debat_tv_one_user_13087,s skripsi s tesis s desertasi s manipulasi esemka mulyono,2025-04-24T03:52:36Z,0,15
debat_tv_one_user_12905,uda kkn aja ngapainla mati an membela mulyono utang uda bejibun,2025-04-24T03:51:29Z,0,15
debat_tv_one_user_13101,orang mulyono jabatan mati bela sesembannya,2025-04-24T03:51:22Z,0,15
debat_tv_one_user_13133,pembelaan ternak mulyono pakanin ya ama mulyono,2025-04-24T03:49:16Z,0,15
debat_tv_one_user_13150,hrn ma bull dog mulyono mati an bla mulyono,2025-04-24T03:47:16Z,0,15
debat_tv_one_user_13184,mulyono dipenjara karna bikin gaduh bikin ribut rakyat,2025-04-24T03:44:30Z,0,15
debat_tv_one_user_324,bang sianipar gak diundang om ternak mulyono dipanggil,2025-04-24T03:44:30Z,0,15
debat_tv_one_user_13200,ternak mulyono dungu,2025-04-24T03:43:38Z,0,15
debat_tv_one_user_13214,kalo seandainya mulyono lulusan ugm buang duit bayar pengacara tinggal tunjukkan aja selesai mulyono suka bikin rakyat gaduh,2025-04-24T03:42:34Z,0,15
debat_tv_one_user_13231,silvester lo ternak mulyono nyari jabatan,2025-04-24T03:41:09Z,0,15
debat_tv_one_user_13258,ternak mulyono muncul whoy buzzer anjeng,2025-04-24T03:38:43Z,0,15
debat_tv_one_user_13277,ternak mulyono sampe segitunya nyebokin mulyono,2025-04-24T03:37:26Z,0,15
debat_tv_one_user_13344,proses pngadilan siarkan live terbuka hati hakim pesanan titipan penguasa mantan rezim mulyono,2025-04-24T03:32:26Z,0,15
debat_tv_one_user_13353,silvester brazzers jokowi ternak mulyono perosak demokrasi bikin gaduh tinggal tunjukkan ijasah asli nya gitu aja repot,2025-04-24T03:31:21Z,0,15
debat_tv_one_user_12912,paparan roy adakan dukung mulyono,2025-04-24T03:29:58Z,0,15
debat_tv_one_user_13394,tangkap aja mulyono jijik liat nya,2025-04-24T03:27:43Z,1,15
debat_tv_one_user_13122,bener mulyono klo bener knp in tinggal kasih liat klo bener diem serang netizen roy suryo dkk mulyono knp takut,2025-04-24T03:25:56Z,0,15
debat_tv_one_user_13411,dokter mulyono,2025-04-24T03:25:41Z,0,15
debat_tv_one_user_13307,andi somplak yg ngacak acak mulyono roy dkk yg berjuang menegakan kebenaran,2025-04-24T03:24:45Z,0,15
debat_tv_one_user_13437,rakyat muak dgn kebohongan mulyono antek nya,2025-04-24T03:23:38Z,0,15
debat_tv_one_user_13441,parah ugm ternak mulyono astaghfirullah,2025-04-24T03:23:19Z,0,15
debat_tv_one_user_13501,tolong konfrontir jg pdi p sbg partai pengusung mulyono,2025-04-24T03:18:28Z,0,15
debat_tv_one_user_13511,buzzer mulyono dongok btul kuliah cari ijazah tpi ga da ilmunya tunjukin aja nying ijazahnya kolornya,2025-04-24T03:17:34Z,0,15
debat_tv_one_user_13521,thn mulyono dark age bngsa indonesia,2025-04-24T03:17:03Z,0,15
debat_tv_one_user_13533,mulyono hrs kesatria ijasah skripsi kkn transkrip nilai asli tunjukan rakyat pegadilan,2025-04-24T03:16:22Z,1,15
debat_tv_one_user_13610,mulyono menaui tanam,2025-04-24T03:10:24Z,12,15
debat_tv_one_user_13523,si manusia silver ternak mulyono tukang cebok byk omon doang tangkap tukang tipu,2025-04-24T03:06:57Z,0,15
debat_tv_one_user_13672,program ilc favorit sayang terhenti periode mulyono alhamdulillah nonton youtube,2025-04-24T03:04:47Z,0,15
debat_tv_one_user_13655,teu ngarti keneh wae c koplok teh dasar ternak mulyono,2025-04-24T02:55:47Z,0,15
debat_tv_one_user_13070,ternak mulyono panik gelagapan ketar ketir was was ndableg gebleg mbudeg micek emang ra ono utusan mulyono pencebokke seng luweh cerdas,2025-04-24T02:55:08Z,0,15
debat_tv_one_user_13785,ternak mulyono argumennya menggebu bela kebohongan ciri penjilat pengkhianat bangsa,2025-04-24T02:54:28Z,1,15
debat_tv_one_user_13788,manusia hebat bikin gatuh jokowi ata mulyono,2025-04-24T02:54:06Z,0,15
debat_tv_one_user_13791,kalo urusan ijazah mulyono pengadilan dpt d pastikan mulyono menang mutlak krn aparat jaksa wowo sdh d beli mulyono paman gibran aman cth keadilan yg d bayar olh mulyono d backing polri,2025-04-24T02:53:37Z,0,15
debat_tv_one_user_13835,lucu kubu mulyono wkwkwk institusi ugm sdg diterpa cobaan,2025-04-24T02:49:04Z,0,15
debat_tv_one_user_13893,hahahah mulyono kuat malu,2025-04-24T02:42:48Z,1,15
debat_tv_one_user_13903,lulusan ruko aja lulus nya mulyono nembak ijasah nggak nyambung,2025-04-24T02:42:00Z,0,15
debat_tv_one_user_13938,orang gila pndukung nya mulyono membolak balikn fakta,2025-04-24T02:38:28Z,0,15
debat_tv_one_user_13950,universitas gemoi mulyono,2025-04-24T02:37:33Z,0,15
debat_tv_one_user_13734,keliatannn bgt penjilat mulyono otaknya kosong cm bs berdebat kosong ga ilmu,2025-04-24T02:32:45Z,0,15
debat_tv_one_user_13824,hamba nya mulyono udah panik,2025-04-24T02:31:44Z,0,15
debat_tv_one_user_14029,pendukung mulyono nalarnya gitu ya,2025-04-24T02:28:09Z,0,15
debat_tv_one_user_14040,pengacara mulyono diragukan pembelaannya mengungkap kebenaran yg berhasil kaya sbb kesalahan kebenaran bayarannya gede,2025-04-24T02:26:41Z,0,15
debat_tv_one_user_14064,pimpin o th mulyono nkri hancur,2025-04-24T02:23:47Z,0,15
debat_tv_one_user_13196,ugm universitas geng mulyono universitas gampang memanipulasi memanipulasi ijazah,2025-04-24T02:22:00Z,0,15
debat_tv_one_user_13913,mang bener mulyono dicatat sejarah pemimpin tukang tipu biar alam kubur yg,2025-04-24T02:21:59Z,0,15
debat_tv_one_user_14027,liat ternak mulyono militan bgt membela menjijikan asli,2025-04-24T02:21:52Z,3,15
debat_tv_one_user_14082,ternak mulyono alumni kampus ruko ga level rs,2025-04-24T02:21:12Z,0,15
debat_tv_one_user_10642,yg bertanggung pdi p yg mencalonkan mulyono yg setuju,2025-04-24T02:19:47Z,0,15
debat_tv_one_user_12720,mulyono omon fitnah murahan nunjukin ijazah aslinya publik terbuka gak berani keanehan keganjilan ijazah skripsi mulyono orang dibantah dibuktikan ijazah aslinya publik beraninya main kucing kucingan wartawan difoto mulyono seneng difoto pencitraan sorry ye lulusan ugm bangga ijazah aslinya publik diumpetin mudah sederhana ruwet polemik ijazah palsu pengaruh kekuasaannya memenjarakan orang mempermasalahkan ijazah tahulah lembaga hukum persidangan ijazah aslinya dihadirkan pengadilan menjatuhkan hukuman hukum negeri konoha jungkir,2025-04-24T02:18:40Z,1,15
debat_tv_one_user_14129,lacak rks khs mahasiswa mulyono bongkar mas roy,2025-04-24T02:16:15Z,0,15
debat_tv_one_user_14133,mulyono panik,2025-04-24T02:15:59Z,6,15
debat_tv_one_user_13913,biar tuhan yg mengadili mulyono berbohong presiden buruk mang bener slama th bos,2025-04-24T02:13:09Z,0,15
debat_tv_one_user_14154,ternak mulyono cengar cengir mendengarkan paparan roy,2025-04-24T02:12:36Z,0,15
debat_tv_one_user_14200,mk ajaa acak si mulyono cuman ugm rekam jejak mulyono tukang ngibulllll nkri kena dikibulin sampe periode emang ahli ngibulllll ahli sandiwara si mulyono,2025-04-24T02:05:11Z,0,15
debat_tv_one_user_13452,gak simpati lihat kuasa hukum nya mulyono,2025-04-24T02:02:12Z,0,15
debat_tv_one_user_13150,klupun mulyono palsu emng yng brni proses,2025-04-24T01:54:18Z,0,15
debat_tv_one_user_14260,hidup mulyono,2025-04-24T01:43:34Z,1,15
debat_tv_one_user_14220,ternak mulyono statement tegang nya beraturan,2025-04-24T01:36:30Z,2,15
debat_tv_one_user_14279,ternak mulyono ngomong nya belepotan,2025-04-24T01:32:25Z,0,15
debat_tv_one_user_14279,mulyono menyerah aj,2025-04-24T01:29:27Z,0,15
debat_tv_one_user_14304,karna berbohong kapok percaya mulyono si raja nipu negoro,2025-04-24T01:21:43Z,2,15
debat_tv_one_user_14329,silfester orng tlol modal otot doang manusia penjilat silit mulyono,2025-04-24T01:07:14Z,0,15
Ijasah_ditunjukan_user_157,jaringan koneksi loyalis anak buah mulyono kuat tersebar institusi susah membongkar kejahatan jokowi,2025-05-23T23:41:47Z,0,15
Ijasah_ditunjukan_user_613,ijazah mulyono tdk pernh perlihatkan yg berani ngomong ijazah mulyono palsu jebloskan penjara aneh,2025-05-18T13:17:43Z,0,15
Ijasah_ditunjukan_user_652,ijazah mulyono maling daftar alumni ir mulyono diganti dg nama joko widodo daftar alumni alm ir mulyono hilang solo drs istana ganti ir yg,2025-05-18T05:12:56Z,0,15
Ijasah_ditunjukan_user_731,ternaknya pede memangnya ternak laknatullah lihat ijazahnya mulyono,2025-05-17T06:43:55Z,0,15
Ijasah_ditunjukan_user_857,hancurrrrrr negara mulyono,2025-05-16T01:44:26Z,0,15
Ijasah_ditunjukan_user_953,adili mulyono makzulkan fufufafa,2025-05-15T08:09:43Z,0,15
Ijasah_ditunjukan_user_1527,kerna presiden goblok sedunia tingbal yg asli selesai bohong mulyono,2025-05-12T12:27:07Z,0,15
Ijasah_ditunjukan_user_1969,drs ir jokowi mulyono titel titel bersamaan lucu,2025-05-10T08:43:23Z,0,15
Ijasah_ditunjukan_user_1980,kandangin si mulyono biar gak liar kelayaban gelandangan politik,2025-05-10T07:57:11Z,0,15
Ijasah_ditunjukan_user_2114,mulyono jiwanya kerdil klo orang tinggal tunjukin ajh ijazah punyanya gk ribet selesai jgn bikin gaduh,2025-05-09T22:28:14Z,0,15
Ijasah_ditunjukan_user_2344,awas ternak ternak mulyono pengemis bansos ngamuk,2025-05-09T04:09:21Z,0,15
Ijasah_ditunjukan_user_2369,lapor kasih aja iijaza asli buktikan media naah melaporkan kebalik kliatan bodo mulyono,2025-05-09T02:59:50Z,0,15
Ijasah_ditunjukan_user_2524,iya kuliah jurusan yg mulyono gak ugm jurusan teknik kayu belom nama dosen pembimbing yg gak dlm skripsi yg skripsi milik mulyono,2025-05-08T12:37:41Z,0,15
Ijasah_ditunjukan_user_2925,tunjukan parcok piaraan mulyono,2025-05-07T14:20:28Z,0,15
Ijasah_ditunjukan_user_2958,percaya dr roy suryo cs banding si mulyono biang kerok ruwettttt,2025-05-07T13:55:11Z,0,15
Ijasah_ditunjukan_user_3310,simple jadikan mulyono sensasi alias ruetkan,2025-05-07T06:29:27Z,0,15
Ijasah_ditunjukan_user_3338,ternak mulyono berang ijasahnya dicurigai keadliannya rakyat ya,2025-05-07T05:48:50Z,0,15
Ijasah_ditunjukan_user_3338,ternak mulyono berang ijasahnya dicurigai keadliannya rakyat ya,2025-05-07T05:48:50Z,0,15
Ijasah_ditunjukan_user_3501,simple aja asli mulyono ugm gak orang menggugat gak masayarakat gugat kebohongan nya gak ternak mulyono,2025-05-07T02:01:36Z,0,15
Ijasah_ditunjukan_user_3575,gak sih namanya jokowi mulyono raine beda banget,2025-05-06T22:33:15Z,0,15
Ijasah_ditunjukan_user_3630,pusing mulyono mencari jalan ijazah palsu nya,2025-05-06T18:56:42Z,0,15
Ijasah_ditunjukan_user_3681,termul ternak mulyono lawan ahli dqlam bidang,2025-05-06T16:33:00Z,0,15
Ijasah_ditunjukan_user_3724,mulyono kacau amburadul,2025-05-06T15:15:02Z,0,15
Ijasah_ditunjukan_user_3929,orang nama ijasah asli mulyono suami widya wati iparnya joko meninggal,2025-05-06T10:43:26Z,0,15
Ijasah_ditunjukan_user_3953,mulyono mesti menunjukannya pd publik difoto wartawan jgn berdalih,2025-05-06T10:01:27Z,0,15
Ijasah_ditunjukan_user_3967,lupa megaeati yer seret dlm mengusung mulyono,2025-05-06T09:37:24Z,0,15
Ijasah_ditunjukan_user_3969,uji forensik negri fotonya yg sesuai dgn mulyono kemana kumisnya difoto giginya bagus mulyono giginya ga simetris,2025-05-06T09:36:43Z,0,15
Ijasah_ditunjukan_user_4103,mulyono yg peduli suara rakyat hobi berbohong kalo mmg asli dibuktikan dasar otak,2025-05-06T05:16:36Z,0,15
Ijasah_ditunjukan_user_4346,fakta yg gak terbantahkan mulyono kalo ngomong emng mencla mencle ngibul titel mulyono yg drs jd ir fakta sdh menunjukan yg tdk beres dr mulyono tau pejabat mental nya korup jgn trtipu dgn sikap yg sok lugu sok polos sok bijak,2025-05-05T19:06:36Z,0,15
Ijasah_ditunjukan_user_4466,mulyono memalukan,2025-05-05T15:31:30Z,0,15
Ijasah_ditunjukan_user_5012,mulyono,2025-05-04T20:41:07Z,0,15
Ijasah_ditunjukan_user_5041,warga negara indonesia percaya si mulyono ijazah palsu nya si mulyono ijazah palsu mantan presiden terburuk si tukang ngibul bohong masuk gorong gorong bisanya bikin onar doang negara si mantan presiden ga camkan,2025-05-04T18:42:40Z,0,15
Ijasah_ditunjukan_user_5111,semoga mulyono gagap gugup bayar bayar,2025-05-04T15:58:58Z,0,15
Ijasah_ditunjukan_user_5348,komper sandingkan aja ijazah ugm mulyono jokowi beda ya,2025-05-04T12:08:16Z,0,15
Ijasah_ditunjukan_user_5351,mulyono cari bekingan polda waspadalah,2025-05-04T12:05:25Z,0,15
Ijasah_ditunjukan_user_5490,tuh serendah sependek pemikiran kuasa hukum mulyono semenjak rejim mulyono oyang orang pintar cerdas menyandang gelar bodoh bloon kesannya,2025-05-04T09:02:51Z,0,15
Ijasah_ditunjukan_user_5688,hati mulyono curang cawe sm polisi jaksa kehakiman awasi ngeri kacau rusak negri mulyono jd presiden,2025-05-04T03:54:07Z,0,15
Ijasah_ditunjukan_user_5935,tunjukin polisi aneh mulyono,2025-05-03T19:13:03Z,0,15
Ijasah_ditunjukan_user_6288,roy suryo panggil mulyono skr sopan panggil jokowi wkwkwkwkkkkkk,2025-05-03T12:06:45Z,0,15
Ijasah_ditunjukan_user_6315,kompos tv kurangi nyeponk mulyono karyawan mu kena phk,2025-05-03T11:49:41Z,0,15
Ijasah_ditunjukan_user_6640,bilang simpel banget tinggal yg asli yah gampang selesai dah bubar dinasty mulyono,2025-05-03T07:35:02Z,0,15
Ijasah_ditunjukan_user_6761,mulyono lengser layak diungkap ybs kekuasasn merekayasa hukum,2025-05-03T06:05:57Z,0,15
Ijasah_ditunjukan_user_6972,siarkan tv nasional biar tau ternak y bawa y mulyono persidangan masarakat yg akal sehat lihat,2025-05-03T04:07:21Z,0,15
Ijasah_ditunjukan_user_7417,ternak mulyono gerah lo bacot ngga mulyono kaya kagak tetep aja ngarepin bansos mending kaya yg menghemdaaki pembuktian ngga berulanh bangsa kebohongan kebohongan yg merugikan negara memalukan bangsa dipimpin orang yg ngga kompeten dijulukin pemimpin negara terkorup bangsa yg mengakibatkan keuangan negara ekonomi morat marit akibatnya dibebankan rakyat,2025-05-02T23:31:56Z,0,15
Ijasah_ditunjukan_user_7426,naratornya kompas tv kesan pertanyaannya koq berat sebelah dibayar brp mulyono,2025-05-02T23:28:36Z,0,15
Ijasah_ditunjukan_user_7504,tuyul mulyono udah kenyang makan duit haram,2025-05-02T22:11:32Z,0,15
Ijasah_ditunjukan_user_7618,mulyono cs triknya sdh kebaca tukang ngibul tinggal uji forensic cek carbon menyedihkan liat ugm dikangkangi mulyono si pembohong rekam jejaknya mulyono yg kasih keterangan ga singkron kasmujo sbg pembimbing skripsi mapala ugm dsb buktiin aja dipengadilan dgn scientific kejujuran hakim dipengadilan disiarkan media biar disaksikan rakyat ugm hrs jujur keterangan kalo ga jujur mudah an langsung azab tuhan,2025-05-02T18:52:28Z,0,15
Ijasah_ditunjukan_user_1990,yg diperiksa ijasah asli jokowi polisi itukan sell bekerjasama dgn mulyono,2025-05-02T17:21:11Z,0,15
Ijasah_ditunjukan_user_7767,lihat nasib mulyono paslu,2025-05-02T16:18:27Z,0,15
Ijasah_ditunjukan_user_8152,polisi partai coklatnya mulyono,2025-05-02T13:45:45Z,0,15
Ijasah_ditunjukan_user_8387,polisi yg tunjukkan ijazahnya jokowi gengnya mulyono,2025-05-02T12:40:25Z,0,15
Ijasah_ditunjukan_user_8390,ugm universitas geng mulyono,2025-05-02T12:39:54Z,0,15
Ijasah_ditunjukan_user_8471,gini lho mulyono mengulur mencari membuktikan klo bnr ijazah skrg mulyono berani maju sampe melaporkan yg menuduhnya krna udah ijazah gw percaya mulyono ijazah asli yg kunci kebohongan mulyono bukti fisik ijazah sndiri ijazah teliti ahli forensik kertas ketikan tinta sesuai dgn klo bnr brarti bkn cm asli ijazah nya aja tp asli mulyono emang lulusan ugm tp klo hasil penelitian alhi forensik membuktikan klo ijazah bikin kebohongan dr mulyono yg bs akui ijazah asli yg keluarkan,2025-05-02T12:23:48Z,0,15
Ijasah_ditunjukan_user_8566,sumber nya mulyono berani jujur mengelak tunjukan ijazah giliran sidang kabur ln,2025-05-02T12:00:35Z,0,15
Ijasah_ditunjukan_user_8646,ternak mulyono tai kambing bilang coklat,2025-05-02T11:44:21Z,0,15
Ijasah_ditunjukan_user_8777,halah tontonan aja gak mulyono salahkan,2025-05-02T11:15:04Z,0,15
Ijasah_ditunjukan_user_8861,manusia penjilat penghinat berlomba lomba berlaga membela kejahata si ijasah palsu mulyono bayaran ratusan juta upah si jokodok mulyono,2025-05-02T10:48:15Z,0,15
Ijasah_ditunjukan_user_8885,mulyono mantan presiden yg hidupnya nggak tenang,2025-05-02T10:44:26Z,0,15
Ijasah_ditunjukan_user_9092,ijasah stofmap emang ugm ga modalin covernya mulyono ugm sih,2025-05-02T09:58:53Z,0,15
Ijasah_ditunjukan_user_9164,bersertificate verifikasi ngawur ajah nggak verifikasi uji dasar ajah mulyono ribet,2025-05-02T09:38:20Z,0,15
Ijasah_ditunjukan_user_9191,integrated ugm university of indonesia yg bergengsi bermartabat luntur membela manusia iblis mulyono jokowi nama nya rusak ugm merespon nya polemik ugm melindungi mulyono jokowi tipu daya nya betapa rendahnya nilai ugm membela pendusta mulyono jokowi,2025-05-02T09:32:27Z,0,15
Ijasah_ditunjukan_user_9240,yg menuduh menyuruh orang yg dituduh membuktikan gk suka ama mulyono anak²nya objektif benci membabi buta klo mulyono krn apapun klo terlibat roya panci amin rais eggy kebenarannya valid,2025-05-02T09:17:32Z,0,15
Ijasah_ditunjukan_user_9316,mah permainan mulyono playing victim biar rakyat die korban fitnah hinaan sederhana mangkanya bambang tri pinokio,2025-05-02T08:57:16Z,0,15
Ijasah_ditunjukan_user_9463,mulyono meragukan iq nysaa,2025-05-02T08:26:24Z,0,15
Ijasah_ditunjukan_user_9463,mulyono teerkuak,2025-05-02T08:25:28Z,0,15
Ijasah_ditunjukan_user_9527,mulyono mulyono opo maning,2025-05-02T08:11:38Z,0,15
Ijasah_ditunjukan_user_9713,palsu penjarakan mulyono asli penjarakan roy suryo happy,2025-05-02T07:39:38Z,0,15
Ijasah_ditunjukan_user_9935,mantap mul buktikan namamu mulyono mulyo nooooooo,2025-05-02T07:09:16Z,1,15
Ijasah_ditunjukan_user_10306,ijasah segsja berlarut pagar laut hilang trik licik mulyono anak pki,2025-05-02T06:21:39Z,0,15
Ijasah_ditunjukan_user_10415,kayak gak apal mulyono aja peraturan apapun buatnnya ijazah yg sngat gmpang ingatt si kebal hukum,2025-05-02T06:10:18Z,0,15
Ijasah_ditunjukan_user_10478,hukum mulyono,2025-05-02T06:03:11Z,0,15
Ijasah_ditunjukan_user_11057,mengecek ijazah netral tau hukum indo konstitusi aja dirubah ijazah ayoo comment peliharaan nya si mulyono tau pendapatnya,2025-05-02T04:41:53Z,0,15
Ijasah_ditunjukan_user_11153,feeling ijazah mulyono insyaallah palsu orang sdh profesional bohong,2025-05-02T04:28:47Z,0,15
Ijasah_ditunjukan_user_11180,buktikan cek ijasah nya mulyono,2025-05-02T04:24:33Z,0,15
Ijasah_ditunjukan_user_11448,bikin hidupkan mulyono biar menutupi kelemahan th mimpin negri dg memporak porandakan hukum konstitusi pendidikan tertinggi negri dicabik mulyono kader pdip bro gmna dg mak banteng nya bro,2025-05-02T03:48:15Z,0,15
Ijasah_ditunjukan_user_11718,penasaran persiapan strategi disiapkan mulyono jejak digital gimana,2025-05-02T03:03:23Z,0,15
Ijasah_ditunjukan_user_11741,tunjukin ijazah palsu buku alumni nama joko mulyono goblok bikin berita,2025-05-02T03:00:26Z,0,15
Ijasah_ditunjukan_user_11869,asli palsu keributan mulyono kebohongan kpd rakyat,2025-05-02T02:32:08Z,0,15
Ijasah_ditunjukan_user_11899,ruwet ruwet ruwet gk tuh mulyono gk tau malu,2025-05-02T02:25:10Z,0,15
Ijasah_ditunjukan_user_11900,yg bikin gaduh mulyono klu emang bener ijazah asli ngga tunjukan publik,2025-05-02T02:24:39Z,0,15
Ijasah_ditunjukan_user_12015,mulyono kemarin kabur vietnam,2025-05-02T01:53:59Z,0,15
Ijasah_ditunjukan_user_12375,panik tuuuu mulyono masuk penjara mulyono ya orang pasang badan tu mulyono anak masi wakil presss aduuuh dasar bahlul penjahat si jokowi dodol,2025-05-02T00:30:20Z,0,15
Ijasah_ditunjukan_user_12421,asli mulyono tinggal uji forensik ilmiah teknologi canggih,2025-05-02T00:21:18Z,0,15
Ijasah_ditunjukan_user_12605,coba panggil ahli forensik negeri cek real time publik si mulyono salah penjarakan si mulyono kalo rs salah penjarakan tp lg yg memeriksa indonesia tp independen tp gue si mulyono ijazahnya palsu,2025-05-01T23:36:27Z,0,15
Ijasah_ditunjukan_user_12612,mulyono sih plis kasih tau gw,2025-05-01T23:33:15Z,0,15
Ijasah_ditunjukan_user_12805,gmn percaya skrg si mulyono kasi liat yg kemarin kemana tu ijazah mulyono si penipu,2025-05-01T22:12:41Z,0,15
Ijasah_ditunjukan_user_12822,usut tuntass mulyono,2025-05-01T21:58:21Z,0,15
Ijasah_ditunjukan_user_12823,kegaduhan emang mulyono bang roy mul ijazah yg asli habis berkara,2025-05-01T21:57:59Z,0,15
Ijasah_ditunjukan_user_13034,pendukung mulyono yg sdh bergerak ya preman spt yg sdh muncul tv yg bilang kepalanya yg palsu,2025-05-01T18:32:44Z,0,15
Ijasah_ditunjukan_user_13206,woww ternak mulyono,2025-05-01T17:14:29Z,0,15
Ijasah_ditunjukan_user_13268,independen pembuktiannya mul mulyono mulyono,2025-05-01T16:55:13Z,0,15
Ijasah_ditunjukan_user_13282,tamat la riwayat mu mulyono busukmu terbongkar cepat lambat,2025-05-01T16:47:53Z,1,15
Ijasah_ditunjukan_user_13311,wkwkwkwk jokowi oh jokowi eh salah mulyono oh mulyono gabutmu maksimal ayo keluarkan kekuatanmu jokowi,2025-05-01T16:39:16Z,0,15
Ijasah_ditunjukan_user_13528,kebohongan ditutup dgn kebohongan kepalsuan ditutup dngn kepalsuan mulyono king of ngibul,2025-05-01T15:42:00Z,0,15
Ijasah_ditunjukan_user_13536,klw emang lulusan ugm pinter roy suryo anies ganjar mulyono apo,2025-05-01T15:41:04Z,0,15
Ijasah_ditunjukan_user_13598,mulyono kuliah nya d jurusan orang utan,2025-05-01T15:26:00Z,0,15
Ijasah_ditunjukan_user_13725,cair pengacara mulyono t kantong kiri,2025-05-01T15:05:05Z,0,15
Ijasah_ditunjukan_user_13831,bodoh nya mulyono pengacara koplak,2025-05-01T14:43:41Z,0,15
Ijasah_ditunjukan_user_13936,mulyono the king of liars,2025-05-01T14:26:21Z,0,15
Ijasah_ditunjukan_user_13993,hatii hatii disemua lembaga pwnegak hukum orang mulyono swmuaa angell angell negara sdh dikuasai oligarki cs mulyono,2025-05-01T14:12:59Z,0,15
Ijasah_ditunjukan_user_14134,klan mulyono berkuasa pastikan simul menang dlm esemka bohong,2025-05-01T13:46:41Z,0,15
Ijasah_ditunjukan_user_14177,mayoritas masyarakat percaya kepolisian gampangnya salah panggil aja alumni kehutanan ugm tsb emang bener ga mulyono kuliah disana samakan ijazahnya,2025-05-01T13:38:03Z,0,15
Ijasah_ditunjukan_user_14280,mulyono klo asli ngapain lapor,2025-05-01T13:17:06Z,0,15
Ijasah_ditunjukan_user_14320,smg mulyono msk penjara aamiin,2025-05-01T13:09:59Z,0,15
Ijasah_ditunjukan_user_14399,tangkapp mulyono,2025-05-01T12:58:00Z,0,15
Ijasah_ditunjukan_user_14443,saveugm ugm universitas gundik mulyono,2025-05-01T12:48:58Z,0,15
Ijasah_ditunjukan_user_14481,mulyono bikin gaduh,2025-05-01T12:42:08Z,0,15
Ijasah_ditunjukan_user_14656,kuasa hukum mulyono mas h penggiringan opini ugm kalo tdk ijazah ya jgn berkelit dusta bungkus dgn tipu,2025-05-01T12:09:42Z,0,15
Ijasah_ditunjukan_user_14666,semoga polisi memeriksa ijazah mulyono super jujur ya doakan jujur doakan terbaik bangsa,2025-05-01T12:08:19Z,0,15
Ijasah_ditunjukan_user_14808,om roy nanya pengacara mulyono kknnya dimana,2025-05-01T11:48:03Z,0,15
Ijasah_ditunjukan_user_14821,kompas ternak mulyono,2025-05-01T11:47:01Z,0,15
Ijasah_ditunjukan_user_14988,tunjukin ijazah parcok bukanya institusi tangan kiri cebokin mulyono,2025-05-01T11:20:42Z,0,15
Ijasah_ditunjukan_user_15039,g percaya kalo mulyono ijazah asli heee mn ternak mulyono dtg bela majikan tu,2025-05-01T11:08:58Z,0,15
Ijasah_ditunjukan_user_15041,knp nunjukin ijazah polisi kapolri lwt wa yah pengecut si mulyono tinggal tunjukkin ijazah publik knp ketar ketir klo anak sd bilang mulyono gak tidur nyenyak panik senyum palsu mulyono berubah marah pake batik bukber berkunjung sultan gue org solo udh tau yg si fake old president,2025-05-01T11:08:52Z,0,15
Ijasah_ditunjukan_user_15179,mulyono uji ijazah fufufafa,2025-05-01T10:46:58Z,0,15
Ijasah_ditunjukan_user_15213,tuhan kl percaya mulyono,2025-05-01T10:42:34Z,0,15
Ijasah_ditunjukan_user_15579,ayo mulyono tunjukkan ijazah mu buktikan asliannya,2025-05-01T09:46:40Z,0,15
Ijasah_ditunjukan_user_15647,mulyono hrs curiga krn sejarahnya suka bohong yg gak suka bohong,2025-05-01T09:36:18Z,0,15
Ijasah_ditunjukan_user_15831,knp skrg tunjukkan sblmnya sblm polemik ijasah sifat mulyono buruk skli,2025-05-01T09:06:43Z,0,15
