author,text,published_at,like_count,source,total_sources,total_comments,screening_time_min,source_entropy,cluster
user_53259,mayoritas masyarakat percaya kepolisian gampangnya salah panggil aja alumni kehutanan ugm tsb emang bener ga mulyono kuliah disana samakan ijazahnya,2025-05-01 13:38:03+00:00,0,ijasah_ditunjukan,1,2,9.383333333333333,0.0,1
user_17925,yg utama aja dosen pembimbingnya skripsinya yg tandatangan gitu ye gemoy,2025-05-01 13:36:42+00:00,0,ijasah_ditunjukan,1,1,0.0,0.0,1
user_6433,intinya roy benci marah pecat penjabat menteri aja msh jd mentri roy menciptakan isu,2025-05-01 13:32:43+00:00,0,ijasah_ditunjukan,1,1,0.0,0.0,1
user_53259,tinggal nunjukkin aja ribet dibikinkan ijazah palsu direvisi blunder²nya yono culasnya ga habis²,2025-05-01 13:28:40+00:00,0,ijasah_ditunjukan,1,2,9.383333333333333,0.0,1
user_12157,karna bebas vikna orang memaki orang laporkan enak kali ngomong roy suryo enaknya aja republik bikin ribut aja media,2025-05-01 13:22:13+00:00,0,ijasah_ditunjukan,1,1,0.0,0.0,1
user_1902,nama masyarakat yg roy grup lo aja yg sll membenci sese orang,2025-05-01 13:21:54+00:00,0,ijasah_ditunjukan,1,3,35.583333333333336,0.0,1
user_54330,bp jokowi berbuat negara gangguan orang orang suka indonesia hukum aja klu ljazah asli penjarakan seumur hidup aja pa presiden prabowo abis bp presiden diganggu jd dihukum aja,2025-05-01 13:14:50+00:00,0,ijasah_ditunjukan,1,2,6.0,0.0,1
user_32720,penjarakan aja,2025-05-01 13:13:55+00:00,0,ijasah_ditunjukan,1,1,0.0,0.0,1
user_23679,polisi wartawan hakim aja meragukan,2025-05-01 13:11:34+00:00,0,ijasah_ditunjukan,1,2,5.433333333333334,0.0,1
user_50987,orang yg berbohong hidupnya nyaman tenang kebohongan tutupi kebohongan emang ijazahnya lihatkan pengacaranya aja ngak lihat pengacaranya kenak kibul jugak dok,2025-05-01 12:48:20+00:00,0,ijasah_ditunjukan,1,1,0.0,0.0,1
user_16210,memfitnah aja bebas giliran beliau lapor polisikan pemfitnah biar rakyat yg menilai yaiya rakyat menilai bodoh,2025-05-01 12:44:49+00:00,0,ijasah_ditunjukan,1,1,0.0,0.0,1
user_30414,ngakakk aja liat tingkah si mukidog kang kibul licik culas serakah mbalelo,2025-05-01 12:41:53+00:00,0,ijasah_ditunjukan,1,1,0.0,0.0,1
user_41573,biar diproses hukum namanya adil roy suryo pelajaran hati aja ngerasain hidup dipenjara,2025-05-01 12:40:04+00:00,0,ijasah_ditunjukan,1,1,0.0,0.0,1
user_47949,roysuryo aja gak apal indonesia raya angel,2025-05-01 12:39:33+00:00,0,ijasah_ditunjukan,1,1,0.0,0.0,1
user_44989,menamakan masarakat km orang yg membeci jokowi aja,2025-05-01 12:36:56+00:00,0,ijasah_ditunjukan,1,1,0.0,0.0,1
user_11303,org mikirin ijazah org aja urusin yg utk negara,2025-05-01 12:21:32+00:00,0,ijasah_ditunjukan,1,1,0.0,0.0,1
user_23899,ijasah sampe skr sepele kaya gitu aja sulit ngurusin korupsi angel wis angel negara,2025-05-01 12:14:30+00:00,0,ijasah_ditunjukan,1,1,0.0,0.0,1
user_17015,bertele tele liatin aja terang tetangan ijazahnya kuliah lulusan ugm bahasa inggrisya puarah aneh lulusan ugm,2025-05-01 12:06:52+00:00,0,ijasah_ditunjukan,1,1,0.0,0.0,1
user_608,ampun sepele aja ampe penjarain orang,2025-05-01 12:06:23+00:00,0,ijasah_ditunjukan,2,2,12963.816666666668,0.6931471805599453,1
user_25819,cepat proses bikin kegaduhan aja proses penjarakan yg bersalah,2025-05-01 11:56:53+00:00,0,ijasah_ditunjukan,1,2,3.7666666666666666,0.0,1
user_53889,mas suryo gak pokal sebagi rakyat goblok aja kawan kawan cari psngong aja deruji besi bilang lulusan ugm yg mengotori berak mas manusia macem masyarakat yg maaf ya analisa tani,2025-05-01 11:49:29+00:00,0,ijasah_ditunjukan,2,3,10629.533333333333,0.6365141682948128,1
user_404,aneh jokowi tinggal tunjukin aja dipengadilan polisi korup edan koe memalukan urat malu putussss ya hahaha,2025-05-01 11:41:26+00:00,0,ijasah_ditunjukan,1,1,0.0,0.0,1
user_54591,gini maju negara perkara ijazah aja menarik dibanding ekonomi,2025-05-01 11:34:49+00:00,0,ijasah_ditunjukan,1,1,0.0,0.0,1
user_22191,emang yg sllu nyinyir pitnah aja penjarakan nusa kambangan,2025-05-01 11:34:28+00:00,0,ijasah_ditunjukan,1,2,13.7,0.0,1
user_35924,gk nyambung terima aja jalani proses hukumnya,2025-05-01 11:33:44+00:00,0,ijasah_ditunjukan,1,1,0.0,0.0,1
user_54542,roy ga teriak ga dapet bayaran yg paham aja,2025-05-01 11:30:51+00:00,0,ijasah_ditunjukan,1,1,0.0,0.0,1
user_56093,emang knp kl dilaporin nya emang loba omong laporin aja biar mingkem,2025-05-01 11:25:34+00:00,0,ijasah_ditunjukan,1,2,20.233333333333334,0.0,1
user_36029,berat kalo nama nya ngadilin penguasa udah susun rapih terkoordinir kalo sedikiit aja otak gak orang bersekolah bahasa inggris nya ancur segi pengucapan gak layak ukuran anak smu,2025-05-01 11:25:19+00:00,0,ijasah_ditunjukan,2,2,7160.633333333333,0.6931471805599453,1
user_42079,aja d otak atik mo ngapain orang jd presiden nya jg udahh aduh roy roy lu kunyukkk ga ngaruh palsu asli yg udah jd presiden kali dasar cari muka aja ni orang,2025-05-01 11:25:04+00:00,0,ijasah_ditunjukan,1,1,0.0,0.0,1
user_36315,andaikan diposisi dituduh aja nggak nunjukkin ijazah jokowi,2025-05-01 11:17:41+00:00,0,ijasah_ditunjukan,1,1,0.0,0.0,1
user_3072,bawak aja mahkamah internasional klu indonesia byk interpensi,2025-05-01 11:15:17+00:00,0,ijasah_ditunjukan,1,1,0.0,0.0,1
user_54729,melanggar hukum dihukum gitu aja repot,2025-05-01 11:02:09+00:00,0,ijasah_ditunjukan,1,2,1.7666666666666666,0.0,1
user_12666,dmana yg lpor yg bawa bukti yg terlapor yg bilang palsu klau salah denjara gk sesuap nasi rela fitnah yg aja dpenjara ni sengkuni nusantara knp gk digantung aja,2025-05-01 11:01:25+00:00,0,ijasah_ditunjukan,2,3,214.9,0.6365141682948128,1
user_19397,roy panci ma ibunya aja curiga lgi ma orang,2025-05-01 11:00:53+00:00,3,ijasah_ditunjukan,1,1,0.0,0.0,1
user_8537,mangka otak kebencian cari masyarakat indonesia penjara karna bannyak manusia terhasut dgn jgn kn ibuk anak aja aja wajib ditegor hukum biar jera,2025-05-01 10:59:54+00:00,0,ijasah_ditunjukan,1,1,0.0,0.0,1
user_10141,syukur laporkan aja semangat de jokowi gak perduli penjarakan reseh menyenggol orang diem,2025-05-01 10:55:04+00:00,0,ijasah_ditunjukan,1,2,8.566666666666666,0.0,1
user_54720,pengacaranya jokowi kayak anak tk sih kalo pembela joko mengklarifikasi ijazahnya asli yg asli aja bohong tolol,2025-05-01 10:46:45+00:00,0,ijasah_ditunjukan,1,3,9.516666666666667,0.0,1
user_43532,emang kalo pidanakan ngomong ngalantur aja,2025-05-01 10:39:43+00:00,0,ijasah_ditunjukan,1,1,0.0,0.0,1
user_50756,masukkan bui aja,2025-05-01 10:35:34+00:00,0,ijasah_ditunjukan,1,1,0.0,0.0,1
user_46293,roy roy ruwet awat idup mu koyo mamin rais tunjuin aja djoko pensiunya biar tenang,2025-05-01 10:34:03+00:00,0,ijasah_ditunjukan,1,1,0.0,0.0,1
user_44372,indonesia aja yg pitnah sorg mantan peresiden yg rendahkan kayak ya skit hati karna jadimenteri ujung nya dipecat,2025-05-01 10:30:37+00:00,0,ijasah_ditunjukan,1,1,0.0,0.0,1
user_17366,pdahal udh gak jurusan teknologi kayu dri situ aja udh ketahuan palsu,2025-05-01 10:23:36+00:00,0,ijasah_ditunjukan,1,1,0.0,0.0,1
user_2847,sederhana aja tunjukan sertipikat ijazahnya urusan selesai rakyat,2025-05-01 10:22:31+00:00,0,ijasah_ditunjukan,1,1,0.0,0.0,1
user_6074,sdh roy suryo backingan kuat makannya mukutnya koar trs ditunnjukkan ijazah asli tetep aja percaya pasukan sakit hati merajalela,2025-05-01 10:21:58+00:00,0,ijasah_ditunjukan,1,1,0.0,0.0,1
user_53968,hak orang tau soryo aja sok masarakat dukung jokowi soryo pecondang,2025-05-01 10:20:59+00:00,0,ijasah_ditunjukan,1,1,0.0,0.0,1
user_53091,heboh aja nih negara heran,2025-05-01 10:20:59+00:00,0,ijasah_ditunjukan,1,1,0.0,0.0,1
user_35263,roy suryo ajak lihat langsung polisi tpi polisi aja patut curigai kualitas polisi,2025-05-01 10:20:12+00:00,0,ijasah_ditunjukan,1,1,0.0,0.0,1
user_19977,suryo ahli hasud gitu aja repoi,2025-05-01 10:19:04+00:00,0,ijasah_ditunjukan,1,1,0.0,0.0,1
user_49580,biarkan org spt berkeliaran udah kandangin aja org ugm tdk dipercaya,2025-05-01 10:17:17+00:00,0,ijasah_ditunjukan,1,1,0.0,0.0,1
user_22290,masyarakat yg roy kmu aja yg menggiring opini palsu,2025-05-01 10:11:29+00:00,0,ijasah_ditunjukan,1,1,0.0,0.0,1
user_31523,pemikiran indonesia maju muter maslah aja kpn indonesia majunya,2025-05-01 10:11:07+00:00,1,ijasah_ditunjukan,1,1,0.0,0.0,1
user_38820,berani berbuat berani bertanggung tindak lanjuti aja jokowi jera,2025-05-01 10:09:13+00:00,0,ijasah_ditunjukan,1,1,0.0,0.0,1
user_32007,bawa pengadilan aja biar clear,2025-05-01 10:08:34+00:00,0,ijasah_ditunjukan,2,2,23183.9,0.6931471805599453,1
user_19862,melamar aja sampe babat bebet bobot,2025-05-01 10:05:38+00:00,0,ijasah_ditunjukan,1,1,0.0,0.0,1
user_16107,masyarakat yg tangkap aja rs biar nga rame bikin kisruh aja,2025-05-01 10:02:30+00:00,0,ijasah_ditunjukan,1,1,0.0,0.0,1
user_23068,gak daftar kuliah ujuk² wisuda jg tau² ijazah transkip nilai jg jd wajar aja klo yg ngusik klo asli ngapain takut tunjukin ijazahnya tes kesalianya beres dah kaya senetron panjangnya,2025-05-01 10:00:30+00:00,0,ijasah_ditunjukan,1,1,0.0,0.0,1
user_3300,kau mengaku roy ijqzahnya plk jokowi bilqng pqlau anak smp aja tau kalo orang masuk pabrik wajib ijqah pqkar bodho,2025-05-01 09:59:15+00:00,0,ijasah_ditunjukan,2,11,9707.05,0.6890092384766586,1
user_54003,manfaat roy suryo sih pingin tau aja,2025-05-01 09:57:02+00:00,0,ijasah_ditunjukan,1,1,0.0,0.0,1
user_17157,rasain sembunyi bentuk ku nsekuensix biar sembarang aja ngarang,2025-05-01 09:56:39+00:00,0,ijasah_ditunjukan,1,1,0.0,0.0,1
user_21372,hak mu roy sekelas presiden aja congkel data pribadinya,2025-05-01 09:54:27+00:00,0,ijasah_ditunjukan,1,1,0.0,0.0,1
user_10225,yg yo klpok kmu roy rakyat aja santai injoe,2025-05-01 09:54:11+00:00,0,ijasah_ditunjukan,1,6,12.533333333333333,0.0,1
user_29539,kalo bole aja sesuka hati,2025-05-01 09:47:55+00:00,0,ijasah_ditunjukan,1,1,0.0,0.0,1
user_39187,aja kalo orang dah sakit hati karna dicopot mentri gak percaya puas aja cari selah yg pengalihan,2025-05-01 09:47:41+00:00,0,ijasah_ditunjukan,1,1,0.0,0.0,1
user_8004,ngk klau ijazah ny d lihat kn k kepolisian aja terbuka aja joko,2025-05-01 09:46:29+00:00,0,ijasah_ditunjukan,1,1,0.0,0.0,1
user_30585,dasar gk suka mencari kesalahan moga keadilan masuk penjara aja,2025-05-01 09:42:01+00:00,0,ijasah_ditunjukan,1,1,0.0,0.0,1
user_16413,menang jokowi tangan wkwk wowo aja bwh tangan,2025-05-01 09:41:42+00:00,0,ijasah_ditunjukan,1,1,0.0,0.0,1
user_10554,roy suryo lagak lu kayak org pinter aja klu bpk jokowi terbukti berbuat bangsa indonesia hasilnya dinikmati rakyat roy suryo kontribusimu bangsa bisanya gaduh aja yg dibahas presiden knp usik,2025-05-01 09:40:24+00:00,0,ijasah_ditunjukan,1,1,0.0,0.0,1
user_53021,kalo dipikir bener klo yg ditunjukin sesuai ga kejanggalan ya aman aja klo yg ditunjukin janggal yg bikin orang ragu foto ijazah pake kacamata aja udah janggal nama dosen pembimbing jg yg beda yg ditulis skripsi,2025-05-01 09:39:48+00:00,0,ijasah_ditunjukan,1,1,0.0,0.0,1
user_46865,mulut roy masi aja nyampah,2025-05-01 09:33:19+00:00,0,ijasah_ditunjukan,1,2,2.533333333333333,0.0,1
user_46999,jgn roy suryo w aja paham kejahatan yg lakukan pinokio oknum oknum penegak hukum,2025-05-01 09:24:00+00:00,0,ijasah_ditunjukan,1,1,0.0,0.0,1
user_31928,bawa bawa masyarakat aja masuk bui lo roy,2025-05-01 09:17:02+00:00,0,ijasah_ditunjukan,1,1,0.0,0.0,1
user_44576,jokowi dunguh pengecut kalok emang izaza yg aslih gk tunjukan aja biar gk bikin gaduh bawak jugak poto pk jokowi yg masik sd smp sma yg berpoto bareng teman nya tamat sekolah poto bareng teman kumpul bareng samakan poto izaza yg tamatan ugm gak gitu aja susah banget sih wiwi nyewa peremanlah bajer anehh,2025-05-01 09:16:36+00:00,0,ijasah_ditunjukan,1,1,0.0,0.0,1
user_25411,ala jg polisi penyidik uda suap uang klo ijazah na aslih kocak jokodok klo mang asli pangil aja media liatin beres,2025-05-01 09:16:29+00:00,0,ijasah_ditunjukan,1,1,0.0,0.0,1
user_40252,hukum aja orang suka bikin kehebohan,2025-05-01 09:11:55+00:00,0,ijasah_ditunjukan,1,1,0.0,0.0,1
user_31945,bilang aja lu takut udah dilaporin masuk penjara ga udah berkelit nyari simpati bilang masarakat yg menilai ditunjukin aslinya emang tujuannya pengin njatuhin nama jokowi ngeyel ngeles,2025-05-01 09:08:45+00:00,0,ijasah_ditunjukan,1,1,0.0,0.0,1
user_24716,hati pengacara jokowi bilang roy bentar elu masuk kandang aja ngeles gue ketawain aja,2025-05-01 09:04:28+00:00,0,ijasah_ditunjukan,1,1,0.0,0.0,1
user_46229,walah roi ember grombolan cocot busuk langsung tangkap urusanya jokowi menunjukan ijazah grombolan hewan liar zempong sekop aja,2025-05-01 09:04:17+00:00,0,ijasah_ditunjukan,1,1,0.0,0.0,1
user_22167,sryo ngurus panci aja nggak beres sok pinter lg,2025-05-01 08:57:52+00:00,0,ijasah_ditunjukan,1,1,0.0,0.0,1
user_16012,aja biar kapok,2025-05-01 08:48:15+00:00,0,ijasah_ditunjukan,1,1,0.0,0.0,1
user_35549,mobil esemka aja gk ikn mangkrak lapangan krja jt gk situ aja masyarakat menilai bgmn kerja jkwi thn,2025-05-01 08:46:23+00:00,0,ijasah_ditunjukan,1,1,0.0,0.0,1
user_8987,pendapat cm org yg gk kerjaan aja ngapain ngurusin ijazah org klo ijazah palsu knpa smpe priode ngapain aja kebencian aja,2025-05-01 08:41:45+00:00,0,ijasah_ditunjukan,1,1,0.0,0.0,1
user_26481,rs udah salah aja ngeyel sakit hati ngga habisnya memfitnah orang coba tunjukin ijasahmu asli palsu,2025-05-01 08:41:14+00:00,0,ijasah_ditunjukan,1,1,0.0,0.0,1
user_44295,yaelah negeri berlomba lomba mengembangkan teknologi indonesia masi aja ngurusin ijazah cok,2025-05-01 08:39:19+00:00,0,ijasah_ditunjukan,1,1,0.0,0.0,1
user_27849,nunjukin ijazah aja sampe berlarut sehari kelar,2025-05-01 08:39:18+00:00,0,ijasah_ditunjukan,1,1,0.0,0.0,1
user_20698,suryo kedengjiannya udah akut kebayang org iri dengki suka usilin kehidupan rumah tangga orang panci aja dibawa eks rumah dinasnya tugasnya mentri,2025-05-01 08:37:41+00:00,2,ijasah_ditunjukan,1,2,2.8833333333333333,0.0,1
user_47495,saran aja sih mndingan indonesia bubar aja biar provinsi pulau mnjadi negara muak dngn berita² dngn yg j w berdalih kata² biar masyarakat yg menilai yg dinilai msyakakat dalang nginak rsj,2025-05-01 08:37:40+00:00,0,ijasah_ditunjukan,1,1,0.0,0.0,1
user_21244,congor kuda lagu indonesia raya aja gak hapal bekas napi aja gak kapok,2025-05-01 08:35:14+00:00,0,ijasah_ditunjukan,2,2,5784.383333333333,0.6931471805599453,1
user_1731,uud jokowi rubah paman usman ijazah gampang tinggal nelpon aja masyarakat bayar pajak bayar utang negara president yg ijazahnya normal,2025-05-01 08:34:30+00:00,0,ijasah_ditunjukan,1,1,0.0,0.0,1
user_22805,ditamyakan teman nya seangkatan spt lulusan ipb teman yg gk alumninya ya palsu gitu aja repot pembohong dibela pembohong rakyat ind spt mobil smk investor ikn aneh,2025-05-01 08:33:27+00:00,0,ijasah_ditunjukan,1,1,0.0,0.0,1
user_47285,urusan pribadi suryo jokowi selesaikan ndak melibatkan rakyat indonesia luas rakyat pusing nih abis jual hasil panen beli ferari lambo eh ribut ribut gak d medsos bikin gak mood buka medsos aja,2025-05-01 08:32:17+00:00,0,ijasah_ditunjukan,1,1,0.0,0.0,1
user_11899,hidup orang berprinsip palu kemana bawanya ya palu dianggap paku mukul aja pengennya mudah an aja kepalu,2025-05-01 08:31:22+00:00,0,ijasah_ditunjukan,1,1,0.0,0.0,1
user_37101,maju trs roy rakyar mendukungmu menggampangkan bngt anak sy aja skripnya susah bngt,2025-05-01 08:29:45+00:00,0,ijasah_ditunjukan,1,2,7.216666666666667,0.0,1
user_30723,tggl tunjukan aja ijazan aslinya dr mesti berbelit susahnya masyarakat ragu keaslian ijazahnya,2025-05-01 08:28:00+00:00,0,ijasah_ditunjukan,1,2,10.116666666666667,0.0,1
user_52570,polisi gak berani ngusut prabowo aja gk beraniiii,2025-05-01 08:26:34+00:00,0,ijasah_ditunjukan,1,1,0.0,0.0,1
user_13166,kayak filem aja suka nya nyari kesalahan orang,2025-05-01 08:23:12+00:00,0,ijasah_ditunjukan,1,1,0.0,0.0,1
user_52586,indonesia maju aja onar ijasah oknum yg bikin stetment mengiring benci jokowi bener licik mepecah belah kerukunanan warga,2025-05-01 08:18:08+00:00,0,ijasah_ditunjukan,1,1,0.0,0.0,1
user_17678,kalo mas suryo pengen tau koar lansung aja dang rumah jokoi,2025-05-01 08:18:05+00:00,0,ijasah_ditunjukan,1,5,5.5,0.0,1
user_10948,betultete teteka nene neneka proses aja mencemarkan nama orang,2025-05-01 08:14:02+00:00,0,ijasah_ditunjukan,1,1,0.0,0.0,1
user_51943,nangis aja lo suryo,2025-05-01 08:10:51+00:00,0,ijasah_ditunjukan,2,2,10062.016666666666,0.6931471805599453,1
user_45067,ribet bgt bangkai ditutupin tetep aja bau ginilah kualitas bangsa konoha ga malu,2025-05-01 08:10:28+00:00,0,ijasah_ditunjukan,1,1,0.0,0.0,1
user_4208,semangat aja bang biar cepat clear,2025-05-01 08:06:03+00:00,0,ijasah_ditunjukan,1,1,0.0,0.0,1
user_56645,roy roy kasian sdh pasrah mudah an dipenjara aja,2025-05-01 08:04:39+00:00,0,ijasah_ditunjukan,1,2,433.53333333333336,0.0,1
user_2915,jgn maaf pk jokowi orang pembuat onar tukang fitnah penjarakan aja biar epek jerah,2025-05-01 07:55:05+00:00,0,ijasah_ditunjukan,1,3,16.566666666666666,0.0,1
user_23853,roy lagu indonesia raya aja gak tau,2025-05-01 07:54:16+00:00,0,ijasah_ditunjukan,1,1,0.0,0.0,1
user_10963,suryo aja koropsi ember gayong joko wi bodo,2025-05-01 07:54:07+00:00,0,ijasah_ditunjukan,1,1,0.0,0.0,1
user_45990,yg nyinyir sirik dengki penyebar fitnah pnjara aja sampe botak bejengger,2025-05-01 07:49:23+00:00,0,ijasah_ditunjukan,1,3,4.616666666666666,0.0,1
user_19227,lha mantan napi aja keternagan msh diagung jd pakar totally barisansakit hati mah sampe ttp cari kesalahan,2025-05-01 07:49:06+00:00,0,ijasah_ditunjukan,1,1,0.0,0.0,1
user_10863,bebas mencaci memfitnah aja mas roy,2025-05-01 07:46:57+00:00,0,ijasah_ditunjukan,1,1,0.0,0.0,1
user_21092,usir aja jokowi keluarga indonesia meresahkan,2025-05-01 07:42:22+00:00,0,ijasah_ditunjukan,1,1,0.0,0.0,1
user_31465,psywar aja,2025-05-01 07:36:52+00:00,0,ijasah_ditunjukan,1,1,0.0,0.0,1
user_15214,nunjukin polisi tau polisi oalah joko joko palsu bilang aja yg cari muka nya joko kebal hukum,2025-05-01 07:36:44+00:00,0,ijasah_ditunjukan,1,1,0.0,0.0,1
user_11706,sepak bola pemerintahan merangkak maju aja orang yg suka nyinyir heran,2025-05-01 07:32:59+00:00,0,ijasah_ditunjukan,1,2,9.633333333333333,0.0,1
user_23694,roy roy tunggu aja uji pengadilan,2025-05-01 07:28:07+00:00,0,ijasah_ditunjukan,1,1,0.0,0.0,1
user_11286,gak mslh kyak gini yg negara maju rakyatnya mskmur aja setuju lulusan sma daftar bupati yg rakyatnya enak,2025-05-01 07:26:02+00:00,0,ijasah_ditunjukan,1,1,0.0,0.0,1
user_18431,biarpun ditunjukin jg gak selesai spa roy tu aja dah dilaporkan ngomongnya jokowi rakyat dibekangmu,2025-05-01 07:23:30+00:00,0,ijasah_ditunjukan,1,2,12.45,0.0,1
user_31742,seurgent sih negara udah maju aja,2025-05-01 07:17:51+00:00,0,ijasah_ditunjukan,1,1,0.0,0.0,1
user_27531,bacot penjara aja roy panji busuk biar gak onar,2025-05-01 07:17:35+00:00,0,ijasah_ditunjukan,1,1,0.0,0.0,1
user_37366,aneh izajah emang asli tunjukin aja langsung,2025-05-01 07:14:23+00:00,0,ijasah_ditunjukan,1,2,2913.133333333333,0.0,1
user_52943,penjarain aja seumur hidup doktor kebabalasan sok pinter tp ga pake etika,2025-05-01 07:09:09+00:00,0,ijasah_ditunjukan,1,2,1.3666666666666667,0.0,1
user_27937,roy suryo iku org track redord masuk bui aja bnyk omong sayang kepinteranmu gawe minteri cok,2025-05-01 07:06:15+00:00,0,ijasah_ditunjukan,1,1,0.0,0.0,1
user_12746,loe suruh suruh orang emang jongosmu enak aja suruh suruh,2025-05-01 07:02:43+00:00,0,ijasah_ditunjukan,1,1,0.0,0.0,1
user_30184,motif sakit hati iri dengki dah aja wkwkwk,2025-05-01 07:02:04+00:00,0,ijasah_ditunjukan,1,1,0.0,0.0,1
user_26330,ngurusin aja ga pekerjaan ya negara maju dri jatum peniti nuklir ngurusin aja,2025-05-01 07:02:01+00:00,0,ijasah_ditunjukan,1,1,0.0,0.0,1
user_56494,tinggal tunjukkan ijazahnya gitu aja repot gus dur pengalihan isu krusial korupsi dll,2025-05-01 07:00:56+00:00,0,ijasah_ditunjukan,2,4,23324.866666666665,0.5623351446188083,1
user_27985,aja orang indonesia,2025-05-01 06:58:12+00:00,0,ijasah_ditunjukan,1,1,0.0,0.0,1
user_25525,tunjukin aja ijazah aslinya jok jokowi gausah muter muter mbulet kaya kentut,2025-05-01 06:56:56+00:00,0,ijasah_ditunjukan,1,1,0.0,0.0,1
user_29128,jg bwa masyrakat masyarakat adem ayem ae no komen si suryo aja tu yg pnebar kbencian perpecahan masyarakt,2025-05-01 06:54:36+00:00,0,ijasah_ditunjukan,1,1,0.0,0.0,1
user_18565,biar menjerit penjara bikin kegaduan aja,2025-05-01 06:54:33+00:00,0,ijasah_ditunjukan,1,1,0.0,0.0,1
user_36259,komentar rs kek org gak sekolah dimata hukum kakek kakek nenek nenek aja,2025-05-01 06:53:45+00:00,0,ijasah_ditunjukan,1,1,0.0,0.0,1
user_18302,sukur tunggu aja jeruji besi menantimu,2025-05-01 06:53:38+00:00,0,ijasah_ditunjukan,1,1,0.0,0.0,1
user_56424,gak mbulet lek emang resmi tunjukan publik selesai to fakultas tinggal statment aja emang keluarkan ijazah jokowi muncul bikin kontroversi aja,2025-05-01 06:52:27+00:00,1,ijasah_ditunjukan,1,1,0.0,0.0,1
user_44302,partai merah mencalonkan jd presiden knp pd diem aja klo palsu,2025-05-01 06:48:04+00:00,0,ijasah_ditunjukan,1,1,0.0,0.0,1
user_10552,ya indonesia susah majunya negara bikin alat alat canggih indonesia bertahun aja bahas ijazah trus coba untung nya kepalang tanggung konoha konoha,2025-05-01 06:46:39+00:00,0,ijasah_ditunjukan,1,1,0.0,0.0,1
user_28178,sikat aja pembuktikan pengadilan,2025-05-01 06:41:36+00:00,0,ijasah_ditunjukan,1,1,0.0,0.0,1
user_56287,ntr klo tunjukin aja ttp bilang palsu emng hrus bawa kr ranah hukum tunjukan hukum jln yg bnar,2025-05-01 06:37:17+00:00,0,ijasah_ditunjukan,1,1,0.0,0.0,1
user_35844,roy bodoh kalo disamakan kayak gitu wibawa negara tertawakan negara kayak mainan aja,2025-05-01 06:37:02+00:00,0,ijasah_ditunjukan,1,1,0.0,0.0,1
user_1019,sdh tangkap aja jgn ksh ampun tangkap gerombolan suryo,2025-05-01 06:36:40+00:00,0,ijasah_ditunjukan,1,1,0.0,0.0,1
user_39153,sy ga mengerti mksud arah rsyo dgn ijazah jkw utk bkin sensasi aja,2025-05-01 06:36:19+00:00,0,ijasah_ditunjukan,1,1,0.0,0.0,1
user_32393,debat konyol negara kocak politisinya kocak udah plis jajah aja,2025-05-01 06:35:27+00:00,0,ijasah_ditunjukan,1,1,0.0,0.0,1
user_34560,presiden aja hujat tuhan allah tobat om suryo,2025-05-01 06:34:46+00:00,0,ijasah_ditunjukan,1,2,0.5,0.0,1
user_34560,presiden aja hujat tuhan allah tobat om suryo,2025-05-01 06:34:16+00:00,0,ijasah_ditunjukan,1,2,0.5,0.0,1
user_24203,masyarakat cok roy suryo maksut lu temen lu ya mata lu melek kagak pemilihan menang jokowi kog lu ngotot aja bilang lu masyarakat,2025-05-01 06:34:01+00:00,0,ijasah_ditunjukan,1,2,7.616666666666666,0.0,1
user_46869,hoee roy jgn bawa masyarakat masyarakat yg rombong lu aja yg berisik,2025-05-01 06:32:40+00:00,0,ijasah_ditunjukan,1,1,0.0,0.0,1
user_11961,gak manfaat nya sebenernya roy cs gak suka benci aja dgn jokowi gak berjuang kepentingan rakyat menang kalah pengadilan gak bermanfaat rakyat,2025-05-01 06:31:53+00:00,0,ijasah_ditunjukan,1,1,0.0,0.0,1
user_2588,disaat china ngembangin teknologi g indonesia aja ngeributin ijazah orang gabut bgt gitu,2025-05-01 06:28:40+00:00,0,ijasah_ditunjukan,1,1,0.0,0.0,1
user_40081,roy suryo panik kerjaan aja ngapain sibuk² urus ijazah orang,2025-05-01 06:26:55+00:00,0,ijasah_ditunjukan,1,1,0.0,0.0,1
user_4924,dr jg g d ladenin karna g bkln selesai d tunjukan apapun jg g bkln percaya buang bkin kerja orang aja,2025-05-01 06:25:18+00:00,0,ijasah_ditunjukan,1,1,0.0,0.0,1
user_55925,berita sengklek diperpanjang mao jokowi ijazah nda ga efek wujud nyata perlukan masyarakat ga kerjaan nyari kerjaan aja,2025-05-01 06:20:05+00:00,0,ijasah_ditunjukan,1,1,0.0,0.0,1
user_3738,kabur aja loe roy arab udah luh makan panci penjara,2025-05-01 06:19:30+00:00,1,ijasah_ditunjukan,1,1,0.0,0.0,1
user_28664,gas nominasi tokoh terkorup nomor jokowi berdasarkan occrp masukin aja penjara,2025-05-01 06:19:30+00:00,0,ijasah_ditunjukan,1,1,0.0,0.0,1
user_41392,ribet banget ya jokowi bekas penguasa tunjkjan aja kebenaran kesatria hadapl lika liku nya bialng pengecut,2025-05-01 06:16:22+00:00,0,ijasah_ditunjukan,1,1,0.0,0.0,1
user_28735,ga segampang nunjukin ijazah selesai kolot pembenci kontroversi mending aja bersih bersih jalur hukum,2025-05-01 06:14:44+00:00,0,ijasah_ditunjukan,1,1,0.0,0.0,1
user_42657,main lapor ijasa aja buktikan tunjukan lucu,2025-05-01 06:12:16+00:00,0,ijasah_ditunjukan,1,1,0.0,0.0,1
user_10221,mul ijazahmu yg sebenaarnya heboh aja,2025-05-01 06:10:00+00:00,0,ijasah_ditunjukan,2,3,26256.583333333332,0.6365141682948128,1
user_23820,woy jkw pembohong pembohong pura pura busuk lulusan ugm bangga ijazah silahkan uji gitu aja repot eeeeeeeeh taaaahek,2025-05-01 06:09:43+00:00,0,ijasah_ditunjukan,2,2,10168.083333333334,0.6931471805599453,1
user_53464,roy ente ditunjukin asli tetep aja gak dipercaya,2025-05-01 06:09:29+00:00,0,ijasah_ditunjukan,1,1,0.0,0.0,1
user_40764,sih panci kebakaran jenggot masuk bui biar cuap bui aja,2025-05-01 06:08:46+00:00,0,ijasah_ditunjukan,1,1,0.0,0.0,1
user_22651,roy udah panik wajah nya pakar pakar omon omon aja hahahaha,2025-05-01 06:08:44+00:00,0,ijasah_ditunjukan,1,1,0.0,0.0,1
user_40817,roy suryo sakit hati gak dapet panggung politik aja sihhh,2025-05-01 06:08:05+00:00,0,ijasah_ditunjukan,1,1,0.0,0.0,1
user_55076,tp kalo jokowi emang bnr lulusan ugm berbahasa inggris lancar bicara media aja ky gugup,2025-05-01 06:05:17+00:00,0,ijasah_ditunjukan,1,1,0.0,0.0,1
user_22371,ijazahnya aja sdh berkepanjangan menyusahkan mengorbankan rakyat,2025-05-01 06:05:13+00:00,0,ijasah_ditunjukan,1,1,0.0,0.0,1
user_42996,kadron laporkan aja wes de biar kapok,2025-05-01 06:03:53+00:00,0,ijasah_ditunjukan,1,3,2.683333333333333,0.0,1
user_41856,hukum su roy suryi secepat nya bikin ulah aja kau,2025-05-01 06:03:24+00:00,0,ijasah_ditunjukan,1,2,1.4,0.0,1
user_48037,bilang roy suryo krlompok penyebar kebencian aja hidup diteruji besi krmarin bilang jokowi prngecut ya terima aja,2025-05-01 06:03:01+00:00,0,ijasah_ditunjukan,1,1,0.0,0.0,1
user_11931,masukin aja lab tinta ga berbohong bandingkan ijazah asli ijazah jokowi zaman aja th yaman temukan al qur an klaim asli maknanya berbeda al qur an skrng baca uji periksa dll alqur an asli teks hapus pelajar alqur an melatih menulis alqur an udah modern teknologi maju ijazah aja sulit buktikan,2025-05-01 06:01:38+00:00,0,ijasah_ditunjukan,1,1,0.0,0.0,1
