author,text,published_at,like_count,source,total_sources,total_comments,screening_time_min,source_entropy,cluster
user_19512,si roy kalo tau ijasah bokap gw jg lgsg dinilai palsu foto muda usia beda banget gw yg anaknya aja gak ngenali foto ijasahnya wkwkwwkwkk,2025-04-30 15:42:11+00:00,0,ijasah_ditunjukan,1,1,0.0,0.0,1
user_6820,ben modar suryo buang aja orang nusa kambangan,2025-04-30 15:42:07+00:00,0,ijasah_ditunjukan,1,3,4.516666666666667,0.0,1
user_54299,la pas debat cawapres aja roy suryo gibran bawa laptop punggungnya klau dasarnya udah benci mah susah,2025-04-30 15:42:03+00:00,0,ijasah_ditunjukan,1,1,0.0,0.0,1
user_47137,lha roy panci aja ngibul ngaku ngaku ilmuwan it tdkk berati palsu roy,2025-04-30 15:41:45+00:00,0,ijasah_ditunjukan,1,2,14.616666666666667,0.0,1
user_7705,cengar cengir aja lu roy,2025-04-30 15:40:21+00:00,0,ijasah_ditunjukan,1,2,0.8166666666666667,0.0,1
user_6762,jngan bawa masarakat ahhh bang mah nonton aja mah urusan bang roy,2025-04-30 15:39:16+00:00,0,ijasah_ditunjukan,1,1,0.0,0.0,1
user_13625,percaya polisi mah aja buang²,2025-04-30 15:38:16+00:00,0,ijasah_ditunjukan,1,2,0.7,0.0,1
user_7953,panciiii berisik dimedsos coba kroscek maen tuduh aja,2025-04-30 15:36:44+00:00,0,ijasah_ditunjukan,1,1,0.0,0.0,1
user_18061,aja roy penjara,2025-04-30 15:36:03+00:00,0,ijasah_ditunjukan,1,1,0.0,0.0,1
user_39709,masrkat mna suryo sejarah negara bikin gduh negara maluin gelar aja sampah ceritanya masrakat orng bngga klau orng pintar,2025-04-30 15:34:55+00:00,0,ijasah_ditunjukan,1,1,0.0,0.0,1
user_42831,tipa kurnia mulutnya nyinyir seret pengadilan lihat aja geram lampir,2025-04-30 15:34:27+00:00,0,ijasah_ditunjukan,1,1,0.0,0.0,1
user_54338,doyan pitnah giliran laporin polisi bilang pembungkaman otaq kebaliq sengkuni bikin malaikat aja pusing keliling,2025-04-30 15:32:46+00:00,0,ijasah_ditunjukan,1,1,0.0,0.0,1
user_49590,rs omon nya bau busuk liat mukanya aja udah baca munafikkk urusannya ngurusin ijazah orang ilmiah ilmiah bidang hoaxxx,2025-04-30 15:32:14+00:00,0,ijasah_ditunjukan,1,2,2.6166666666666667,0.0,1
user_49049,ayo taruhan aja,2025-04-30 15:32:03+00:00,0,ijasah_ditunjukan,1,1,0.0,0.0,1
user_18534,ngapain pakek pakek pengacara rakyat curiga ya tunjukkan aja langsung beres gitu aja repot,2025-04-30 15:31:17+00:00,1,ijasah_ditunjukan,1,3,6.0,0.0,1
user_19598,roy suryo mesin pompa air aja dibawa pulang,2025-04-30 15:30:56+00:00,0,ijasah_ditunjukan,1,1,0.0,0.0,1
user_47137,roy panciiiii gua masyarakat aja gak perduli palsu asli lho aja yg ribet gak kebagian kursi jabatan bikin resek,2025-04-30 15:27:08+00:00,0,ijasah_ditunjukan,1,2,14.616666666666667,0.0,1
user_25111,ngomong bawa bawa masyarakat lu aja kali ah lu yg laporin ama jokowi bawa bawa masyarakat kampret,2025-04-30 15:26:20+00:00,0,ijasah_ditunjukan,1,3,13.1,0.0,1
user_25303,liat aja hasil yg bohong ketahuan,2025-04-30 15:25:54+00:00,0,ijasah_ditunjukan,1,1,0.0,0.0,1
user_7851,tangkap aja,2025-04-30 15:24:37+00:00,0,ijasah_ditunjukan,1,1,0.0,0.0,1
user_31176,nunggu aja aah hasil nya,2025-04-30 15:24:36+00:00,0,ijasah_ditunjukan,1,1,0.0,0.0,1
user_32468,klo nunjukin ijazahnya ya yg mempermasalahkan cm polisi aja polisi parcoknya jokowi hahaa aneh,2025-04-30 15:24:15+00:00,0,ijasah_ditunjukan,1,1,0.0,0.0,1
user_7205,ngrusuhin bikin fitnah masukin aja bui stempel ugm mengakui sah,2025-04-30 15:22:29+00:00,0,ijasah_ditunjukan,1,1,0.0,0.0,1
user_55930,nggak muter x menghasut warga negara mah setuju aja penjarakan penjaranya,2025-04-30 15:21:33+00:00,0,ijasah_ditunjukan,1,1,0.0,0.0,1
user_974,penilitian ilmiah pake data postingan keblonger sy gk aeklolah aja tau,2025-04-30 15:20:52+00:00,0,ijasah_ditunjukan,2,2,7128.416666666667,0.6931471805599453,1
user_19807,benaaar rs kl asli tinggal tunjukan aja hadapan publik,2025-04-30 15:19:26+00:00,0,ijasah_ditunjukan,1,1,0.0,0.0,1
user_9894,mslh ijazah aja mslh beliau lulusan sma liat prestasi beliau memajukan indonesia dimata dunia liat jasa beliau membangun negeri yg menganggap orang pintar presiden yg jujur ikhlas membangun negeri mentri aja kagak becus dipecat,2025-04-30 15:19:18+00:00,0,ijasah_ditunjukan,1,2,13.016666666666667,0.0,1
user_53190,repot ijzah mantan presiden menujukkan aja selesai curiga silakan aja uji asli dituntut kerana hukum,2025-04-30 15:18:43+00:00,0,ijasah_ditunjukan,1,1,0.0,0.0,1
user_37602,buktikan aja jgn bikin gaduhan masyarakat berani sumpah pocong ga jokowi,2025-04-30 15:17:46+00:00,0,ijasah_ditunjukan,1,1,0.0,0.0,1
user_46754,klu pikir iya knp jokowi tuh dr dl liatin aja sih klu ijazah asli mlh bikin gaduh saindonesia esemka aja ga jls ikn ga jls sertifikat laut ga jls,2025-04-30 15:17:11+00:00,0,ijasah_ditunjukan,1,1,0.0,0.0,1
user_3464,test fotensik orang lab nya kaya tuuuh aja asli,2025-04-30 15:15:57+00:00,0,ijasah_ditunjukan,2,4,7915.883333333333,0.6931471805599453,1
user_47706,roy suryo percaya mukanya aja sdh mafia,2025-04-30 15:15:31+00:00,0,ijasah_ditunjukan,1,1,0.0,0.0,1
user_19261,tunggu aja besok bahasanya kayak menyalakan jokowi wajib melaporkan bias gk sok pinter,2025-04-30 15:15:30+00:00,0,ijasah_ditunjukan,1,1,0.0,0.0,1
user_22306,sulit percaya penegak hukum sekelas mk aja dikondisikan pengadilan,2025-04-30 15:14:07+00:00,0,ijasah_ditunjukan,1,1,0.0,0.0,1
user_54408,gak suka jokowi klo go ijasa go la aja cuman kuli bangunan kuasa sma,2025-04-30 15:12:29+00:00,0,ijasah_ditunjukan,1,1,0.0,0.0,1
user_46116,terima aja nasibmu juragan panci,2025-04-30 15:12:13+00:00,0,ijasah_ditunjukan,1,2,4.75,0.0,1
user_42811,jokowi klo cma izasah tunjukin aja sesimpel cpt selesai g berbelit gitu aja repot,2025-04-30 15:12:13+00:00,0,ijasah_ditunjukan,1,1,0.0,0.0,1
user_36915,lo kaga bacot biarlah hukum peradilan yg menentukan penonton pendengar yg gitu aja koq repot,2025-04-30 15:11:58+00:00,0,ijasah_ditunjukan,1,1,0.0,0.0,1
user_14261,semoga cepat ringkus pembuat kegaduhan ngurusin ijazah orang aja nih,2025-04-30 15:09:20+00:00,0,ijasah_ditunjukan,1,1,0.0,0.0,1
user_3295,penjarakan aja roy suryo sy muak ngelihatmuka nya muka tembok,2025-04-30 15:09:18+00:00,0,ijasah_ditunjukan,1,1,0.0,0.0,1
user_47443,suaramu roy menandakan ketakutan yg ikuti aja proses hukumnya persiapkan dirimu utk penjara,2025-04-30 15:08:35+00:00,0,ijasah_ditunjukan,1,1,0.0,0.0,1
user_24404,panci bener sok bener aja,2025-04-30 15:08:13+00:00,0,ijasah_ditunjukan,1,3,3.283333333333333,0.0,1
user_3224,du dul tetep aja menarik narik nama rakyat mah urusan mu kawan mu sbaiknya siapkan aja nya sibuk nerima panggilan sidang pn ending nya ya pindah tidur hotel prodeo,2025-04-30 15:08:11+00:00,0,ijasah_ditunjukan,1,1,0.0,0.0,1
user_51423,untung ruginya ngurusin ijazahnya jokowi ngurusi aja gk bener achirnya dipenjara kasihan dirimu pikiran kotor sukanya fitnah menghujat,2025-04-30 15:07:26+00:00,0,ijasah_ditunjukan,2,2,9030.666666666666,0.6931471805599453,1
user_1191,masyarakat yg roy suryo oke rakyat terima aja oke ha ha ha merdeka,2025-04-30 15:06:44+00:00,0,ijasah_ditunjukan,1,3,16.233333333333334,0.0,1
user_54487,lo ngomong mulut bau ditunjukin ndasmu ga percaya dasar rai garong muka nya aja ketahuan nyonyornya dasar ahlak pki,2025-04-30 15:05:29+00:00,0,ijasah_ditunjukan,1,2,3.5,0.0,1
user_50517,oh indonesiaku ributin ijazah yg skrg hmpir tdk berguna uang negara yg korupsi mlh diemin aja,2025-04-30 15:03:52+00:00,0,ijasah_ditunjukan,1,1,0.0,0.0,1
user_17806,tunggu aja suka menghalalkan besok lusa terbukti emg umur kuat hidup,2025-04-30 15:03:24+00:00,0,ijasah_ditunjukan,1,1,0.0,0.0,1
user_54487,klo rai garong ga percaya ayo ajak carok aja monas,2025-04-30 15:01:59+00:00,0,ijasah_ditunjukan,1,2,3.5,0.0,1
user_2337,suryo udah membelokan yg pake membela berkilah aja udah ketauan sulit ber argumen,2025-04-30 15:01:34+00:00,0,ijasah_ditunjukan,1,2,15.45,0.0,1
user_6877,tunggu aja dipenjara,2025-04-30 15:00:52+00:00,0,ijasah_ditunjukan,1,2,2.466666666666667,0.0,1
user_35009,yg bikin ribut aja dikandang jeruji besi,2025-04-30 15:00:15+00:00,0,ijasah_ditunjukan,1,1,0.0,0.0,1
user_36187,tetep aja komplotan pemilih anis aja goblok turunan ya gue pemilih anis yg move on kalah pilpres bikin stres,2025-04-30 14:57:38+00:00,0,ijasah_ditunjukan,1,1,0.0,0.0,1
user_46905,jokowi menghibur memperhatikan org yg kalah pilpres kali blm sempet bales dendam caper aja sih,2025-04-30 14:57:06+00:00,0,ijasah_ditunjukan,2,2,7499.133333333333,0.6931471805599453,1
user_34190,tinggal nunjuk an ijazah aja pengadilan bawa polda klo emang uji akademik selesai aduh jok,2025-04-30 14:53:25+00:00,0,ijasah_ditunjukan,1,1,0.0,0.0,1
user_6456,ijazah aja bikin ribet mending u urusin koruptor ga berani kah takut kah makan uangnya,2025-04-30 14:52:27+00:00,0,ijasah_ditunjukan,1,1,0.0,0.0,1
user_11713,pidanakn krna kamutu koq mmfitnah mgatasi nama masarakat pnjarakn aja pk,2025-04-30 14:50:55+00:00,0,ijasah_ditunjukan,1,3,5.3,0.0,1
user_52461,dapet bayaran sih roy suryo perasaan presiden ga ngasih liat ijazahnya publik ya kayak ngga urusan fundamental aja gini indonesia indonesiaaa,2025-04-30 14:50:54+00:00,0,ijasah_ditunjukan,1,1,0.0,0.0,1
user_22331,orang bener mah kalem ngadepin aja,2025-04-30 14:50:48+00:00,0,ijasah_ditunjukan,1,1,0.0,0.0,1
user_22272,ksh aja tau rakyat aslinya mulyono mulyono,2025-04-30 14:50:20+00:00,0,ijasah_ditunjukan,1,1,0.0,0.0,1
user_5424,lu konyol roy ijazah sdh melewati institusi kredibel lu nyolot aja palsu,2025-04-30 14:48:52+00:00,0,ijasah_ditunjukan,1,2,18.283333333333335,0.0,1
user_11308,mantap lha prosesnya aja terbukti skripsinya ijasahnya,2025-04-30 14:47:41+00:00,0,ijasah_ditunjukan,1,1,0.0,0.0,1
user_33773,jokowi sukanya bukin gaduh tinggal tunjukin aja selesai muakk,2025-04-30 14:47:22+00:00,0,ijasah_ditunjukan,1,1,0.0,0.0,1
user_31743,joko gentle suruh nujukan ijazah kemasyarakat aja rebit kepolisi salam waras,2025-04-30 14:47:19+00:00,0,ijasah_ditunjukan,1,1,0.0,0.0,1
user_6956,ijazah aja negara kayanya ricuh bnget,2025-04-30 14:46:48+00:00,0,ijasah_ditunjukan,1,1,0.0,0.0,1
user_24845,aja barisan sakit hati nya aja uci skripsi orang tim penguji dunia doktor,2025-04-30 14:46:36+00:00,0,ijasah_ditunjukan,1,3,2.1333333333333333,0.0,1
user_35875,gak maanpaat nya berita hujat serang menjelekan manusia zaman gibah gunjing miris masyrakat indonesia aja adu domba berita manpaat masyrkat gak,2025-04-30 14:45:59+00:00,0,ijasah_ditunjukan,1,1,0.0,0.0,1
user_41043,kalu kalah aja isunya kriminalisasi dul,2025-04-30 14:45:50+00:00,0,ijasah_ditunjukan,1,2,75.41666666666667,0.0,1
user_14485,orang sabar injak injak roy roy terimah akibatnya nenek nenek nyiyir aja kerjaan nya layak diperhitungkan,2025-04-30 14:44:30+00:00,0,ijasah_ditunjukan,1,1,0.0,0.0,1
user_26551,penegak hukum curang langsung hukum mati aja biar pelajaran generasi,2025-04-30 14:43:38+00:00,0,ijasah_ditunjukan,1,3,3.65,0.0,1
user_18006,bawa masarakat wey masarakat yg way emang lu sirik aja malu bos,2025-04-30 14:42:54+00:00,0,ijasah_ditunjukan,1,1,0.0,0.0,1
user_5247,pemerintah super korup urusan ijazah aja pakai pengacara,2025-04-30 14:42:19+00:00,0,ijasah_ditunjukan,1,1,0.0,0.0,1
user_49162,ijasah sifat nya pribadi dukomen ga donk pamerkan publik ga roy ga bs bgitu aja nya fitnah lo roy emg kerjaan lo roy tau dah lo d byr biar huru hara ky gini udah selamat ber kurung dlm sel dingin taon,2025-04-30 14:41:41+00:00,0,ijasah_ditunjukan,1,1,0.0,0.0,1
user_43038,inova gak bayar pajak aja udah keliatan mobil dinaiki jokowow,2025-04-30 14:41:23+00:00,0,ijasah_ditunjukan,1,1,0.0,0.0,1
user_36044,ribet dr mslh ijazah skrg ugm nya aja bicara junur beres ugm takut sm sih,2025-04-30 14:39:56+00:00,0,ijasah_ditunjukan,1,1,0.0,0.0,1
user_55525,suruh kisruh sengaja mencari dgn jokowi menuduh ijazah palsu hadapi aja diranah hukum,2025-04-30 14:39:43+00:00,0,ijasah_ditunjukan,1,1,0.0,0.0,1
user_3161,halah roy roy tunjukkan matamu tetep aja mencari kesalahannya emak yen ngawor ya tetep proses ngapain pilih krn fakta pencemaran nama berita bohong pendukung jokowi fanaktik obyektif,2025-04-30 14:39:16+00:00,0,ijasah_ditunjukan,1,2,5880.683333333333,0.0,1
user_47510,playing victim mantap presiden memenjarakann roy roy nyanyi indonesia raya aja ngk nisa ngaku ahli menpora aja kena tipu penjual sepeda online,2025-04-30 14:39:02+00:00,0,ijasah_ditunjukan,1,1,0.0,0.0,1
user_53623,masyarakat senang jokowi mengungkap penjahat berkedok negara sikat aja kasih ruang rakyat menangani,2025-04-30 14:38:53+00:00,15,ijasah_ditunjukan,1,1,0.0,0.0,1
user_12282,sidang aja,2025-04-30 14:37:36+00:00,0,ijasah_ditunjukan,2,3,8025.433333333333,0.6365141682948128,1
user_40359,penelitian ilmiah hasilnya ijazah jokowi palsu beralih ijazah jokowi yg beredar media sosial palsu cuman peneliti konyol aja yg menjamin kebenaran hasil penelitiannya penelitian ilmiah berproses roy bersifat diperbaiki disanggah berdasarkan bukti kebenaran ilmiah bersifat probabilitas didasarkan bukti empiris kuat kebenaran mutlak yg loe omongin roy roy malu maluin alumni ugm aja loe roy,2025-04-30 14:37:21+00:00,0,ijasah_ditunjukan,2,5,7016.566666666667,0.5004024235381879,1
user_29600,kuliah d aja bela in smpai dapetin ijazah loh,2025-04-30 14:37:19+00:00,0,ijasah_ditunjukan,1,2,0.7166666666666667,0.0,1
user_36173,mul mul bikin ribut indonesia aja lu,2025-04-30 14:36:53+00:00,0,ijasah_ditunjukan,1,1,0.0,0.0,1
user_30540,negara laen udah sampe sdm nya orang indonesia aja jongkok aja negara menghina negara,2025-04-30 14:36:33+00:00,0,ijasah_ditunjukan,1,1,0.0,0.0,1
user_20631,negara negara kampang man korupsi gak tuntas urus aja korupsi woy binatang,2025-04-30 14:35:44+00:00,0,ijasah_ditunjukan,1,7,9.533333333333333,0.0,1
user_1757,muak dengar sich dokter bicara arogan bangat manusia kayak tuhan aja,2025-04-30 14:35:44+00:00,0,ijasah_ditunjukan,1,1,0.0,0.0,1
user_20899,masyarakat menilai emang roy suryo komunikasinya selaya profokasi ketawanya merendahkan lawan bicara pantslah pidanakan aja kelakuannya memenuhi unsur pidana,2025-04-30 14:35:34+00:00,0,ijasah_ditunjukan,1,1,0.0,0.0,1
user_50081,kalo ga pidanakan ngelunjak pindahkan aja yg menyebarkan berita hoax yg memfitnah jokowi tangkap biar kapok,2025-04-30 14:35:25+00:00,0,ijasah_ditunjukan,1,3,8.116666666666667,0.0,1
user_13056,masuk penjara aja,2025-04-30 14:34:39+00:00,0,ijasah_ditunjukan,1,1,0.0,0.0,1
user_8793,bawa bawa masyarakat aja kawan mu roy,2025-04-30 14:33:52+00:00,0,ijasah_ditunjukan,2,3,5893.266666666666,0.6365141682948128,1
user_16291,wkwkwkw jd nya tersakiti nih ceritanya roy suryo lu fitnah msh percaya aja sma tukang sembunyi in panci,2025-04-30 14:33:37+00:00,0,ijasah_ditunjukan,1,1,0.0,0.0,1
user_49361,roy panci buang laut aja biar makn ikan,2025-04-30 14:33:33+00:00,0,ijasah_ditunjukan,1,1,0.0,0.0,1
user_30416,astaghfirullah al azim bersikeras asli ngaku aja,2025-04-30 14:32:32+00:00,1,ijasah_ditunjukan,1,1,0.0,0.0,1
user_32555,aja roy pakai baju oren rakyat dukung jokowi widodo,2025-04-30 14:32:10+00:00,3,ijasah_ditunjukan,1,2,9.85,0.0,1
user_29298,cari panggung aja si suryo skip aja sih manusia ndak,2025-04-30 14:31:14+00:00,0,ijasah_ditunjukan,1,1,0.0,0.0,1
user_39200,yg namanya pembenci aja ga percaya,2025-04-30 14:30:55+00:00,0,ijasah_ditunjukan,1,1,0.0,0.0,1
user_490,tuhan bilang ijazah asli aja dibantah hakim wkkk,2025-04-30 14:30:47+00:00,0,ijasah_ditunjukan,1,2,7.616666666666666,0.0,1
user_53567,klo dah gak ush berlindung kriminalisasi ya suryo hadapin sidangnya aja tinggal lihat yg msuk kmr besi,2025-04-30 14:29:01+00:00,0,ijasah_ditunjukan,1,1,0.0,0.0,1
user_50853,rs aja org yg kerjanya menfitnain org terbukti penjarain aja org hatinya dah kena penyakit susah sembuhnya yg otaknya ngomongin org memfitnah suhuzone dendam ga percaya dgn kebenaran dah penjarakan aja rs motifnya yg bayar selidiki aja,2025-04-30 14:28:53+00:00,0,ijasah_ditunjukan,1,2,8.416666666666666,0.0,1
user_38864,udahlah ga ush bacot kau roy tggu aja pengadilan buktikan yg,2025-04-30 14:28:50+00:00,0,ijasah_ditunjukan,1,1,0.0,0.0,1
user_6058,curiga aja trs sampe mati roy makan curiga,2025-04-30 14:28:44+00:00,0,ijasah_ditunjukan,1,1,0.0,0.0,1
user_24476,pengacara cerdas contoh pengacaranya mulyono aja gak lihat ijazahnya mulyono gak,2025-04-30 14:28:35+00:00,0,ijasah_ditunjukan,1,1,0.0,0.0,1
user_26131,anis aja periksa kpk dateng eh jokowi temenin pengacara hahahahah,2025-04-30 14:27:46+00:00,0,ijasah_ditunjukan,2,4,8675.116666666667,0.5623351446188083,1
user_27677,ah cari perlindungan kalo udah lo aja dewa panci,2025-04-30 14:27:34+00:00,0,ijasah_ditunjukan,1,1,0.0,0.0,1
user_13617,mas roy suryo bilang aja benci belok kiri kanan ngomong membohongi hati nurani iya,2025-04-30 14:27:16+00:00,0,ijasah_ditunjukan,1,1,0.0,0.0,1
user_35962,roy suryo cengar cengir nikmatin aja mumpung,2025-04-30 14:26:57+00:00,0,ijasah_ditunjukan,1,1,0.0,0.0,1
user_3877,jgn polisi doang cctv aja langganan mati klo bau polisinya pakai forensik independen fbi klo polisi indonesia diandelin btw ipk jebot aja som iyeh pengacara logikanya aduh bgt materialnya yg dibuktikan ngetek sm ugm pratikno mantan rektor ugm orang ugm dah nggak suka duit polos bnr klo gw sodara polisi pas kena razia gw ya bilang sim stnk aslinya sodara gw yg polisi bilang asli klo nggak percaya silakan buktikan yg menuduh yg membuktikan beg,2025-04-30 14:26:46+00:00,0,ijasah_ditunjukan,1,1,0.0,0.0,1
user_20925,penjarakan aja gaduh begeini muak liat muka rs,2025-04-30 14:26:30+00:00,0,ijasah_ditunjukan,1,1,0.0,0.0,1
user_55732,buang laut aja tu roy suryo,2025-04-30 14:26:29+00:00,0,ijasah_ditunjukan,1,1,0.0,0.0,1
user_841,kalo roypanci hebat gak nylon presiden aja,2025-04-30 14:26:23+00:00,0,ijasah_ditunjukan,1,2,1.85,0.0,1
user_21302,tunjukin aja loh ijazahnya ko ruwet,2025-04-30 14:25:52+00:00,0,ijasah_ditunjukan,1,1,0.0,0.0,1
user_45185,alah roy nyinyir aja masuk buy berasa,2025-04-30 14:25:20+00:00,0,ijasah_ditunjukan,1,1,0.0,0.0,1
user_56693,penjarakan aja org kyk g kerjaan aja,2025-04-30 14:22:51+00:00,0,ijasah_ditunjukan,1,1,0.0,0.0,1
user_4285,ijazahnya palsu merubah kondisi negri beliau tdk menjabat aneh aja,2025-04-30 14:22:47+00:00,0,ijasah_ditunjukan,1,1,0.0,0.0,1
user_33314,arsip skripsinya aja jg penuh kejanggalan,2025-04-30 14:22:07+00:00,0,ijasah_ditunjukan,1,1,0.0,0.0,1
user_32376,disolo aja sidang tertutup mediasi gak lucu tu,2025-04-30 14:21:55+00:00,0,ijasah_ditunjukan,1,1,0.0,0.0,1
user_3424,clear polisi aja si jok bgt joko sengajaa lo negeri kacau salahnya tunjukkan aja asli,2025-04-30 14:21:03+00:00,0,ijasah_ditunjukan,1,1,0.0,0.0,1
user_42764,sakit hatiiii aja yg dimasalahin sadar woiiii bangun bangsa keihlasan sukzon mulu orang ibadahmu berguna woiii,2025-04-30 14:20:24+00:00,0,ijasah_ditunjukan,1,2,1.0,0.0,1
user_15763,kalaw ijaza nya jokowi aslih memakai pengecara liatkan aja ijaza nya pd rakyat beres gk keributan barti ijaza nya palsu,2025-04-30 14:19:26+00:00,0,ijasah_ditunjukan,1,4,16.0,0.0,1
user_31499,gimana jokowi ijazah ugm sma aja,2025-04-30 14:19:17+00:00,0,ijasah_ditunjukan,2,2,26794.833333333332,0.6931471805599453,1
user_7295,kalo asli tunjukkan aja biar dianalisis asli bungkam penuduh diumpetin trus nyewa kuasa hukum preman ribet,2025-04-30 14:18:39+00:00,0,ijasah_ditunjukan,1,1,0.0,0.0,1
user_21975,tdk otang pintar roy suro sianipar rakyat gak tau arti new roman adakah fakultas kehutanan jurusan kayu tandatangan skripsi langsung roy suryo cs mencerdaskan rakyat kayak jokowi sandiwara gak agamanya aja gak paham pemimpin,2025-04-30 14:18:25+00:00,0,ijasah_ditunjukan,1,1,0.0,0.0,1
user_46436,menang menang kalah kalah yah kayak tim liga primer inggris kalo komentator yah bahas bahas fans dukung dukung yah aja kejadiannya simple banget banget menang kalah yah gitu gitu aja kejadiannya nyungsep nyungsep yah gitu gitu aja,2025-04-30 14:17:42+00:00,0,ijasah_ditunjukan,1,1,0.0,0.0,1
user_53287,bener sepele tunjukkan aja bener mah ngapain takut tunjukin aja ijasahnya beres,2025-04-30 14:16:55+00:00,0,ijasah_ditunjukan,1,1,0.0,0.0,1
user_26169,kardus aja digembok percaya jasaaah asli sblm diuji forensik,2025-04-30 14:16:34+00:00,1,ijasah_ditunjukan,1,2,4.033333333333333,0.0,1
user_5598,sebentar lg ngandang klw orang omong mah tinggal liat aja muka nya d tv pakai baju tahanan mulut mu harimau mu,2025-04-30 14:16:16+00:00,0,ijasah_ditunjukan,1,1,0.0,0.0,1
user_38557,gerombolan kadrun panci cs memnag indonesia gaduh info a hati aja masyarakat indonesia,2025-04-30 14:15:55+00:00,0,ijasah_ditunjukan,2,2,24403.6,0.6931471805599453,1
user_22411,ijazah brp slesainya adaaaaa aja yg ributin cok negatifnya nih dr pd manfaatnya ijsahnya asli palsu gk sih indonesia damaaiii aja kasian yg yg gampang d adu domba,2025-04-30 14:15:26+00:00,0,ijasah_ditunjukan,1,1,0.0,0.0,1
user_15798,istilah gus dur gitu aja koq susah tunjukkan ijazahnya dicurigai keasliannya,2025-04-30 14:14:32+00:00,1,ijasah_ditunjukan,1,2,1.1,0.0,1
user_26075,ijasah aja masalahin roy roy masalahin mah tuh org² yg udah korupsi besar²n tpi dpat hukuman yg enak,2025-04-30 14:14:19+00:00,0,ijasah_ditunjukan,1,1,0.0,0.0,1
user_709,sy curiga ijazahnya palsu kayanya persidangan nya penuh permainan mk aja diatur,2025-04-30 14:14:14+00:00,1,ijasah_ditunjukan,1,1,0.0,0.0,1
user_9416,pakde jokowi ngapain respon rame deh disenyumin aja entar cape direspon,2025-04-30 14:13:20+00:00,0,ijasah_ditunjukan,1,1,0.0,0.0,1
user_7475,ayo mas ro maju pumpung masuk penjara mampus lu prabotan dapur aja mbat ga tau malu luh sakit hati ksalahan ya ujungnya pnjara,2025-04-30 14:12:35+00:00,0,ijasah_ditunjukan,1,1,0.0,0.0,1
user_21117,sederhana krn kelompok roy suryo aja yg cari,2025-04-30 14:12:35+00:00,0,ijasah_ditunjukan,1,1,0.0,0.0,1
user_11459,masyarakat gak ribet bos kumis ente aja yg kepo sakit hati,2025-04-30 14:12:24+00:00,0,ijasah_ditunjukan,1,1,0.0,0.0,1
user_9110,bagus roy pdhal takut mangkanya bodoh konyol aja dak kerjaan hasil gak hati tu peliharalah hilangkan kebencian stress,2025-04-30 14:10:51+00:00,0,ijasah_ditunjukan,1,2,7.166666666666667,0.0,1
user_32880,menuduh aja lihat fisiknya langsung udah maen tuduh aja berdasarkan unggahan orang sosmed,2025-04-30 14:10:36+00:00,0,ijasah_ditunjukan,1,1,0.0,0.0,1
user_41232,manten presiden repot lapor undang aja makan malam tunjukkan ijazah dirumah clear tho kecuali emang plasue,2025-04-30 14:09:52+00:00,1,ijasah_ditunjukan,1,1,0.0,0.0,1
user_22187,nyanyi lagu indonesia raya aja gak hapal sok jago ni suryo gigilu rapiin kumis lo,2025-04-30 14:09:00+00:00,0,ijasah_ditunjukan,1,1,0.0,0.0,1
user_40972,aja kau rs tukang gaduh aja kau giliran dilaporin ketar ketirn nya kau masuk buih ga adil katamu hadeuuuuhhhh panci pancinya bang tolong dikembalikan,2025-04-30 14:08:27+00:00,0,ijasah_ditunjukan,1,1,0.0,0.0,1
user_6925,cina anak anak belajar merakit robot belajar teknologi aja ribut ijasah orang,2025-04-30 14:08:03+00:00,0,ijasah_ditunjukan,1,1,0.0,0.0,1
user_47025,orang egk nunjukin ijasah nya media sosial yg ngedit jokowi hak menujukan berfikir pake logika aja jokowi walikota gubernur presiden iya palsu kalo bilang palsu egk aja pas jokowi walikota,2025-04-30 14:07:59+00:00,0,ijasah_ditunjukan,1,1,0.0,0.0,1
user_3227,rekam jejak presiden luas semenjak tk sd smp sma kampus dimana kuliah samar spt jokowi konon sma aja gak lulus,2025-04-30 14:07:57+00:00,0,ijasah_ditunjukan,1,5,19.35,0.0,1
user_18456,masyarakat sdh jijik dm panci pura begoo aja,2025-04-30 14:07:48+00:00,0,ijasah_ditunjukan,1,2,0.8333333333333334,0.0,1
user_48893,kalo besok ditilang polisi berati gak tunjukkan stnk sim suruh aja polisi samsat bener banget ni,2025-04-30 14:06:44+00:00,0,ijasah_ditunjukan,1,2,8.183333333333334,0.0,1
user_23421,wkwkwk ribut aja abis bangsa mengembangkan teknologi,2025-04-30 14:06:32+00:00,0,ijasah_ditunjukan,1,1,0.0,0.0,1
user_48905,ruwet tinggal tunjukin aja ijazah aslinya uji ngapain pake hukum rakyat ragu huklm konoha,2025-04-30 14:05:59+00:00,0,ijasah_ditunjukan,1,1,0.0,0.0,1
user_19898,lawan aja suryo dajal dajal ustana pembawa rusuh indonesia do rakyat jelata mas suryo dkk kemenangan,2025-04-30 14:04:57+00:00,0,ijasah_ditunjukan,1,1,0.0,0.0,1
user_14055,tinggal tunjukkan ijazah nya aja susah muter,2025-04-30 14:04:26+00:00,0,ijasah_ditunjukan,1,1,0.0,0.0,1
user_50827,loe nya aja yg tolol jokowi dah gak persoalin hina bully brisik aja masuk sel,2025-04-30 14:03:57+00:00,0,ijasah_ditunjukan,1,2,1.2,0.0,1
user_10192,slalu bawa masyarakat panci milik negera aja ambil muak lihat org,2025-04-30 14:03:24+00:00,0,ijasah_ditunjukan,1,5,5.016666666666667,0.0,1
user_46612,bacodd bilangin jgn in lapor ciut menang aja yg tamatan rendah aja gk percaya omongan,2025-04-30 14:02:36+00:00,0,ijasah_ditunjukan,1,1,0.0,0.0,1
user_11166,ngomong aja tinggal tunjukan diserahkan berwenang diuji materi,2025-04-30 14:02:13+00:00,0,ijasah_ditunjukan,1,6,22.35,0.0,1
user_35841,pasukan roy cs panik mengelak aja bro,2025-04-30 14:02:12+00:00,0,ijasah_ditunjukan,1,1,0.0,0.0,1
user_27615,pendidikan hukum gimana konstitusi aja obrak abrik mimpi kaliii,2025-04-30 14:02:11+00:00,0,ijasah_ditunjukan,1,1,0.0,0.0,1
user_55037,proses ijazahnya aja sdh ga bener,2025-04-30 14:01:30+00:00,0,ijasah_ditunjukan,1,1,0.0,0.0,1
user_15646,bawa masyarakat suryo ngomong mu aja,2025-04-30 13:59:43+00:00,0,ijasah_ditunjukan,1,2,14.833333333333334,0.0,1
user_82,tunjukin aja ijazahnya rakyat gitu aja susah,2025-04-30 13:59:35+00:00,0,ijasah_ditunjukan,1,1,0.0,0.0,1
user_48893,tunjukkan aja ijazahnya mulyono selesai gak lari lari ribet banget udah pembohong jujur aja hidup tenang mati khusnul khatimah dunia sebentar ajak orang pembohong jujur jujur terhormat ya pembohong terhina mata tuhan bertaubatlah ajal menjemput,2025-04-30 13:58:33+00:00,0,ijasah_ditunjukan,1,2,8.183333333333334,0.0,1
user_14477,nunjukin polusi aja bohong coba periksa terbuka ahli berani gak,2025-04-30 13:58:33+00:00,0,ijasah_ditunjukan,2,2,4362.666666666667,0.6931471805599453,1
user_36114,klo uji forensik indonesia sih ragu gw mending undang tim uji forensik negara klo ambil orang dri negara ragu ma tim foernsik dri indo ya biar netral aja,2025-04-30 13:57:14+00:00,0,ijasah_ditunjukan,1,1,0.0,0.0,1
